site-address,deliverable,end-date,entry-date,hazardous-substances,hectares,maximum-net-dwellings,minimum-net-dwellings,notes,organisation,ownership-status,planning-permission-date,planning-permission-history,planning-permission-status,planning-permission-type,site,site-plan-url,start-date
"Hadrian Road (land south of Metro line), Wallsend",,,2020-04-15,,1.15,18,18,,local-authority-eng:NTY,mixed ownership,,,not permissioned,,1,http://my.northtyneside.gov.uk/category/1134/housing-and-employment,2017-12-22
"Cedar Grove Block, High Street East, Wallsend",,,2020-04-15,,0.7,32,19,,local-authority-eng:NTY,mixed ownership,,,not permissioned,,2,http://my.northtyneside.gov.uk/category/1134/housing-and-employment,2017-12-22
"Langdale Centre, Langdale Gardens, Howdon",,,2020-04-15,,1.43,39,39,,local-authority-eng:NTY,owned by a public authority,,,not permissioned,,38,http://my.northtyneside.gov.uk/category/1134/housing-and-employment,2017-12-22
"Land at Martin Road, Howdon",,31/12/2019,2020-04-15,,0.12,4,4,,local-authority-eng:NTY,not owned by a public authority,,,not permissioned,,48,http://my.northtyneside.gov.uk/category/1134/housing-and-employment,2017-12-22
"Howdon Green, Willington Quay",,,2020-04-15,,3.54,83,83,,local-authority-eng:NTY,not owned by a public authority,2017-05-10,https://idoxpublicaccess.northtyneside.gov.uk/online-applications/applicationDetails.do?activeTab=summary&keyVal=K9T2DZBH09700,permissioned,outline planning permission,58,http://my.northtyneside.gov.uk/category/1134/housing-and-employment,2017-12-22
"West Chirton South, Norham Road, North Shields",yes,,2020-04-15,,28.95,399,399,,local-authority-eng:NTY,mixed ownership,2019-07-17,https://idoxpublicaccess.northtyneside.gov.uk/online-applications/applicationDetails.do?keyVal=PJVZ2YBHH3B00&activeTab=summary,permissioned,reserved matters approval,63,http://my.northtyneside.gov.uk/category/1134/housing-and-employment,2017-12-22
Backworth Business Park,yes,,2020-04-15,,4.73,65,65,,local-authority-eng:NTY,mixed ownership,,https://idoxpublicaccess.northtyneside.gov.uk/online-applications/caseDetails.do?caseType=Application&keyVal=PB181QBHIUW00,pending decision,,66,http://my.northtyneside.gov.uk/category/1134/housing-and-employment,2017-12-22
"Foxhunters Industrial Estate, Hillheads Road, Whitley Bay",,,2020-04-15,,2.72,61,61,,local-authority-eng:NTY,mixed ownership,,,not permissioned,,67,http://my.northtyneside.gov.uk/category/1134/housing-and-employment,2017-12-22
"201-225 High Street East, Wallsend",,,2020-04-15,,0.16,5,5,,local-authority-eng:NTY,not owned by a public authority,,,not permissioned,,79,http://my.northtyneside.gov.uk/category/1134/housing-and-employment,2017-12-22
"Forest Hall Delivery Office, Station Road, Forest Hall",,,2020-04-15,,0.16,5,5,,local-authority-eng:NTY,not owned by a public authority,,,not permissioned,,81,http://my.northtyneside.gov.uk/category/1134/housing-and-employment,2017-12-22
"Tynemouth Jubilee Infirmary, Hawkey's Lane, North Shields",,,2020-04-15,,1.48,40,40,,local-authority-eng:NTY,owned by a public authority,,,not permissioned,,83,http://my.northtyneside.gov.uk/category/1134/housing-and-employment,2017-12-22
"Land at 26-37 Clive Street, North Shields",,,2020-04-15,,0.3,50,50,,local-authority-eng:NTY,not owned by a public authority,2019-07-09,https://idoxpublicaccess.northtyneside.gov.uk/online-applications/caseDetails.do?caseType=Application&keyVal=PPBR07BH0GZ00,permissioned,full planning permission,85,http://my.northtyneside.gov.uk/category/1134/housing-and-employment,2017-12-22
"Percy Main Bus Depot, Norham Road, North Shields",,,2020-04-15,,0.45,12,12,,local-authority-eng:NTY,not owned by a public authority,,,not permissioned,,91,http://my.northtyneside.gov.uk/category/1134/housing-and-employment,2017-12-22
"Grieves Row, Dudley",yes,,2020-04-15,,1.94,88,53,,local-authority-eng:NTY,not owned by a public authority,,,not permissioned,,95,http://my.northtyneside.gov.uk/category/1134/housing-and-employment,2017-12-22
"Fenwick's Pit, East Holywell",yes,,2020-04-15,,4.43,18,18,,local-authority-eng:NTY,not owned by a public authority,2016-07-26,https://idoxpublicaccess.northtyneside.gov.uk/online-applications/applicationDetails.do?activeTab=summary&keyVal=NSYZYABH0GZ00,permissioned,full planning permission,112,http://my.northtyneside.gov.uk/category/1134/housing-and-employment,2017-12-22
"Former Grange Interiors Building, Bird Street, North Shields",yes,,2020-04-15,,0.54,35,35,,local-authority-eng:NTY,mixed ownership,2018-01-03,https://idoxpublicaccess.northtyneside.gov.uk/online-applications/applicationDetails.do?activeTab=summary&keyVal=OGUF8XBH0I300,not permissioned,full planning permission,116,http://my.northtyneside.gov.uk/category/1134/housing-and-employment,2017-12-22
"Land at Rising Sun adjacent to Sports Ground, Kings Road North, Wallsend",,,2020-04-15,,0.23,7,7,,local-authority-eng:NTY,owned by a public authority,,,not permissioned,,162,http://my.northtyneside.gov.uk/category/1134/housing-and-employment,2017-12-22
"Land at Coble Dene, Royal Quays, North Shields",,31/12/2019,2020-04-15,,0.24,7,7,,local-authority-eng:NTY,owned by a public authority,,,not permissioned,,198,http://my.northtyneside.gov.uk/category/1134/housing-and-employment,2017-12-22
"Site at Coquet Avenue (Former site of Marine Park and Cocquet Park First School), Whitley Bay",,,2020-04-15,,0.59,94,94,,local-authority-eng:NTY,not owned by a public authority,,,not permissioned,,219,http://my.northtyneside.gov.uk/category/1134/housing-and-employment,2017-12-22
"Land south of Whitley Road, Benton",yes,31/12/2019,2020-04-15,,2.25,51,51,,local-authority-eng:NTY,owned by a public authority,2012-06-06,https://idoxpublicaccess.northtyneside.gov.uk/online-applications/simpleSearchResults.do?action=firstPage,permissioned,outline planning permission,223,http://my.northtyneside.gov.uk/category/1134/housing-and-employment,2017-12-22
"Fleur De Lis, Dock Road Industrial Estate, North Shields",yes,15/04/2020,2020-04-15,,0.14,8,8,,local-authority-eng:NTY,not owned by a public authority,2016-11-29,https://idoxpublicaccess.northtyneside.gov.uk/online-applications/applicationDetails.do?activeTab=summary&keyVal=OEH2HHBHH5400,permissioned,full planning permission,233,http://my.northtyneside.gov.uk/category/1134/housing-and-employment,2017-12-22
"Linskill Mews, Linskill Terrace, North Shields",,,2020-04-15,,0.17,9,9,,local-authority-eng:NTY,not owned by a public authority,2017-07-21,https://idoxpublicaccess.northtyneside.gov.uk/online-applications/caseDetails.do?caseType=Application&keyVal=OPYB88BHGHE00,permissioned,outline planning permission,249,http://my.northtyneside.gov.uk/category/1134/housing-and-employment,2017-12-22
"Bawtry Court, Broomfield Avenue, Wallsend",,31/12/2019,2020-04-15,,0.22,13,13,,local-authority-eng:NTY,owned by a public authority,2007-12-27,https://idoxpublicaccess.northtyneside.gov.uk/online-applications/applicationDetails.do?activeTab=summary&keyVal=JP8ISTBHEC000,permissioned,outline planning permission,260,http://my.northtyneside.gov.uk/category/1134/housing-and-employment,2017-12-22
"Pioneer Social Club, Seghill Road Ends, Dudley",,,2020-04-15,,0.15,12,5,allocated for ?residential development for the purposes of section 59A of the Town and Country Planning Act 1990 (permission in principle),local-authority-eng:NTY,not owned by a public authority,2020-04-14,https://idoxpublicaccess.northtyneside.gov.uk/online-applications/applicationDetails.do?keyVal=PWZW3UBH09D00&activeTab=summary,permissioned,permission in principle,266,http://my.northtyneside.gov.uk/category/1134/housing-and-employment,2017-12-22
Stephenson Industrial Estate East,,,2020-04-15,,4.88,110,110,,local-authority-eng:NTY,mixed ownership,,,not permissioned,,277,http://my.northtyneside.gov.uk/category/1134/housing-and-employment,2017-12-22
Stephenson Industrial Estate West,,,2020-04-15,,7.3,164,164,,local-authority-eng:NTY,mixed ownership,,,not permissioned,,278,http://my.northtyneside.gov.uk/category/1134/housing-and-employment,2017-12-22
"Tanners Bank West (S), North Shields (former Tyne Brand site)",,,2020-04-15,,1.85,50,50,,local-authority-eng:NTY,mixed ownership,,,not permissioned,,280,http://my.northtyneside.gov.uk/category/1134/housing-and-employment,2017-12-22
"Tanners Bank East, North Shields",,,2020-04-15,,0.95,42,42,,local-authority-eng:NTY,mixed ownership,,,not permissioned,,281,http://my.northtyneside.gov.uk/category/1134/housing-and-employment,2017-12-22
"Brewhouse Bank A (northern parcel), North Shields",,,2020-04-15,,0.51,18,18,,local-authority-eng:NTY,mixed ownership,,,not permissioned,,282,http://my.northtyneside.gov.uk/category/1134/housing-and-employment,2017-12-22
"East George Street, North Shields",,,2020-04-15,,0.87,31,31,,local-authority-eng:NTY,mixed ownership,,,not permissioned,,284,http://my.northtyneside.gov.uk/category/1134/housing-and-employment,2017-12-22
"Hutson Street & East George Street Block, North Shields",,,2020-04-15,,0.45,16,16,,local-authority-eng:NTY,mixed ownership,,,not permissioned,,285,http://my.northtyneside.gov.uk/category/1134/housing-and-employment,2017-12-22
"Dock Road Industrial Estate, Lawson Street, North Shields",,,2020-04-15,,4.25,96,96,,local-authority-eng:NTY,mixed ownership,,,not permissioned,,288,http://my.northtyneside.gov.uk/category/1134/housing-and-employment,2017-12-22
"Land at North Shields Metro Station, Russell Street, North Shields",yes,,2020-04-15,,0.52,14,14,,local-authority-eng:NTY,not owned by a public authority,,,not permissioned,,299,http://my.northtyneside.gov.uk/category/1134/housing-and-employment,2017-12-22
"Land adjacent to Benton Metro Station, Station Approach, Benton",yes,,2020-04-15,,0.39,20,12,,local-authority-eng:NTY,not owned by a public authority,,,not permissioned,,301,http://my.northtyneside.gov.uk/category/1134/housing-and-employment,2017-12-22
"Metro Sidings at Waterville Road, North Shields",yes,,2020-04-15,,1.24,34,34,,local-authority-eng:NTY,not owned by a public authority,,,not permissioned,,302,http://my.northtyneside.gov.uk/category/1134/housing-and-employment,2017-12-22
"Percy Hedley School, Station Road, Forest Hall",,,2020-04-15,,0.62,28,17,,local-authority-eng:NTY,not owned by a public authority,,,not permissioned,,307,http://my.northtyneside.gov.uk/category/1134/housing-and-employment,2017-12-22
"Land at Albion Road, North Shields",,15/04/2020,2020-04-15,,0.25,8,8,,local-authority-eng:NTY,not owned by a public authority,,,not permissioned,,311,http://my.northtyneside.gov.uk/category/1134/housing-and-employment,2017-12-22
"Albion House, Albion Road, North Shields",,,2020-04-15,,0.79,21,21,,local-authority-eng:NTY,,,,not permissioned,,315,http://my.northtyneside.gov.uk/category/1134/housing-and-employment,2017-12-22
"Bingo Hall, Lovaine Place, North Shields",,,2020-04-15,,0.12,4,4,,local-authority-eng:NTY,,,,not permissioned,,323,http://my.northtyneside.gov.uk/category/1134/housing-and-employment,2017-12-22
"Land at Waldo Street, North Shields",,,2020-04-15,,0.11,3,3,,local-authority-eng:NTY,,,,not permissioned,,324,http://my.northtyneside.gov.uk/category/1134/housing-and-employment,2017-12-22
"Telephone Exchange, Station Road, Wallsend",,,2020-04-15,,0.2,6,6,,local-authority-eng:NTY,,,,not permissioned,,326,http://my.northtyneside.gov.uk/category/1134/housing-and-employment,2017-12-22
"Whisky Bends, Promenade, Whitley Bay",,,2020-04-15,,0.02,3,3,,local-authority-eng:NTY,owned by a public authority,2019-09-16,https://idoxpublicaccess.northtyneside.gov.uk/online-applications/caseDetails.do?caseType=Application&keyVal=POEWCHBHJXE00,permissioned,full planning permission,337,http://my.northtyneside.gov.uk/category/1134/housing-and-employment,2017-12-22
"Garage Site, The Links, Whitley Bay",,,2020-04-15,,0.12,4,4,,local-authority-eng:NTY,not owned by a public authority,,,not permissioned,,338,http://my.northtyneside.gov.uk/category/1134/housing-and-employment,2017-12-22
"Former Coastways Garage, Coast Road, Wallsend",,,2020-04-15,,0.59,14,14,,local-authority-eng:NTY,not owned by a public authority,2012-03-02,https://idoxpublicaccess.northtyneside.gov.uk/online-applications/applicationDetails.do?activeTab=summary&keyVal=LVIOSBBH0GZ00,permissioned,full planning permission,339,http://my.northtyneside.gov.uk/category/1134/housing-and-employment,2017-12-22
"The Avenue, Park Avenue, Whitley Bay",yes,31/12/2019,2020-04-15,,0.27,12,12,,local-authority-eng:NTY,owned by a public authority,2017-09-29,https://idoxpublicaccess.northtyneside.gov.uk/online-applications/applicationDetails.do?activeTab=summary&keyVal=ORLHT5BHH5K00,permissioned,reserved matters approval,341,http://my.northtyneside.gov.uk/category/1134/housing-and-employment,2017-12-22
"Gasometer at Minton Lane, North Shields",,,2020-04-15,,1.63,44,44,,local-authority-eng:NTY,not owned by a public authority,,,not permissioned,,344,http://my.northtyneside.gov.uk/category/1134/housing-and-employment,2017-12-22
"Howdon Gas Works, Howdon Lane, Howdon",,,2020-04-15,,2.96,67,67,,local-authority-eng:NTY,not owned by a public authority,,,not permissioned,,346,http://my.northtyneside.gov.uk/category/1134/housing-and-employment,2017-12-22
"Portugal Place Block, High Street West, Wallsend",,,2020-04-15,,0.44,23,14,,local-authority-eng:NTY,mixed ownership,,,not permissioned,,348,http://my.northtyneside.gov.uk/category/1134/housing-and-employment,2017-12-22
"Harvey Combe, Station Road Industrial Estate, Killingworth",,,2020-04-15,,11,240,144,,local-authority-eng:NTY,owned by a public authority,,,not permissioned,,354,http://my.northtyneside.gov.uk/category/1134/housing-and-employment,2017-12-22
"Tanners Bank West (N), North Shields",,,2020-04-15,,2.18,49,49,,local-authority-eng:NTY,mixed ownership,,,not permissioned,,355,http://my.northtyneside.gov.uk/category/1134/housing-and-employment,2017-12-22
"Devonshire Drive, Whitley Road, Holystone",yes,,2020-04-15,,1.69,76,46,,local-authority-eng:NTY,not owned by a public authority,,,not permissioned,,366,http://my.northtyneside.gov.uk/category/1134/housing-and-employment,2017-12-22
"Ash Court, Rake Lane, North Shields",,,2020-04-15,,0.2,6,6,,local-authority-eng:NTY,owned by a public authority,,,not permissioned,,389,http://my.northtyneside.gov.uk/category/1134/housing-and-employment,2017-12-22
"Tynemouth Court, Hawkey's Lane, North Shields",,,2020-04-15,,0.5,14,14,,local-authority-eng:NTY,owned by a public authority,,https://idoxpublicaccess.northtyneside.gov.uk/online-applications/caseDetails.do?caseType=Application&keyVal=PZH344BHJ7N00,pending decision,,390,http://my.northtyneside.gov.uk/category/1134/housing-and-employment,2017-12-22
"Whitley Bay Police Station, Laburnum Avenue, Whitley Bay",,,2020-04-15,,0.11,3,3,,local-authority-eng:NTY,owned by a public authority,,,not permissioned,,392,http://my.northtyneside.gov.uk/category/1134/housing-and-employment,2017-12-22
"Drift Inn, Front Street, Seaton Burn",,,2020-04-15,,0.28,14,8,,local-authority-eng:NTY,,2012-02-17,https://idoxpublicaccess.northtyneside.gov.uk/online-applications/applicationDetails.do?activeTab=summary&keyVal=LVQO60BH06V00,permissioned,full planning permission,404,http://my.northtyneside.gov.uk/category/1134/housing-and-employment,2017-12-22
"Grasmere Court, Swindale Drive, Killingworth (Former West House PH)",yes,,2020-04-15,,0.16,8,5,allocated for ?residential development for the purposes of section 59A of the Town and Country Planning Act 1990 (permission in principle),local-authority-eng:NTY,,2020-04-15,https://idoxpublicaccess.northtyneside.gov.uk/online-applications/applicationDetails.do?previousCaseType=Property&keyVal=PWJC7ABH09D00&previousCaseNumber=000KWIBHBU000&previousCaseUprn=000047040651&activeTab=summary&previousKeyVal=PGHG1YBH00601,permissioned,permission in principle,407,http://my.northtyneside.gov.uk/category/1134/housing-and-employment,2017-12-22
"Rosehill Social Club, Tynemouth Road, Wallsend",yes,,2020-04-15,,0.2,10,10,,local-authority-eng:NTY,not owned by a public authority,2015-11-03,https://idoxpublicaccess.northtyneside.gov.uk/online-applications/applicationDetails.do?activeTab=summary&keyVal=NKS9D9BHJLA00,permissioned,full planning permission,408,http://my.northtyneside.gov.uk/category/1134/housing-and-employment,2017-12-22
"Cosalt Factory, Liddell Street, North Shields",yes,,2020-04-15,,0.11,22,22,,local-authority-eng:NTY,,2015-03-31,https://idoxpublicaccess.northtyneside.gov.uk/online-applications/applicationDetails.do?activeTab=summary&keyVal=N6W6GMBHGN600,permissioned,full planning permission,409,http://my.northtyneside.gov.uk/category/1134/housing-and-employment,2017-12-22
"Coleman NE Ltd, Walker Place, North Shields",,,2020-04-15,,0.28,27,27,,local-authority-eng:NTY,not owned by a public authority,2017-02-07,https://idoxpublicaccess.northtyneside.gov.uk/online-applications/applicationDetails.do?activeTab=summary&keyVal=NRKMX7BHL4000,permissioned,full planning permission,411,http://my.northtyneside.gov.uk/category/1134/housing-and-employment,2017-12-22
"Trinity United Reformed Church & Hall, Esplanade, Whitley Bay",,,2020-04-15,,0.16,5,5,,local-authority-eng:NTY,,,,not permissioned,,412,http://my.northtyneside.gov.uk/category/1134/housing-and-employment,2017-12-22
"Dudley Social Club, Western Terrace, Dudley",,,2020-04-15,,0.1,6,3,allocated for ?residential development for the purposes of section 59A of the Town and Country Planning Act 1990 (permission in principle),local-authority-eng:NTY,,2020-04-15,https://idoxpublicaccess.northtyneside.gov.uk/online-applications/applicationDetails.do?keyVal=PX02NEBH09D00&activeTab=summary,permissioned,permission in principle,433,http://my.northtyneside.gov.uk/category/1134/housing-and-employment,2017-12-22
"Black Bull Inn, Front Street, Benton",yes,,2020-04-15,,0.6,9,9,,local-authority-eng:NTY,,2013-03-25,https://idoxpublicaccess.northtyneside.gov.uk/online-applications/applicationDetails.do?activeTab=summary&keyVal=MHG3LHBH09700,permissioned,full planning permission,438,http://my.northtyneside.gov.uk/category/1134/housing-and-employment,2017-12-22
"Earsdon Garage, Bank Top, Earsdon",yes,31/12/2019,2020-04-15,,0.15,8,8,,local-authority-eng:NTY,,2011-04-20,https://idoxpublicaccess.northtyneside.gov.uk/online-applications/applicationDetails.do?activeTab=summary&keyVal=LELR6XBHDX000,permissioned,full planning permission,440,http://my.northtyneside.gov.uk/category/1134/housing-and-employment,2017-12-22
"Former Clousden Hill Filling Station, Great Lime Road, Forest Hall",yes,,2020-04-15,,0.28,8,8,,local-authority-eng:NTY,,2013-09-02,https://idoxpublicaccess.northtyneside.gov.uk/online-applications/applicationDetails.do?activeTab=summary&keyVal=MPMGHZBHDX000,permissioned,full planning permission,441,http://my.northtyneside.gov.uk/category/1134/housing-and-employment,2017-12-22
"West Farm, 44 Front Street, Earsdon",yes,31/12/2019,2020-04-15,,0.25,6,6,,local-authority-eng:NTY,,2016-03-09,https://idoxpublicaccess.northtyneside.gov.uk/online-applications/applicationDetails.do?activeTab=summary&keyVal=NZ0HWMBHMQC00,permissioned,full planning permission,443,http://my.northtyneside.gov.uk/category/1134/housing-and-employment,2017-12-22
"Tynemouth Motor Company, Albion Road, North Shields",yes,,2020-04-15,,0.1,6,6,,local-authority-eng:NTY,,2012-05-10,https://idoxpublicaccess.northtyneside.gov.uk/online-applications/applicationDetails.do?activeTab=summary&keyVal=LWI8J4BH0GZ00,permissioned,outline planning permission,445,http://my.northtyneside.gov.uk/category/1134/housing-and-employment,2017-12-22
"Land and buildings at Bedford Street and Clive Street, North Shields",,,2020-04-15,,0.4,16,16,,local-authority-eng:NTY,,1998-11-19,https://idoxpublicaccess.northtyneside.gov.uk/online-applications/applicationDetails.do?activeTab=summary&keyVal=9801386FUL,permissioned,full planning permission,486,http://my.northtyneside.gov.uk/category/1134/housing-and-employment,2017-12-22
Backworth Primary School,,,2020-04-15,,0.52,14,14,,local-authority-eng:NTY,owned by a public authority,,,not permissioned,,552,http://my.northtyneside.gov.uk/category/1134/housing-and-employment,2017-12-22
"16 John Street, Cullercoats",yes,,2020-04-15,,0.09,10,10,,local-authority-eng:NTY,,2016-09-26,https://idoxpublicaccess.northtyneside.gov.uk/online-applications/applicationDetails.do?activeTab=summary&keyVal=O20UVXBHFPF00,permissioned,full planning permission,558,http://my.northtyneside.gov.uk/category/1134/housing-and-employment,2017-12-22
"Land at Westholme Farm Social Club, Mullen Road, Wallsend",yes,,2020-04-15,,0.17,6,6,,local-authority-eng:NTY,,2015-08-19,https://idoxpublicaccess.northtyneside.gov.uk/online-applications/simpleSearchResults.do?action=firstPage,permissioned,full planning permission,559,http://my.northtyneside.gov.uk/category/1134/housing-and-employment,2017-12-22
"New Winning Tavern, Church Bank, Wallsend",,15/04/2020,2020-04-15,,0.1,3,3,,local-authority-eng:NTY,,,,permissioned,,560,http://my.northtyneside.gov.uk/category/1134/housing-and-employment,2017-12-22
