site-address,deliverable,end-date,entry-date,hazardous-substances,hectares,maximum-net-dwellings,minimum-net-dwellings,notes,organisation,ownership-status,planning-permission-date,planning-permission-history,planning-permission-status,planning-permission-type,site,site-plan-url,start-date
St Anns General Hospital St Anns Road London N15 3TH,yes,,2017-12-31,,3.80,456,456,"Hybrid application comprising: Full application for the construction of 106 flats and 7 houses ranging in height from 2 to 5 storeys, conversion of retained buildings to provide 7 houses and 148 sq. m of retail (use class A1), car parking spaces, highway and public realm works, hard and soft landscaping, access and associated development: and: Outline application (with all matters reserved except for principal means of access) for the construction of new buildings and conversion of retained buildings ranging in height from 2 to 5 storeys to provide up to 350 residential units, new healthcare buildings, upgrade of existing access point off Hermitage Road, open space and associated development, and outline application (with all matters reserved except for scale and layout) for construction of a new mental health inpatient building up to 3 storeys in height (use class C2) and associated development.. http://www.haringey.gov.uk/planning-and-building-control/planning/planning-policy/local-plan/local-plan-site-allocations-dpd",local-authority-eng:HRY,owned by a public authority,2015-07-10,,permissioned,full planning permission,HGY/2014/1691,http://www.planningservices.haringey.gov.uk/portal/servlets/ApplicationSearchServlet?PKID=274419,2017-12-31
22A Broadlands Road London N6 4AG,yes,,2017-12-31,,0.10,2,2,"Demolition of 2-storey building (School's Car Club garages with flat above), brown brick side extension to No.24 (former boarding house) and rear extension to No.22 and replacement with a gabled 3 and a half storey new villa containing a pair of semi-det. http://www.planningservices.haringey.gov.uk/portal/servlets/ApplicationSearchServlet?PKID=278650",local-authority-eng:HRY,not owned by a public authority,2015-07-31,,permissioned,full planning permission,HGY/2015/0028,http://www.planningservices.haringey.gov.uk/portal/servlets/ApplicationSearchServlet?PKID=278650,2017-12-31
All Saints Vicarage 1B Church Road London N6 4QH,yes,,2017-12-31,,0.06,3,3,"Demolition of existing building and construction of new building comprising 1 x 4 bedroom house, 1 x 1 bedroom flat and 1 x 4 bedroom vicarage with associated landscaping parking and servicing. http://www.planningservices.haringey.gov.uk/portal/servlets/ApplicationSearchServlet?PKID=281948",local-authority-eng:HRY,not owned by a public authority,2015-07-10,,permissioned,full planning permission,HGY/2015/1396,http://www.planningservices.haringey.gov.uk/portal/servlets/ApplicationSearchServlet?PKID=281948,2017-12-31
62-70 Coolhurst Road London N8 8EU,yes,,2017-12-31,,0.10,5,5,"Part demolition of the existing 3 storey terrace of 5 dwelling houses, and construction of extensions and other alterations to provide a new 4 storey terrace of 5 dwelling houses with roof terraces and basement garages, including new 2 storey infill extension to no. 62. http://www.planningservices.haringey.gov.uk/portal/servlets/ApplicationSearchServlet?PKID=279835",local-authority-eng:HRY,not owned by a public authority,2015-05-27,,permissioned,full planning permission,HGY/2015/0610,http://www.planningservices.haringey.gov.uk/portal/servlets/ApplicationSearchServlet?PKID=279835,2017-12-31
Omega Works Hermitage Road London N4 1NA London,yes,,2017-12-31,,0.51,66,66,"Permission has lapsed. Redevelopment of site comprising a 4 storey block providing 66 1, 2, 3 bed flats and erection of part 4/part 5 storey commercial block providing 1643 sq metres GFA (gross floor area) with 54 car parking spaces, 25 bicycle parking spaces, 11 motorcycle spaces and associated landscaping and boundary treatment. http://www.planningservices.haringey.gov.uk/portal/servlets/ApplicationSearchServlet?PKID=119994",local-authority-eng:HRY,not owned by a public authority,2005-09-20,,permissioned,full planning permission,HGY/2005/0333,http://www.planningservices.haringey.gov.uk/portal/servlets/ApplicationSearchServlet?PKID=119994,2017-12-31
Site Rear of 44 The Broadway Crouch End London N8 London,yes,,2017-12-31,,0.01,1,1,Permission has lapsed. Demolition of existing garages and erection of 1 x 2 storey two bedroom house with parking space.. http://www.planningservices.haringey.gov.uk/portal/servlets/ApplicationSearchServlet?PKID=141571,local-authority-eng:HRY,not owned by a public authority,2006-11-07,,permissioned,full planning permission,HGY/2006/1818,http://www.planningservices.haringey.gov.uk/portal/servlets/ApplicationSearchServlet?PKID=141571,2017-12-31
"R/O & Adj to 36, Albert Road London N22 7AH London",yes,,2017-12-31,,0.04,2,2,"Permission has lapsed. Demolition of existing commercial building, garages to rear and lean to and erection of 1 x 2 storey building comprising 1 x one bed and 1 x two bed self contained flats. (amended scheme).. http://www.planningservices.haringey.gov.uk/portal/servlets/ApplicationSearchServlet?PKID=135829",local-authority-eng:HRY,not owned by a public authority,2006-06-06,,permissioned,full planning permission,HGY/2006/0645,http://www.planningservices.haringey.gov.uk/portal/servlets/ApplicationSearchServlet?PKID=135829,2017-12-31
"Percival Court, High Road London N17 8ER London",yes,,2017-12-31,,0.09,3,3,Permission has lapsed. Demolition of existing buildings and erection of 3 storey office block and 3 x 2 storey two bed houses.. http://www.planningservices.haringey.gov.uk/portal/servlets/ApplicationSearchServlet?PKID=154035,local-authority-eng:HRY,not owned by a public authority,2007-07-10,,permissioned,full planning permission,HGY/2007/0850,http://www.planningservices.haringey.gov.uk/portal/servlets/ApplicationSearchServlet?PKID=154035,2017-12-31
"Former GLS Supplies Depot, (Hale Village) Ferry Lane London N17 London",yes,,2017-12-31,,4.74,2428,2428,"Majority of this site is completed. Demolition of all structures and remediation for the development of a mixed use scheme comprising up to 1210 residential units (Use Class C3), student accommodation (C2), office (B1), hotel (C1), retail (A1, A2, A3, A4 ,A5 and B1) uses, a health centre (D1), a health club (D2), cr�che (D1) and a primary school, with provision for underground and on-street car parking, to be comprised within separate building blocks ranging in height from 1 to 18 storeys, incorporating public open space, an unculverted watercourse and Combined Heat and Power (CHP) with associated renewable energy systems (outline application).. http://www.haringey.gov.uk/sites/haringeygovuk/files/final_haringey_tottenham_aap_dtp_online.pdf",local-authority-eng:HRY,not owned by a public authority,2007-10-09,,permissioned,outline planning permission,HGY/2006/1177,http://www.planningservices.haringey.gov.uk/portal/servlets/ApplicationSearchServlet?PKID=139388,2017-12-31
Land at 24A Birstall Road London N15 5EN London,yes,,2017-12-31,,0.02,8,8,"Permission has lapsed. Erection of 2 storey building comprising 3 x one bed flats, 4 x two bed flats and 1 x maisonette, with associated cycle and refuse storage (revised scheme).. http://www.planningservices.haringey.gov.uk/portal/servlets/ApplicationSearchServlet?PKID=176040",local-authority-eng:HRY,not owned by a public authority,2008-05-14,,permissioned,full planning permission,HGY/2008/0659,http://www.planningservices.haringey.gov.uk/portal/servlets/ApplicationSearchServlet?PKID=176040,2017-12-31
2-6 Summerland Gardens Hornsey London N10 3QN London,yes,,2017-12-31,,0.03,4,4,Permission has lapsed. Demolition of existing block of 5 single storey garages/workshops and erection of 4 x two storey houses with integral garages. http://www.planningservices.haringey.gov.uk/portal/servlets/ApplicationSearchServlet?PKID=180478,local-authority-eng:HRY,not owned by a public authority,2008-08-13,,permissioned,full planning permission,HGY/2008/1340,http://www.planningservices.haringey.gov.uk/portal/servlets/ApplicationSearchServlet?PKID=180478,2017-12-31
Land Adjacent 110 Broad Lane Tottenham London N15 4DT London,yes,,2017-12-31,,0.03,8,8,Permission has lapsed. Erection of 1 x 4 storey building comprising 1 x three bed and 7 x two bed self contained flats.. http://www.planningservices.haringey.gov.uk/portal/servlets/ApplicationSearchServlet?PKID=144519,local-authority-eng:HRY,not owned by a public authority,2008-05-15,,permissioned,full planning permission,HGY/2006/2323,http://www.planningservices.haringey.gov.uk/portal/servlets/ApplicationSearchServlet?PKID=144519,2017-12-31
16-52 High Road London N15 6LS London,yes,,2017-12-31,,0.09,9,9,"Demolition of existing garages and erection of 3 storey building comprising 1 x three bed, 4 x two bed and 4 x one bed flats with commercial use (A1 / A2) at ground floor level, offices at first floor level and parking at basement level. (Revised Scheme). http://www.planningservices.haringey.gov.uk/portal/servlets/ApplicationSearchServlet?PKID=175637",local-authority-eng:HRY,not owned by a public authority,2008-06-11,,permissioned,full planning permission,HGY/2008/0593,http://www.planningservices.haringey.gov.uk/portal/servlets/ApplicationSearchServlet?PKID=175637,2017-12-31
7 Orchard Place London N17 8BH,yes,,2017-12-31,,0.06,6,6,Permission has lapsed. Redevelopment of site to provide 3 storey building comprising 2 x three bed and 4 x two bed self-contained flats with 3 no car parking spaces.. http://www.planningservices.haringey.gov.uk/portal/servlets/ApplicationSearchServlet?PKID=174500,local-authority-eng:HRY,not owned by a public authority,2008-08-07,,permissioned,full planning permission,HGY/2008/0462,http://www.planningservices.haringey.gov.uk/portal/servlets/ApplicationSearchServlet?PKID=174500,2017-12-31
"Adj to 150, Alexandra Park Road Wood Green London N22 7UJ London",yes,,2017-12-31,,0.02,1,1,Permission has lapsed. Demolition of existing garage and erection of a two storey rear side extension to form one bedroom dwellinghouse. http://www.planningservices.haringey.gov.uk/portal/servlets/ApplicationSearchServlet?PKID=187658,local-authority-eng:HRY,not owned by a public authority,2009-02-19,,permissioned,full planning permission,HGY/2008/1839,http://www.planningservices.haringey.gov.uk/portal/servlets/ApplicationSearchServlet?PKID=187658,2017-12-31
579C High Road London N17 6SB London,yes,,2017-12-31,,0.10,8,8,"Permission has lapsed. Demolition of existing building and erection of part two / part three storey building comprising of 1 x 3 bed, 3 x 2, 4 x 1 bed flats, 4 x B1 units at ground floor with eight car parking spaces.. http://www.planningservices.haringey.gov.uk/portal/servlets/ApplicationSearchServlet?PKID=195262",local-authority-eng:HRY,not owned by a public authority,2009-06-12,,permissioned,full planning permission,HGY/2009/0181,http://www.planningservices.haringey.gov.uk/portal/servlets/ApplicationSearchServlet?PKID=195262,2017-12-31
10A Annington Road London N2 9NB London,yes,,2017-12-31,,0.02,2,2,Permission has lapsed. Demolition of existing single storey garage workshop and erection of new 2 storey building to provide 2 x two bed flats.. http://www.planningservices.haringey.gov.uk/portal/servlets/ApplicationSearchServlet?PKID=208023,local-authority-eng:HRY,not owned by a public authority,2010-02-01,,permissioned,full planning permission,HGY/2009/2074,http://www.planningservices.haringey.gov.uk/portal/servlets/ApplicationSearchServlet?PKID=208023,2017-12-31
5 Stirling Road London N17 9UN London,yes,,2017-12-31,,0.02,2,2,Permission has lapsed. Demolition of existing building and erection of 2 x 4 bedroom dwellinghouses.. http://www.planningservices.haringey.gov.uk/portal/servlets/ApplicationSearchServlet?PKID=199761,local-authority-eng:HRY,not owned by a public authority,2009-07-22,,permissioned,full planning permission,HGY/2009/0893,http://www.planningservices.haringey.gov.uk/portal/servlets/ApplicationSearchServlet?PKID=199761,2017-12-31
Site between 186-188 Hermitage Road London N4 1NN London,yes,,2017-12-31,,0.01,1,1,Permission has lapsed. Demolition of existing garage and erection of 1 x 2 storey two bedroom self-contained dwelling.. http://www.planningservices.haringey.gov.uk/portal/servlets/ApplicationSearchServlet?PKID=204646,local-authority-eng:HRY,not owned by a public authority,2009-12-09,,permissioned,full planning permission,HGY/2009/1559,http://www.planningservices.haringey.gov.uk/portal/servlets/ApplicationSearchServlet?PKID=204646,2017-12-31
624 High Road London N17 9TL London,yes,,2017-12-31,,0.23,42,42,"Retention of the existing structural frame comprising Scotland Green House, rebuilding of the front and rear elevations, adding a fourth storey to the existing building and erection of a new four storey building to the front of the site to provide 42 residential units and one commercial unit.. http://www.planningservices.haringey.gov.uk/portal/servlets/ApplicationSearchServlet?PKID=204381",local-authority-eng:HRY,not owned by a public authority,2010-01-18,,permissioned,full planning permission,HGY/2009/1532,http://www.planningservices.haringey.gov.uk/portal/servlets/ApplicationSearchServlet?PKID=204381,2017-12-31
"Land forming part of 60,Grand Avenue London N10 3BP London",yes,,2017-12-31,,0.03,1,1,Application for a new planning permission to replace an extant planning permission (HGY/2005/1416) for erection of a 2 storey 5 bedroom end of terrace house with rooms at basement and roof and 1 off street parking space. http://www.planningservices.haringey.gov.uk/portal/servlets/ApplicationSearchServlet?PKID=216974,local-authority-eng:HRY,not owned by a public authority,2010-08-27,,permissioned,full planning permission,HGY/2010/1305,http://www.planningservices.haringey.gov.uk/portal/servlets/ApplicationSearchServlet?PKID=216974,2017-12-31
Land To The Rear Of 100 Wightman Road London N4 1RN London,yes,,2017-12-31,,0.01,1,1,Permission has lapsed. Demolition of existing garage and erection of 1 x basement level and two storey one bedroom house.. http://www.planningservices.haringey.gov.uk/portal/servlets/ApplicationSearchServlet?PKID=228736,local-authority-eng:HRY,not owned by a public authority,2011-03-22,,permissioned,full planning permission,HGY/2011/0141,http://www.planningservices.haringey.gov.uk/portal/servlets/ApplicationSearchServlet?PKID=228736,2017-12-31
Land at 24A Birstall Road London N15 5EN London,yes,,2017-12-31,,0.03,8,8,"Application for a new planning permission to replace an extant planning permission HGY/2008/0659 in order to extend the time limit for implementation: erection of 2 storey building comprising 3 x one bed flats, 4 x two bed flats and 1 x maisonette with a. http://www.planningservices.haringey.gov.uk/portal/servlets/ApplicationSearchServlet?PKID=234685",local-authority-eng:HRY,not owned by a public authority,2011-05-24,,permissioned,full planning permission,HGY/2011/0655,http://www.planningservices.haringey.gov.uk/portal/servlets/ApplicationSearchServlet?PKID=234685,2017-12-31
"Land at Haringey Heartlands, between Hornsey Park Road, Mayes Road, Clarendon Road and the Kings Cross / East Coast Mainline London",yes,,2017-12-31,,4.59,1080,950,"Outline planning application for demolition of existing structures and redevelopment to provide a residential led, mixed-use development, comprising between 950 to 1,080 residential units (C3); with 460sqm to 700sqm of office uses (B1); 370sqm to 700sqm of retail/financial and professional services uses (A1/A2); 190sqm to 550sqm of restaurant/cafe/drinking establishment uses (A3/A4); 325sqm to 550sqm of community/assembly/leisure uses (D1/D2); new landscaping, public and private open space, and energy centre, two utility compounds, up to 251 car parking spaces, cycle parking, access and other associated infrastructure works.. http://www.planningservices.haringey.gov.uk/portal/servlets/ApplicationSearchServlet?PKID=197286",local-authority-eng:HRY,not owned by a public authority,2012-03-21,,permissioned,outline planning permission,HGY/2009/0503,http://www.planningservices.haringey.gov.uk/portal/servlets/ApplicationSearchServlet?PKID=197286,2017-12-31
29/31 Aylmer Road London N2 0BS,yes,,2017-12-31,,0.15,9,9,"Demolition of no's 29-31 Aylmer Road and erection of a part 4/part 5 storey building comprising of 9 self contained flats to provide 6 x 2 bedroom apartments and 3 x 3 bedroom apartments. Provision of 14 covered car parking spaces, 1 visitor's space, cy. http://www.planningservices.haringey.gov.uk/portal/servlets/ApplicationSearchServlet?PKID=256442",local-authority-eng:HRY,not owned by a public authority,2012-12-21,,permissioned,full planning permission,HGY/2012/0554,http://www.planningservices.haringey.gov.uk/portal/servlets/ApplicationSearchServlet?PKID=256442,2017-12-31
Garages Rear of 269 Archway Road London N6 5BT,yes,,2017-12-31,,0.01,1,1,"Demolition of existing garages and erection of 1 x 2 storey, two bed dwelling. http://www.planningservices.haringey.gov.uk/portal/servlets/ApplicationSearchServlet?PKID=261175",local-authority-eng:HRY,not owned by a public authority,2013-03-04,,permissioned,full planning permission,HGY/2012/1572,http://www.planningservices.haringey.gov.uk/portal/servlets/ApplicationSearchServlet?PKID=261175,2017-12-31
"Wards Corner Site, High Road London N15 London",yes,,2017-12-31,,0.83,163,163,"Demolition of existing buildings and erection of a mixed use development comprising class C3 residential, class A1/A2/A3/A4 uses, with access, parking and associated landscaping and public realm improvements. http://www.haringey.gov.uk/planning-and-building-control/planning/planning-policy/local-plan/local-plan-site-allocations-dpd",local-authority-eng:HRY,mixed ownership,2012-07-12,,permissioned,full planning permission,HGY/2012/0915,http://www.planningservices.haringey.gov.uk/portal/servlets/ApplicationSearchServlet?PKID=307535,2017-12-31
Hornsey Reuse and Recycling Centre High Street London N8 7QB,yes,,2017-12-31,,2.14,438,438,"Demolition of existing structures and buildings and redevelopment of the site to provide a mixed-use development comprising approximately 3,250sqm (GIA) foodstore (A1 use) and 114 space surface level car parking for the foodstore; 438 residential units including affordable housing and ancillary residential gym, approximately 356sqm (GIA) unit on Hornsey High Street (flexible A1, A2 (including a temporary marketing suite), or D1 use); two live/work units fronting onto Cross Lane; together with private amenity space and new public realm, including publicly accessible routes through the site; an energy centre; 178 car parking spaces for the residential use (within a basement and undercroft); cycle parking; refuse storage; recycling centre in the foodstore car park; access; and other infrastructure work. http://www.haringey.gov.uk/planning-and-building-control/planning/planning-policy/local-plan/local-plan-site-allocations-dpd",local-authority-eng:HRY,mixed ownership,2014-04-04,,permissioned,full planning permission,HGY/2013/2019,http://www.planningservices.haringey.gov.uk/portal/servlets/ApplicationSearchServlet?PKID=270227,2017-12-31
Site adjoining 1 Coningsby Road London N4 1EG,yes,,2017-12-31,,0.01,1,1,Erection of a two storey two bedroom house. http://www.planningservices.haringey.gov.uk/portal/servlets/ApplicationSearchServlet?PKID=271884,local-authority-eng:HRY,not owned by a public authority,2014-03-24,,permissioned,full planning permission,HGY/2014/0267,http://www.planningservices.haringey.gov.uk/portal/servlets/ApplicationSearchServlet?PKID=271884,2017-12-31
Land rear of 27-47 Cecile Park London N8,yes,,2017-12-31,,0.14,4,4,Demolition of 33 existing lock-up garages and erection of 4 x 2 storey four bedroom houses with basement floors and associated landscaping and car parking. http://www.planningservices.haringey.gov.uk/portal/servlets/ApplicationSearchServlet?PKID=262172,local-authority-eng:HRY,not owned by a public authority,2013-06-04,,permissioned,full planning permission,HGY/2012/1705,http://www.planningservices.haringey.gov.uk/portal/servlets/ApplicationSearchServlet?PKID=262172,2017-12-31
Land to rear of 14 Lansdowne Road London N17 9XE,yes,,2017-12-31,,0.01,2,2,"Erection of new three storey residential building with flat roof, comprising 2 x two bed flats, with provision of bin store to front.. http://www.planningservices.haringey.gov.uk/portal/servlets/ApplicationSearchServlet?PKID=268547",local-authority-eng:HRY,not owned by a public authority,2013-10-09,,permissioned,full planning permission,HGY/2013/1685,http://www.planningservices.haringey.gov.uk/portal/servlets/ApplicationSearchServlet?PKID=268547,2017-12-31
21 Great Cambridge Road London N17 7LH,yes,,2017-12-31,,0.02,1,1,Demolition of an existing building and erection of a new building with retail unit on the ground floor with storage in the basement and a two bedroom flat on the first and second floor. http://www.planningservices.haringey.gov.uk/portal/servlets/ApplicationSearchServlet?PKID=271248,local-authority-eng:HRY,not owned by a public authority,2014-03-07,,permissioned,full planning permission,HGY/2014/0090,http://www.planningservices.haringey.gov.uk/portal/servlets/ApplicationSearchServlet?PKID=271248,2017-12-31
30 Summerhill Road London N15 4HD London,yes,,2017-12-31,,0.05,3,3,Demolition of existing warehouse and erection of 1 x 4 bed house and 2 x 2 bed mews houses with provision of bin and cycle storage. http://www.planningservices.haringey.gov.uk/portal/servlets/ApplicationSearchServlet?PKID=315175,local-authority-eng:HRY,not owned by a public authority,2013-11-22,,permissioned,full planning permission,HGY/2017/2431,http://www.planningservices.haringey.gov.uk/portal/servlets/ApplicationSearchServlet?PKID=315175,2017-12-31
56 Muswell Hill London N10 3ST,yes,,2017-12-31,,0.43,28,28,"Demolition of existing specialist school (D1 use) and night club (sui generis use) and partial demolition of existing restaurant building (A3 use). Conversion of retained buildings and erection of new buildings of 3 storeys to provide 1,054sqm of floorspace as replacement specialist school including community use accessed from Muswell hill (D1 use), partly accommodated within the existing vacant building at No.56 Muswell Hill, 28 residential units (C3 use), and a 288sqm ground floor retail unit at No.56 Muswell Hill (A1/A2/A3 use). Provision of car parking, cycle parking and associated hard and soft landscaping. http://www.planningservices.haringey.gov.uk/portal/servlets/ApplicationSearchServlet?PKID=270248",local-authority-eng:HRY,not owned by a public authority,2014-02-14,,permissioned,full planning permission,HGY/2013/2069,http://www.planningservices.haringey.gov.uk/portal/servlets/ApplicationSearchServlet?PKID=270248,2017-12-31
Land to rear of 1-11 The Drive London N11 2DY,yes,,2017-12-31,,0.19,3,3,Development of a terrace of three x 4 bedroom houses. http://www.planningservices.haringey.gov.uk/portal/servlets/ApplicationSearchServlet?PKID=270884,local-authority-eng:HRY,not owned by a public authority,2014-02-14,,permissioned,full planning permission,HGY/2013/2396,http://www.planningservices.haringey.gov.uk/portal/servlets/ApplicationSearchServlet?PKID=270884,2017-12-31
1A Hewitt Road London N8 0BS,yes,,2017-12-31,,0.01,2,2,Construction of two storey 2 bedroom residential unit with associated outside space on the site of an unused garage. http://www.planningservices.haringey.gov.uk/portal/servlets/ApplicationSearchServlet?PKID=271300,local-authority-eng:HRY,not owned by a public authority,2014-01-29,,permissioned,full planning permission,HGY/2013/2566,http://www.planningservices.haringey.gov.uk/portal/servlets/ApplicationSearchServlet?PKID=271300,2017-12-31
Hale Wharf,yes,,2017-12-31,,6.32,505,505,"Outline planning permission (for the entire site) for a residential led mixed use development comprising the demolition of existing buildings and structures; the construction of buildings across the site to include residential (up to 505 units) and flexible retail or business uses (Use Classes A1-A5 or B1); pedestrian/cycle footbridges, modification works to the existing vehicular access and associated highway works; refurbishment of existing infrastructure (including provision of an on-site energy centre, if required), landscaping and public realm works; new servicing arrangements; car/cycle parking; and associated and facilitating works. All matters are reserved for the pedestrian footbridges, Phases 2 and 3 Buildings and detailed permission is sought with no matters reserved for the Phase 1 Buildings. The detailed component of the application (Phase 1 buildings only) comprises the demolition of existing buildings; the construction of buildings ranging from 16 to 21 storeys to accommodate 249 residential units and 307m2 (GIA) of flexible retail or business uses (Use Classes A1-A5 or B1); modification works to the existing vehicular access and associated highway works; infrastructure (including provision of an on-site energy centre, if required), landscaping and public realm works; new servicing arrangements; car/cycle parking; and associated and facilitating works.. http://www.planningservices.haringey.gov.uk/portal/servlets/ApplicationSearchServlet?PKID=290435",local-authority-eng:HRY,mixed ownership,2017-06-13,,permissioned,outline planning permission,17140201,http://www.planningservices.haringey.gov.uk/portal/servlets/ApplicationSearchServlet?PKID=290435,2017-12-31
Park Grove and Durnsford Road,yes,,2017-12-31,,1.48,160,160,http://www.haringey.gov.uk/planning-and-building-control/planning/planning-policy/local-plan/local-plan-site-allocations-dpd,local-authority-eng:HRY,owned by a public authority,,,,,17140364,http://www.haringey.gov.uk/planning-and-building-control/planning/planning-policy/local-plan/local-plan-site-allocations-dpd,2017-12-31
