site-address,deliverable,end-date,entry-date,hazardous-substances,hectares,maximum-net-dwellings,minimum-net-dwellings,notes,organisation,ownership-status,planning-permission-date,planning-permission-history,planning-permission-status,planning-permission-type,site,site-plan-url,start-date
"St Martin's Hospital, Canterbury",yes,,2017-11-23,,6.39,163,163,Strategic Allocation in Local Plan. Allocated for 164 Units,local-authority-eng:CAT,,,,not permissioned,,BR-002,"https://mapping.canterbury.gov.uk/webapps/Brownfield_Sites/?center=616725,157695,27700&scale=2000",2017-11-01
"Land Adjacent to Canterbury West Station, Canterbury",yes,,2017-11-23,,0.22,20,20,Existing Allocation in Local Plan. Allocated for erection of 20 dwellings,local-authority-eng:CAT,mixed ownership,,,not permissioned,,BR-004,"https://mapping.canterbury.gov.uk/webapps/Brownfield_Sites/?center=614654,158485,27700&scale=500",2017-11-01
"Kingsmead Depot, Kingsmead Road, Canterbury",yes,,2017-11-23,,3.85,32,32,Existing Allocation in Local Plan. Full Application is pending decision. Demolition of existing buildings and erection of 40 dwellings,local-authority-eng:CAT,mixed ownership,,,pending decision,,BR-005,"https://mapping.canterbury.gov.uk/webapps/Brownfield_Sites/?center=615399,158576,27700&scale=2000",2017-11-01
"Former Employment Exchange, St Johns Lane, Canterbury",,,2017-11-23,,0.08,24,24,Existing Allocation in Local Plan. Allocated for 24 Dwellings,local-authority-eng:CAT,,,,not permissioned,,BR-006,"https://mapping.canterbury.gov.uk/webapps/Brownfield_Sites/?center=614781,157530,27700&scale=500",2017-11-01
"Canterbury East Station (North side) Car Park, Canterbury",yes,,2017-11-23,,0.48,24,24,Existing Allocation in Local Plan. Allocated for erection of 24 dwellings,local-authority-eng:CAT,,,,not permissioned,,BR-007,"https://mapping.canterbury.gov.uk/webapps/Brownfield_Sites/?center=614832,157229,27700&scale=1000",2017-11-01
"Northgate Car Park, Norhgate, Canterbury",,,2017-11-23,,0.21,21,21,Existing Allocation in Local Plan. Allocated for erection of 21 dwellings,local-authority-eng:CAT,mixed ownership,,,not permissioned,,BR-008,"https://mapping.canterbury.gov.uk/webapps/Brownfield_Sites/?center=615305,158415,27700&scale=500",2017-11-01
"Castle Street Car Park, Canterbury",,,2017-11-23,,0.28,54,54,Existing Allocation in Local Plan. Allocated for erection of 54 dwellings,local-authority-eng:CAT,owned by a public authority,,,not permissioned,,BR-009,"https://mapping.canterbury.gov.uk/webapps/Brownfield_Sites/?center=614604,157429,27700&scale=1000",2017-11-01
"BT Car park, Upper Chantry Lane, Canterbury",yes,,2017-11-23,,0.43,20,20,Existing Allocation in Local Plan. Allocated for erection of 20 dwellings,local-authority-eng:CAT,,,,not permissioned,,BR-010,"https://mapping.canterbury.gov.uk/webapps/Brownfield_Sites/?center=615338,157302,27700&scale=1000",2017-11-01
"Holmans Meadow Car Park, Dover Street, Canterbury",,,2017-11-23,,0.54,20,20,Existing Allocation in Local Plan. Allocated for erection of 20 dwellings,local-authority-eng:CAT,owned by a public authority,,,not permissioned,,BR-011,"https://mapping.canterbury.gov.uk/webapps/Brownfield_Sites/?center=615144,157450,27700&scale=1000",2017-11-01
"Rosemary Lane Car Park, Rosemary Lane, Canterbury",yes,,2017-11-23,,0.27,20,20,Existing Allocation in Local Plan. Allocated for erection of 20 dwellings,local-authority-eng:CAT,owned by a public authority,,,not permissioned,,BR-012,"https://mapping.canterbury.gov.uk/webapps/Brownfield_Sites/?center=614612,157566,27700&scale=500",2017-11-01
"White Horse Lane, Canterbury",yes,,2017-11-23,,0.19,10,10,Existing Allocation in Local Plan. Allocated for erection of 10 dwellings,local-authority-eng:CAT,mixed ownership,,,not permissioned,,BR-014,"https://mapping.canterbury.gov.uk/webapps/Brownfield_Sites/?center=614836,157794,27700&scale=1000",2017-11-01
"Ivy Lane Car Park, Ivy Lane, Canterbury",yes,,2017-11-23,,0.08,10,10,Existing Allocation in Local Plan. Allocated for erection of 10 dwellings,local-authority-eng:CAT,owned by a public authority,,,not permissioned,,BR-015,"https://mapping.canterbury.gov.uk/webapps/Brownfield_Sites/?center=615443,157600,27700&scale=500",2017-11-01
"Hawks Lane Car Park, Hawks Lane, Canterbury",yes,,2017-11-23,,0.03,9,9,Existing Allocation in Local Plan. Allocated for 9 dwellings,local-authority-eng:CAT,owned by a public authority,,,not permissioned,,BR-016,"https://mapping.canterbury.gov.uk/webapps/Brownfield_Sites/?center=614823,157744,27700&scale=500",2017-11-01
"St Radigunds Car Park, St Radigunds Street, Canterbury",,,2017-11-23,,0.07,7,7,Existing Allocation in Local Plan. Allocated for 7 dwellings,local-authority-eng:CAT,owned by a public authority,,,not permissioned,,BR-017,"https://mapping.canterbury.gov.uk/webapps/Brownfield_Sites/?center=615042,158292,27700&scale=500",2017-11-01
"The Garth, St Stephens Road, Canterbury",yes,,2017-11-23,,0.14,12,12,Existing Allocation in Local Plan. Proposed three storey building containing 12 two-bedroom apartments.,local-authority-eng:CAT,,2017-06-23,,permissioned,full planning permission,BR-018,"https://mapping.canterbury.gov.uk/webapps/Brownfield_Sites/?center=614873,158392,27700&scale=500",2017-11-01
"St Johns Lane Car Park, St Johns Lane, Canterbury",,,2017-11-23,,0.06,5,5,Existing Allocation in Local Plan. Allocation for erection of 5 dwellings,local-authority-eng:CAT,mixed ownership,,,not permissioned,,BR-019,"https://mapping.canterbury.gov.uk/webapps/Brownfield_Sites/?center=614745,157561,27700&scale=500",2017-11-01
"Garage Site at Kings Road/Park Road Junction, Herne Bay",,,2017-11-23,,0.13,43,43,Existing Allocation in Local Plan. Allocated for 43 dwellings,local-authority-eng:CAT,,,,not permissioned,,BR-020,"https://mapping.canterbury.gov.uk/webapps/Brownfield_Sites/?center=617703,168002,27700&scale=500",2017-11-01
"Land at Herne Bay Station, Herne Bay",yes,,2017-11-23,,0.58,35,35,Existing Allocation in Local Plan. Erection of 35 dwellings,local-authority-eng:CAT,,,,not permissioned,,BR-021,"https://mapping.canterbury.gov.uk/webapps/Brownfield_Sites/?center=617030,167446,27700&scale=1000",2017-11-01
"Central Development Area, Herne Bay",,,2017-11-23,,3.7,56,46,Part Of Herne Bay Action Plan HB1,local-authority-eng:CAT,mixed ownership,,,not permissioned,,BR-022,"https://mapping.canterbury.gov.uk/webapps/Brownfield_Sites/?center=617716,168129,27700&scale=1000",2017-11-01
"Beach Street, Herne Bay",yes,,2017-11-23,,0.33,19,14,Part Of Herne Bay Action Plan HB2,local-authority-eng:CAT,mixed ownership,,,not permissioned,,BR-023,"https://mapping.canterbury.gov.uk/webapps/Brownfield_Sites/?center=617697,168335,27700&scale=1000",2017-11-01
"Herne Bay Bus Depot, Herne Bay",yes,,2017-11-23,,0.52,30,20,Part Of Herne Bay Action Plan HB3. Full Application pending decision,local-authority-eng:CAT,,,,pending decision,,BR-024,"https://mapping.canterbury.gov.uk/webapps/Brownfield_Sites/?center=617565,168174,27700&scale=1000",2017-11-01
"Tankerton Road Car Park & Garage, Whitstable",,,2017-11-23,,0.19,17,17,Existing Allocation in Local Plan. Allocated for 17 dwellings,local-authority-eng:CAT,owned by a public authority,,,not permissioned,,BR-025,"https://mapping.canterbury.gov.uk/webapps/Brownfield_Sites/?center=612346,167172,27700&scale=500",2017-11-01
"124 & Adjoining Middle Wall, Whitstable",,,2017-11-23,,0.15,7,7,Existing Allocation in Local Plan. Allocated for 7 dwellings,local-authority-eng:CAT,mixed ownership,,,not permissioned,,BR-026,"https://mapping.canterbury.gov.uk/webapps/Brownfield_Sites/?center=610644,166359,27700&scale=500",2017-11-01
"The Tile Warehouse and Former Boat Storage Yard, Sea Street/Sea Wall, Whitstable, CT5 1AN",yes,,2017-11-23,,0.16,8,8,Existing Allocation in Local Plan. Demolition of existing tile warehouse and mixed use redevelopment. Erection of 8 residential townhouses,local-authority-eng:CAT,,2017-07-19,,permissioned,full planning permission,BR-027,"https://mapping.canterbury.gov.uk/webapps/Brownfield_Sites/?center=610638,166828,27700&scale=500",2017-11-01
"Herne Bay Court, Canterbury Road, Herne Bay, CT6 5TD",yes,,2017-11-23,,3.76,157,157,Erection of retirement village,local-authority-eng:CAT,,2014-12-03,,permissioned,full planning permission,BR-029,"https://mapping.canterbury.gov.uk/webapps/Brownfield_Sites/?center=618210,167173,27700&scale=2000",2017-11-01
"Land at Gordon Road, Wincheap, CT1 3PP",yes,,2017-11-23,,0.11,14,14,Following demolition of industrial building: erection of block of 4 one-bedroom flats and 4 two-bed flats; and a separate block of 2 two-bed flats and 4 one-bed flats,local-authority-eng:CAT,,2014-05-12,,permissioned,full planning permission,BR-031,"https://mapping.canterbury.gov.uk/webapps/Brownfield_Sites/?center=614675,157207,27700&scale=500",2017-11-01
"108 High Street, Herne Bay, CT6 5JY",yes,,2017-11-23,,0.03,6,6,Conversion of upper floors from commercial and associated residential accommodation to provide 6 one-bedroom flats.,local-authority-eng:CAT,,2014-03-04,,permissioned,full planning permission,BR-032,"https://mapping.canterbury.gov.uk/webapps/Brownfield_Sites/?center=617707,168203,27700&scale=500",2017-11-01
"Site of Former Sturry Road Social Club, East Street, Canterbury, CT1 1EE",yes,,2017-11-23,,0.26,10,10,Erection of 10 bungalows,local-authority-eng:CAT,owned by a public authority,2017-10-16,,permissioned,full planning permission,BR-034,"https://mapping.canterbury.gov.uk/webapps/Brownfield_Sites/?center=616452,159095,27700&scale=1000",2017-11-01
"Land at Belmont Road, Whitstable, CT5 1QJ",yes,,2017-11-23,,0.27,10,10,"Demolition of industrial buildings and erection of 10 dwellings with associated garaging, parking and landscaping.",local-authority-eng:CAT,,2015-10-15,,permissioned,full planning permission,BR-035,"https://mapping.canterbury.gov.uk/webapps/Brownfield_Sites/?center=610998,166142,27700&scale=1000",2017-11-01
"49-55 Canterbury Road, Whitstable, CT5 4HH",yes,,2017-11-23,,0.06,4,4,"Change of use of part of the ground floor of 49-55 Canterbury Road from restaurant to three flats, and change of use of first floor of 49-51 Canterbury Road to two flats.",local-authority-eng:CAT,,2016-01-27,,permissioned,full planning permission,BR-041,"https://mapping.canterbury.gov.uk/webapps/Brownfield_Sites/?center=610739,165919,27700&scale=500",2017-11-01
"Wesley Manse, 71 Whitstable Road, Canterbury, CT2 8EA",yes,,2017-11-23,,0.11,8,8,"Alteration, extension and conversion of property to nine no. apartments.",local-authority-eng:CAT,,2016-03-02,,permissioned,full planning permission,BR-047,"https://mapping.canterbury.gov.uk/webapps/Brownfield_Sites/?center=614039,158490,27700&scale=500",2017-11-01
"Old Brewery Business Centre, 75 Stour Street, Canterbury, CT1 2NR",yes,,2017-11-23,,0.07,5,5,"Demolition of rear extension to 75 Stour Street together with internal alterations, change of use and construction of 2 new buildings within the courtyard to form 5 new residential dwellings.",local-authority-eng:CAT,,2016-05-13,,permissioned,full planning permission,BR-053,"https://mapping.canterbury.gov.uk/webapps/Brownfield_Sites/?center=614775,157773,27700&scale=500",2017-11-01
"Northgate House, 115-120 Northgate, Canterbury, CT1 1EZ",yes,,2017-11-23,,0.12,24,24,Convert existing offices into 24 flats.,local-authority-eng:CAT,,2016-08-17,,permissioned,full planning permission,BR-059,"https://mapping.canterbury.gov.uk/webapps/Brownfield_Sites/?center=615340,158367,27700&scale=500",2017-11-01
"10 Upper Bridge Street, Canterbury, CT1 2NA",yes,,2017-11-23,,0.04,8,8,Convert existing offices into 8 units of residential accommodation.,local-authority-eng:CAT,,2016-09-27,,permissioned,full planning permission,BR-062,"https://mapping.canterbury.gov.uk/webapps/Brownfield_Sites/?center=615125,157506,27700&scale=500",2017-11-01
"21 St Georges Terrace, Herne Bay, CT6 8RH",yes,,2017-11-23,,0.04,6,6,Proposed four-storey building containing 7 apartments following demolition of the existing dwelling.,local-authority-eng:CAT,,2017-03-10,,permissioned,full planning permission,BR-063,"https://mapping.canterbury.gov.uk/webapps/Brownfield_Sites/?center=617086,168211,27700&scale=500",2017-11-01
"8b-11 North Lane, Canterbury, CT2 7SL",yes,,2017-11-23,,0.04,7,7,Conversion to 4 townhouses and demolition of existing outbuildings to rear and erection of 2no. apartments and 1no. studio unit.,local-authority-eng:CAT,,2015-10-23,,permissioned,full planning permission,BR-065,"https://mapping.canterbury.gov.uk/webapps/Brownfield_Sites/?center=614626,158205,27700&scale=500",2017-11-01
"226A and 226B Tankerton Road, Whitstable, CT5 2AY",yes,,2017-11-23,,0.03,3,3,Roof extension and alterations to provide 5 flats,local-authority-eng:CAT,,2017-04-10,,permissioned,full planning permission,BR-066,"https://mapping.canterbury.gov.uk/webapps/Brownfield_Sites/?center=612515,167140,27700&scale=500",2017-11-01
"60A London Road, Canterbury, CT2 8JZ",yes,,2017-11-23,,0.06,9,9,Demolition of house and construction of new building incorporating 10 flats.,local-authority-eng:CAT,,2016-06-09,,permissioned,full planning permission,BR-069,"https://mapping.canterbury.gov.uk/webapps/Brownfield_Sites/?center=613872,158125,27700&scale=500",2017-11-01
"24 Avenue Road, Herne Bay, CT6 8TB",yes,,2017-11-23,,0.01,4,4,"Conversion of property to 5 self-contained flats, part demolition of rear projection and new flat roof, replacement of pavement light with wrought iron grille and sub-division of rear courtyard",local-authority-eng:CAT,,2015-11-02,,permissioned,full planning permission,BR-070,"https://mapping.canterbury.gov.uk/webapps/Brownfield_Sites/?center=617212,168186,27700&scale=500",2017-11-01
"43 Queens Avenue, Canterbury, CT2 8BA",yes,,2017-11-23,,0.06,6,6,Demolition of building and erection of 7 apartments,local-authority-eng:CAT,,2017-06-08,,permissioned,full planning permission,BR-083,"https://mapping.canterbury.gov.uk/webapps/Brownfield_Sites/?center=613850,158117,27700&scale=500",2017-11-01
"The Gentyl Knyght, Knight Avenue, Canterbury, CT2 8PU",yes,,2017-11-23,,0.09,5,5,Demolition of public house and erection of five two-storey terraced houses,local-authority-eng:CAT,,2017-09-01,,permissioned,full planning permission,BR-084,"https://mapping.canterbury.gov.uk/webapps/Brownfield_Sites/?center=613373,157700,27700&scale=500",2017-11-01
"Wayford, Sweechbridge Road, Herne Bay, CT6 6TB",yes,,2017-11-23,,0.2,4,4,Erection of five dwellings following demolition of bungalow.,local-authority-eng:CAT,,2017-05-04,,permissioned,full planning permission,BR-086,"https://mapping.canterbury.gov.uk/webapps/Brownfield_Sites/?center=621028,167973,27700&scale=500",2017-11-01
"64-65 Central Paradee, Herne Bay, CT6 5JG",yes,,2017-11-23,,0.03,12,12,Demolition of existing building and erection of five-storey building with 12,local-authority-eng:CAT,,2017-04-28,,permissioned,full planning permission,BR-087,"https://mapping.canterbury.gov.uk/webapps/Brownfield_Sites/?center=617748,168390,27700&scale=500",2017-11-01
"St Benedict Nursing Home, 22-23 St George's Terrace, Herne Bay, CT6 8RH",yes,,2017-11-23,,0.09,10,10,"Proposed change of use from care home to residential; together with two-storey rear and roof extension, to provide 10 apartments.",local-authority-eng:CAT,,2017-10-03,,permissioned,full planning permission,BR-088,"https://mapping.canterbury.gov.uk/webapps/Brownfield_Sites/?center=617063,168206,27700&scale=500",2017-11-01
"Belmont Yard, Belmont Road, Whitstable",yes,,2017-11-23,,0.23,10,10,Demolition of existing building and erection of 10 dwellings with associated parking,local-authority-eng:CAT,,2017-09-07,,permissioned,full planning permission,BR-089,"https://mapping.canterbury.gov.uk/webapps/Brownfield_Sites/?center=610961,166142,27700&scale=1000",2017-11-01
"Herne Bay Golf Driving Range, Greenhill",,,2017-11-23,,0.31,8,1,This is part of a larger Local Plan allocated site for 40 dwellings,local-authority-eng:CAT,,,,not permissioned,,BR-091,"https://mapping.canterbury.gov.uk/webapps/Brownfield_Sites/?center=616854,166853,27700&scale=500",2017-11-01
