site-address,deliverable,end-date,entry-date,hazardous-substances,hectares,maximum-net-dwellings,minimum-net-dwellings,notes,organisation,ownership-status,planning-permission-date,planning-permission-history,planning-permission-status,planning-permission-type,site,site-plan-url,start-date
"Land at Stevens Road, Balby",yes,,2018-12-31,,2.47,196,196,"11/00246/EXTM - Erection of 112 houses and 84 apartments (being extension of time on planning application 06/00014/FULM, granted on 09/04/2008). Application approved by Planning Committee subject to S106. Erection of 196 dwellings (112 houses and 84 apartments)",local-authority-eng:DNC,not owned by a public authority,,http://www.doncaster.gov.uk/services/planning/planning-applications-online-public-access,pending decision,,111,http://dmbc.maps.arcgis.com/apps/webappviewer/index.html?id=2ac0d9b40cc34eb2b05e80a122b7a6e2,2017-12-31
"Former Bloodstock Sales Site, Carr House Road",yes,,2018-12-31,,1.74,58,46,18/02614/4FULM - pending,local-authority-eng:DNC,owned by a public authority,,http://www.doncaster.gov.uk/services/planning/planning-applications-online-public-access,pending decision,,253,http://dmbc.maps.arcgis.com/apps/webappviewer/index.html?id=2ac0d9b40cc34eb2b05e80a122b7a6e2,2017-12-31
"Plot 5A, off Carolina Way / Lakeside Boulevard",yes,,2018-12-31,,2,66,53,,local-authority-eng:DNC,owned by a public authority,,http://www.doncaster.gov.uk/services/planning/planning-applications-online-public-access,not permissioned,,261,http://dmbc.maps.arcgis.com/apps/webappviewer/index.html?id=2ac0d9b40cc34eb2b05e80a122b7a6e2,2017-12-31
"Plot 6, Lakeside Boulevard",yes,,2018-12-31,,3.11,109,87,"Has previously been granted planning permission (Ref:06/02537/FULA) for the erection of 308 apartments in 4 complexes, each varying in height between 2 and 4 storeys with limited 5 storey elements, with associated public open space, landscaped areas and car parking, together with a building for Class A3 use",local-authority-eng:DNC,owned by a public authority,,http://www.doncaster.gov.uk/services/planning/planning-applications-online-public-access,not permissioned,,262,http://dmbc.maps.arcgis.com/apps/webappviewer/index.html?id=2ac0d9b40cc34eb2b05e80a122b7a6e2,2017-12-31
"Barnburgh House, Edlington Lane, New Edlington",yes,,2018-12-31,,0.24,9,7,,local-authority-eng:DNC,owned by a public authority,,http://www.doncaster.gov.uk/services/planning/planning-applications-online-public-access,not permissioned,,375,http://dmbc.maps.arcgis.com/apps/webappviewer/index.html?id=2ac0d9b40cc34eb2b05e80a122b7a6e2,2017-12-31
"Garden Street, Mexborough",,,2018-12-31,,0.51,19,15,,local-authority-eng:DNC,owned by a public authority,,http://www.doncaster.gov.uk/services/planning/planning-applications-online-public-access,not permissioned,,379,http://dmbc.maps.arcgis.com/apps/webappviewer/index.html?id=2ac0d9b40cc34eb2b05e80a122b7a6e2,2017-12-31
"Windhill, Whinhill Avenue, Mexborough",,,2018-12-31,,3.33,140,112,Former housing area that has been cleared of existing housing stock under housing renewal programme. Permission 17/02056/FULM,local-authority-eng:DNC,owned by a public authority,,http://www.doncaster.gov.uk/services/planning/planning-applications-online-public-access,not permissioned,,414,http://dmbc.maps.arcgis.com/apps/webappviewer/index.html?id=2ac0d9b40cc34eb2b05e80a122b7a6e2,2017-12-31
"Woodland View, Edwin Road, Woodlands",,,2018-12-31,,0.61,14,14,17/02056/FULM. 14 affordable bungalows,local-authority-eng:DNC,owned by a public authority,2017-11-01,http://www.doncaster.gov.uk/services/planning/planning-applications-online-public-access,permissioned,full planning permission,415,http://dmbc.maps.arcgis.com/apps/webappviewer/index.html?id=2ac0d9b40cc34eb2b05e80a122b7a6e2,2017-12-31
"Civic And Cultural Quarter, Waterdale",yes,,2018-12-31,,11.26,33,33,"08/02535/OUTA - This is a large mixed use Outline permission, a significant proportion has now come forward with Reserved Matters and indeed built. There is a 1ha site (Scarborough House) identified for residential uses that has not yet had Reserved Matters. Although this site has been temporary greened over, it previosuly contained Council Offices and car parking so is considered to be Brownfield. The capacity in this register reflects this part of the scheme only. Other residential elements are under construction (see 12/02500/REMM) and the original capacity of 450 units is no longer expected to materialise with a revised total of 130 units now expected. Mixed Use Civic & Cultural Quarter comprising new performance venue, public library, civic offices, A1/A2/A3/A4 retail, B1 offices, D2 leisure, C1 hotels and C3 residential and open space",local-authority-eng:DNC,owned by a public authority,2010-03-30,http://www.doncaster.gov.uk/services/planning/planning-applications-online-public-access,permissioned,outline planning permission,440,http://dmbc.maps.arcgis.com/apps/webappviewer/index.html?id=2ac0d9b40cc34eb2b05e80a122b7a6e2,2017-12-31
"Askern Saw Mills, High Street, Askern",yes,,2018-12-31,,15.08,220,220,"08/01077/OUTA - Reserved Matters now submitted (16/01651/REMM) but not yet determined.. Mixed use redevelopment of saw mill and land to the south for up to 220 dwellings, up to 310 sq. m A1 use, up to 310 sq. m A3 use, up to 560 sq. m A4 use, up to 1400 sq. m B1c use, up to 8550 sq. m Class B2 use and public open space and retention of 3.81 ha of open storage in B8 use and existing building on approx. 15.17 ha of land",local-authority-eng:DNC,not owned by a public authority,2013-07-11,http://www.doncaster.gov.uk/services/planning/planning-applications-online-public-access,permissioned,outline planning permission,569,http://dmbc.maps.arcgis.com/apps/webappviewer/index.html?id=2ac0d9b40cc34eb2b05e80a122b7a6e2,2017-12-31
"28 Cow House Lane, Armthorpe",yes,,2018-12-31,,0.26,7,7,15/00828/FUL. Erection of 8 houses following demolition of existing bungalow and commercial premises,local-authority-eng:DNC,not owned by a public authority,2015-09-01,http://www.doncaster.gov.uk/services/planning/planning-applications-online-public-access,permissioned,full planning permission,602,http://dmbc.maps.arcgis.com/apps/webappviewer/index.html?id=2ac0d9b40cc34eb2b05e80a122b7a6e2,2017-12-31
"Land off Bankwood Lane, Rossington",,,2018-12-31,,0.53,54,43,Previous planning permission (Ref: 11/01655/EXTM) but now lapsed. Subsequent temporary change of use from former factory and factory outlet to HGV parking for a period of 18 months (Retrospective - 16/02386/COUM) pending decision.. Residential development of 43 dwellings,local-authority-eng:DNC,not owned by a public authority,,http://www.doncaster.gov.uk/services/planning/planning-applications-online-public-access,not permissioned,,629,http://dmbc.maps.arcgis.com/apps/webappviewer/index.html?id=2ac0d9b40cc34eb2b05e80a122b7a6e2,2017-12-31
"Land At 41 Sandford Road, Balby",,,2018-12-31,,1.11,45,36,Previous planning permission (Ref: 11/02159/EXTM) but now lapsed. This was for a high density 3 x blocks apartment scheme totalling 125 units.. Residential development of 36 dwellings,local-authority-eng:DNC,not owned by a public authority,,http://www.doncaster.gov.uk/services/planning/planning-applications-online-public-access,not permissioned,,633,http://dmbc.maps.arcgis.com/apps/webappviewer/index.html?id=2ac0d9b40cc34eb2b05e80a122b7a6e2,2017-12-31
"Site At Former Yorkshire Main Colliery , Broomhouse Lane, Balby",yes,,2018-12-31,,17.6,375,375,"18/02100/OUTM. Hybrid planning application comprising: Part A: Full planning application for creation of temporary access and enabling earthworks to create development platform. Part B: Outline planning application for residential development of up to 375 houses and public house with associated access, landscaping and public open space. Approval sought for access. All other matters reserved. DRAFT. http://www.doncaster.gov.uk/services/planning/planning-applications-online-public-access",local-authority-eng:DNC,not owned by a public authority,,http://www.doncaster.gov.uk/services/planning/planning-applications-online-public-access,pending decision,,646,http://dmbc.maps.arcgis.com/apps/webappviewer/index.html?id=2ac0d9b40cc34eb2b05e80a122b7a6e2,2017-12-31
"163 Balby Road, Balby",,,2018-12-31,,0.16,9,9,"18/00501/FULM. Change of use of former school building to form 6 No. four bed HMO (House in Multiple Occupation), 3 No. self contained one bed apartments and 1 No. two-bed apartment, and erection of two storey pitched roof extension to front elevation to form office.. http://www.doncaster.gov.uk/services/planning/planning-applications-online-public-access",local-authority-eng:DNC,not owned by a public authority,2018-11-13,http://www.doncaster.gov.uk/services/planning/planning-applications-online-public-access,permissioned,full planning permission,654,http://dmbc.maps.arcgis.com/apps/webappviewer/index.html?id=2ac0d9b40cc34eb2b05e80a122b7a6e2,2017-12-31
"Site Of Former Rossington Colliery, West End Lane, New Rossington",yes,,2018-12-31,,51.7,1034,1034,"12/01107/OUTA - Outline permission capacity has been reduced to reflect subsequent Reserved Matters (15/00008/REMM /16/00871/REMM & 14/02683/REM) approvals and starts on site for initial residential phases of this large development scheme.. Mixed use development comprising up to 1200 residential units, local superstore (Use Class A1), hotel, (Use Class C1), restaurant (Use Class A3/A4), fast food outlet (Use Class A3/A5), petrol filling station with ancillary retail (Sui Generis), community building (Use Class D1) and land for new primary school. http://www.doncaster.gov.uk/services/planning/planning-applications-online-public-access",local-authority-eng:DNC,not owned by a public authority,2013-10-01,http://www.doncaster.gov.uk/services/planning/planning-applications-online-public-access,permissioned,outline planning permission,662,http://dmbc.maps.arcgis.com/apps/webappviewer/index.html?id=2ac0d9b40cc34eb2b05e80a122b7a6e2,2017-12-31
"The Embankment, Leach Lane Industrial Estate, Leach Lane, Mexborough",,,2018-12-31,,0.55,24,24,14/02813/FULM - Evidence provided from landowner/developer that site not currently viable as part of evidence submitted to Public Inquiry May 2017 hence excluded from 5YHLS. More recent evidence that the scheme will now go ahead however: http://wearedoncaster.co.uk/news/multimillion-pound-doncaster-waterfront-scheme-set-to-move-ahead/?utm_source=newsletter&amp;utm_medium=email&amp;utm_campaign=Mexborough&amp;utm_content=November%20(2). Erection of 17 houses & 7 apartments,local-authority-eng:DNC,not owned by a public authority,2016-01-18,http://www.doncaster.gov.uk/services/planning/planning-applications-online-public-access,permissioned,full planning permission,687,http://dmbc.maps.arcgis.com/apps/webappviewer/index.html?id=2ac0d9b40cc34eb2b05e80a122b7a6e2,2017-12-31
"Former Earth Centre Car Park, Kilners Bridge, Denaby Main",yes,,2018-12-31,,6.63,175,175,14/02981/FULM. Residential development of 175 houses,local-authority-eng:DNC,not owned by a public authority,2015-10-15,http://www.doncaster.gov.uk/services/planning/planning-applications-online-public-access,permissioned,full planning permission,691,http://dmbc.maps.arcgis.com/apps/webappviewer/index.html?id=2ac0d9b40cc34eb2b05e80a122b7a6e2,2017-12-31
"Red Lion Hotel, 41 Bank Street, Mexborough",,,2018-12-31,,0.06,16,16,11/02702/FULM - Planning permission lapsed. Current application pending for demolition of existing building (18/02022/FUL),local-authority-eng:DNC,not owned by a public authority,,http://www.doncaster.gov.uk/services/planning/planning-applications-online-public-access,not permissioned,,790,http://dmbc.maps.arcgis.com/apps/webappviewer/index.html?id=2ac0d9b40cc34eb2b05e80a122b7a6e2,2017-12-31
"Bentley House, Jossey Lane, Scawthorpe",yes,,2018-12-31,,2.28,80,80,Previous permission (12/01046/OUTM) lapsed.. Residential development following demolition of existing buildings and means of access. http://www.doncaster.gov.uk/services/planning/planning-applications-online-public-access,local-authority-eng:DNC,not owned by a public authority,,http://www.doncaster.gov.uk/services/planning/planning-applications-online-public-access,not permissioned,,791,http://dmbc.maps.arcgis.com/apps/webappviewer/index.html?id=2ac0d9b40cc34eb2b05e80a122b7a6e2,2017-12-31
"Land at Former Industrial Estate, Briars Lane, Stainforth",yes,,2018-12-31,,4.14,152,152,13/00897/FULM. Residential development of 152 dwellings. http://www.doncaster.gov.uk/services/planning/planning-applications-online-public-access,local-authority-eng:DNC,not owned by a public authority,2015-02-17,http://www.doncaster.gov.uk/services/planning/planning-applications-online-public-access,permissioned,full planning permission,794,http://dmbc.maps.arcgis.com/apps/webappviewer/index.html?id=2ac0d9b40cc34eb2b05e80a122b7a6e2,2017-12-31
"Land At Doncaster Football Ground, Bawtry Road, Doncaster, DN4 7PD",yes,,2018-12-31,,3.384,152,152,16/02139/FULM. Erection of 151 residential dwellings and associated infrastructure on 3.38ha of land (Without compliance with condition 2 of planning application 13/01639/FULM granted on 16/01/2015 - Alterations to approved layout - 1 additional dwelling).. http://www.doncaster.gov.uk/services/planning/planning-applications-online-public-access,local-authority-eng:DNC,not owned by a public authority,2017-09-08,http://www.doncaster.gov.uk/services/planning/planning-applications-online-public-access,permissioned,full planning permission,797,http://dmbc.maps.arcgis.com/apps/webappviewer/index.html?id=2ac0d9b40cc34eb2b05e80a122b7a6e2,2018-12-31
"The Old Vicarage, Stonegate, Thorne",yes,,2018-12-31,,0.11,11,11,14/02119/FULM. Conversion former elderly persons residence to form 11 self contained apartments. http://www.doncaster.gov.uk/services/planning/planning-applications-online-public-access,local-authority-eng:DNC,not owned by a public authority,2014-12-16,http://www.doncaster.gov.uk/services/planning/planning-applications-online-public-access,permissioned,full planning permission,805,http://dmbc.maps.arcgis.com/apps/webappviewer/index.html?id=2ac0d9b40cc34eb2b05e80a122b7a6e2,2017-12-31
"Sandy Lane, Doncaster",,,2018-12-31,,1.3,49,39,http://www.doncaster.gov.uk/services/planning/planning-applications-online-public-access,local-authority-eng:DNC,not owned by a public authority,,http://www.doncaster.gov.uk/services/planning/planning-applications-online-public-access,not permissioned,,833,http://dmbc.maps.arcgis.com/apps/webappviewer/index.html?id=2ac0d9b40cc34eb2b05e80a122b7a6e2,2017-12-31
"Warmsworth Reservoir, Warmsworth",,,2018-12-31,,0.6,29,18,17/00537/OUTM - pending decsion (23 dwellings),local-authority-eng:DNC,not owned by a public authority,,http://www.doncaster.gov.uk/services/planning/planning-applications-online-public-access,pending decision,,835,http://dmbc.maps.arcgis.com/apps/webappviewer/index.html?id=2ac0d9b40cc34eb2b05e80a122b7a6e2,2017-12-31
Kirk Street/Ramsden Road/Eden Grove,yes,,2018-12-31,,21.3,930,930,"There are several planning approvals for this site (06/03071/OUTM; 11/01077/REMM;14/00616/FULM). The original Outline permission included proposals for a wider mixed use development, but viability issues has subsequently resulted in further approvals for just additional residential uses. The site has had planning permission implemented (development platform created), but that scheme is no longer being delivered and no houses have been built. Likely that a fresh application will be required therefore.. Residential development for 930 dwellings. http://www.doncaster.gov.uk/services/planning/planning-applications-online-public-access",local-authority-eng:DNC,not owned by a public authority,2015-02-27,http://www.doncaster.gov.uk/services/planning/planning-applications-online-public-access,permissioned,full planning permission,838,http://dmbc.maps.arcgis.com/apps/webappviewer/index.html?id=2ac0d9b40cc34eb2b05e80a122b7a6e2,2017-12-31
"Land At Alagu Close ,Off Highwoods Road, Mexborough",yes,,2018-12-31,,0.24,9,9,15/00827/OUT. Residential development - 9 units. http://www.doncaster.gov.uk/services/planning/planning-applications-online-public-access,local-authority-eng:DNC,not owned by a public authority,2015-06-11,http://www.doncaster.gov.uk/services/planning/planning-applications-online-public-access,permissioned,outline planning permission,850,http://dmbc.maps.arcgis.com/apps/webappviewer/index.html?id=2ac0d9b40cc34eb2b05e80a122b7a6e2,2017-12-31
"125A, 127, 127A, 129 AND 131A Balby Road, Balby",yes,,2018-12-31,,0.02,10,10,14/02130/FULM. Change of Use of 5 shop units (Class A1) to 10 studio flats (C3). http://www.doncaster.gov.uk/services/planning/planning-applications-online-public-access,local-authority-eng:DNC,not owned by a public authority,2014-12-19,http://www.doncaster.gov.uk/services/planning/planning-applications-online-public-access,permissioned,full planning permission,862,http://dmbc.maps.arcgis.com/apps/webappviewer/index.html?id=2ac0d9b40cc34eb2b05e80a122b7a6e2,2017-12-31
"Campsall and District Working Men's Social Club, The Avenue, Campsall",,,2018-12-31,,0.38,18,14,Previous planning permission (Ref: 12/00308/OUT) but now lapsed.. Residential development of 14 units following demolition of Working Men's Club. http://www.doncaster.gov.uk/services/planning/planning-applications-online-public-access,local-authority-eng:DNC,not owned by a public authority,,http://www.doncaster.gov.uk/services/planning/planning-applications-online-public-access,not permissioned,,867,http://dmbc.maps.arcgis.com/apps/webappviewer/index.html?id=2ac0d9b40cc34eb2b05e80a122b7a6e2,2017-12-31
"Oswin Avenue, Balby",yes,,2018-12-31,,0.25,22,22,13/00522/FULM. Residential development of 22 dwellings following demolition of commercial units. http://www.doncaster.gov.uk/services/planning/planning-applications-online-public-access,local-authority-eng:DNC,not owned by a public authority,2015-10-08,http://www.doncaster.gov.uk/services/planning/planning-applications-online-public-access,permissioned,full planning permission,886,http://dmbc.maps.arcgis.com/apps/webappviewer/index.html?id=2ac0d9b40cc34eb2b05e80a122b7a6e2,2017-12-31
"Former Reservoir, Green Lane, Scawthorpe",yes,,2018-12-31,,0.86,12,12,16/03030/FULM. Residential development of12 dwellings following demolition of redundant reservoir. http://www.doncaster.gov.uk/services/planning/planning-applications-online-public-access,local-authority-eng:DNC,not owned by a public authority,2017-07-11,http://www.doncaster.gov.uk/services/planning/planning-applications-online-public-access,permissioned,full planning permission,888,http://dmbc.maps.arcgis.com/apps/webappviewer/index.html?id=2ac0d9b40cc34eb2b05e80a122b7a6e2,2017-12-31
"Land Rear Of 67 - 79 South End, Station Road, Dunscroft",yes,,2018-12-31,,0.16,7,7,14/01809/FUL. Residential development for 7 dwellings,local-authority-eng:DNC,not owned by a public authority,2015-06-04,http://www.doncaster.gov.uk/services/planning/planning-applications-online-public-access,permissioned,full planning permission,890,http://dmbc.maps.arcgis.com/apps/webappviewer/index.html?id=2ac0d9b40cc34eb2b05e80a122b7a6e2,2017-12-31
"Land Of The Former Cinema, Edlington Lane, Edlington",yes,,2018-12-31,,0.11,16,16,14/02581/FULM. Erection 16 apartments. http://www.doncaster.gov.uk/services/planning/planning-applications-online-public-access,local-authority-eng:DNC,not owned by a public authority,2015-05-22,http://www.doncaster.gov.uk/services/planning/planning-applications-online-public-access,permissioned,full planning permission,893,http://dmbc.maps.arcgis.com/apps/webappviewer/index.html?id=2ac0d9b40cc34eb2b05e80a122b7a6e2,2017-12-31
"Former Nurses Home, Cemetery Road, Mexborough",yes,,2018-12-31,,0.3,9,9,15/02583/OUT. Residential development for up to 9 units,local-authority-eng:DNC,not owned by a public authority,2016-02-08,http://www.doncaster.gov.uk/services/planning/planning-applications-online-public-access,permissioned,outline planning permission,894,http://dmbc.maps.arcgis.com/apps/webappviewer/index.html?id=2ac0d9b40cc34eb2b05e80a122b7a6e2,2017-12-31
"Princegate House, Princegate, Doncaster",yes,,2018-12-31,,0.07,8,8,14/02938/FUL. 8 Residential apartments constructed on a newly created 6th floor to existing building,local-authority-eng:DNC,not owned by a public authority,2015-04-17,http://www.doncaster.gov.uk/services/planning/planning-applications-online-public-access,permissioned,full planning permission,897,http://dmbc.maps.arcgis.com/apps/webappviewer/index.html?id=2ac0d9b40cc34eb2b05e80a122b7a6e2,2017-12-31
"Site Of Former Rossington Colliery, West End Lane, New Rossington",yes,,2018-12-31,,2.84,96,96,15/00008/REMM. Erection of 96 dwellings. http://www.doncaster.gov.uk/services/planning/planning-applications-online-public-access,local-authority-eng:DNC,not owned by a public authority,2015-04-27,http://www.doncaster.gov.uk/services/planning/planning-applications-online-public-access,permissioned,reserved matters approval,899,http://dmbc.maps.arcgis.com/apps/webappviewer/index.html?id=2ac0d9b40cc34eb2b05e80a122b7a6e2,2017-12-31
"East Lane House, 60 East Lane, Stainforth",yes,,2018-12-31,,0.17,10,10,15/00219/FULM. Change of Use of vacant day nursery (Class D1) to 10 self contained flats (C3). http://www.doncaster.gov.uk/services/planning/planning-applications-online-public-access,local-authority-eng:DNC,not owned by a public authority,2015-04-28,http://www.doncaster.gov.uk/services/planning/planning-applications-online-public-access,permissioned,full planning permission,901,http://dmbc.maps.arcgis.com/apps/webappviewer/index.html?id=2ac0d9b40cc34eb2b05e80a122b7a6e2,2017-12-31
"Snooker Club, 21 - 27 St Sepulchre Gate, Doncaster",yes,,2018-12-31,,0.05,6,6,15/00474/FUL. Change of Use of 2nd floor from snooker club (Class D2) to 6 apartments (Class C3),local-authority-eng:DNC,not owned by a public authority,2015-04-28,http://www.doncaster.gov.uk/services/planning/planning-applications-online-public-access,permissioned,full planning permission,902,http://dmbc.maps.arcgis.com/apps/webappviewer/index.html?id=2ac0d9b40cc34eb2b05e80a122b7a6e2,2017-12-31
"Denison House, 15 South Parade, Doncaster",yes,,2018-12-31,,0.16,11,11,15/01088/FULM. Change of Use from offices to create 11 apartments. http://www.doncaster.gov.uk/services/planning/planning-applications-online-public-access,local-authority-eng:DNC,not owned by a public authority,2015-06-25,http://www.doncaster.gov.uk/services/planning/planning-applications-online-public-access,permissioned,full planning permission,906,http://dmbc.maps.arcgis.com/apps/webappviewer/index.html?id=2ac0d9b40cc34eb2b05e80a122b7a6e2,2017-12-31
"Armthorpe Shopping Centre, Mill Street, Armthorpe",yes,,2018-12-31,,0.36,9,9,15/02042/COU. Change of Use of first floor from office use (class B1a) to 9 apartments. http://www.doncaster.gov.uk/services/planning/planning-applications-online-public-access,local-authority-eng:DNC,not owned by a public authority,2015-12-11,http://www.doncaster.gov.uk/services/planning/planning-applications-online-public-access,permissioned,full planning permission,913,http://dmbc.maps.arcgis.com/apps/webappviewer/index.html?id=2ac0d9b40cc34eb2b05e80a122b7a6e2,2017-12-31
"Land South Of Armthorpe Shopping Centre, Mill Street, Armthorpe",yes,,2018-12-31,,0.28,11,11,17/01854/FULM. Residential development of 11 units. http://www.doncaster.gov.uk/services/planning/planning-applications-online-public-access,local-authority-eng:DNC,not owned by a public authority,2018-03-01,http://www.doncaster.gov.uk/services/planning/planning-applications-online-public-access,permissioned,reserved matters approval,914,http://dmbc.maps.arcgis.com/apps/webappviewer/index.html?id=2ac0d9b40cc34eb2b05e80a122b7a6e2,2017-12-31
"Land North Of Armthorpe Shopping Centre, Mill Street, Armthorpe",yes,,2018-12-31,,0.18,7,7,18/00153/FUL. Residential development of 7units. http://www.doncaster.gov.uk/services/planning/planning-applications-online-public-access,local-authority-eng:DNC,not owned by a public authority,2018-04-27,http://www.doncaster.gov.uk/services/planning/planning-applications-online-public-access,permissioned,full planning permission,915,http://dmbc.maps.arcgis.com/apps/webappviewer/index.html?id=2ac0d9b40cc34eb2b05e80a122b7a6e2,2017-12-31
"Belmont Works, 3 Havelock Road, Balby",yes,,2018-12-31,,0.1,8,8,15/02051/OUT. 2 blocks of 4 flats following demolition of existing buildings. http://www.doncaster.gov.uk/services/planning/planning-applications-online-public-access,local-authority-eng:DNC,not owned by a public authority,2015-10-21,http://www.doncaster.gov.uk/services/planning/planning-applications-online-public-access,permissioned,outline planning permission,916,http://dmbc.maps.arcgis.com/apps/webappviewer/index.html?id=2ac0d9b40cc34eb2b05e80a122b7a6e2,2017-12-31
"Barnby Dun Car Centre, Top Road, Barnby Dun",yes,,2018-12-31,,0.21,6,6,15/02336/OUT. Residential development of 6 units following demolition of existing buildings. Revised Outline application pending consideration (18/02564/OUT). http://www.doncaster.gov.uk/services/planning/planning-applications-online-public-access,local-authority-eng:DNC,not owned by a public authority,2015-11-18,http://www.doncaster.gov.uk/services/planning/planning-applications-online-public-access,permissioned,outline planning permission,918,http://dmbc.maps.arcgis.com/apps/webappviewer/index.html?id=2ac0d9b40cc34eb2b05e80a122b7a6e2,2017-12-31
