site-address,deliverable,end-date,entry-date,hazardous-substances,hectares,maximum-net-dwellings,minimum-net-dwellings,notes,organisation,ownership-status,planning-permission-date,planning-permission-history,planning-permission-status,planning-permission-type,site,site-plan-url,start-date
"1 Scot Lane, Doncaster, DN1 1EW",yes,,2018-12-31,,0.029,10,10,17/01145/COU. Change of use of first and second floors to form 10 No. HiMO bedrooms.. http://www.doncaster.gov.uk/services/planning/planning-applications-online-public-access,local-authority-eng:DNC,not owned by a public authority,2017-06-30,http://www.doncaster.gov.uk/services/planning/planning-applications-online-public-access,permissioned,full planning permission,1071,http://dmbc.maps.arcgis.com/apps/webappviewer/index.html?id=2ac0d9b40cc34eb2b05e80a122b7a6e2,2018-12-31
"Spar Stores, 7 High Street, Hatfield, Doncaster, DN7 6RS",yes,,2018-12-31,,0.056,5,5,17/01182/FUL. 1. Demolition of existing buildings. 2 Erection of 2 two bedroom dwellings and 2 one bedroom self contained flats to rear with associated alterations 3. Alterations and extensions to existing shop/flat to create 3 self contained apartments. 4. Change of use from Retail (A1) to Coffee Shop (A3) with alterations to shop front (amended plans). http://www.doncaster.gov.uk/services/planning/planning-applications-online-public-access,local-authority-eng:DNC,not owned by a public authority,2017-10-26,http://www.doncaster.gov.uk/services/planning/planning-applications-online-public-access,permissioned,full planning permission,1072,http://dmbc.maps.arcgis.com/apps/webappviewer/index.html?id=2ac0d9b40cc34eb2b05e80a122b7a6e2,2018-12-31
"St Peters House, Princes Street, Doncaster, DN1 3NJ",yes,,2018-12-31,,0.087,51,51,17/01457/PRIOR. Change of use from B1 (offices) to C3 (Dwellinghouse) use; to create 51 apartments.. http://www.doncaster.gov.uk/services/planning/planning-applications-online-public-access,local-authority-eng:DNC,not owned by a public authority,2017-08-09,http://www.doncaster.gov.uk/services/planning/planning-applications-online-public-access,permissioned,full planning permission,1074,http://dmbc.maps.arcgis.com/apps/webappviewer/index.html?id=2ac0d9b40cc34eb2b05e80a122b7a6e2,2018-12-31
"Suite Express House, 39A Skellow Road, Carcroft, Doncaster, DN6 8HQ",yes,,2018-12-31,,0.093,7,7,17/01587/FUL. Conversion of 1st floor commercial space to form 6 apartments and alterations to rear elevation. Conversion of out-building store to form 1 apartment and associated external alterations. Use of rear courtyard for a private car park.. http://www.doncaster.gov.uk/services/planning/planning-applications-online-public-access,local-authority-eng:DNC,not owned by a public authority,2017-09-20,http://www.doncaster.gov.uk/services/planning/planning-applications-online-public-access,permissioned,full planning permission,1076,http://dmbc.maps.arcgis.com/apps/webappviewer/index.html?id=2ac0d9b40cc34eb2b05e80a122b7a6e2,2018-12-31
"Units 1 To 2 Queens Court, Rowan Garth, Bentley, Doncaster, DN5 9QB",yes,,2018-12-31,,0.227,9,9,17/01797/FUL. Erection of 9 dwellings with garages on approx 0.23ha of land.. http://www.doncaster.gov.uk/services/planning/planning-applications-online-public-access,local-authority-eng:DNC,not owned by a public authority,2017-08-29,http://www.doncaster.gov.uk/services/planning/planning-applications-online-public-access,permissioned,full planning permission,1077,http://dmbc.maps.arcgis.com/apps/webappviewer/index.html?id=2ac0d9b40cc34eb2b05e80a122b7a6e2,2018-12-31
"White And Carter, Station Road, Blaxton, Doncaster, DN9 3AQ",yes,,2018-12-31,,0.274,8,8,17/01856/FUL. Proposed erection of 8 detached houses and garages and demolition of existing buildings. http://www.doncaster.gov.uk/services/planning/planning-applications-online-public-access,local-authority-eng:DNC,not owned by a public authority,2017-11-10,http://www.doncaster.gov.uk/services/planning/planning-applications-online-public-access,permissioned,full planning permission,1078,http://dmbc.maps.arcgis.com/apps/webappviewer/index.html?id=2ac0d9b40cc34eb2b05e80a122b7a6e2,2018-12-31
"Armthorpe Shopping Centre, Mill Street, Armthorpe, Doncaster, DN3 3DL",yes,,2018-12-31,,0.816,6,6,17/01908/FULM. Conversion of 6 existing 3 bedroom flats to create a total of 12 one bedroom flats. http://www.doncaster.gov.uk/services/planning/planning-applications-online-public-access,local-authority-eng:DNC,not owned by a public authority,2017-12-06,http://www.doncaster.gov.uk/services/planning/planning-applications-online-public-access,permissioned,full planning permission,1079,http://dmbc.maps.arcgis.com/apps/webappviewer/index.html?id=2ac0d9b40cc34eb2b05e80a122b7a6e2,2018-12-31
"Cedar Adult Centre, Warde Avenue, Balby, Doncaster, DN4 9DX",yes,,2018-12-31,,0.707,25,25,17/02293/3FULM. Erection of 25 affordable dwellings (Being application under Regulation 3 Town & Country Planning (General) Regulations 1992). http://www.doncaster.gov.uk/services/planning/planning-applications-online-public-access,local-authority-eng:DNC,owned by a public authority,2017-12-13,http://www.doncaster.gov.uk/services/planning/planning-applications-online-public-access,permissioned,full planning permission,1081,http://dmbc.maps.arcgis.com/apps/webappviewer/index.html?id=2ac0d9b40cc34eb2b05e80a122b7a6e2,2018-12-31
"Conisbrough Social Education Centre, Old Road, Conisbrough, Doncaster, DN12 3LR",yes,,2018-12-31,,1.183,41,41,17/02355/3FULM. Erection of 41 affordable dwellings (Being application under Regulation 3 Town & Country Planning (General) Regulations 1992).. http://www.doncaster.gov.uk/services/planning/planning-applications-online-public-access,local-authority-eng:DNC,owned by a public authority,2017-12-15,http://www.doncaster.gov.uk/services/planning/planning-applications-online-public-access,permissioned,full planning permission,1082,http://dmbc.maps.arcgis.com/apps/webappviewer/index.html?id=2ac0d9b40cc34eb2b05e80a122b7a6e2,2018-12-31
"Prudential Chambers, 4 Silver Street, Doncaster, DN1 1HQ",yes,,2018-12-31,,0.003,6,6,"17/02770/PRIOR. Prior approval notification for the change of use of first, second and third floor offices (Class B1(a)) to six self contained flats (Class C3).. http://www.doncaster.gov.uk/services/planning/planning-applications-online-public-access",local-authority-eng:DNC,not owned by a public authority,2018-01-02,http://www.doncaster.gov.uk/services/planning/planning-applications-online-public-access,permissioned,full planning permission,1084,http://dmbc.maps.arcgis.com/apps/webappviewer/index.html?id=2ac0d9b40cc34eb2b05e80a122b7a6e2,2018-12-31
"7 - 9 Scot Lane, Doncaster, DN1 1EW",yes,,2018-12-31,,0.025,9,9,"17/02798/COU. Change of use of first, second and third floor from gymnasium to 9 apartments including the creation of an internal bin store to ground floor.. http://www.doncaster.gov.uk/services/planning/planning-applications-online-public-access",local-authority-eng:DNC,not owned by a public authority,2018-01-08,http://www.doncaster.gov.uk/services/planning/planning-applications-online-public-access,permissioned,full planning permission,1085,http://dmbc.maps.arcgis.com/apps/webappviewer/index.html?id=2ac0d9b40cc34eb2b05e80a122b7a6e2,2018-12-31
"Site Of Former Westminster Club, Westminster Crescent, Intake, Doncaster, DN2 6HU",yes,,2018-12-31,,0.485,23,23,17/02929/FULM. Erection of 23 dwellings with associated infrastructure and car parking on approximately 0.48 Ha of land. http://www.doncaster.gov.uk/services/planning/planning-applications-online-public-access,local-authority-eng:DNC,not owned by a public authority,2018-03-16,http://www.doncaster.gov.uk/services/planning/planning-applications-online-public-access,permissioned,full planning permission,1086,http://dmbc.maps.arcgis.com/apps/webappviewer/index.html?id=2ac0d9b40cc34eb2b05e80a122b7a6e2,2018-12-31
