site-address,deliverable,end-date,entry-date,hazardous-substances,hectares,maximum-net-dwellings,minimum-net-dwellings,notes,organisation,ownership-status,planning-permission-date,planning-permission-history,planning-permission-status,planning-permission-type,site,site-plan-url,start-date
49 Queens Road East Grinstead,yes,,2018-12-13,,0.15,14,14,"Planning Permission Reference: DM/17/2725. Conversion of a D1 educational building to 14 no. residential apartments with new additional set back third floor and infilling of existing undercroft areas. Associated car parking, landscaping, cycle spaces, amenity areas, 1.1m high metal fence and new ramp.. https://www.midsussex.gov.uk/planning-building/evidence-supporting-documents/",local-authority-eng:MSS,not owned by a public authority,2018-01-26,https://pa.midsussex.gov.uk/online-applications/,permissioned,full planning permission,SHLAAID923,https://www.midsussex.gov.uk/planning-building/evidence-supporting-documents/,2018-12-13
18 Station Road East Grinstead,yes,,2018-12-13,,0.02,6,6,Planning Permission Reference: DM/17/1634. Proposed Change of Use from ground floor to second floor of office (B1) building to residential (C3) comprising 6 x one bed residential units.. https://www.midsussex.gov.uk/planning-building/evidence-supporting-documents/,local-authority-eng:MSS,not owned by a public authority,2017-06-06,https://pa.midsussex.gov.uk/online-applications/,permissioned,other,SHLAAID926,https://www.midsussex.gov.uk/planning-building/evidence-supporting-documents/,2018-12-13
3 Heath Sqaure Boltro Road Haywards Heath,yes,,2018-12-13,,0.01,6,6,Planning Permission Reference: DM/17/2328. Proposed change of use from office use (Class B1(a)) to 6 no. dwellings (Class C3). https://www.midsussex.gov.uk/planning-building/evidence-supporting-documents/,local-authority-eng:MSS,not owned by a public authority,2017-07-24,https://pa.midsussex.gov.uk/online-applications/,permissioned,other,SHLAAID954,https://www.midsussex.gov.uk/planning-building/evidence-supporting-documents/,2018-12-13
Sussex House London Road East Grinstead,yes,,2018-12-13,,0.24,8,8,"Planning Permission Reference: DM/18/1038. The application seeks confirmation of the lawfulness of the completion of the development permitted in a Decision Notice dated 27th January 2014 under reference 13/04040/FUL for a vertical extension to the existing building to form 8 residential units and formation of a new commercial A1, A3, B1 and A2 at the above address.. https://www.midsussex.gov.uk/planning-building/evidence-supporting-documents/",local-authority-eng:MSS,not owned by a public authority,2018-05-14,https://pa.midsussex.gov.uk/online-applications/,permissioned,other,SHLAAID409,https://www.midsussex.gov.uk/planning-building/evidence-supporting-documents/,2018-12-13
1-5 Queens Walk and 22-26 London Road East Grinstead,,,2018-12-13,,0.35,160,160,No further details available.. https://www.midsussex.gov.uk/planning-building/evidence-supporting-documents/,local-authority-eng:MSS,not owned by a public authority,,https://pa.midsussex.gov.uk/online-applications/,not permissioned,,SHLAAID961,https://www.midsussex.gov.uk/planning-building/evidence-supporting-documents/,2018-12-13
