site-address,deliverable,end-date,entry-date,hazardous-substances,hectares,maximum-net-dwellings,minimum-net-dwellings,notes,organisation,ownership-status,planning-permission-date,planning-permission-history,planning-permission-status,planning-permission-type,site,site-plan-url,start-date
"The Founders Studio, The Guildford School Of Acting, Millbrook, Guildford",,,2018-10-19,,0.03,6,6,"Application ref. 17/P/02214. The erection of 3 storey building comprising A1, A2 and B1a uses on the ground floor and 4 x 1 bed and 2 x 2 bed flats above following demolition of existing building.",local-authority-eng:GRT,not owned by a public authority,2018-03-14,http://www2.guildford.gov.uk/publicaccess/simpleSearchResults.do?action=firstPage,permissioned,full planning permission,BLR_067,https://www.guildford.gov.uk/media/29017/BLR-067/pdf/BLR_067.pdf,2018-10-19
"Stoke Mill, Woking Road, Guildford, GU1 1QA",,,2018-10-19,,0.45,23,23,"Application ref. 17/W/00095. Application for notification for prior approval for a proposed change of use of a building from Office Use (Class B1(a)) to a Dwellinghouse (Class C3), comprising 23 residential units.",local-authority-eng:GRT,not owned by a public authority,2017-12-28,http://www2.guildford.gov.uk/publicaccess/simpleSearchResults.do?action=firstPage,permissioned,full planning permission,BLR_069,https://www.guildford.gov.uk/media/29019/BLR-069/pdf/BLR_069.pdf,2018-10-19
"Stoughton Social Club, 172 Worplesdon Road, Guildford",,,2018-10-19,,0.14,14,14,"Application ref. 18/P/00043. Extension, refurbishment and change of use of a vacant social club to 14 flats, including associated landscaping works, construction of a refuse and cycle store and parking provision.",local-authority-eng:GRT,not owned by a public authority,2018-06-11,http://www2.guildford.gov.uk/publicaccess/applicationDetails.do?activeTab=summary&keyVal=_GUILD_DCAPR_180626,permissioned,full planning permission,BLR_070,https://www.guildford.gov.uk/media/29020/BLR-070/pdf/BLR_070.pdf,2018-10-19
"Day Nursery, 56 Epsom Road, Guildford, GU4 7AA",,,2018-10-19,,0.08,6,6,"Application ref. 18/P/00323. Creation of six flats following change of use from D1 (Nursery) to C3 (Residential) use. Internal alterations and erection of a three storey extension on the eastern elevation with associated landscaping, parking and associated works.",local-authority-eng:GRT,not owned by a public authority,2018-08-15,http://www2.guildford.gov.uk/publicaccess/simpleSearchResults.do?action=firstPage,permissioned,full planning permission,BLR_071,https://www.guildford.gov.uk/media/29021/BLR-071/pdf/BLR_071.pdf,2018-10-19
"Roseberry, Keens Lane, Guildford, GU3 3JS",,,2018-12-04,,0.26,7,7,"Application ref. 18/P/00058. Proposed erection of eight two storey dwellinghouses (one detached dwelling, two pairs of semi-detached dwellings and a terrace of three dwellings) with associated parking, landscaping and access improvement works, following demolition of existing buildings",local-authority-eng:GRT,not owned by a public authority,2018-03-09,http://www2.guildford.gov.uk/publicaccess/applicationDetails.do?activeTab=summary&keyVal=_GUILD_DCAPR_180657,permissioned,full planning permission,BLR_072,https://www.guildford.gov.uk/media/29022/BLR-072/pdf/BLR_072.pdf,2018-12-04
"Inner Court, Pewley Hill, Guildford, GU1 3SP",,,2018-10-31,,0.03,2,2,,local-authority-eng:GRT,not owned by a public authority,,,not permissioned,,BLR_073,https://www.guildford.gov.uk/media/29023/BLR-073/pdf/BLR_073.pdf,2018-10-31
"Oldlands Field Yard, Garlicks Arch Copse, Portsmouth Road, Ripley, GU2 6EL",,,2018-11-02,,0.32,10,10,,local-authority-eng:GRT,not owned by a public authority,,,not permissioned,,BLR_074,https://www.guildford.gov.uk/media/29024/BLR-074/pdf/BLR_074.pdf,2018-11-02
