point,OrganisationURI,OrganisationLabel,SiteReference,SiteNameAddress,GeoX,GeoY,SiteplanURL,Hectares,OwnershipStatus,HazardousSubstances,PlanningStatus,PermissionType,PermissionDate,PlanningHistory,MinNetDwellings,NetDwellingsRangeFrom,NetDwellingsRangeTo,Deliverable,Notes,FirstAddedDate,LastUpdatedDate,EndDate
,http://opendatacommunities.org/id/unitary-authority/swindon,,18HMR005,"14 Bath Road And Land To Rear Of 12-24 Bath Road, Old Town",-1.778704,51.55303,https://pa1.swindon.gov.uk/publicaccess/applicationDetails.do?activeTab=documents&keyVal=N68LSEPT0FL00,0.13,not owned by a public authority,,permissioned,full planning permission,2015-02-03,https://pa1.swindon.gov.uk/publicaccess/applicationDetails.do?activeTab=documents&keyVal=N68LSEPT0FL00,,12,12,yes,18HMR005 - S/14/0886 | Erection of 10no. dwellings and change of use from office to 2no. flats,2019-04-05,2020-12-23,2020-12-23
,http://opendatacommunities.org/id/unitary-authority/swindon,,18HMR006,"Abbey Stadium, Lady Lane, Swindon (Residual)",-1.791156,51.606531,https://pa1.swindon.gov.uk/publicaccess/applicationDetails.do?activeTab=documents&keyVal=N5PKY5PT97000,6.4,not owned by a public authority,,permissioned,outline planning permission,2015-04-02,https://pa1.swindon.gov.uk/publicaccess/applicationDetails.do?activeTab=documents&keyVal=N5PKY5PT97000,,100,100,yes,"18HMR006 - S/OUT/14/0833 | Outline application for a mixed use development comprising up to 100no. dwellings, car parking in association with stadium events, fire station and associated facilities, access works, landscaping and open space.",2019-04-05,2020-12-23,
,http://opendatacommunities.org/id/unitary-authority/swindon,,18HMR010,"Land At Clevedon House, 29 Woodland View, Wroughton",-1.793776,51.522148,https://pa1.swindon.gov.uk/publicaccess/applicationDetails.do?activeTab=documents&keyVal=NSX5RKPT04V00,0.6,not owned by a public authority,,permissioned,outline planning permission,2016-04-15,https://pa1.swindon.gov.uk/publicaccess/applicationDetails.do?activeTab=documents&keyVal=NSX5RKPT04V00,,10,10,yes,18HMR010 - S/OUT/15/1338 | Outline application for the demolition of 3no. existing dwellings and the erection of up to 10no. dwellings,2019-04-05,2020-12-23,
,http://opendatacommunities.org/id/unitary-authority/swindon,,18HMR012,"Land At Nursery Close, Wroughton, Swindon",-1.780443,51.564704,https://pa1.swindon.gov.uk/publicaccess/applicationDetails.do?activeTab=documents&keyVal=NLK10IPT97000,0.08,not owned by a public authority,,permissioned,full planning permission,2015-11-26,https://pa1.swindon.gov.uk/publicaccess/applicationDetails.do?activeTab=documents&keyVal=NLK10IPT97000,,5,5,yes,"18HMR012 - S/15/0467 | Erection of 5 no. dwellings, a detached garage",2018-12-31,2020-12-23,2020-12-23
,http://opendatacommunities.org/id/unitary-authority/swindon,,18HMR015,"3-5 Lagos Street, Swindon, SN1 2BU",-1.79342,51.597808,https://pa1.swindon.gov.uk/publicaccess/applicationDetails.do?activeTab=documents&keyVal=OG26DDPTJP200,0.12,not owned by a public authority,,permissioned,full planning permission,2017-01-18,https://pa1.swindon.gov.uk/publicaccess/applicationDetails.do?activeTab=documents&keyVal=OG26DDPTJP200,,8,8,yes,18HMR015 - S/16/1911 | Erection of 8no. flats,2018-12-31,2020-12-23,
,http://opendatacommunities.org/id/unitary-authority/swindon,,18HMR016,44 Victoria RoadOld TownSwindonSN1 3AY,-1.819241,51.562092,https://pa1.swindon.gov.uk/publicaccess/applicationDetails.do?activeTab=documents&keyVal=OSQ72TPTGAM00,0.01,not owned by a public authority,,permissioned,full planning permission,2017-09-12,https://pa1.swindon.gov.uk/publicaccess/applicationDetails.do?activeTab=documents&keyVal=OSQ72TPTGAM00,,5,5,yes,18HMR016 - S/17/1150 | Change of use of house in multiple occupation (HMO) to 5no. flats,2018-12-31,2020-12-23,
,http://opendatacommunities.org/id/unitary-authority/swindon,,18HMR019,"Abbeymeads Medical Practice, Elstree Way, Abbey Meads, Swindon",-1.816581,51.559986,https://pa1.swindon.gov.uk/publicaccess/applicationDetails.do?activeTab=documents&keyVal=O8K8VHPTHYQ00,0.19,not owned by a public authority,,permissioned,full planning permission,2016-08-19,https://pa1.swindon.gov.uk/publicaccess/applicationDetails.do?activeTab=documents&keyVal=O8K8VHPTHYQ00,,7,7,yes,18HMR019 - S/16/1059 | Erection of a new dental practice and adjoining opticians (Class A1) with 3no. flats above. and 4 no. dwellings,2018-12-31,2020-12-23,
,http://opendatacommunities.org/id/unitary-authority/swindon,,18HMR023,"The Quadrant, Stonehill Green, Swindon",-1.800472,51.60946,https://pa1.swindon.gov.uk/publicaccess/applicationDetails.do?activeTab=documents&keyVal=O41CUTPT0IN00,0.62,not owned by a public authority,,permissioned,full planning permission,2016-03-11,https://pa1.swindon.gov.uk/publicaccess/applicationDetails.do?activeTab=documents&keyVal=O41CUTPT0IN00,,100,100,yes,18HMR023 - S/PRIORC/16/0477 | Prior Approval Notification for the change of use from offices (class B1(a)) to dwelling houses (class C3) (100no. flats),2018-12-31,2020-12-23,2020-12-23
,http://opendatacommunities.org/id/unitary-authority/swindon,,18HMR024,"Minerva House, Delta 800, Welton Road, Westlea, Swindon",-1.756112,51.588008,https://pa1.swindon.gov.uk/publicaccess/applicationDetails.do?activeTab=documents&keyVal=O83M09PT0IN00,0.42,not owned by a public authority,,permissioned,permission in principle,2016-07-18,https://pa1.swindon.gov.uk/publicaccess/applicationDetails.do?activeTab=documents&keyVal=O83M09PT0IN00,,38,38,yes,18HMR024 - S/PRIORC/16/0988 | Prior Approval Notification for the change of use from offices (Class B1a) to dwellings (Class C3) (38no. apartments).,2018-12-31,2020-12-23,
,http://opendatacommunities.org/id/unitary-authority/swindon,,18HMR025,"Land At Abbey Farm, Tadpole Lane Blunsdon St. Andrew Swindon",-1.719676,51.587405,https://pa1.swindon.gov.uk/publicaccess/applicationDetails.do?activeTab=documents&keyVal=OPHJ2GPTMNV00,0.08,not owned by a public authority,,permissioned,full planning permission,2018-01-10,https://pa1.swindon.gov.uk/publicaccess/applicationDetails.do?activeTab=documents&keyVal=OPHJ2GPTMNV00,,6,6,yes,18HMR025 - S/17/0775 | Erection of 2no. retail units with 6no. flats above,2018-12-31,2020-12-23,
,http://opendatacommunities.org/id/unitary-authority/swindon,,18HMR027,"Former Hertz Rent A Car, Hyde Road, Stratton St Margaret, Swindon",-1.775882,51.550054,https://pa1.swindon.gov.uk/publicaccess/applicationDetails.do?activeTab=documents&keyVal=PIN6ZVPT0FL00,0.23,not owned by a public authority,,permissioned,full planning permission,2019-05-02,https://pa1.swindon.gov.uk/publicaccess/applicationDetails.do?activeTab=documents&keyVal=PIN6ZVPT0FL00,,19,19,yes,18HMR027 - S/18/1903 | Erection of 19no. dwellings and associated works.,2018-12-31,2020-12-23,
,http://opendatacommunities.org/id/unitary-authority/swindon,,18HMR029,South Marston Hotel And Spa Old Vicarage LaneSouth Marston Swindon SN3 4SH,-1.751255,51.574131,https://pa1.swindon.gov.uk/publicaccess/applicationDetails.do?activeTab=documents&keyVal=PBHKXEPTGWA00,2.59,not owned by a public authority,,permissioned,reserved matters approval,2019-03-19,https://pa1.swindon.gov.uk/publicaccess/applicationDetails.do?activeTab=documents&keyVal=PBHKXEPTGWA00,,69,69,yes,18HMR029 - S/RES/18/1145 | Reserved matters to S/OUT/15/1985 - Erection of 69no. Dwellings,2018-12-31,2020-12-23,
,http://opendatacommunities.org/id/unitary-authority/swindon,,18HMR038,"28 & 29 Newport Street, Old Town, Swindon",-1.766698,51.540781,https://pa1.swindon.gov.uk/publicaccess/applicationDetails.do?activeTab=documents&keyVal=O72GHUPT0IN00,0.02,not owned by a public authority,,permissioned,full planning permission,2016-07-07,https://pa1.swindon.gov.uk/publicaccess/applicationDetails.do?activeTab=documents&keyVal=O72GHUPT0IN00,,6,6,yes,18HMR038 - S/16/0864 | Erection of a roof extension to accommodate 2no. dwellings and erection of 2no. dwellings to the rear,2018-12-31,2020-12-23,2020-12-23
,http://opendatacommunities.org/id/unitary-authority/swindon,,18HMR045,"Selina House 192 Oxford Road, Stratton St Margaret, Swindon, SN3 4HA",-1.785682,51.529073,https://pa1.swindon.gov.uk/publicaccess/applicationDetails.do?activeTab=documents&keyVal=OVSUEUPTHN600,0.15,not owned by a public authority,,permissioned,full planning permission,2018-02-08,https://pa1.swindon.gov.uk/publicaccess/applicationDetails.do?activeTab=documents&keyVal=OVSUEUPTHN600,,8,8,yes,18HMR045 - S/17/1478 | Demolition of care home and erection of 8 no. flats,2018-12-31,2020-12-23,
,http://opendatacommunities.org/id/unitary-authority/swindon,,18HMR049,"Union Square, Swindon",-1.79461,51.522344,https://pa1.swindon.gov.uk/publicaccess/applicationDetails.do?activeTab=documents&keyVal=LKMDETPT0FL00,10.18,not owned by a public authority,,permissioned,full planning permission,2012-05-03,https://pa1.swindon.gov.uk/publicaccess/applicationDetails.do?activeTab=documents&keyVal=LKMDETPT0FL00,,405,405,yes,18HMR049 - S/11/0614 | Outline application seeking redevelopment to provide mixed-use development,2018-12-31,2020-12-23,
,http://opendatacommunities.org/id/unitary-authority/swindon,,18HMR050,"Land At Marlborough Park, Swindon",-1.784553,51.61122,https://pa1.swindon.gov.uk/publicaccess/applicationDetails.do?activeTab=documents&keyVal=NZ4ZRWPT0FL00,15.3,not owned by a public authority,,permissioned,full planning permission,2017-04-10,https://pa1.swindon.gov.uk/publicaccess/applicationDetails.do?activeTab=documents&keyVal=NZ4ZRWPT0FL00,,91,91,yes,18HMR050 - S/OUT/15/2051 | A Hybrid application for a mix of residential development to include - full details of the erection of 91no. dwellings & 74no. age-restricted retirement dwellings,2018-12-31,2020-12-23,
,http://opendatacommunities.org/id/unitary-authority/swindon,,19HMR004,"Former Garage & Land, Phillips Lane, Old Town, Swindon, SN1 4BH",-1.642515,51.552619,https://pa1.swindon.gov.uk/publicaccess/applicationDetails.do?activeTab=documents&keyVal=PZU4LLPTKGF00,0.19,not owned by a public authority,,permissioned,full planning permission,2020-09-25,https://pa1.swindon.gov.uk/publicaccess/applicationDetails.do?activeTab=documents&keyVal=PZU4LLPTKGF00,,37,37,yes,19HMR004 - S/19/1589 | Erection of 37no. apartments and 2no. commercial units for Class B1 or Class A2 or Class D1 Use and associated works.,2019-12-31,2020-12-23,
,http://opendatacommunities.org/id/unitary-authority/swindon,,19HMR007,"Land Adjacent To Berkley Farm House, Swindon Road, Wroughton, Swindon, SN4 9AQ",-1.734456,51.575355,https://pa1.swindon.gov.uk/publicaccess/applicationDetails.do?activeTab=documents&keyVal=OB9XC2PT0FL00,0.29,not owned by a public authority,,permissioned,full planning permission,2017-10-19,https://pa1.swindon.gov.uk/publicaccess/applicationDetails.do?activeTab=documents&keyVal=OB9XC2PT0FL00,,4,4,yes,19HMR007 - S/16/1357 | Erection of 4no. detached dwellings,2019-12-31,2020-12-23,
,http://opendatacommunities.org/id/unitary-authority/swindon,,19HMR011,"Former Haskins Garage, High Street, Wroughton, Swindon",-1.786592,51.556795,https://pa1.swindon.gov.uk/publicaccess/applicationDetails.do?activeTab=documents&keyVal=OLF5M6PTLAJ00,0.18,not owned by a public authority,,permissioned,full planning permission,2017-04-05,https://pa1.swindon.gov.uk/publicaccess/applicationDetails.do?activeTab=documents&keyVal=OLF5M6PTLAJ00,,13,13,yes,19HMR011 - S/17/0286 | Erection of 13no. dwellings and associated works.,2019-12-31,2020-12-23,
,http://opendatacommunities.org/id/unitary-authority/swindon,,19HMR014,"Land At Holdcroft, Broad Bush, Blunsdon, Swindon",-1.7876,51.524801,https://pa1.swindon.gov.uk/publicaccess/applicationDetails.do?activeTab=documents&keyVal=ON9VR9PTLVS00,3,not owned by a public authority,,permissioned,full planning permission,2018-03-27,https://pa1.swindon.gov.uk/publicaccess/applicationDetails.do?activeTab=documents&keyVal=ON9VR9PTLVS00,,54,54,yes,19HMR014 - S/17/0528 | Erection of 54no. Dwellings,2019-12-31,2020-12-23,
,http://opendatacommunities.org/id/unitary-authority/swindon,,19HMR021,"Land at Alresco Childcare, Newtown Lare, Bishopstone, SN6 8PW",-1.777064,51.579986,https://pa1.swindon.gov.uk/publicaccess/applicationDetails.do?activeTab=documents&keyVal=OYQXU2PTIVR00,0.26,not owned by a public authority,,permissioned,full planning permission,2018-02-08,https://pa1.swindon.gov.uk/publicaccess/applicationDetails.do?activeTab=documents&keyVal=OYQXU2PTIVR00,,2,2,yes,19HMR021 - S/17/1826 | Erection of 2no. dwellings,2019-12-31,2020-12-23,
,http://opendatacommunities.org/id/unitary-authority/swindon,,19HMR026,"Land at 5 Wanborough Road, Stratton St Margaret, Swindon",-1.804841,51.55975,https://pa1.swindon.gov.uk/publicaccess/applicationDetails.do?activeTab=documents&keyVal=P46S91PT04V00,0.48,not owned by a public authority,,permissioned,full planning permission,2019-01-28,https://pa1.swindon.gov.uk/publicaccess/applicationDetails.do?activeTab=documents&keyVal=P46S91PT04V00,,15,15,yes,19HMR026 - S/18/0265 | Erection of 15no. dwellings,2019-12-31,2020-12-23,2020-12-23
,http://opendatacommunities.org/id/unitary-authority/swindon,,19HMR030,"The Former Cycle Club, 33 Dixon Street, Swindon",-1.729012,51.586939,https://pa1.swindon.gov.uk/publicaccess/applicationDetails.do?activeTab=documents&keyVal=PEU5YHPT04V00,0.03,not owned by a public authority,,permissioned,full planning permission,2019-02-26,https://pa1.swindon.gov.uk/publicaccess/applicationDetails.do?activeTab=documents&keyVal=PEU5YHPT04V00,,8,8,yes,19HMR030 - S/18/1523 | Demolition of existing building and erection of 8 no. flats,2019-12-31,2020-12-23,
,http://opendatacommunities.org/id/unitary-authority/swindon,,19HMR038,"Land Adjacent to Co-operative Convenience Store, Moormead Road, Wroughton, Swindon",-1.780691,51.554122,https://pa1.swindon.gov.uk/publicaccess/applicationDetails.do?activeTab=documents&keyVal=OXPO62PTIFK00,0.07,not owned by a public authority,,permissioned,outline planning permission,2019-02-28,https://pa1.swindon.gov.uk/publicaccess/applicationDetails.do?activeTab=documents&keyVal=OXPO62PTIFK00,,5,5,yes,19HMR038 - S/OUT/17/1693 | Outline application for the erection of 2no. apartments and 3 dwellings,2019-12-31,2020-12-23,
,http://opendatacommunities.org/id/unitary-authority/swindon,,19HMR039,"409 - 411 Cricklade Road, Swindon, SN2 1AQ",-1.801562,51.565596,https://pa1.swindon.gov.uk/publicaccess/applicationDetails.do?activeTab=documents&keyVal=PFAM9JPT0FL00,0.09,not owned by a public authority,,permissioned,full planning permission,2019-03-07,https://pa1.swindon.gov.uk/publicaccess/applicationDetails.do?activeTab=documents&keyVal=PFAM9JPT0FL00,,6,6,yes,19HMR039 - S/18/1569 | Demolition of 409 Cricklade Road and erection of 6no. dwellings ( one 1 bed flat and five 2 bed houses),2019-12-31,2020-12-23,
,http://opendatacommunities.org/id/unitary-authority/swindon,,19HMR041,"98 Redcliffe Street, Swindon, SN2 2BZ",-1.762084,51.570294,https://pa1.swindon.gov.uk/publicaccess/applicationDetails.do?activeTab=documents&keyVal=PAXLL7PTGMP00,0.04,not owned by a public authority,,permissioned,full planning permission,2019-02-15,https://pa1.swindon.gov.uk/publicaccess/applicationDetails.do?activeTab=documents&keyVal=PAXLL7PTGMP00,,6,6,yes,19HMR041 - S/18/1072 | Erection of a three storey block of 6 no. flats,2019-12-31,2020-12-23,
,http://opendatacommunities.org/id/unitary-authority/swindon,,PP181901,Crown Timber Site Unit A Thornhill Industrial Estate South Marston Swindon,-1.782897,51.564644,https://pa1.swindon.gov.uk/publicaccess/applicationDetails.do?activeTab=documents&keyVal=NG3QDNPT97000,2.05,not owned by a public authority,,permissioned,outline planning permission,2018-05-15,https://pa1.swindon.gov.uk/publicaccess/applicationDetails.do?activeTab=documents&keyVal=NG3QDNPT97000,,47,47,yes,PP181901 - S/OUT/14/2058 | Outline application for the erection of up to 47no. dwellings,2018-12-31,2020-12-23,
,http://opendatacommunities.org/id/unitary-authority/swindon,,PP181915,"Bus Depot Eastcott Road, Old Town, SwindonSN1 3LS",-1.782661,51.55904,https://pa1.swindon.gov.uk/publicaccess/applicationDetails.do?activeTab=documents&keyVal=OYDTNAPTIQF00,0.61,not owned by a public authority,,permissioned,full planning permission,2018-11-21,https://pa1.swindon.gov.uk/publicaccess/applicationDetails.do?activeTab=documents&keyVal=OYDTNAPTIQF00,,45,45,yes,"PP181915 - S/17/1777 | Demolition of existing buildings, erection of new buildings and conversion of existing buildings to form 45no. residential units",2018-12-31,2020-12-23,
,http://opendatacommunities.org/id/unitary-authority/swindon,,PP181917,Morris Street Club 20-22 Morris Street Rodbourne Swindon SN2 2HU,-1.777846,51.555757,https://pa1.swindon.gov.uk/publicaccess/applicationDetails.do?activeTab=documents&keyVal=P54EY9PTLSB00,0.04,not owned by a public authority,,permissioned,full planning permission,2018-10-22,https://pa1.swindon.gov.uk/publicaccess/applicationDetails.do?activeTab=documents&keyVal=P54EY9PTLSB00,,5,5,yes,PP181917 - S/18/0380 | Partial demolition with two storey extension and alterations to allow for the conversion of the existing social club to form 4 no. 1 bedroom flats and 1 no.2 bedroom flat,2018-12-31,2020-12-23,
,http://opendatacommunities.org/id/unitary-authority/swindon,,PP181918,Coachbuilders House Stratton Road Stratton St Margaret Swindon,-1.77671,51.553074,https://pa1.swindon.gov.uk/publicaccess/applicationDetails.do?activeTab=documents&keyVal=P44UC4PTLAY00,0.23,not owned by a public authority,,permissioned,full planning permission,2018-09-07,https://pa1.swindon.gov.uk/publicaccess/applicationDetails.do?activeTab=documents&keyVal=P44UC4PTLAY00,,8,8,yes,PP181918 - S/18/0256 | Erection of a mansard roof with dormer windows to create 8no. additional flats ( 7 one bed flats and 1 two bed flat),2018-12-31,2020-12-23,2020-12-23
,http://opendatacommunities.org/id/unitary-authority/swindon,,PP181920,175 - 176 Manchester Road Swindon SN1 1TU,-1.727288,51.555305,https://pa1.swindon.gov.uk/publicaccess/applicationDetails.do?activeTab=documents&keyVal=OXX2I2PT0FL00,0.02,not owned by a public authority,,permissioned,full planning permission,2018-12-18,https://pa1.swindon.gov.uk/publicaccess/applicationDetails.do?activeTab=documents&keyVal=OXX2I2PT0FL00,,6,6,yes,PP181920 - S/17/1707 | Change of use of 2no. dwellings to 6no. self contained apartments,2018-12-31,2020-12-23,2020-12-23
,http://opendatacommunities.org/id/unitary-authority/swindon,,PP181922,"2 Temple Chambers Temple Street, Swindon, SN1 1SQ",-1.826729,51.569192,https://pa1.swindon.gov.uk/publicaccess/applicationDetails.do?activeTab=documents&keyVal=P5BFPAPTLW600,0.01,not owned by a public authority,,permissioned,full planning permission,2018-05-18,https://pa1.swindon.gov.uk/publicaccess/applicationDetails.do?activeTab=documents&keyVal=P5BFPAPTLW600,,5,5,yes,"PP181922 - S/18/0406 | Change of use of ground, first and second floor and roof space from Class A1/A2/B1 to Class C3 to provide 5no. dwellings",2018-12-31,2020-12-23,2020-12-23
,http://opendatacommunities.org/id/unitary-authority/swindon,,PP181923,"53 Victoria Road, Old Town, Swindon, SN1 3AY",-1.741264,51.565407,https://pa1.swindon.gov.uk/publicaccess/applicationDetails.do?activeTab=documents&keyVal=PBLB5MPT0FL00,0.01,not owned by a public authority,,permissioned,permission in principle,2018-08-22,https://pa1.swindon.gov.uk/publicaccess/applicationDetails.do?activeTab=documents&keyVal=PBLB5MPT0FL00,,5,5,yes,PP181923 - S/PRIORC/18/1149 | Prior notification application for the change of use from office (Class B1a) to 5no. flats (Class C3),2018-12-31,2020-12-23,2020-12-23
,http://opendatacommunities.org/id/unitary-authority/swindon,,PP181924,99-100 Victoria RoadOld TownSwindonSN1 3BE,-1.744905,51.550565,https://pa1.swindon.gov.uk/publicaccess/applicationDetails.do?activeTab=documents&keyVal=P6CW7SPT04V00,0.27,not owned by a public authority,,permissioned,permission in principle,2018-05-24,https://pa1.swindon.gov.uk/publicaccess/applicationDetails.do?activeTab=documents&keyVal=P6CW7SPT04V00,,31,31,yes,PP181924 - S/PRIORC/18/0544 | Prior notification application for the change of use from office (Class B1) to 31no. dwellinghouses (Class C3).,2018-12-31,2020-12-23,
,http://opendatacommunities.org/id/unitary-authority/swindon,,s0006,"Land north of Edison Road, Dorcan",-1.774146,51.548621,https://pa1.swindon.gov.uk/publicaccess/applicationDetails.do?activeTab=documents&keyVal=PINLXMPTKEW00,1.67,not owned by a public authority,,permissioned,full planning permission,2019-04-10,https://pa1.swindon.gov.uk/publicaccess/applicationDetails.do?activeTab=documents&keyVal=PINLXMPTKEW00,,,,yes,s0006 - S/18/1906 | Change of use of land from former factory site (use class B1) to lorry park (sui generis).,2018-12-31,2020-12-23,
,http://opendatacommunities.org/id/unitary-authority/swindon,,s0024,"Oak House, Rivermead Drive, Swindon",-1.830491,51.5782,https://pa1.swindon.gov.uk/publicaccess/,2.52,not owned by a public authority,,not permissioned,,,https://pa1.swindon.gov.uk/publicaccess/,,0,0,yes,s0024 - s0024 | No Recent Planning History,2018-12-31,2020-12-23,
,http://opendatacommunities.org/id/unitary-authority/swindon,,s0070,Nythe Complex,-1.792698,51.568885,https://pa1.swindon.gov.uk/publicaccess/,0.93,owned by a public authority,,not permissioned,,,https://pa1.swindon.gov.uk/publicaccess/,,35,35,,s0070 - s0070 | No Recent Planning History,2018-12-31,2020-12-23,
,http://opendatacommunities.org/id/unitary-authority/swindon,,s0082,Land bounded by Netherton Close/ Cranemore Avenue/ Keswick Road,-1.783934,51.559327,https://pa1.swindon.gov.uk/publicaccess/,0.17,mixed ownership,,not permissioned,,,https://pa1.swindon.gov.uk/publicaccess/,,6,6,,s0082 - s0082 | No Recent Planning History,2017-12-31,2020-12-23,
,http://opendatacommunities.org/id/unitary-authority/swindon,,s0090,"Coal Yard, Signal Way",-1.787405,51.559517,https://pa1.swindon.gov.uk/publicaccess/applicationDetails.do?activeTab=documents&keyVal=P9WLL8PT04V00,0.03,owned by a public authority,,permissioned,full planning permission,2018-08-24,https://pa1.swindon.gov.uk/publicaccess/applicationDetails.do?activeTab=documents&keyVal=P9WLL8PT04V00,,1,1,yes,s0090 - S/18/0971 | Erection of 1no. dwelling,2017-12-31,2020-12-23,
,http://opendatacommunities.org/id/unitary-authority/swindon,,s0093,"Former youth Centre, Sparcells",-1.727309,51.585659,https://pa1.swindon.gov.uk/publicaccess/applicationDetails.do?activeTab=documents&keyVal=P5N5YBPTM3A00,0.21,not owned by a public authority,,permissioned,full planning permission,2018-11-15,https://pa1.swindon.gov.uk/publicaccess/applicationDetails.do?activeTab=documents&keyVal=P5N5YBPTM3A00,,6,6,yes,s0093 - S/18/0460 | Erection of 6no residential dwellings,2018-12-31,2020-12-23,2020-12-23
,http://opendatacommunities.org/id/unitary-authority/swindon,,s0099,North Star (Former Clares Site and Oasis Leisure Centre),-1.790611,51.523084,https://pa1.swindon.gov.uk/publicaccess/,13.05,not owned by a public authority,,permissioned,full planning permission,,https://pa1.swindon.gov.uk/publicaccess/,,,,yes,"s0099 - s0099 | Outline application for the erection of a leisure development of up to 160, 000 sq.m. To include the provision of an entertainment arena, indoor ski centre, cinema, hotel, retail, restaurants and cafes, access, parking and associated works. Application is ongoing. Ref. : S/OUT/15/0943",2018-12-31,2020-12-23,
,http://opendatacommunities.org/id/unitary-authority/swindon,,s0100,Aspen House and Granville Street Car Park,-1.79276,51.525949,https://pa1.swindon.gov.uk/publicaccess/applicationDetails.do?activeTab=documents&keyVal=Q69LYKPTFR800,1.27,not owned by a public authority,,permissioned,full planning permission,2020-06-03,https://pa1.swindon.gov.uk/publicaccess/applicationDetails.do?activeTab=documents&keyVal=Q69LYKPTFR800,,0,0,yes,s0100 - S/20/0284 | Erection of a hotel (Use Class C1) with ancillary restaurant.Ref. : S/OUT/17/0665,2017-12-31,2020-12-23,
,http://opendatacommunities.org/id/unitary-authority/swindon,,s0101,Tented Market,-1.787231,51.562094,https://pa1.swindon.gov.uk/publicaccess/applicationDetails.do?activeTab=documents&keyVal=NYTT2FPTFMJ00,0.14,not owned by a public authority,,permissioned,full planning permission,2016-11-09,https://pa1.swindon.gov.uk/publicaccess/applicationDetails.do?activeTab=documents&keyVal=NYTT2FPTFMJ00,,0,0,,"s0101 - S/15/2017 | Demolition of existing and erection of a two story buildings with retail (A1) and food & drink (A3) units. Permission granted on appeal.Ref. : S/15/2017Decision Issued Date: 16/06/2016Demolition of existing tented market and erection of a 12 storey building comprising 101no. Flats, 4no. Class A3 (Food and Drink) units, 1no. Class A1 (Shop) unit. Application granted permission subject to S106 and conditions at October 2017 Planning CommitteeRef. : S/17/0673Decision Issued Date: Pending.",2017-12-31,2020-12-23,
,http://opendatacommunities.org/id/unitary-authority/swindon,,s0111,Thornhill Industrial Estate,-1.785588,51.562884,https://pa1.swindon.gov.uk/publicaccess/,5.09,not owned by a public authority,,not permissioned,,,https://pa1.swindon.gov.uk/publicaccess/,,0,0,yes,s0111 - S/OUT/14/2059 | Application withdrawn 15/05/2018,2017-12-31,2020-12-23,
,http://opendatacommunities.org/id/unitary-authority/swindon,,s0113,Site of disused retail units on Devizes Road,-1.782885,51.562069,https://pa1.swindon.gov.uk/publicaccess/,0.08,not owned by a public authority,,not permissioned,,,https://pa1.swindon.gov.uk/publicaccess/,,5,5,yes,s0113 - s0113 | No Recent Planning History,2017-12-31,2020-12-23,
