site-address,deliverable,end-date,entry-date,hazardous-substances,hectares,maximum-net-dwellings,minimum-net-dwellings,notes,organisation,ownership-status,planning-permission-date,planning-permission-history,planning-permission-status,planning-permission-type,point,site,site-plan-url,start-date,slug
"Elms Field & The Paddocks, Elms Rd, Wokingham",yes,,2018-12-10,,6.6532892,126,126,Full application for the erection of mixed use development for Town Centre uses and 126 residential units,local-authority-eng:WOK,not owned by a public authority,2016-03-30,,permissioned,full planning permission,POINT(-0.837814 51.409471),BR024,http://planning.wokingham.gov.uk/FastWebPL/welcome.asp,2017-08-18,brownfield-land/local-authority-eng/WOK/BR024
Cyber House 2 Molly Millars Lane Wokingham Berkshire RG41 2PX,yes,,2018-12-10,,0.1990258,65,65,Prior approval submission for the conversion of existing offices (Use Class B1(a)) to 65no residential flats (10no studio and 55no one bedroom)(Use Class C3).,local-authority-eng:WOK,not owned by a public authority,2016-08-16,,permissioned,full planning permission,POINT(-0.843181 51.404182),BR058,http://planning.wokingham.gov.uk/FastWebPL/welcome.asp,2017-08-18,brownfield-land/local-authority-eng/WOK/BR058
Nigra Building Mulberry Business Park Fishponds Road RG41 2GY,yes,,2018-12-10,,0.5472566,42,42,Prior approval submission for the conversion of existing office (Use Class B1(a)) to 42no residential apartments (Use Class C3).,local-authority-eng:WOK,not owned by a public authority,2016-07-20,,permissioned,full planning permission,POINT(-0.848241 51.403045),BR063,http://planning.wokingham.gov.uk/FastWebPL/welcome.asp,2017-08-18,brownfield-land/local-authority-eng/WOK/BR063
Nigra Building Mulberry Business Park Fishponds Road Wokingham RG41 2GY .,yes,,2018-12-10,,0.6248813,9,9,Full application for the proposed raising of roof height to create a new second floor extension to create 9no self contained residential apartments including a communal garden and upgraded cycle storage and refuse facilities.,local-authority-eng:WOK,not owned by a public authority,2017-02-27,,permissioned,full planning permission,POINT(-0.848269 51.403081),BR069,http://planning.wokingham.gov.uk/FastWebPL/welcome.asp,2017-11-29,brownfield-land/local-authority-eng/WOK/BR069
"North Wokingham - Matthewsgreen Farm, Phase 2b",yes,,2018-12-10,,3.5924144,73,73,Reserved Matters application pursuant to Outline planning consent O/2014/2242 for Phase 2b of the development involving the erection of 73 residential dwellings,local-authority-eng:WOK,not owned by a public authority,2016-11-14,,permissioned,reserved matters approval,POINT(-0.847861 51.426753),BR071,http://planning.wokingham.gov.uk/FastWebPL/welcome.asp,2017-08-18,brownfield-land/local-authority-eng/WOK/BR071
Rosa Building Mulberry Business Park Fishponds Wokingham Berkshire RG41 2GY,yes,,2018-12-10,,0.4025304,33,33,Prior approval submission for the conversion of existing office (Use Class B1(a)) to 33no residential apartments (Use Class C3).,local-authority-eng:WOK,not owned by a public authority,2016-09-13,,permissioned,full planning permission,POINT(-0.85012 51.402659),BR076,http://planning.wokingham.gov.uk/FastWebPL/welcome.asp,2017-08-18,brownfield-land/local-authority-eng/WOK/BR076
Ilex House Fishponds Road Wokingham Berkshire RG41 2GY,yes,,2018-12-10,,0.5056506,45,45,Prior approval submission for the conversion of existing office (Use Class B1(a)) to 45no residential apartments (Use Class C3).,local-authority-eng:WOK,not owned by a public authority,2016-09-21,,permissioned,full planning permission,POINT(-0.849743 51.402197),BR077,http://planning.wokingham.gov.uk/FastWebPL/welcome.asp,2017-08-18,brownfield-land/local-authority-eng/WOK/BR077
21-26 Tape Lane Hurst RG10 0DP .,yes,,2018-12-10,,0.3676262,11,11,"Full application for the proposed erection of 11no dwellings with associated access, car parking, landscaping and drainage following demolition of existing semi-detached bungalows.",local-authority-eng:WOK,not owned by a public authority,2016-12-06,,permissioned,full planning permission,POINT(-0.854264 51.457146),BR078,http://planning.wokingham.gov.uk/FastWebPL/welcome.asp,2017-08-18,brownfield-land/local-authority-eng/WOK/BR078
"North Wokingham - Matthewsgreen Farm, Phase 3",yes,,2018-12-10,,5.358968,74,74,Reserved Matters application pursuant to Outline planning consent O/2014/2242 for 74 dwellings,local-authority-eng:WOK,not owned by a public authority,2017-07-17,,permissioned,reserved matters approval,POINT(-0.846177 51.425649),BR104,http://planning.wokingham.gov.uk/FastWebPL/welcome.asp,2017-08-18,brownfield-land/local-authority-eng/WOK/BR104
"Land at Market Place, Peach St & Rose St, Wokingham",yes,,2018-12-10,,1.0663726,26,26,Full application for part redevelopment and part retention and refurbishment of existing buildings to provide a mixed use development for town centre uses including 26 residential units,local-authority-eng:WOK,not owned by a public authority,2015-03-05,,permissioned,full planning permission,POINT(-0.832501 51.410874),BR156,http://planning.wokingham.gov.uk/FastWebPL/welcome.asp,2017-08-18,brownfield-land/local-authority-eng/WOK/BR156
"Land At The Manor, Brookers Hill Shinfield Reading RG2 9BX",yes,,2018-12-10,,4.4596047,126,126,"Reserved Matters application pursuant to planning consent VAR/2013/0602 for a development of 126 dwellings, a sports pavilion, public open space, landscaping and associated works. This application comprises details of appearance, landscaping, layout and s cale.",local-authority-eng:WOK,not owned by a public authority,2017-06-30,,permissioned,reserved matters approval,POINT(-0.951463 51.409931),BR175,http://planning.wokingham.gov.uk/FastWebPL/welcome.asp,2017-08-18,brownfield-land/local-authority-eng/WOK/BR175
"Land At, Arborfield Garrison Biggs Lane -Parcel K",yes,,2018-12-10,,0.4845755,12,12,"Application for approval of Reserved Matters pursuant to Outline Planning Consent O/2014/2280 for 12 dwellings with access from Sheerlands Road, with associated internal access roads, parking, landscaping and open space, footpaths/cycleway, Sustainable Urban Drainage (SuDs) (Parcel K) (Appearance, Landscaping, Layout and scale to be considered)",local-authority-eng:WOK,not owned by a public authority,2018-04-11,,permissioned,reserved matters approval,POINT(-0.899907 51.383372),BR191,http://planning.wokingham.gov.uk/FastWebPL/welcome.asp,2018-04-01,brownfield-land/local-authority-eng/WOK/BR191
"Land At, Arborfield Garrison Biggs Lane Arborfield - (Parcel Q)",yes,,2018-12-10,,2.584773,114,114,Application for the Reserved Matters for the erection of 114 dwellings,local-authority-eng:WOK,not owned by a public authority,2018-01-22,,permissioned,reserved matters approval,POINT(-0.898358 51.378475),BR192,http://planning.wokingham.gov.uk/FastWebPL/welcome.asp,2018-04-01,brownfield-land/local-authority-eng/WOK/BR192
"Land At, Arborfield Garrison Biggs Lane Arborfield -Parcel U2",yes,,2018-12-10,,2.8068251,79,79,Application for approval of Reserved Matters pursuant to Outline Planning Consent O/2014/2280 for 79 dwellings,local-authority-eng:WOK,not owned by a public authority,2017-08-09,,permissioned,reserved matters approval,POINT(-0.891594 51.386028),BR193,http://planning.wokingham.gov.uk/FastWebPL/welcome.asp,2018-04-01,brownfield-land/local-authority-eng/WOK/BR193
"Land At, Arborfield Garrison Biggs Lane Arborfield - Parcel H, I and J",yes,,2018-12-10,,8.9807685,179,179,Reserved Matters application pursuant to Outline Planning Consent O/2014/2280 for the erection of 179 dwellings,local-authority-eng:WOK,not owned by a public authority,2017-07-25,,permissioned,reserved matters approval,POINT(-0.901872 51.378122),BR194,http://planning.wokingham.gov.uk/FastWebPL/welcome.asp,2018-04-01,brownfield-land/local-authority-eng/WOK/BR194
"Sutton Court, Culver Lane, Earley",yes,,2018-12-10,,0.8208384,20,20,"Proposed demolition of existing block of flats and erection of 20 dwelling houses with access, parking and landscaping.",local-authority-eng:WOK,not owned by a public authority,2013-06-21,,permissioned,full planning permission,POINT(-0.928746 51.451754),BR195,http://planning.wokingham.gov.uk/FastWebPL/welcome.asp,2018-04-01,brownfield-land/local-authority-eng/WOK/BR195
"15-27 High Street, Wargrave, RG10 8BU",yes,,2018-12-10,,0.2888888,10,10,"Full planning application for demolition of existing car showroom, repair/MOT garage plus Suncroft dwelling and proposed erection of 10 dwellings with provision of car-parking, private amenity space, bin and bicycle storage.",local-authority-eng:WOK,not owned by a public authority,2017-08-10,,permissioned,full planning permission,POINT(-0.868743 51.502588),BR196,http://planning.wokingham.gov.uk/FastWebPL/welcome.asp,2018-04-01,brownfield-land/local-authority-eng/WOK/BR196
"Former Bearwood Golf Course, Mole Rd, Sindlesham",yes,,2018-12-10,,48.195304,18,18,Full application for the redevelopment of Former Bearwood Golf Course to provide a new football training ground and academy facility & 18 net residential units,local-authority-eng:WOK,not owned by a public authority,2015-07-20,,permissioned,full planning permission,POINT(-0.891645 51.413067),BR197,http://planning.wokingham.gov.uk/FastWebPL/welcome.asp,2018-04-01,brownfield-land/local-authority-eng/WOK/BR197
74-80 Peach Street Wokingham RG40 1XH,yes,,2018-12-10,,0.1840316,39,39,"Proposed demolition of existing building (comprising office, retail and residential floorspace) and erection of a new building comprising 140 sq m retail floorspace on ground level, and 39 residential units",local-authority-eng:WOK,not owned by a public authority,2015-01-30,,permissioned,full planning permission,POINT(-0.830183 51.411544),BR198,http://planning.wokingham.gov.uk/FastWebPL/welcome.asp,2018-04-01,brownfield-land/local-authority-eng/WOK/BR198
7-9 Shute End Wokingham RG40 1BH,yes,,2018-12-10,,1.9064435,10,10,Full application for the change of use from bed and breakfast (Use Class C1) to a residential hostel (Sui Generis) with 10 no self- contained units including changes to fenestration and internal refurbishment.,local-authority-eng:WOK,not owned by a public authority,2017-08-09,,permissioned,full planning permission,POINT(-0.837147 51.411964),BR199,http://planning.wokingham.gov.uk/FastWebPL/welcome.asp,2018-04-01,brownfield-land/local-authority-eng/WOK/BR199
"7-9 Wiltshire Road, RG40 1TP",yes,,2018-12-10,,0.3828854,33,33,"Demolition of existing buildings and erection of a block of 33 sheltered apartments for the elderly; construction of basement parking and surface parking spaces; associated integral refuse bin store, electric pavement car store and cycle store; modification of existing access.",local-authority-eng:WOK,not owned by a public authority,2015-12-24,,permissioned,full planning permission,POINT(-0.829213 51.414079),BR200,http://planning.wokingham.gov.uk/FastWebPL/welcome.asp,2018-04-01,brownfield-land/local-authority-eng/WOK/BR200
"Carnival Pool, Wellington Rd, Wokingham",yes,,2018-12-10,,2.1620235,55,55,Full planning application for the redevelopment of the Carnival Pool site to create leisure led development as part of the regeneration of Wokingham town centre. The proposals include the demolition of all existing buildings on site and the construction of: a leisure centre (use class D2); library (use class D1); restaurant (use class A3); commercial unit for non-residential institution or assembly and leisure use (use classes D1 or D2); 55 dwellings (use class C3); pedestrian and vehicular access including a pedestrian boulevard and realignment of Wellington Road; car parking; hard and soft landscaping; realignment of an existing footpath; drainage and,local-authority-eng:WOK,not owned by a public authority,2018-02-02,,permissioned,full planning permission,POINT(-0.838417 51.407786),BR201,http://planning.wokingham.gov.uk/FastWebPL/welcome.asp,2018-04-01,brownfield-land/local-authority-eng/WOK/BR201
Hewden Plant Hire Old Forest Road Wokingham RG41 1HY,yes,,2018-12-10,,0.7942108,43,43,"Full application for proposed erection of 43 dwellings (7 x 1 bedroom apartments, 11 x 2 bedroom apartments, 17 x 3 bedroom houses and 8 x 4 bedroom houses) together with associated access improvements, parking and refuse storage following the demolition of existing buildings.",local-authority-eng:WOK,not owned by a public authority,2017-05-18,,permissioned,full planning permission,POINT(-0.86179 51.423041),BR202,http://planning.wokingham.gov.uk/FastWebPL/welcome.asp,2018-04-01,brownfield-land/local-authority-eng/WOK/BR202
134-146 London Road Twyford RG10 9HJ,yes,,2018-12-10,,0.6319767,31,31,"Full application for the erection of 31 two bedroom apartments with associated communal areas, landscaping and parking (C3 residential use).",local-authority-eng:WOK,not owned by a public authority,2017-08-15,,permissioned,full planning permission,POINT(-0.85698 51.4844),BR203,http://planning.wokingham.gov.uk/FastWebPL/welcome.asp,2018-04-01,brownfield-land/local-authority-eng/WOK/BR203
Valley Nurseries Whistley Green Hurst RG10 0DX,yes,,2018-12-10,,1.0782996,16,16,Full planning application for the proposed erection of 16 no. dwellings with garages and parking spaces with new access to Whistley Green following demolition of derelict greenhouses.,local-authority-eng:WOK,not owned by a public authority,2017-08-15,,permissioned,full planning permission,POINT(-0.858333 51.459622),BR204,http://planning.wokingham.gov.uk/FastWebPL/welcome.asp,2018-04-01,brownfield-land/local-authority-eng/WOK/BR204
58 Hurst Road Twyford Reading RG10 0AN,yes,,2018-12-10,,0.6940669,12,12,"Proposed erection of 12no dwellings ( including 4no affordable dwellings ) with access, parking, open space and landscaping.",local-authority-eng:WOK,not owned by a public authority,2015-04-02,,permissioned,full planning permission,POINT(-0.863143 51.4717),BR205,http://planning.wokingham.gov.uk/FastWebPL/welcome.asp,2018-04-01,brownfield-land/local-authority-eng/WOK/BR205
Land adj to Norton Road Wokingham Berkshire RG40 2BD,yes,,2018-12-10,,0.1395096,9,9,Full application for the proposed erection of 6no two bedroom flats and 3no two bedroom terraced houses including demolition of existing light industrial unit.,local-authority-eng:WOK,not owned by a public authority,2016-10-07,,permissioned,full planning permission,POINT(-0.835885 51.407275),BR206,http://planning.wokingham.gov.uk/FastWebPL/welcome.asp,2018-04-01,brownfield-land/local-authority-eng/WOK/BR206
"UoR Bulmershe Campus, Woodlands Ave, (phase 2) RG5 4BJ",yes,,2018-12-10,,8.8437125,257,257,"Proposed erection of 68 dwellings with associated roads, parking, amenity space, landscaping and creation of new access onto Loddon Bridge Road.",local-authority-eng:WOK,not owned by a public authority,2014-10-17,,permissioned,full planning permission,POINT(-0.922475 51.449763),BR207,http://planning.wokingham.gov.uk/FastWebPL/welcome.asp,2018-04-01,brownfield-land/local-authority-eng/WOK/BR207
"Marlborough House, Basingstoke Rd, Spencers Wood. RG7 1AE",yes,,2018-12-10,,0.1598035,15,15,"Full application for the proposed conversion, alteration and extension of existing office building to provide 15 flats ( 12no 1bed, & 3no 2beds)",local-authority-eng:WOK,not owned by a public authority,2016-03-15,,permissioned,full planning permission,POINT(-0.973175 51.395133),BR208,http://planning.wokingham.gov.uk/FastWebPL/welcome.asp,2018-04-01,brownfield-land/local-authority-eng/WOK/BR208
"81-109 Crockhamwell Road, Woodley, RG5 3JP",yes,,2018-12-10,,0.1032181,8,8,Prior approval submission for the conversion of part of first floor of existing offices (Use Class B1(a)) to 8no residential units (Use Class C3).,local-authority-eng:WOK,not owned by a public authority,2018-03-28,,permissioned,full planning permission,POINT(-0.905997 51.452802),BR209,http://planning.wokingham.gov.uk/FastWebPL/welcome.asp,2018-04-01,brownfield-land/local-authority-eng/WOK/BR209
Riseley Business Park Basingstoke Road Riseley Reading RG7 1NW,yes,,2018-12-10,,0.7754805,26,26,Prior approval submission for the conversion of 3no existing office buildings (Use Class B1(a)) to 47no residential apartments (Use Class C3).,local-authority-eng:WOK,not owned by a public authority,2016-05-27,,permissioned,full planning permission,POINT(-0.963532 51.364539),BR210,http://planning.wokingham.gov.uk/FastWebPL/welcome.asp,2018-04-01,brownfield-land/local-authority-eng/WOK/BR210
"Waterloo House, Riseley Business Park Basingstoke Road Riseley RG71QF",yes,,2018-12-10,,4.7039841,10,10,Prior approval submission for the conversion of existing office building (Use Class B1(a)) to 10no residential apartments (Use Class C3).,local-authority-eng:WOK,not owned by a public authority,2016-06-21,,permissioned,full planning permission,POINT(-0.96393 51.364066),BR211,http://planning.wokingham.gov.uk/FastWebPL/welcome.asp,2018-04-01,brownfield-land/local-authority-eng/WOK/BR211
498 Reading Road Winnersh Berkshire RG41 5EX,yes,,2018-12-10,,9.777077,8,8,Prior approval for proposed change of use from Offices to 8 residential apartments.,local-authority-eng:WOK,not owned by a public authority,2017-11-03,,permissioned,Other,POINT(-0.885124 51.431718),BR212,http://planning.wokingham.gov.uk/FastWebPL/welcome.asp,2018-04-01,brownfield-land/local-authority-eng/WOK/BR212
"12 Oaklands Business Centre, Oaklands Park Wokingham RG412FD",yes,,2018-12-10,,0.2115413,18,18,Prior approval submission for the conversion of existing office building (Use Class B1(a)) to 18no residential apartments (Use Class C3).,local-authority-eng:WOK,not owned by a public authority,2017-08-29,,permissioned,full planning permission,POINT(-0.85012 51.400366),BR213,http://planning.wokingham.gov.uk/FastWebPL/welcome.asp,2018-04-01,brownfield-land/local-authority-eng/WOK/BR213
Crown House Toutley Industrial Estate RG41 1QN,yes,,2018-12-10,,0.1548286,24,24,Notification for prior approval for the proposed change of use from office (B1) to Residential (C3) use for 24 residential apartments.,local-authority-eng:WOK,not owned by a public authority,2017-03-09,,permissioned,full planning permission,POINT(-0.849745 51.428498),BR214,http://planning.wokingham.gov.uk/FastWebPL/welcome.asp,2018-04-01,brownfield-land/local-authority-eng/WOK/BR214
Crown House Toutley Industrial Estate RG41 1QN,yes,,2018-12-10,,0.1548124,0,0,Prior approval submission for the conversion of existing offices (use class B1 (a)) to 22 x 1 bedroom flats (use class C3),local-authority-eng:WOK,not owned by a public authority,2016-12-01,,permissioned,full planning permission,POINT(-0.849745 51.428498),BR215,http://planning.wokingham.gov.uk/FastWebPL/welcome.asp,2018-04-01,brownfield-land/local-authority-eng/WOK/BR215
Baileys House Central Walk Wokingham RG40 1AZ,yes,,2018-12-10,,9.1597078,8,8,Prior approval for proposed change of use from Offices to 8 residential dwelling units.,local-authority-eng:WOK,not owned by a public authority,2018-03-09,,permissioned,full planning permission,POINT(-0.83439 51.411235),BR217,http://planning.wokingham.gov.uk/FastWebPL/welcome.asp,2018-04-01,brownfield-land/local-authority-eng/WOK/BR217
Quoin House Fishponds Road RG41 2QJ,yes,,2018-12-10,,0.3469857,23,23,Prior approval submission for the conversion of existing offices (use class B1 (a)) to 23 apartments (use class C3),local-authority-eng:WOK,not owned by a public authority,2018-02-27,,permissioned,full planning permission,POINT(-0.84596 51.404587),BR218,http://planning.wokingham.gov.uk/FastWebPL/welcome.asp,2018-04-01,brownfield-land/local-authority-eng/WOK/BR218
"Loddon Vale House, Hurricane Way, Woodley RG5 4UX",yes,,2018-12-10,,4.4580278,10,10,Prior approval submission for the conversion of existing offices to 10 residential units.,local-authority-eng:WOK,not owned by a public authority,2017-09-15,,permissioned,full planning permission,POINT(-0.888295 51.454578),BR219,http://planning.wokingham.gov.uk/FastWebPL/welcome.asp,2018-04-01,brownfield-land/local-authority-eng/WOK/BR219
"North Wokingham - Matthewsgreen Farm, Phase 4",yes,,2018-12-10,,10.030157,243,243,Application for the approval of Reserved Matters pursuant to Outline planning consent O/2014/2242 for the erection of 253 residential dwellings,local-authority-eng:WOK,not owned by a public authority,2017-02-14,,permissioned,reserved matters approval,POINT(-0.843985 51.42302),BR220,http://planning.wokingham.gov.uk/FastWebPL/welcome.asp,2018-04-01,brownfield-land/local-authority-eng/WOK/BR220
"Land At, Arborfield Garrison Biggs Lane Arborfield Parcel A-G",yes,,2018-12-10,,10.76087,223,223,Application for Reserved Matters for the erection of 223 dwellings,local-authority-eng:WOK,not owned by a public authority,2016-11-23,,permissioned,reserved matters approval,POINT(-0.903365 51.379961),BR221,http://planning.wokingham.gov.uk/FastWebPL/welcome.asp,2018-04-01,brownfield-land/local-authority-eng/WOK/BR221
"Land At, Arborfield Garrison Biggs Lane Arborfield Parcel T",yes,,2018-12-10,,6.4022469,127,127,Application for Reserved Matters for the erection of 127 dwellings,local-authority-eng:WOK,not owned by a public authority,2016-09-14,,permissioned,reserved matters approval,POINT(-0.884445 51.386302),BR222,http://planning.wokingham.gov.uk/FastWebPL/welcome.asp,2018-04-01,brownfield-land/local-authority-eng/WOK/BR222
"North Wokingham - Matthewsgreen Farm, Phase 2a",yes,,2018-12-10,,4.6604524,82,82,Reserved Matters application pursuant to Outline planning consent O/2014/2242 for Phase 2a development involving the erection of 82 residential dwellings,local-authority-eng:WOK,not owned by a public authority,2016-08-01,,permissioned,reserved matters approval,POINT(-0.842023 51.424978),BR223,http://planning.wokingham.gov.uk/FastWebPL/welcome.asp,2018-04-01,brownfield-land/local-authority-eng/WOK/BR223
S of M4 - Land North Of Hyde End Road Hyde End Road Shinfield RG2 9EP,yes,,2018-12-10,,1.6624331,31,31,"Full application for the proposed erection of 32no dwellings with associated vehicular access, parking and landscaping.",local-authority-eng:WOK,not owned by a public authority,2017-08-15,,permissioned,reserved matters approval,POINT(-0.959747 51.394008),BR224,http://planning.wokingham.gov.uk/FastWebPL/welcome.asp,2018-04-01,brownfield-land/local-authority-eng/WOK/BR224
"Land At, Arborfield Garrison Biggs Lane Arborfield Parcel O1",yes,,2018-12-10,,5.0545323,113,113,Reserved Matters application for the erection of 113 dwellings,local-authority-eng:WOK,not owned by a public authority,2015-11-26,,permissioned,reserved matters approval,POINT(-0.887356 51.38597),BR225,http://planning.wokingham.gov.uk/FastWebPL/welcome.asp,2018-04-01,brownfield-land/local-authority-eng/WOK/BR225
"S of M4 - North of Cutbush Lane, Shinfield",yes,,2018-12-10,,7.9667758,126,126,Reserved Matters application pursuant to Outline Planning Consent O/2013/0101for a residential development comprising up to 126 dwellings,local-authority-eng:WOK,not owned by a public authority,2015-06-24,,permissioned,reserved matters approval,POINT(-0.942603 51.413205),BR226,http://planning.wokingham.gov.uk/FastWebPL/welcome.asp,2018-04-01,brownfield-land/local-authority-eng/WOK/BR226
Unit 3 Cutbush Court Danehill RG6 4UW .,yes,,2018-12-10,,1.9870454,6,6,Prior approval submission for the conversion of existing office building (Use Class B1(a)) to 6no 1 bedroom residential flats (Use Class C3).,local-authority-eng:WOK,not owned by a public authority,2017-02-28,,permissioned,full planning permission,POINT(-0.929104 51.421067),BR227,http://planning.wokingham.gov.uk/FastWebPL/welcome.asp,2018-04-01,brownfield-land/local-authority-eng/WOK/BR227
"Wellington House, Riseley Business Park Basingstoke Road Riseley RG71QF",yes,,2018-12-10,,3.5669308,9,9,Prior approval submission for the conversion of existing office building (Use Class B1(a)) to 9no residential apartments (Use Class C3).,local-authority-eng:WOK,not owned by a public authority,2016-06-21,,permissioned,full planning permission,POINT(-0.963998 51.364246),BR228,http://planning.wokingham.gov.uk/FastWebPL/welcome.asp,2018-04-01,brownfield-land/local-authority-eng/WOK/BR228
Kingsbridge House Wargrave Road Twyford RG10 9NY,yes,,2018-12-10,,7.1530663,8,8,"Full Planning application for alterations to existing roof structure, facades and ground floor. Change of use on ground and first floor form offices and second floor from single flat to 8 self- contained apartments(C3 use).",local-authority-eng:WOK,owned by a public authority,2017-03-23,,permissioned,full planning permission,POINT(-0.867657 51.477814),BR229,http://planning.wokingham.gov.uk/FastWebPL/welcome.asp,2018-04-01,brownfield-land/local-authority-eng/WOK/BR229
70A Waterloo Road Wokingham RG40 2JL,yes,,2018-12-10,,1.046368,7,7,Full application for the proposed erection of 7no dwellings following demolition of existing dwelling.,local-authority-eng:WOK,not owned by a public authority,2017-11-02,,permissioned,full planning permission,POINT(-0.8151 51.40651),BR230,http://planning.wokingham.gov.uk/FastWebPL/welcome.asp,2018-04-01,brownfield-land/local-authority-eng/WOK/BR230
