site-address,deliverable,end-date,entry-date,hazardous-substances,hectares,maximum-net-dwellings,minimum-net-dwellings,notes,organisation,ownership-status,planning-permission-date,planning-permission-history,planning-permission-status,planning-permission-type,point,site,site-plan-url,start-date,slug
"Site of Mount Pleasant Hospital, Frederick Road, St Leonards",yes,,2019-12-21,,1.84,56,40,Refused planning application for half of the proposed site. Planning applications pending for 3 portions of site,local-authority-eng:HAS,not owned by a public authority,,http://publicaccess.hastings.gov.uk/online-applications/applicationDetails.do?activeTab=summary&keyVal=_HSTBC_DCAPR_114879|http://publicaccess.hastings.gov.uk/online-applications/applicationDetails.do?activeTab=summary&keyVal=_HSTBC_DCAPR_116561|http://publicaccess.hastings.gov.uk/online-applications/applicationDetails.do?activeTab=summary&keyVal=_HSTBC_DCAPR_116555|http://publicaccess.hastings.gov.uk/online-applications/applicationDetails.do?activeTab=summary&keyVal=_HSTBC_DCAPR_116552,pending decision,,POINT(-6.527118 55.057399),BL1,https://www.hastings.gov.uk/content/planning/planning_policy/pdfs/BL1.pdf,,brownfield-land/local-authority-eng/HAS/BL1
"123-125 West Hill Road, Hastings (former Malmesbury House)",,,2019-12-21,,0.7,117,117,,local-authority-eng:HAS,not owned by a public authority,1989-09-11,http://publicaccess.hastings.gov.uk/online-applications/applicationDetails.do?activeTab=summary&keyVal=_HSTBC_DCAPR_3205,permissioned,reserved matters approval,POINT(-6.555933 55.019365),BL2,https://www.hastings.gov.uk/content/planning/planning_policy/pdfs/BL2.pdf,,brownfield-land/local-authority-eng/HAS/BL2
"Hastings Station Yard (Part), Hastings (also known as Station Plaza, Station Approach, Devonshire Road)",,,2019-12-21,,0.44,103,103,Site is part of last uncompleted and unimplemented phase of larger station plaza redevelopment,local-authority-eng:HAS,not owned by a public authority,2009-11-11,http://publicaccess.hastings.gov.uk/online-applications/applicationDetails.do?activeTab=summary&keyVal=_HSTBC_DCAPR_84409,permissioned,full planning permission,POINT(-6.545737 55.043934),BL3,https://www.hastings.gov.uk/content/planning/planning_policy/pdfs/BL3.pdf,,brownfield-land/local-authority-eng/HAS/BL3
"Former Observer Building, 53 Cambridge Road, Hastings",,,2019-12-21,,0.07,50,39,,local-authority-eng:HAS,not owned by a public authority,2018-06-18,http://publicaccess.hastings.gov.uk/online-applications/applicationDetails.do?activeTab=summary&keyVal=_HSTBC_DCAPR_103671,permissioned,full planning permission,POINT(-6.551242 55.041857),BL4,https://www.hastings.gov.uk/content/planning/planning_policy/pdfs/BL4.pdf,,brownfield-land/local-authority-eng/HAS/BL4
"Seaside Road, West St Leonards",,,2019-12-21,,2.22,120,120,Site part of wider West Marina redevelopmnet area to potentially include mix of commerical residential and leisure uses,local-authority-eng:HAS,owned by a public authority,,,Not permissioned,,POINT(-6.558371 55.016994),BL5,https://www.hastings.gov.uk/content/planning/planning_policy/pdfs/BL5.pdf,,brownfield-land/local-authority-eng/HAS/BL5
"Broomgrove Redevelopment area, Former Power Station, Ore Valley, Hastings",,,2019-12-21,,2.35,50,50,,local-authority-eng:HAS,owned by a public authority,,,Not permissioned,,POINT(-6.528718 55.053257),BL6,https://www.hastings.gov.uk/content/planning/planning_policy/pdfs/BL6.pdf,,brownfield-land/local-authority-eng/HAS/BL6
"12-19 Braybrooke Terrace, Hastings",,,2019-12-21,,0.23,25,25,,local-authority-eng:HAS,not owned by a public authority,,,Not permissioned,,POINT(-6.546061 55.041076),BL7,https://www.hastings.gov.uk/content/planning/planning_policy/pdfs/BL7.pdf,,brownfield-land/local-authority-eng/HAS/BL7
"Taxi Office, Site of Former social club, St John's Road, St Leonards",,,2019-12-21,,0.12,30,30,,local-authority-eng:HAS,not owned by a public authority,,,Not permissioned,,POINT(-6.550178 55.032583),BL8,https://www.hastings.gov.uk/content/planning/planning_policy/pdfs/BL8.pdf,,brownfield-land/local-authority-eng/HAS/BL8
"Site of former West St Leonards Primary School, Bexhill Road, Hastings",,,2019-12-21,,3.92,100,100,Application for health centre on part of the site,local-authority-eng:HAS,owned by a public authority,2019-02-14,http://publicaccess.hastings.gov.uk/online-applications/applicationDetails.do?activeTab=summary&keyVal=_HSTBC_DCAPR_115732,permissioned,,POINT(-6.554335 55.014217),BL10,https://www.hastings.gov.uk/content/planning/planning_policy/pdfs/BL10.pdf,,brownfield-land/local-authority-eng/HAS/BL10
"Gambier House, 111 West Hill Road, Hastings",,,2019-12-21,,0.23,15,15,,local-authority-eng:HAS,not owned by a public authority,,,Not permissioned,,POINT(-6.556381 55.021488),BL11,https://www.hastings.gov.uk/content/planning/planning_policy/pdfs/BL11.pdf,,brownfield-land/local-authority-eng/HAS/BL11
"Site of Hollingsworth Garage, Braybrooke Road, Hastings",,,2019-12-21,,0.4,56,56,,local-authority-eng:HAS,not owned by a public authority,,,Not permissioned,,POINT(-6.542158 55.04485),BL12,https://www.hastings.gov.uk/content/planning/planning_policy/pdfs/BL12.pdf,,brownfield-land/local-authority-eng/HAS/BL12
"Former Westerleigh School, Hollington Park Close, Hastings",,,2019-12-21,,2.15,68,68,Demolition has taken place on site,local-authority-eng:HAS,not owned by a public authority,,http://publicaccess.hastings.gov.uk/online-applications/applicationDetails.do?activeTab=summary&keyVal=_HSTBC_DCAPR_116149,Not permissioned,,POINT(-6.539135 55.021486),BL13,https://www.hastings.gov.uk/content/planning/planning_policy/pdfs/BL13.pdf,,brownfield-land/local-authority-eng/HAS/BL13
"West Hill Road Reservoir, St Leonards",,,2019-12-21,,0.19,14,14,,local-authority-eng:HAS,not owned by a public authority,,,Not permissioned,,POINT(-6.556122 55.023774),BL15,https://www.hastings.gov.uk/content/planning/planning_policy/pdfs/BL15.pdf,,brownfield-land/local-authority-eng/HAS/BL15
"Mount Denys, Pine Hill & Ridgeway, The Ridge, Hastings",,,2019-12-21,,0.64,31,31,Demolition has taken place on site,local-authority-eng:HAS,owned by a public authority,,,Not permissioned,,POINT(-6.513282 55.055),BL16,https://www.hastings.gov.uk/content/planning/planning_policy/pdfs/BL16.pdf,,brownfield-land/local-authority-eng/HAS/BL16
"Horntye Park, Bohemia Road, Hastings",,,2019-12-21,,1.01,115,115,,local-authority-eng:HAS,not owned by a public authority,,,Not permissioned,,POINT(-6.54265 55.034852),BL17,https://www.hastings.gov.uk/content/planning/planning_policy/pdfs/BL17.pdf,,brownfield-land/local-authority-eng/HAS/BL17
"Land at Church Street, Hastings",yes,,2019-12-21,,0.35,5,5,Development of site to provide 5 dwellings,local-authority-eng:HAS,not owned by a public authority,2017-07-20,http://publicaccess.hastings.gov.uk/online-applications/applicationDetails.do?activeTab=summary&keyVal=_HSTBC_DCAPR_104541,permissioned,reserved matters approval,POINT(-6.522116 55.059955),BL18,https://www.hastings.gov.uk/content/planning/planning_policy/pdfs/BL18.pdf,,brownfield-land/local-authority-eng/HAS/BL18
"4-5 Stockleigh Road, St Leonards",,,2019-12-21,,0.03,12,12,12 new flats on previously developed land,local-authority-eng:HAS,not owned by a public authority,,http://publicaccess.hastings.gov.uk/online-applications/applicationDetails.do?activeTab=summary&keyVal=_HSTBC_DCAPR_116839,pending decision,,POINT(-6.552598 55.03027),BL19,https://www.hastings.gov.uk/content/planning/planning_policy/pdfs/BL19.pdf,,brownfield-land/local-authority-eng/HAS/BL19
"37 Charles Road West (former Filsham Nurseries), St Leonards",,,2019-12-21,,0.26,7,7,"Demolition of existing buildings and ancillary buildings. Erection of 7no residential units, landscape and parking. Application pending for proposed development of 10 x 3 bedroom dwellinghouses.",local-authority-eng:HAS,not owned by a public authority,2017-07-20,http://publicaccess.hastings.gov.uk/online-applications/applicationDetails.do?activeTab=summary&keyVal=_HSTBC_DCAPR_103716|http://publicaccess.hastings.gov.uk/online-applications/applicationDetails.do?activeTab=summary&keyVal=_HSTBC_DCAPR_116619,permissioned,full planning permission,POINT(-6.540972 55.026238),BL21,https://www.hastings.gov.uk/content/planning/planning_policy/pdfs/BL21.pdf,,brownfield-land/local-authority-eng/HAS/BL21
"14 Westfield Lane, St Leonards",yes,,2019-12-21,,0.33,14,14,,local-authority-eng:HAS,owned by a public authority,,,Not permissioned,,POINT(-6.486552 55.03163),BL22,https://www.hastings.gov.uk/content/planning/planning_policy/pdfs/BL22.pdf,,brownfield-land/local-authority-eng/HAS/BL22
"12-13 York Buildings, Wellington Place, Hastings",yes,,2019-12-21,,0.02,6,6,Alteration works to ground floor stair and to three upper storeys of existing building and conversion into six flats for residential accommodation (Application HS/LB/16/00661 also applies),local-authority-eng:HAS,owned by a public authority,2017-01-20,http://publicaccess.hastings.gov.uk/online-applications/applicationDetails.do?activeTab=summary&keyVal=_HSTBC_DCAPR_103972,permissioned,full planning permission,POINT(-6.550734 55.044884),BL27,https://www.hastings.gov.uk/content/planning/planning_policy/pdfs/BL27.pdf,,brownfield-land/local-authority-eng/HAS/BL27
"The Grove School (Former St Leonards Academy, Darwell Campus, Darwell Close), St Leonards",,,2019-12-21,,9.4,240,210,"Outline application for the erection of up to 210 dwellings (25% affordable) with associated open space, play areas, landscaping and access.",local-authority-eng:HAS,owned by a public authority,2017-11-17,http://publicaccess.hastings.gov.uk/online-applications/applicationDetails.do?activeTab=summary&keyVal=_HSTBC_DCAPR_102356,permissioned,outline planning permission,POINT(-6.531772 55.016289),BL28,https://www.hastings.gov.uk/content/planning/planning_policy/pdfs/BL28.pdf,,brownfield-land/local-authority-eng/HAS/BL28
"1 & 2 Wayside, 490-492 Sedlescombe Road North, St Leonards",,,2019-12-21,,0.19,5,5,,local-authority-eng:HAS,owned by a public authority,,http://publicaccess.hastings.gov.uk/online-applications/applicationDetails.do?activeTab=summary&keyVal=_HSTBC_DCAPR_105013,Not permissioned,,POINT(-6.497771 55.026325),BL31,https://www.hastings.gov.uk/content/planning/planning_policy/pdfs/BL31.pdf,,brownfield-land/local-authority-eng/HAS/BL31
"309-311 Harold Road, Hastings",yes,,2019-12-21,,0.09,7,6,Demolition of the existing buildings and erection of 7 terraced dwellings (6 x two bedroom and 1 x one bedroom) with associated off-street parking,local-authority-eng:HAS,not owned by a public authority,2018-11-23,http://publicaccess.hastings.gov.uk/online-applications/applicationDetails.do?activeTab=summary&keyVal=_HSTBC_DCAPR_115587,permissioned,full planning permission,POINT(-6.530978 55.063046),BL33,https://www.hastings.gov.uk/content/planning/planning_policy/pdfs/BL33.pdf,,brownfield-land/local-authority-eng/HAS/BL33
"Cinques Port Way (Former Stamco Timber Yard and TA Centre), St Leonards",,,2019-12-21,,0.65,25,25,,local-authority-eng:HAS,not owned by a public authority,,,Not permissioned,,POINT(-6.558145 55.01509),BL34,https://www.hastings.gov.uk/content/planning/planning_policy/pdfs/BL34.pdf,,brownfield-land/local-authority-eng/HAS/BL34
"Part of the former Spyway School Buildings, Hollington Park School Grounds, Gillsmans Hill, St Leonards",,,2019-12-21,,0.32,8,8,"Outline application,(seeking approval of Access), for erection of 8 dwellings together with parking and access(amended proposal). Reserved matters application pending relating to the layout, scale, external appearance of the buildings, means of access and soft and hard landscaping of Planning permission HS/OA/17/00812 - Outline application,(seeking approval of Access), for erection of 8 dwellings together with parking and access(amended proposal). Previously part of BL14.",local-authority-eng:HAS,not owned by a public authority,2018-05-24,http://publicaccess.hastings.gov.uk/online-applications/applicationDetails.do?activeTab=summary&keyVal=_HSTBC_DCAPR_105161|http://publicaccess.hastings.gov.uk/online-applications/applicationDetails.do?activeTab=summary&keyVal=_HSTBC_DCAPR_116603,permissioned,outline planning permission,POINT(-6.534788 55.025046),BL35,https://www.hastings.gov.uk/content/planning/planning_policy/pdfs/BL35.pdf,,brownfield-land/local-authority-eng/HAS/BL35
"Former Spyways School (part), Gillsmans Hill, St Leonards",,,2019-12-21,,0.72,25,25,Formerly part of BL14.,local-authority-eng:HAS,not owned by a public authority,,,Not permissioned,,POINT(-6.534133 55.024445),BL36,https://www.hastings.gov.uk/content/planning/planning_policy/pdfs/BL36.pdf,,brownfield-land/local-authority-eng/HAS/BL36
381-391 Old London Road (Former Hare & Hounds public house & adjoining car sales yard),,,2019-12-21,,0.08,6,6,"Planning permission pending for redevelopment to form 10No. self-contained flats, with associated off-road parking",local-authority-eng:HAS,not owned by a public authority,,http://publicaccess.hastings.gov.uk/online-applications/applicationDetails.do?activeTab=summary&keyVal=_HSTBC_DCAPR_116394,pending decision,,POINT(-6.523768 55.062807),BL37,https://www.hastings.gov.uk/content/planning/planning_policy/pdfs/BL37.pdf,,brownfield-land/local-authority-eng/HAS/BL37
"107 The Ridge (Simes & Sons), Hastings",,,2019-12-21,,0.22,8,8,,local-authority-eng:HAS,not owned by a public authority,,http://publicaccess.hastings.gov.uk/online-applications/applicationDetails.do?activeTab=summary&keyVal=_HSTBC_DCAPR_100096,Not permissioned,,POINT(-6.515735 55.05821),BL38,https://www.hastings.gov.uk/content/planning/planning_policy/pdfs/BL38.pdf,,brownfield-land/local-authority-eng/HAS/BL38
"43-45 Queens Road (upper floors), Hastings",,,2019-12-21,,0.02,5,5,"Above shop space (first, second and loft space) into 5 self-contained flats, incorporating with ground floor entrance alteration and rear roof dormers construction.",local-authority-eng:HAS,not owned by a public authority,2018-08-23,http://publicaccess.hastings.gov.uk/online-applications/applicationDetails.do?activeTab=summary&keyVal=_HSTBC_DCAPR_114917,permissioned,full planning permission,POINT(-6.547376 55.046242),BL39,https://www.hastings.gov.uk/content/planning/planning_policy/pdfs/BL39.pdf,,brownfield-land/local-authority-eng/HAS/BL39
"West House, 115 West Hill Road",,,2019-12-21,,0.33,,,,local-authority-eng:HAS,not owned by a public authority,,,Not permissioned,,POINT(-6.556343 55.020958),BL41,https://www.hastings.gov.uk/content/planning/planning_policy/pdfs/BL41.pdf,,brownfield-land/local-authority-eng/HAS/BL41
"Bilmore Corner, Battle Road",,,2019-12-21,,0.06,2,8,Demolition of office unit and erection of detached building comprising 2 flats. permission for part of site - 2 dwellings,local-authority-eng:HAS,not owned by a public authority,2019-03-25,http://publicaccess.hastings.gov.uk/online-applications/applicationDetails.do?activeTab=summary&keyVal=_HSTBC_DCAPR_116054,permissioned,full planning permission,POINT(-6.520566 55.028749),BL42,https://www.hastings.gov.uk/content/planning/planning_policy/pdfs/BL42.pdf,,brownfield-land/local-authority-eng/HAS/BL42
