site-address,deliverable,end-date,entry-date,hazardous-substances,hectares,maximum-net-dwellings,minimum-net-dwellings,notes,organisation,ownership-status,planning-permission-date,planning-permission-history,planning-permission-status,planning-permission-type,point,site,site-plan-url,start-date,slug
"1-2 Wesley Gate, Queens Road, Reading",yes,,2019-12-16,,0.08,15,15,Prior approval 181321 and 191520. Change of use of office building from Class B1(a) (offices) to C3 (dwelling houses) to comprise 15 dwelling units.,local-authority-eng:RDG,not owned by a public authority,2018-09-27,,permissioned,full planning permission,POINT(-0.962862 51.453274),BL2039,https://www.reading.gov.uk/media/8107/Brownfield-Register-Maps-BL2001-2051/pdf/Brownfield_Land_Register_Maps_2019_2001_to_2051.pdf,2018-12-16,brownfield-land/local-authority-eng/RDG/BL2039
"54 Queens Road, Reading",yes,,2019-12-16,,0.16,20,20,Prior approval 180982. Change of use of building from Class B1(a) (offices) to C3 (dwelling houses) to comprise 20 residential flats including 4 x 2 bedroom and 16 x 1 bedroom flats.,local-authority-eng:RDG,not owned by a public authority,2018-07-31,,permissioned,full planning permission,POINT(-0.964724 51.453066),BL2040,https://www.reading.gov.uk/media/8107/Brownfield-Register-Maps-BL2001-2051/pdf/Brownfield_Land_Register_Maps_2019_2001_to_2051.pdf,2018-12-16,brownfield-land/local-authority-eng/RDG/BL2040
"108 London Street, Reading",yes,,2019-12-16,,0.04,7,7,"Planning permission 181218. Change of use and conversion from offices (Class B1a) to 7 (4x1 & 3x2-bed) residential apartments (Class C3) with associated parking, refuse storage and associated works.",local-authority-eng:RDG,not owned by a public authority,2018-09-17,,permissioned,full planning permission,POINT(-0.967706 51.451006),BL2041,https://www.reading.gov.uk/media/8107/Brownfield-Register-Maps-BL2001-2051/pdf/Brownfield_Land_Register_Maps_2019_2001_to_2051.pdf,2018-12-16,brownfield-land/local-authority-eng/RDG/BL2041
"Addington House, 73 London Street, Reading",yes,,2019-12-16,,0.03,8,8,"Planning permission 180758. Conversion of basement and 3 storey office building to 8 (1x studio, 4x1 & 3x2-bed flats) residential units (Class C3) and associated works.",local-authority-eng:RDG,not owned by a public authority,2018-10-12,,permissioned,full planning permission,POINT(-0.967644 51.451851),BL2042,https://www.reading.gov.uk/media/8107/Brownfield-Register-Maps-BL2001-2051/pdf/Brownfield_Land_Register_Maps_2019_2001_to_2051.pdf,2018-12-16,brownfield-land/local-authority-eng/RDG/BL2042
"Cadogan House, Rose Kiln Lane, Reading",yes,,2019-12-16,,0.23,39,19,"Prior approvals 181643 (39 units), 172277 (19 units) and 182166 (24 units). Prior approval for change of use of ground & first floors from Class B1(a) (offices) to C3 (dwelling houses) to comprise 39 residential units.",local-authority-eng:RDG,not owned by a public authority,2018-11-09,,permissioned,full planning permission,POINT(-0.975931 51.444883),BL2043,https://www.reading.gov.uk/media/8107/Brownfield-Register-Maps-BL2001-2051/pdf/Brownfield_Land_Register_Maps_2019_2001_to_2051.pdf,2018-12-16,brownfield-land/local-authority-eng/RDG/BL2043
"42 Queens Road, Reading",yes,,2019-12-16,,0.03,5,5,"Permission 181579.. Change of use from employment agency (A2) to 5 self-contained apartments with associated internal alterations, enlarged external basement light well with new windows and new roof lights to existing single storey rear extension.",local-authority-eng:RDG,not owned by a public authority,2018-12-18,,permissioned,full planning permission,POINT(-0.965327 51.453116),BL2044,https://www.reading.gov.uk/media/8107/Brownfield-Register-Maps-BL2001-2051/pdf/Brownfield_Land_Register_Maps_2019_2001_to_2051.pdf,2019-12-16,brownfield-land/local-authority-eng/RDG/BL2044
"Mulberry House, 1a Eldon Road, Reading",yes,,2019-12-16,,0.08,7,7,"Alternative permission 171521 is for demolition for landscaping.. Demolish Mulberry House (D1) and erect part 3, part 5 storey building for 7 (3x1 & 4x2-bed) dwellings, 5 parking spaces.",local-authority-eng:RDG,not owned by a public authority,2019-03-27,,permissioned,full planning permission,POINT(-0.958127 51.453277),BL2045,https://www.reading.gov.uk/media/8107/Brownfield-Register-Maps-BL2001-2051/pdf/Brownfield_Land_Register_Maps_2019_2001_to_2051.pdf,2019-12-16,brownfield-land/local-authority-eng/RDG/BL2045
"Dukesbridge House, 23 Duke Street, Reading",yes,,2019-12-16,,0.19,77,77,"Prior approval 190602. Change of use of part lower ground floor, part ground floor, first, second, third and loft floors from Class B1(a)(offices) to Class C3 (dwelling houses) to comprise 77 dwellings (26 x studio, 49 x 1 bed, 2 x 2 bed).",local-authority-eng:RDG,not owned by a public authority,2019-06-06,,permissioned,full planning permission,POINT(-0.968118 51.454435),BL2046,https://www.reading.gov.uk/media/8107/Brownfield-Register-Maps-BL2001-2051/pdf/Brownfield_Land_Register_Maps_2019_2001_to_2051.pdf,2019-12-16,brownfield-land/local-authority-eng/RDG/BL2046
"149 London Road, Reading",yes,,2019-12-16,,0.11,6,6,"Permission 161303, under construction.. Conversion of vacant A3 restaurant into 6 flats",local-authority-eng:RDG,not owned by a public authority,2019-06-18,,permissioned,full planning permission,POINT(-0.951142 51.452873),BL2047,https://www.reading.gov.uk/media/8107/Brownfield-Register-Maps-BL2001-2051/pdf/Brownfield_Land_Register_Maps_2019_2001_to_2051.pdf,2019-12-16,brownfield-land/local-authority-eng/RDG/BL2047
"36 Queens Road, Reading",yes,,2019-12-16,,0.03,5,5,"Permission 181908. Change of use from office to 5x1 bed flats, ground floor enlargement to rear and rooflights",local-authority-eng:RDG,not owned by a public authority,2019-07-05,,permissioned,full planning permission,POINT(-0.965601 51.453074),BL2048,https://www.reading.gov.uk/media/8107/Brownfield-Register-Maps-BL2001-2051/pdf/Brownfield_Land_Register_Maps_2019_2001_to_2051.pdf,2019-12-16,brownfield-land/local-authority-eng/RDG/BL2048
"10 Southern Court, South Street, Reading",yes,,2019-12-16,,0.02,16,16,Prior approvals 182027 and 190965. Prior approval for change of use from Class B1(a) (offices) to C3 (dwelling houses) to comprise 16 residential units.,local-authority-eng:RDG,not owned by a public authority,2019-08-09,,permissioned,full planning permission,POINT(-0.965953 51.45215),BL2049,https://www.reading.gov.uk/media/8107/Brownfield-Register-Maps-BL2001-2051/pdf/Brownfield_Land_Register_Maps_2019_2001_to_2051.pdf,2019-12-16,brownfield-land/local-authority-eng/RDG/BL2049
"Dukesbridge Chambers, 1 Duke Street, Reading",yes,,2019-12-16,,0.03,25,25,"Prior approval 191221. Change of use of part ground floor and first to fourth floors from Class B1(a) (Offices) to Class C3(Dwellinghouses) to comprise 25 dwellings (13 x Studio, 11 x 1 bed and 1 x 2 bed).",local-authority-eng:RDG,not owned by a public authority,2019-09-19,,permissioned,full planning permission,POINT(-0.968757 51.454837),BL2050,https://www.reading.gov.uk/media/8107/Brownfield-Register-Maps-BL2001-2051/pdf/Brownfield_Land_Register_Maps_2019_2001_to_2051.pdf,2019-12-16,brownfield-land/local-authority-eng/RDG/BL2050
"27 Hamilton Road, Reading",yes,,2019-12-16,,0.09,9,9,Permission 161779. Single storey side and two storey rear extensions and conversion of existing 12 bedroom HMO to 7 one bedroom flats and 2 two bedroom flats,local-authority-eng:RDG,not owned by a public authority,2019-11-01,,permissioned,full planning permission,POINT(-0.945352 51.451212),BL2051,https://www.reading.gov.uk/media/8107/Brownfield-Register-Maps-BL2001-2051/pdf/Brownfield_Land_Register_Maps_2019_2001_to_2051.pdf,2019-12-16,brownfield-land/local-authority-eng/RDG/BL2051
"131 Wokingham Road, Reading",,,2019-12-16,,0.15,12,8,Allocation ER1k in Local Plan.. Development for residential with ground floor local centre uses.. https://www.reading.gov.uk/media/10410/Reading-Borough-Council-Local-Plan/pdf/Local_Plan_Adopted_November_2019.pdf,local-authority-eng:RDG,not owned by a public authority,,,not permissioned,,POINT(-0.935394 51.447462),BL3001,https://www.reading.gov.uk/media/8106/Brownfield-Register-Maps-BL3001-3026/pdf/Brownfield_Land_Register_Maps_2019_3001_to_3026.pdf,2017-12-15,brownfield-land/local-authority-eng/RDG/BL3001
"Hamilton Centre, Bulmershe Road, Reading",,,2019-12-16,,0.35,19,13,Allocation ER1f in Local Plan. Development for residential. https://www.reading.gov.uk/media/10410/Reading-Borough-Council-Local-Plan/pdf/Local_Plan_Adopted_November_2019.pdf,local-authority-eng:RDG,owned by a public authority,,,not permissioned,,POINT(-0.939883 51.446244),BL3002,https://www.reading.gov.uk/media/8106/Brownfield-Register-Maps-BL3001-3026/pdf/Brownfield_Land_Register_Maps_2019_3001_to_3026.pdf,2017-12-15,brownfield-land/local-authority-eng/RDG/BL3002
"Land adjacent to 40 Redlands Road, Reading",yes,,2019-12-16,,0.43,35,23,Allocation ER1d in Local Plan. Development for residential.. https://www.reading.gov.uk/media/10410/Reading-Borough-Council-Local-Plan/pdf/Local_Plan_Adopted_November_2019.pdf,local-authority-eng:RDG,not owned by a public authority,,,not permissioned,,POINT(-0.9583 51.446319),BL3005,https://www.reading.gov.uk/media/8106/Brownfield-Register-Maps-BL3001-3026/pdf/Brownfield_Land_Register_Maps_2019_3001_to_3026.pdf,2017-12-15,brownfield-land/local-authority-eng/RDG/BL3005
"The Woodley Arms PH, Waldeck Street, Reading",yes,,2019-12-16,,0.09,38,26,"Allocation ER1a in Local Plan. Planning permission for student accommodation 171893 granted on appeal 10/10/2018. Development for residential, with potential for student accommodation.. https://www.reading.gov.uk/media/10410/Reading-Borough-Council-Local-Plan/pdf/Local_Plan_Adopted_November_2019.pdf",local-authority-eng:RDG,not owned by a public authority,,,not permissioned,,POINT(-0.967508 51.4464),BL3006,https://www.reading.gov.uk/media/8106/Brownfield-Register-Maps-BL3001-3026/pdf/Brownfield_Land_Register_Maps_2019_3001_to_3026.pdf,2017-12-15,brownfield-land/local-authority-eng/RDG/BL3006
"92-96 Southampton Street, Reading",yes,,2019-12-16,,0.04,7,7,"Permission 160571, under construction at 31/03/2019. The erection of a building containing 7 dwellings to the rear of 92-96 Southampton Street, including altered access off Pell Street and landscaping/Listed building consent for works to the boundary wall to number 92 along Pell Street.",local-authority-eng:RDG,not owned by a public authority,2017-08-07,,permissioned,full planning permission,POINT(-0.969808 51.449694),BL3007,https://www.reading.gov.uk/media/8106/Brownfield-Register-Maps-BL3001-3026/pdf/Brownfield_Land_Register_Maps_2019_3001_to_3026.pdf,2017-12-15,brownfield-land/local-authority-eng/RDG/BL3007
"Corner of Crown Street and Southampton Street, Reading",yes,,2019-12-16,,0.08,19,13,Allocation CR14j in Local Plan. Development for residential. https://www.reading.gov.uk/media/10410/Reading-Borough-Council-Local-Plan/pdf/Local_Plan_Adopted_November_2019.pdf,local-authority-eng:RDG,owned by a public authority,,,not permissioned,,POINT(-0.969445 51.449834),BL3008,https://www.reading.gov.uk/media/8106/Brownfield-Register-Maps-BL3001-3026/pdf/Brownfield_Land_Register_Maps_2019_3001_to_3026.pdf,2017-12-15,brownfield-land/local-authority-eng/RDG/BL3008
"13-21 Crown Street and 27 Silver Street, Reading",yes,,2019-12-16,,0.33,80,80,"Permission 170794, under construction. Allocation in Local Plan (CR14k).. Residential development consisting of 80 no. dwellings (Class C3) with associated access and landscaping works. Demolition of existing buildings. https://www.reading.gov.uk/media/10410/Reading-Borough-Council-Local-Plan/pdf/Local_Plan_Adopted_November_2019.pdf",local-authority-eng:RDG,not owned by a public authority,2017-10-12,,permissioned,full planning permission,POINT(-0.967225 51.450004),BL3010,https://www.reading.gov.uk/media/8106/Brownfield-Register-Maps-BL3001-3026/pdf/Brownfield_Land_Register_Maps_2019_3001_to_3026.pdf,2017-12-15,brownfield-land/local-authority-eng/RDG/BL3010
"40 Silver Street, Reading",,,2019-12-16,,0.11,14,14,Permission 150885 expired March 2019. Redevelopment for 14 flats (8x2bed & 6x1 bed) including 14 parking spaces and landscaping.,local-authority-eng:RDG,not owned by a public authority,,,not permissioned,,POINT(-0.966859 51.448993),BL3011,https://www.reading.gov.uk/media/8106/Brownfield-Register-Maps-BL3001-3026/pdf/Brownfield_Land_Register_Maps_2019_3001_to_3026.pdf,2017-12-15,brownfield-land/local-authority-eng/RDG/BL3011
"South of Elgar Road, Reading",,,2019-12-16,,5.38,500,330,"Allocation SR3 in Local Plan. Development of the South of Elgar Road site will be for residential (330-500 dwellings), with potential for supporting community uses. The potential for commercial uses to be part of any future mixed-use development hinges on whether a layout can be created that allows the relationship between residential and commercial to be effectively managed.. https://www.reading.gov.uk/media/10410/Reading-Borough-Council-Local-Plan/pdf/Local_Plan_Adopted_November_2019.pdf",local-authority-eng:RDG,not owned by a public authority,,,not permissioned,,POINT(-0.971242 51.440319),BL3013,https://www.reading.gov.uk/media/8106/Brownfield-Register-Maps-BL3001-3026/pdf/Brownfield_Land_Register_Maps_2019_3001_to_3026.pdf,2017-12-15,brownfield-land/local-authority-eng/RDG/BL3013
"35 Christchurch Road, Reading",yes,,2019-12-16,,0.08,10,10,"Permission 151034. Conversion of 12 Bedroom HMO into 10 self-contained units comprising 7 x 1 bed studios, 1 x 2 bed apartment and 2 x 1 bed apartment.",local-authority-eng:RDG,not owned by a public authority,2016-11-01,,permissioned,full planning permission,POINT(-0.962299 51.444484),BL3014,https://www.reading.gov.uk/media/8106/Brownfield-Register-Maps-BL3001-3026/pdf/Brownfield_Land_Register_Maps_2019_3001_to_3026.pdf,2017-12-15,brownfield-land/local-authority-eng/RDG/BL3014
"Warwick House, 1 Warwick Road, Reading",yes,,2019-12-16,,0.15,10,10,"Permission 151407.. A single building comprising 10 flats on 2 floors on land adjacent to Warwick House, Warwick Road Reading.",local-authority-eng:RDG,not owned by a public authority,2018-04-17,,permissioned,full planning permission,POINT(-0.962237 51.442146),BL3015,https://www.reading.gov.uk/media/8106/Brownfield-Register-Maps-BL3001-3026/pdf/Brownfield_Land_Register_Maps_2019_3001_to_3026.pdf,2017-12-15,brownfield-land/local-authority-eng/RDG/BL3015
"Land North of Manor Farm Road, Reading",,,2019-12-16,,13.69,1020,680,"Allocation SR2 in Local Plan.. Redevelopment of the Manor Farm Road site will primarily be for housing (between 680-1,020 dwellings), an extension to the Whitley District Centre, school provision and open space and public realm improvements, but also include small employment units to replace the Micro Centre, community uses, in addition to a limited amount of employment uses.. https://www.reading.gov.uk/media/10410/Reading-Borough-Council-Local-Plan/pdf/Local_Plan_Adopted_November_2019.pdf",local-authority-eng:RDG,mixed ownership,,,not permissioned,,POINT(-0.971415 51.432587),BL3017,https://www.reading.gov.uk/media/8106/Brownfield-Register-Maps-BL3001-3026/pdf/Brownfield_Land_Register_Maps_2019_3001_to_3026.pdf,2017-12-15,brownfield-land/local-authority-eng/RDG/BL3017
"Land at the Madejski Stadium, Shooters Way, Reading",,,2019-12-16,,19.0,618,618,"Application 160199 is a hybrid, with 196 residential units and non-residential elements in detail, and 422 units in outline. Permitted November 2018. Residential development (Blocks 1-6 only) to provide up to 422 residential units, comprising predominantly 1 and 2 bedroom apartments (Use Class C3) along with associated landscaping and car parking. Residential and mixed usedevelopment comprising: 196 residential units, convention centre andice rink, 246 bedroom hotel and up to 102 serviced apartments, deckedcar parking within convention centre, flexible ancillary retail space, multi storey car park, public open space, associated access, landscaping, cycle parking, transport interchange and related infrastructure/engineering works, ancillary facilities etc",local-authority-eng:RDG,not owned by a public authority,,,permissioned,,POINT(-0.982648 51.422354),BL3018,https://www.reading.gov.uk/media/8106/Brownfield-Register-Maps-BL3001-3026/pdf/Brownfield_Land_Register_Maps_2019_3001_to_3026.pdf,2017-12-15,brownfield-land/local-authority-eng/RDG/BL3018
"Worton Grange, Imperial Way, Reading",yes,,2018-12-16,,6.17,76,76,"Permission 151944 was hybrid - detailed for commercial development, and outline for residential. Permission 161496 was reserved matters for residential. Commercial development complete and residential development under construction at 31/03/2019.. Development for 175 homes,12 commercial units (B1c, B2, B8), car showrooms, retail, 120 bed hotel, pub, coffee shop, restaurant, bank. 33 dwellings completed at 31/03/2018, remainder shown here.",local-authority-eng:RDG,not owned by a public authority,2016-04-14,,permissioned,reserved matters approval,POINT(-0.973176 51.418216),BL3019,https://www.reading.gov.uk/media/8106/Brownfield-Register-Maps-BL3001-3026/pdf/Brownfield_Land_Register_Maps_2019_3001_to_3026.pdf,2017-12-15,brownfield-land/local-authority-eng/RDG/BL3019
"Land at corner of Newark Street and Crown Street, Reading",yes,,2019-12-16,,0.03,9,9,Permission 180417. Part of allocation CR14k in Local Plan.. Residential development comprising 9 flats (Class C3).,local-authority-eng:RDG,not owned by a public authority,2018-07-20,,permissioned,full planning permission,POINT(-0.967889 51.44992),BL3020,https://www.reading.gov.uk/media/8106/Brownfield-Register-Maps-BL3001-3026/pdf/Brownfield_Land_Register_Maps_2019_3001_to_3026.pdf,2018-12-16,brownfield-land/local-authority-eng/RDG/BL3020
"125 Highgrove Street, Reading",yes,,2019-12-16,,0.13,8,8,Permission 171477. Erection of 8 new dwellings (Use Class C3) including landscaping. Demolition of existing buildings within site.,local-authority-eng:RDG,not owned by a public authority,2018-06-12,,permissioned,full planning permission,POINT(-0.963821 51.444632),BL3021,https://www.reading.gov.uk/media/8106/Brownfield-Register-Maps-BL3001-3026/pdf/Brownfield_Land_Register_Maps_2019_3001_to_3026.pdf,2018-12-16,brownfield-land/local-authority-eng/RDG/BL3021
"14 Arkwright Road, Reading",yes,,2019-12-16,,0.33,37,37,Prior approval 180654. Site is within Core Employment Area and therefore application involving loss of employment would be contrary to policy.. Change of use of office building from Class B1(a) (offices) to C3 (dwelling houses) to comprise 37 dwelling units.,local-authority-eng:RDG,not owned by a public authority,2018-06-13,,permissioned,full planning permission,POINT(-0.970705 51.436699),BL3022,https://www.reading.gov.uk/media/8106/Brownfield-Register-Maps-BL3001-3026/pdf/Brownfield_Land_Register_Maps_2019_3001_to_3026.pdf,2018-12-16,brownfield-land/local-authority-eng/RDG/BL3022
"85-87 Basingstoke Road, Reading",yes,,2019-12-16,,0.06,23,17,"Prior approval 182091 (17 flats) and 190358 (23 flats). Prior approvals for change of use of part ground, first and second floors from Class B1(a) (offices) to C3 (dwelling houses) to comprise of 17 or 23 flats.",local-authority-eng:RDG,not owned by a public authority,2019-04-30,,permissioned,full planning permission,POINT(-0.967111 51.439131),BL3023,https://www.reading.gov.uk/media/8106/Brownfield-Register-Maps-BL3001-3026/pdf/Brownfield_Land_Register_Maps_2019_3001_to_3026.pdf,2019-12-16,brownfield-land/local-authority-eng/RDG/BL3023
"34-38 Southampton Street, Reading",yes,,2019-12-16,,0.03,11,11,"Permission 181117. Erection of a basement and 4-storey building to provide 11 (1x studio, 8x1-bed & 2x2-bed) residential units and associated works following the demolition of the existing buildings (basement & 3- storey public house and 2-storey residential building)",local-authority-eng:RDG,not owned by a public authority,2019-08-12,,permissioned,full planning permission,POINT(-0.971131 51.451),BL3024,https://www.reading.gov.uk/media/8106/Brownfield-Register-Maps-BL3001-3026/pdf/Brownfield_Land_Register_Maps_2019_3001_to_3026.pdf,2019-12-16,brownfield-land/local-authority-eng/RDG/BL3024
"Former Sales and Marketing Suites, Drake Way, Reading",yes,,2019-12-16,,0.24,12,12,"Permission 180543. Proposed construction of 12 apartments ( 1 x 1 bed, 11 x 2 bed) with associated car parking, landscaping and open space, and infrastructure provision.",local-authority-eng:RDG,not owned by a public authority,2019-09-23,,permissioned,full planning permission,POINT(-0.97641 51.430527),BL3025,https://www.reading.gov.uk/media/8106/Brownfield-Register-Maps-BL3001-3026/pdf/Brownfield_Land_Register_Maps_2019_3001_to_3026.pdf,2019-12-16,brownfield-land/local-authority-eng/RDG/BL3025
"1 St Giles Court, Southampton Street, Reading",yes,,2019-12-16,,0.03,5,5,Prior approval 191513. Change of use of building from Class B1(a) (offices) to C3 (dwelling houses) to comprise 5 x 1-bedroom flats.,local-authority-eng:RDG,not owned by a public authority,2019-11-15,,permissioned,full planning permission,POINT(-0.971448 51.450985),BL3026,https://www.reading.gov.uk/media/8106/Brownfield-Register-Maps-BL3001-3026/pdf/Brownfield_Land_Register_Maps_2019_3001_to_3026.pdf,2019-12-16,brownfield-land/local-authority-eng/RDG/BL3026
"169-173 Basingstoke Road, Reading",,,2019-12-16,,0.8,80,50,Allocation SR4c in Local Plan. Redevelopment of industrial and warehousing for residential. https://www.reading.gov.uk/media/10410/Reading-Borough-Council-Local-Plan/pdf/Local_Plan_Adopted_November_2019.pdf,local-authority-eng:RDG,not owned by a public authority,,,not permissioned,,POINT(-0.967277 51.437496),BL4001,https://www.reading.gov.uk/media/8108/Brownfield-Register-Maps-BL4001-4025/pdf/Brownfield_Land_Register_Maps_2019_4001_to_4025.pdf,2017-12-15,brownfield-land/local-authority-eng/RDG/BL4001
"Alice Burrows Home, Dwyer Road, Reading",yes,,2019-12-16,,0.48,27,18,Allocation WR3p in Local Plan.. Development for residential and/or residential care.. https://www.reading.gov.uk/media/10410/Reading-Borough-Council-Local-Plan/pdf/Local_Plan_Adopted_November_2019.pdf,local-authority-eng:RDG,owned by a public authority,,,not permissioned,,POINT(-1.019697 51.441813),BL4005,https://www.reading.gov.uk/media/8108/Brownfield-Register-Maps-BL4001-4025/pdf/Brownfield_Land_Register_Maps_2019_4001_to_4025.pdf,2017-12-15,brownfield-land/local-authority-eng/RDG/BL4005
"Land at Conwy Close, Tilehurst, Reading",yes,,2019-12-16,,1.04,44,44,"Permission 161390 under construction at 31/03/2019. Residential development comprising 57 dwellings, vehicular, cycle and pedestrian access, parking, and hard and soft landscaping and open space at land off Conwy Close.",local-authority-eng:RDG,owned by a public authority,2016-12-15,,permissioned,full planning permission,POINT(-1.027065 51.451918),BL4006,https://www.reading.gov.uk/media/8108/Brownfield-Register-Maps-BL4001-4025/pdf/Brownfield_Land_Register_Maps_2019_4001_to_4025.pdf,2017-12-15,brownfield-land/local-authority-eng/RDG/BL4006
"5 Westcote Road, Reading",yes,,2019-12-16,,0.97,7,7,"Permission 160246 under construction. Demolition of existing dwelling and erection of a part one, part two storey building comprising 2 x 1-bed and 6 x 2-bed flats, with associated parking, refuse store, and cycle store.",local-authority-eng:RDG,not owned by a public authority,2018-01-11,,permissioned,full planning permission,POINT(-0.996167 51.449931),BL4007,https://www.reading.gov.uk/media/8108/Brownfield-Register-Maps-BL4001-4025/pdf/Brownfield_Land_Register_Maps_2019_4001_to_4025.pdf,2017-12-15,brownfield-land/local-authority-eng/RDG/BL4007
"Amethyst Lane, Reading",,,2019-12-16,,0.57,48,32,Allocation WR3n in Local Plan.. Development for residential. https://www.reading.gov.uk/media/10410/Reading-Borough-Council-Local-Plan/pdf/Local_Plan_Adopted_November_2019.pdf,local-authority-eng:RDG,owned by a public authority,,,not permissioned,,POINT(-1.001562 51.448673),BL4008,https://www.reading.gov.uk/media/8108/Brownfield-Register-Maps-BL4001-4025/pdf/Brownfield_Land_Register_Maps_2019_4001_to_4025.pdf,2017-12-15,brownfield-land/local-authority-eng/RDG/BL4008
"62-79 Armadale Court, Westcote Road, Reading",yes,,2019-12-16,,0.38,8,8,Permission 131528 now expired.. Erection of 6 x 2 bedroom flats and 2 x 3 bedroom flats above the existing building.,local-authority-eng:RDG,not owned by a public authority,,,not permissioned,,POINT(-0.997835 51.448012),BL4009,https://www.reading.gov.uk/media/8108/Brownfield-Register-Maps-BL4001-4025/pdf/Brownfield_Land_Register_Maps_2019_4001_to_4025.pdf,2017-12-15,brownfield-land/local-authority-eng/RDG/BL4009
"Former Elvian School Site, Bath Road, Reading",yes,,2019-12-16,,5.0,10,10,"Permission 151175. 161877 is reserved matters for school. School and most of residential development complete and remainder under construction at 31/03/2019.. Hybrid application - outline for a new 6 form entry secondary school and detailed permission for 118 dwellings, following the demolition of the existing buildings. 35 dwellings completed at 31/03/2018, remainder shown here.",local-authority-eng:RDG,not owned by a public authority,2016-04-04,,permissioned,full planning permission,POINT(-0.99949 51.446687),BL4011,https://www.reading.gov.uk/media/8108/Brownfield-Register-Maps-BL4001-4025/pdf/Brownfield_Land_Register_Maps_2019_4001_to_4025.pdf,2017-12-15,brownfield-land/local-authority-eng/RDG/BL4011
