site-address,deliverable,end-date,entry-date,hazardous-substances,hectares,maximum-net-dwellings,minimum-net-dwellings,notes,organisation,ownership-status,planning-permission-date,planning-permission-history,planning-permission-status,planning-permission-type,point,site,site-plan-url,start-date,slug
"Former Reading Family Centre, North Street, Reading",yes,,2019-12-16,,0.23,47,47,"Allocation CR14b in Local Plan. Permissions 181652 and 181653.. Outline - erection of a 2.5, 3.5 and 4.5 storey building comprising 47 apartments (fully affordable or 30 per cent affordable housing) in a mix of one, two and three-bedroom units. Landscaping, cycle and car parking with associated works (all matters reserved except layout and means of access).. https://www.reading.gov.uk/media/10410/Reading-Borough-Council-Local-Plan/pdf/Local_Plan_Adopted_November_2019.pdf",local-authority-eng:RDG,owned by a public authority,2019-03-12,,permissioned,outline planning permission,POINT(-0.980787 51.457487),BL1035,https://www.reading.gov.uk/media/8109/Brownfield-Register-Maps-BL1001-1052/pdf/Brownfield_Land_Register_Maps_2019_1001_to_1052.pdf,2017-12-15,brownfield-land/local-authority-eng/RDG/BL1035
"Broad Street Mall, Oxford Road, Reading",,,2018-12-16,,2.75,420,280,"Allocation CR12d in Local Plan. Undetermined planning application 182137 for residential development on top of Mall. Site within area covered by Minster Quarter Development Framework, adopted December 2018.. The site will be used for continued retail and leisure provision, maintaining frontages along Oxford Street and St Mary’s Butts, and improving frontages to Hosier Street and Queens Walk, with uses including residential, with some potential for offices, on upper floors. This may be achieved by comprehensive redevelopment. Alternatively, a development which retains the existing mall with additional development above will onlymay be appropriate where it improves the quality of the existing mall frontages.. https://www.reading.gov.uk/media/10410/Reading-Borough-Council-Local-Plan/pdf/Local_Plan_Adopted_November_2019.pdf",local-authority-eng:RDG,not owned by a public authority,,,not permissioned,,POINT(-0.976674 51.454753),BL1038,https://www.reading.gov.uk/media/8109/Brownfield-Register-Maps-BL1001-1052/pdf/Brownfield_Land_Register_Maps_2019_1001_to_1052.pdf,2017-12-15,brownfield-land/local-authority-eng/RDG/BL1038
"Hosier Street, Reading",,,2019-12-16,,3.41,750,500,"Allocation CR12e in Local Plan. Site within area covered by Minster Quarter Development Framework, adopted December 2018.. Development on this site will result in a new residential community centred around an improved area of public open space and a high quality environment, with an improved entrance to the site from St Mary’s Butts. The edges of the open space will be activated with retail, and/or leisure and/or other main town centre uses such as hotel use, and development may also include some limited offices uses. The Hexagon theatre will only be developed if a replacement facility for Reading is provided, and approaches to the theatre will be improved. Development will also include a replacement site for the street market. The car parking below ground level will be retained and incorporated into the development.. https://www.reading.gov.uk/media/10410/Reading-Borough-Council-Local-Plan/pdf/Local_Plan_Adopted_November_2019.pdf",local-authority-eng:RDG,owned by a public authority,,,not permissioned,,POINT(-0.976703 51.453495),BL1039,https://www.reading.gov.uk/media/8109/Brownfield-Register-Maps-BL1001-1052/pdf/Brownfield_Land_Register_Maps_2019_1001_to_1052.pdf,2017-12-15,brownfield-land/local-authority-eng/RDG/BL1039
"Central Swimming Pool, Battle Street, Reading",,,2019-12-16,,0.55,120,80,"Allocation CR14a in Local Plan. Planning permission previously granted for 89 dwellings (031246), since expired.. Development for residential use once replacement swimming provision has been addressed.. https://www.reading.gov.uk/media/10410/Reading-Borough-Council-Local-Plan/pdf/Local_Plan_Adopted_November_2019.pdf",local-authority-eng:RDG,owned by a public authority,,,not permissioned,,POINT(-0.984315 51.456132),BL1040,https://www.reading.gov.uk/media/8109/Brownfield-Register-Maps-BL1001-1052/pdf/Brownfield_Land_Register_Maps_2019_1001_to_1052.pdf,2017-12-15,brownfield-land/local-authority-eng/RDG/BL1040
"149-153 Oxford Road, Reading",,,2019-12-16,,0.1,5,5,Previous permission for 5 dwellings net gain (090795) now expired.. Demolition of existing extensions at the rear of 149-153 Oxford Road and refurbishment and conversion of existing buildings into 8 x 1 bed flats and 2 x 2 bed flat plus construction of 2 new studio flats and associated car park (5 dwellings net gain),local-authority-eng:RDG,not owned by a public authority,,,not permissioned,,POINT(-0.983006 51.454808),BL1043,https://www.reading.gov.uk/media/8109/Brownfield-Register-Maps-BL1001-1052/pdf/Brownfield_Land_Register_Maps_2019_1001_to_1052.pdf,2017-12-15,brownfield-land/local-authority-eng/RDG/BL1043
"125 Chatham Street, Reading",yes,,2018-12-16,,0.11,15,15,Prior approval 170979 for change of use (resubmission of previous 2013 approval). Permission 130842 for extension now expired. Forms part of Local Plan allocation (CR12c).. Change of use of offices to 8 dwellings and extension for additional 7 dwellings.. https://www.reading.gov.uk/media/10410/Reading-Borough-Council-Local-Plan/pdf/Local_Plan_Adopted_November_2019.pdf,local-authority-eng:RDG,not owned by a public authority,2015-01-22,,permissioned,full planning permission,POINT(-0.975708 51.458719),BL1044,https://www.reading.gov.uk/media/8109/Brownfield-Register-Maps-BL1001-1052/pdf/Brownfield_Land_Register_Maps_2019_1001_to_1052.pdf,2017-12-15,brownfield-land/local-authority-eng/RDG/BL1044
"114 Oxford Road, Reading",yes,,2019-12-16,,0.14,16,16,"Permission 150721 under construction. Forms part of Local Plan allocation (CR13c).. Erection of part 4, part 5 storey building providing 16 (2x1, 13x2 & 1x3-bed) residential units (Class C3) with associated parking and landscaping, following demolition of existing buildings (Class A1 / B8 / nil use).. https://www.reading.gov.uk/media/10410/Reading-Borough-Council-Local-Plan/pdf/Local_Plan_Adopted_November_2019.pdf",local-authority-eng:RDG,not owned by a public authority,2016-02-17,,permissioned,full planning permission,POINT(-0.981856 51.455401),BL1045,https://www.reading.gov.uk/media/8109/Brownfield-Register-Maps-BL1001-1052/pdf/Brownfield_Land_Register_Maps_2019_1001_to_1052.pdf,2017-12-15,brownfield-land/local-authority-eng/RDG/BL1045
"Chatham Street, Eaton Place and Oxford Road, Reading",,,2019-12-16,,0.45,171,91,"Allocation CR12c in Local Plan (remainder, not including permissions at 114 Oxford Road, 125 Chatham Street and Eaton Court). Development of this area will be primarily for residential, with potential for community uses. There may also be some small scale retail and leisure uses on the Oxford Road frontage.. https://www.reading.gov.uk/media/10410/Reading-Borough-Council-Local-Plan/pdf/Local_Plan_Adopted_November_2019.pdf",local-authority-eng:RDG,not owned by a public authority,,,not permissioned,,POINT(-0.981255 51.455872),BL1046a,https://www.reading.gov.uk/media/8109/Brownfield-Register-Maps-BL1001-1052/pdf/Brownfield_Land_Register_Maps_2019_1001_to_1052.pdf,2017-12-15,brownfield-land/local-authority-eng/RDG/BL1046a
"Eaton Court, 106-112 Oxford Road, Reading",,,2019-12-16,,0.44,58,58,Prior approval 190419. Part of allocation CR12c in Local Plan.. Change of use from Class B1(a) (offices) to C3 (dwelling houses) to comprise 58 Units,local-authority-eng:RDG,not owned by a public authority,2019-05-14,,permissioned,full planning permission,POINT(-0.981123 51.455331),BL1046b,https://www.reading.gov.uk/media/8109/Brownfield-Register-Maps-BL1001-1052/pdf/Brownfield_Land_Register_Maps_2019_1001_to_1052.pdf,2019-12-16,brownfield-land/local-authority-eng/RDG/BL1046b
"78 Oxford Road, Reading",,,2019-12-16,,0.03,6,6,"Previous permission for 6 dwellings net gain (050014), now expired. Application for 13 dwellings (9 net gain) (161860) withdrawn.. Extension and refurbishment to provide 10 flats (6 net gain) and cafe front",local-authority-eng:RDG,not owned by a public authority,,,not permissioned,,POINT(-0.979396 51.455316),BL1047,https://www.reading.gov.uk/media/8109/Brownfield-Register-Maps-BL1001-1052/pdf/Brownfield_Land_Register_Maps_2019_1001_to_1052.pdf,2017-12-15,brownfield-land/local-authority-eng/RDG/BL1047
"22-24 Cross Street, Reading",yes,,2019-12-16,,0.01,6,6,"Permission 171742. Change of use to residential (C3) on first, second and third floors to create 6 x one bedroom flats with alterations to fenestration and gable roof alteration to existing rear four storey projection",local-authority-eng:RDG,not owned by a public authority,2018-03-01,,permissioned,full planning permission,POINT(-0.971652 51.456022),BL1048,https://www.reading.gov.uk/media/8109/Brownfield-Register-Maps-BL1001-1052/pdf/Brownfield_Land_Register_Maps_2019_1001_to_1052.pdf,2018-12-16,brownfield-land/local-authority-eng/RDG/BL1048
"1 Station Road and 22 Friar Street, Reading",yes,,2019-12-16,,0.03,15,15,"Prior approval 182109. Prior approval for change of use 1st, 2nd and 3rd floors of building from Class B1(a) (offices) to C3 (dwelling houses) to comprise 15 dwellings.",local-authority-eng:RDG,not owned by a public authority,2019-01-28,,permissioned,full planning permission,POINT(-0.972379 51.456955),BL1049,https://www.reading.gov.uk/media/8109/Brownfield-Register-Maps-BL1001-1052/pdf/Brownfield_Land_Register_Maps_2019_1001_to_1052.pdf,2018-12-16,brownfield-land/local-authority-eng/RDG/BL1049
"33 Blagrave Street, Reading",yes,,2019-12-16,,0.07,28,28,Prior approval 181074. Change of use from Class B1(a) (offices) to C3 (dwelling houses) to comprise of 28 dwellings (17 x 1-bed and 11 x 2-bed),local-authority-eng:RDG,not owned by a public authority,2018-08-15,,permissioned,full planning permission,POINT(-0.970685 51.457416),BL1050,https://www.reading.gov.uk/media/8109/Brownfield-Register-Maps-BL1001-1052/pdf/Brownfield_Land_Register_Maps_2019_1001_to_1052.pdf,2018-12-16,brownfield-land/local-authority-eng/RDG/BL1050
"29 Russell Street, Reading",yes,,2019-12-16,,0.03,8,8,"Permission 161332. Change of Use of Sui Generis HMO to 8 Flats, after demolition of existing rear extension and erection of a new part 4/part 2 storey rear extension",local-authority-eng:RDG,not owned by a public authority,2019-02-27,,permissioned,full planning permission,POINT(-0.982468 51.453752),BL1051,https://www.reading.gov.uk/media/8109/Brownfield-Register-Maps-BL1001-1052/pdf/Brownfield_Land_Register_Maps_2019_1001_to_1052.pdf,2019-12-16,brownfield-land/local-authority-eng/RDG/BL1051
"Battle Inn PH, 2 Bedford Road, Reading",yes,,2019-12-16,,0.03,6,6,"Permission 180876 granted on appeal. Demolition of public house (A4 use class) and erection of a part five/part four/part two storey building containing a single A1/A2/A3 use class unit at ground floor and 6 self-contained flats (C3 use class) above (3 x 1 bed, 2 x 2 bed and 1 x 1 bed units)",local-authority-eng:RDG,not owned by a public authority,2019-07-25,,permissioned,full planning permission,POINT(-0.983241 51.455251),BL1052,https://www.reading.gov.uk/media/8109/Brownfield-Register-Maps-BL1001-1052/pdf/Brownfield_Land_Register_Maps_2019_1001_to_1052.pdf,2019-12-16,brownfield-land/local-authority-eng/RDG/BL1052
"211-221 Oxford Road, Reading",,,2019-12-16,,0.16,5,5,"Allocation WR3g in Local Plan. Development on part of the site already complete and/or permissioned, only remainder of dwellings shown. Development for residential with district centre uses on ground floor Oxford Road frontage, continuing the existing Oxford Road building line.. https://www.reading.gov.uk/media/10410/Reading-Borough-Council-Local-Plan/pdf/Local_Plan_Adopted_November_2019.pdf",local-authority-eng:RDG,not owned by a public authority,,,not permissioned,,POINT(-0.986595 51.455199),BL2002a,https://www.reading.gov.uk/media/8107/Brownfield-Register-Maps-BL2001-2051/pdf/Brownfield_Land_Register_Maps_2019_2001_to_2051.pdf,2017-12-15,brownfield-land/local-authority-eng/RDG/BL2002a
"Rear of 8 Prospect Street, Reading",yes,,2019-12-16,,0.03,5,5,Prior approval 190782. Change of use from light industrial (B1©) to dwelling houses (C3) for 5 dwellings.,local-authority-eng:RDG,not owned by a public authority,2019-07-04,,permissioned,full planning permission,POINT(-0.986745 51.454931),BL2002b,https://www.reading.gov.uk/media/8107/Brownfield-Register-Maps-BL2001-2051/pdf/Brownfield_Land_Register_Maps_2019_2001_to_2051.pdf,2019-12-16,brownfield-land/local-authority-eng/RDG/BL2002b
"57 Baker Street, Reading",yes,,2019-12-16,,0.17,9,9,"Permission 180624.. Erection of two 2/3 storey buildings to provide 9 (2x2-bed and 7x3-bed) residential units (Class C3), 9 parking spaces, landscaping and associated works",local-authority-eng:RDG,not owned by a public authority,2019-02-06,,permissioned,full planning permission,POINT(-0.982029 51.452786),BL2003,https://www.reading.gov.uk/media/8107/Brownfield-Register-Maps-BL2001-2051/pdf/Brownfield_Land_Register_Maps_2019_2001_to_2051.pdf,2017-12-15,brownfield-land/local-authority-eng/RDG/BL2003
"Yeomanry House, Castle Hill, Reading",,,2019-12-16,,0.44,14,10,Allocation WR3e in Local Plan. Change of use of listed building to residential use or to potential office or restaurant use.. https://www.reading.gov.uk/media/10410/Reading-Borough-Council-Local-Plan/pdf/Local_Plan_Adopted_November_2019.pdf,local-authority-eng:RDG,owned by a public authority,,,not permissioned,,POINT(-0.981509 51.450929),BL2004,https://www.reading.gov.uk/media/8107/Brownfield-Register-Maps-BL2001-2051/pdf/Brownfield_Land_Register_Maps_2019_2001_to_2051.pdf,2017-12-15,brownfield-land/local-authority-eng/RDG/BL2004
"4 Berkeley Avenue, Reading",,,2019-12-16,,0.06,14,10,Allocation WR3f in Local Plan. Development for residential. https://www.reading.gov.uk/media/10410/Reading-Borough-Council-Local-Plan/pdf/Local_Plan_Adopted_November_2019.pdf,local-authority-eng:RDG,not owned by a public authority,,,not permissioned,,POINT(-0.979127 51.448031),BL2006,https://www.reading.gov.uk/media/8107/Brownfield-Register-Maps-BL2001-2051/pdf/Brownfield_Land_Register_Maps_2019_2001_to_2051.pdf,2017-12-15,brownfield-land/local-authority-eng/RDG/BL2006
"Central Club, London Street, Reading",,,2019-12-16,,0.05,12,8,Allocation CR14h in Local Plan. Development for residential with potential for ground floor community provision.. https://www.reading.gov.uk/media/10410/Reading-Borough-Council-Local-Plan/pdf/Local_Plan_Adopted_November_2019.pdf,local-authority-eng:RDG,owned by a public authority,,,not permissioned,,POINT(-0.968659 51.452795),BL2007,https://www.reading.gov.uk/media/8107/Brownfield-Register-Maps-BL2001-2051/pdf/Brownfield_Land_Register_Maps_2019_2001_to_2051.pdf,2017-12-15,brownfield-land/local-authority-eng/RDG/BL2007
"5-9 Berkeley Avenue, Reading",yes,,2019-12-16,,0.63,112,112,"Original permission 070256, allowed on appeal. 101656 is extension of time. Development under construction.. Redevelopment of storage premises for 112 flats",local-authority-eng:RDG,not owned by a public authority,2011-11-16,,permissioned,full planning permission,POINT(-0.974256 51.447718),BL2008,https://www.reading.gov.uk/media/8107/Brownfield-Register-Maps-BL2001-2051/pdf/Brownfield_Land_Register_Maps_2019_2001_to_2051.pdf,2017-12-15,brownfield-land/local-authority-eng/RDG/BL2008
"Pulleyn Park, Rose Kiln Lane, Reading",,,2019-12-16,,1.29,100,70,"Allocation SR4a in Local Plan. Redevelopment of builders merchant and car dealerships for residential, with potential for on-site retail facilities to serve the site.. https://www.reading.gov.uk/media/10410/Reading-Borough-Council-Local-Plan/pdf/Local_Plan_Adopted_November_2019.pdf",local-authority-eng:RDG,not owned by a public authority,,,not permissioned,,POINT(-0.97371 51.445735),BL2009,https://www.reading.gov.uk/media/8107/Brownfield-Register-Maps-BL2001-2051/pdf/Brownfield_Land_Register_Maps_2019_2001_to_2051.pdf,2017-12-15,brownfield-land/local-authority-eng/RDG/BL2009
"187-189 Kings Road, Reading",,,2019-12-16,,0.1,33,22,Allocation CR14l in Local Plan. Application for more extensive development (161205) refused.. Change of use of listed buildings from offices to residential or student accommodation. https://www.reading.gov.uk/media/10410/Reading-Borough-Council-Local-Plan/pdf/Local_Plan_Adopted_November_2019.pdf,local-authority-eng:RDG,not owned by a public authority,,,not permissioned,,POINT(-0.956829 51.454039),BL2015,https://www.reading.gov.uk/media/8107/Brownfield-Register-Maps-BL2001-2051/pdf/Brownfield_Land_Register_Maps_2019_2001_to_2051.pdf,2017-12-15,brownfield-land/local-authority-eng/RDG/BL2015
"Princes House, 73A London Road, Reading",,,2019-12-16,,0.16,26,26,Prior approval 150685 now expired.. Change of use of existing building from Class B1(a) (offices) to C3 (dwellinghouses) to comprise 18 x 1 bed flats and 8 x 2 bedroom flats.,local-authority-eng:RDG,owned by a public authority,,,not permissioned,,POINT(-0.959862 51.451692),BL2017,https://www.reading.gov.uk/media/8107/Brownfield-Register-Maps-BL2001-2051/pdf/Brownfield_Land_Register_Maps_2019_2001_to_2051.pdf,2017-12-15,brownfield-land/local-authority-eng/RDG/BL2017
"Dingley House, 3-5 Craven Road, Reading",,,2019-12-16,,0.33,22,15,Allocation ER1b in Local Plan.. Retention and change of use of locally listed building for residential with limited additional development.. https://www.reading.gov.uk/media/10410/Reading-Borough-Council-Local-Plan/pdf/Local_Plan_Adopted_November_2019.pdf,local-authority-eng:RDG,owned by a public authority,,,not permissioned,,POINT(-0.956909 51.450533),BL2018,https://www.reading.gov.uk/media/8107/Brownfield-Register-Maps-BL2001-2051/pdf/Brownfield_Land_Register_Maps_2019_2001_to_2051.pdf,2017-12-15,brownfield-land/local-authority-eng/RDG/BL2018
"3-4 Wesley Gate, Queens Road, Reading",yes,,2019-12-16,,0.07,18,18,Prior approval 170314 for conversion under construction. Planning permission 172162 for roof extension.. Change of use of office building from Class B1(a) (offices) to C3 (dwelling houses) to comprise 11 X 1-bed and 3 X 2-bed flats. Roof extension for additional four flats.,local-authority-eng:RDG,not owned by a public authority,2017-04-12,,permissioned,full planning permission,POINT(-0.962572 51.453406),BL2019,https://www.reading.gov.uk/media/8107/Brownfield-Register-Maps-BL2001-2051/pdf/Brownfield_Land_Register_Maps_2019_2001_to_2051.pdf,2017-12-15,brownfield-land/local-authority-eng/RDG/BL2019
"Havell House, 62-66 Queens Road, Reading",yes,,2019-12-16,,0.06,13,13,"Prior approvals reference 181464, 181466, 181467, 181468. Change of use from offices to 13 dwellings",local-authority-eng:RDG,not owned by a public authority,2018-10-04,,permissioned,full planning permission,POINT(-0.963149 51.453331),BL2020,https://www.reading.gov.uk/media/8107/Brownfield-Register-Maps-BL2001-2051/pdf/Brownfield_Land_Register_Maps_2019_2001_to_2051.pdf,2017-12-15,brownfield-land/local-authority-eng/RDG/BL2020
"60 Queens Road, Reading",,,2019-12-16,,0.22,30,30,"Prior approval 141834 has expired, and offices now refurbished.. Change of use of office to 30 dwellings.",local-authority-eng:RDG,not owned by a public authority,,,not permissioned,,POINT(-0.963613 51.4532),BL2021,https://www.reading.gov.uk/media/8107/Brownfield-Register-Maps-BL2001-2051/pdf/Brownfield_Land_Register_Maps_2019_2001_to_2051.pdf,2017-12-15,brownfield-land/local-authority-eng/RDG/BL2021
"Clarendon House, 59-75 Queens Road, Reading",yes,,2019-12-16,,0.21,92,92,"Prior approval 180722 and 180156 for conversion, under construction. Permission 180909 for extension, not started.. Change of use of building from Class B1(a)(offices) to C3 (dwelling houses) to comprise 49 residential units. Roof and rear extension for additional 43 dwellings.",local-authority-eng:RDG,not owned by a public authority,2017-07-31,,permissioned,full planning permission,POINT(-0.962419 51.453792),BL2025,https://www.reading.gov.uk/media/8107/Brownfield-Register-Maps-BL2001-2051/pdf/Brownfield_Land_Register_Maps_2019_2001_to_2051.pdf,2017-12-15,brownfield-land/local-authority-eng/RDG/BL2025
"100 Kings Road, Reading",yes,,2019-12-16,,0.19,9,9,"Permission 161449. Change of use at fourth and fifth floors from 9 apart-hotel suites (Class C1) to 9 (2xstudio, 1x1, 3x2 & 3x3-bed) residential units (Class C3)",local-authority-eng:RDG,not owned by a public authority,2017-01-23,,permissioned,full planning permission,POINT(-0.964286 51.454582),BL2027,https://www.reading.gov.uk/media/8107/Brownfield-Register-Maps-BL2001-2051/pdf/Brownfield_Land_Register_Maps_2019_2001_to_2051.pdf,2017-12-15,brownfield-land/local-authority-eng/RDG/BL2027
"83-85 London Street, Reading",,,2019-12-16,,0.06,18,18,Prior approval 181880. Change of use from Class B1(a) (offices) to C3 (dwelling houses) to comprise 18 X 1-bed dwellings,local-authority-eng:RDG,not owned by a public authority,2018-12-21,,permissioned,full planning permission,POINT(-0.967379 51.451489),BL2029,https://www.reading.gov.uk/media/8107/Brownfield-Register-Maps-BL2001-2051/pdf/Brownfield_Land_Register_Maps_2019_2001_to_2051.pdf,2017-12-15,brownfield-land/local-authority-eng/RDG/BL2029
"Enterprise House, 89-97 London Street, Reading",,,2019-12-16,,0.15,12,8,"Allocation CR14i in Local Plan. Planning permission previously granted for conversion to 10 dwellings (111087), now expired. Change of use of listed building from offices to residential. https://www.reading.gov.uk/media/10410/Reading-Borough-Council-Local-Plan/pdf/Local_Plan_Adopted_November_2019.pdf",local-authority-eng:RDG,not owned by a public authority,,,not permissioned,,POINT(-0.967108 51.451342),BL2031,https://www.reading.gov.uk/media/8107/Brownfield-Register-Maps-BL2001-2051/pdf/Brownfield_Land_Register_Maps_2019_2001_to_2051.pdf,2017-12-15,brownfield-land/local-authority-eng/RDG/BL2031
"Aspen House, 300 Kings Road, Reading",yes,,2019-12-16,,0.07,14,14,Permission 180683. Part five part three storey building of 14 residential apartments (C3) and associated undercroft car parking,local-authority-eng:RDG,not owned by a public authority,2019-02-13,,permissioned,full planning permission,POINT(-0.953641 51.453129),BL2033,https://www.reading.gov.uk/media/8107/Brownfield-Register-Maps-BL2001-2051/pdf/Brownfield_Land_Register_Maps_2019_2001_to_2051.pdf,2017-12-15,brownfield-land/local-authority-eng/RDG/BL2033
"Alexander House, 205-207 Kings Road, Reading",yes,,2019-12-16,,0.16,56,56,"Permission 162057. Also included as allocation in Local Plan (ER1g). Application 190160 for student accommodation refused.. Erection of basement and 4 - 7 storey building comprising 56 (30x1, 18x2 & 8x3-bed) residential units (Class C3) with associated parking and landscaping, following demolition of existing basement and 2 storey office building (Class B1a). https://www.reading.gov.uk/media/10410/Reading-Borough-Council-Local-Plan/pdf/Local_Plan_Adopted_November_2019.pdf",local-authority-eng:RDG,not owned by a public authority,2017-05-10,,permissioned,full planning permission,POINT(-0.951733 51.453463),BL2034,https://www.reading.gov.uk/media/8107/Brownfield-Register-Maps-BL2001-2051/pdf/Brownfield_Land_Register_Maps_2019_2001_to_2051.pdf,2017-12-15,brownfield-land/local-authority-eng/RDG/BL2034
"Arthur Hill Swimming Pool, 221-225 Kings Road, Reading",,,2019-12-16,,0.11,10,6,Allocation ER1h in Local Plan. Development for residential whilst retaining the frontage of the building where possible.. https://www.reading.gov.uk/media/10410/Reading-Borough-Council-Local-Plan/pdf/Local_Plan_Adopted_November_2019.pdf,local-authority-eng:RDG,owned by a public authority,,,not permissioned,,POINT(-0.95022 51.45353),BL2035,https://www.reading.gov.uk/media/8107/Brownfield-Register-Maps-BL2001-2051/pdf/Brownfield_Land_Register_Maps_2019_2001_to_2051.pdf,2017-12-15,brownfield-land/local-authority-eng/RDG/BL2035
"Gas Holder, Kenavon Drive, Reading",,,2019-12-16,,0.71,130,130,"Application 190627 has resolution to grant permission subject to Section 106. Allocation CR13d in Local Plan. Demolition of existing buildings and Gas Holder and the erection of new buildings ranging between 2 and 9 storeys in height, providing 130 residential units (Class C3) with associated access, car parking, landscaping and open space.. https://www.reading.gov.uk/media/10410/Reading-Borough-Council-Local-Plan/pdf/Local_Plan_Adopted_November_2019.pdf",local-authority-eng:RDG,not owned by a public authority,,,pending decision,,POINT(-0.952144 51.457504),BL2036,https://www.reading.gov.uk/media/8107/Brownfield-Register-Maps-BL2001-2051/pdf/Brownfield_Land_Register_Maps_2019_2001_to_2051.pdf,2017-12-15,brownfield-land/local-authority-eng/RDG/BL2036
"261-275 London Road, Reading",,,2019-12-16,,0.16,16,10,Allocation ER1i in Local Plan. Development for residential with district centre uses on the ground floor.. https://www.reading.gov.uk/media/10410/Reading-Borough-Council-Local-Plan/pdf/Local_Plan_Adopted_November_2019.pdf,local-authority-eng:RDG,not owned by a public authority,,,not permissioned,,POINT(-0.946179 51.454034),BL2037,https://www.reading.gov.uk/media/8107/Brownfield-Register-Maps-BL2001-2051/pdf/Brownfield_Land_Register_Maps_2019_2001_to_2051.pdf,2017-12-15,brownfield-land/local-authority-eng/RDG/BL2037
"28 Wokingham Road, Reading",yes,,2019-12-16,,0.07,7,7,Permission 150325. Erection of seven new flats: 4 x 2 bed flats and 3 x 1 bed flat,local-authority-eng:RDG,not owned by a public authority,2016-05-03,,permissioned,full planning permission,POINT(-0.946808 51.452349),BL2038,https://www.reading.gov.uk/media/8107/Brownfield-Register-Maps-BL2001-2051/pdf/Brownfield_Land_Register_Maps_2019_2001_to_2051.pdf,2017-12-15,brownfield-land/local-authority-eng/RDG/BL2038
