site-address,deliverable,end-date,entry-date,hazardous-substances,hectares,maximum-net-dwellings,minimum-net-dwellings,notes,organisation,ownership-status,planning-permission-date,planning-permission-history,planning-permission-status,planning-permission-type,point,site,site-plan-url,start-date,slug
"Phase 3, Dee Park Estate, Spey Road, Reading",yes,,2019-12-16,,16.4,108,108,"Outline permission 091606. Phases 1 and 2 already complete. Demolish flats, centre, school, pub. Erect dwellings, community uses, retail, primary school. Demolition of 363 dwellings, and construct 705 dwellings (net gain of 342). Phase 3 involves demolition of 112 homes and construction of 190 homes (78 net gain), of which 30 dwellings demolished at 31/03/2018.",local-authority-eng:RDG,mixed ownership,2009-12-23,,permissioned,outline planning permission,POINT(-1.017926 51.456644),BL4012,https://www.reading.gov.uk/media/8108/Brownfield-Register-Maps-BL4001-4025/pdf/Brownfield_Land_Register_Maps_2019_4001_to_4025.pdf,2017-12-15,brownfield-land/local-authority-eng/RDG/BL4012
"103 Dee Road, Reading",,,2019-12-16,,0.85,50,34,"Allocation WR3m in Local Plan. Previously permitted for redevelopment for 42 dwellings (100126), now expired.. Development for residential subject to the fire station being surplus to requirements.. https://www.reading.gov.uk/media/10410/Reading-Borough-Council-Local-Plan/pdf/Local_Plan_Adopted_November_2019.pdf",local-authority-eng:RDG,owned by a public authority,,,not permissioned,,POINT(-1.015243 51.454904),BL4013,https://www.reading.gov.uk/media/8108/Brownfield-Register-Maps-BL4001-4025/pdf/Brownfield_Land_Register_Maps_2019_4001_to_4025.pdf,2017-12-15,brownfield-land/local-authority-eng/RDG/BL4013
"1025-1027 Oxford Road, Tilehurst, Reading",,,2019-12-16,,0.19,12,12,061080 was original outline permission. 070937 is reserved matters permission. Existing dwellings on site have been demolished.. Demolish existing dwellings and erect 2 no. buildings containing 12 no. apartments.,local-authority-eng:RDG,not owned by a public authority,2007-10-11,,permissioned,reserved matters approval,POINT(-1.033155 51.472227),BL4015,https://www.reading.gov.uk/media/8108/Brownfield-Register-Maps-BL4001-4025/pdf/Brownfield_Land_Register_Maps_2019_4001_to_4025.pdf,2017-12-15,brownfield-land/local-authority-eng/RDG/BL4015
"Charters Car Sales, Oxford Road, Reading",,,2019-12-16,,0.33,18,12,Allocation WR3r in Local Plan. Development for residential.. https://www.reading.gov.uk/media/10410/Reading-Borough-Council-Local-Plan/pdf/Local_Plan_Adopted_November_2019.pdf,local-authority-eng:RDG,not owned by a public authority,,,not permissioned,,POINT(-1.033142 51.472856),BL4016,https://www.reading.gov.uk/media/8108/Brownfield-Register-Maps-BL4001-4025/pdf/Brownfield_Land_Register_Maps_2019_4001_to_4025.pdf,2017-12-15,brownfield-land/local-authority-eng/RDG/BL4016
"Norcot Community Centre, Lyndhurst Road, Reading",yes,,2019-12-16,,0.13,18,18,"Application 181377 has resolution to grant permission subject to Section 106. Allocation WR3q in Local Plan. Erection of a three storey building comprising 18 (8x1 and 10x2 bed) residential units (Use Class C3) with associated bin and cycle storage, a 96.4sqm (NIA) building for community use (Use Class D1), vehicle parking, landscaping and associated works.. https://www.reading.gov.uk/media/10410/Reading-Borough-Council-Local-Plan/pdf/Local_Plan_Adopted_November_2019.pdf",local-authority-eng:RDG,owned by a public authority,,,not permissioned,,POINT(-1.02423 51.465409),BL4018,https://www.reading.gov.uk/media/8108/Brownfield-Register-Maps-BL4001-4025/pdf/Brownfield_Land_Register_Maps_2019_4001_to_4025.pdf,2017-12-15,brownfield-land/local-authority-eng/RDG/BL4018
"816 Oxford Road, Reading",,,2019-12-16,,0.23,20,13,Allocation WR3l in Local Plan.. Development for residential. https://www.reading.gov.uk/media/10410/Reading-Borough-Council-Local-Plan/pdf/Local_Plan_Adopted_November_2019.pdf,local-authority-eng:RDG,not owned by a public authority,,,not permissioned,,POINT(-1.011068 51.461612),BL4019,https://www.reading.gov.uk/media/8108/Brownfield-Register-Maps-BL4001-4025/pdf/Brownfield_Land_Register_Maps_2019_4001_to_4025.pdf,2017-12-15,brownfield-land/local-authority-eng/RDG/BL4019
"784-794 Oxford Road, Reading",,,2019-12-16,,0.22,22,14,Allocation WR3k in Local Plan.. Development for residential. https://www.reading.gov.uk/media/10410/Reading-Borough-Council-Local-Plan/pdf/Local_Plan_Adopted_November_2019.pdf,local-authority-eng:RDG,not owned by a public authority,,,not permissioned,,POINT(-1.010072 51.461064),BL4020,https://www.reading.gov.uk/media/8108/Brownfield-Register-Maps-BL4001-4025/pdf/Brownfield_Land_Register_Maps_2019_4001_to_4025.pdf,2017-12-15,brownfield-land/local-authority-eng/RDG/BL4020
"750 & 752 Oxford Road, Tilehurst, Reading",yes,,2019-12-16,,0.07,8,8,"Permission 160938. COU from ground floor betting shop (sui generis) and shop/showroom (A1) with first floor office (B1) changing to 8 no. residential flats (C3). Construction of an additional roof storey, and provision of parking, bin and cycle storage.",local-authority-eng:RDG,not owned by a public authority,2017-02-21,,permissioned,full planning permission,POINT(-1.008863 51.460407),BL4021,https://www.reading.gov.uk/media/8108/Brownfield-Register-Maps-BL4001-4025/pdf/Brownfield_Land_Register_Maps_2019_4001_to_4025.pdf,2017-12-15,brownfield-land/local-authority-eng/RDG/BL4021
"St George's Hall, St George's Road, Reading",yes,,2019-12-16,,0.31,12,12,"Permission 152301 under construction at 31/03/2019. Church extension of 88sqm with dedicated parking area, core access road and construction of 12 affordable housing units with associated parking and amenity space",local-authority-eng:RDG,not owned by a public authority,2017-03-23,,permissioned,full planning permission,POINT(-1.00773 51.457565),BL4022,https://www.reading.gov.uk/media/8108/Brownfield-Register-Maps-BL4001-4025/pdf/Brownfield_Land_Register_Maps_2019_4001_to_4025.pdf,2017-12-15,brownfield-land/local-authority-eng/RDG/BL4022
"1a Elm Park Road, Reading",yes,,2019-12-16,,0.02,5,5,"Permission 171226 under construction at 31/03/2019. Part demolition, extensions and alterations to form 5 self-contained flats.",local-authority-eng:RDG,not owned by a public authority,2018-06-12,,permissioned,full planning permission,POINT(-0.996023 51.456476),BL4023,https://www.reading.gov.uk/media/8108/Brownfield-Register-Maps-BL4001-4025/pdf/Brownfield_Land_Register_Maps_2019_4001_to_4025.pdf,2018-12-16,brownfield-land/local-authority-eng/RDG/BL4023
"The Pond House PH, 738 Oxford Road, Reading",yes,,2019-12-16,,0.08,6,6,"Planning permission 171127 under construction at 31/03/2019. Permission 150539 is an alternative development for 3 houses.. Erection of new building containing 3 x 2 bed and 3 x 1 bed flats, with associated private shared amenity space and car parking.",local-authority-eng:RDG,not owned by a public authority,2018-06-27,,permissioned,full planning permission,POINT(-1.0084 51.460511),BL4024,https://www.reading.gov.uk/media/8108/Brownfield-Register-Maps-BL4001-4025/pdf/Brownfield_Land_Register_Maps_2019_4001_to_4025.pdf,2018-12-16,brownfield-land/local-authority-eng/RDG/BL4024
2-6 Water Road and 158 Dee Road,yes,,2019-12-16,,0.21,7,7,"Outline planning permission 161507. Demolition of 4 existing dwelling houses 2,4,6 Water Road and 158 Dee Road and erection of 6 no.4 bedroom and 5 no. 3 bedroom dwellings and car parking.",local-authority-eng:RDG,not owned by a public authority,2019-01-18,,permissioned,outline planning permission,POINT(-1.01303 51.45475),BL4025,https://www.reading.gov.uk/media/8108/Brownfield-Register-Maps-BL4001-4025/pdf/Brownfield_Land_Register_Maps_2019_4001_to_4025.pdf,2018-12-16,brownfield-land/local-authority-eng/RDG/BL4025
"Land at Moulsford Mews, Reading",,,2019-12-16,,0.16,16,10,"Allocation WR3j in Local Plan. Originally permitted as health clinic as part of Battle Hospital development, but this part of the development was not delivered.. Development for residential.. https://www.reading.gov.uk/media/10410/Reading-Borough-Council-Local-Plan/pdf/Local_Plan_Adopted_November_2019.pdf",local-authority-eng:RDG,owned by a public authority,,,not permissioned,,POINT(-0.997908 51.457814),BL5001,https://www.reading.gov.uk/media/8110/Brownfield-Register-Maps-BL5001-5012/pdf/Brownfield_Land_Register_Maps_2019_5001_to_5012.pdf,2017-12-15,brownfield-land/local-authority-eng/RDG/BL5001
"Part of Former Battle Hospital, Portman Road, Reading",yes,,2019-12-16,,2.77,184,184,"Permission 180319, for which demolition underway at 31/03/2019. Allocation WR3i in Local Plan.. Application for 211 dwellings with associated access, cycle path provision, parking, landscaping and open space provision, following demolition of existing buildings (including 28 dwellings).. https://www.reading.gov.uk/media/10410/Reading-Borough-Council-Local-Plan/pdf/Local_Plan_Adopted_November_2019.pdf",local-authority-eng:RDG,owned by a public authority,2018-10-29,,permissioned,full planning permission,POINT(-0.995274 51.45977),BL5002,https://www.reading.gov.uk/media/8110/Brownfield-Register-Maps-BL5001-5012/pdf/Brownfield_Land_Register_Maps_2019_5001_to_5012.pdf,2017-12-15,brownfield-land/local-authority-eng/RDG/BL5002
"Reading University Boat Club, Thames Promenade, Caversham, Reading",yes,,2019-12-16,,0.56,25,16,"Allocation CA1a in Local Plan. Development for residential, subject to relocation or retention of the boat club.. https://www.reading.gov.uk/media/10410/Reading-Borough-Council-Local-Plan/pdf/Local_Plan_Adopted_November_2019.pdf",local-authority-eng:RDG,not owned by a public authority,,,not permissioned,,POINT(-0.974842 51.465887),BL5003,https://www.reading.gov.uk/media/8110/Brownfield-Register-Maps-BL5001-5012/pdf/Brownfield_Land_Register_Maps_2019_5001_to_5012.pdf,2017-12-15,brownfield-land/local-authority-eng/RDG/BL5003
"St Martin's Precinct, Church Street, Caversham, Reading",,,2019-12-16,,1.71,40,40,"Permission 140997. Erection of new and extended retail floorspace, new restaurant, new leisure floorspace, residential apartments, car park works and associated landscaping, surfacing, public realm and shopfront improvement works.",local-authority-eng:RDG,not owned by a public authority,2015-03-31,,permissioned,full planning permission,POINT(-0.973589 51.467198),BL5004,https://www.reading.gov.uk/media/8110/Brownfield-Register-Maps-BL5001-5012/pdf/Brownfield_Land_Register_Maps_2019_5001_to_5012.pdf,2017-12-15,brownfield-land/local-authority-eng/RDG/BL5004
"458-478 Oxford Road and 1-3 Chester Street, Reading",,,2019-12-16,,0.1,5,5,Permission for a retail unit and nine dwellings (162355).. Development for residential,local-authority-eng:RDG,not owned by a public authority,2018-12-20,,permissioned,full planning permission,POINT(-1.000792 51.458234),BL5006,https://www.reading.gov.uk/media/8110/Brownfield-Register-Maps-BL5001-5012/pdf/Brownfield_Land_Register_Maps_2019_5001_to_5012.pdf,2017-12-15,brownfield-land/local-authority-eng/RDG/BL5006
"361-363 Oxford Road, Reading",yes,,2019-12-16,,0.27,6,6,Permission 170530 under construction at 31/03/2019. Proposed roof extension and alterations to form an A1 retail unit and four residential flats at ground and first floor level and two residential flats at 2nd floor level.,local-authority-eng:RDG,not owned by a public authority,2017-07-19,,permissioned,full planning permission,POINT(-0.994317 51.456183),BL5007,https://www.reading.gov.uk/media/8110/Brownfield-Register-Maps-BL5001-5012/pdf/Brownfield_Land_Register_Maps_2019_5001_to_5012.pdf,2017-12-15,brownfield-land/local-authority-eng/RDG/BL5007
"Rear of 303-315 Oxford Road, Reading",,,2019-12-16,,0.22,20,14,Allocation WR3h in Local Plan.. Development for residential.. https://www.reading.gov.uk/media/10410/Reading-Borough-Council-Local-Plan/pdf/Local_Plan_Adopted_November_2019.pdf,local-authority-eng:RDG,not owned by a public authority,,,not permissioned,,POINT(-0.991918 51.455335),BL5008,https://www.reading.gov.uk/media/8110/Brownfield-Register-Maps-BL5001-5012/pdf/Brownfield_Land_Register_Maps_2019_5001_to_5012.pdf,2017-12-15,brownfield-land/local-authority-eng/RDG/BL5008
"307-311 Gosbrook Road, Caversham, Reading",yes,,2019-12-16,,0.05,5,5,Permission 060683. Under construction at 31/03/2019.. Demolition of existing printing works and erection of 4 apartments and 1 garden flat.,local-authority-eng:RDG,not owned by a public authority,2006-12-07,,permissioned,full planning permission,POINT(-0.963482 51.465338),BL5009,https://www.reading.gov.uk/media/8110/Brownfield-Register-Maps-BL5001-5012/pdf/Brownfield_Land_Register_Maps_2019_5001_to_5012.pdf,2017-12-15,brownfield-land/local-authority-eng/RDG/BL5009
"Land at Lowfield Road, Caversham, Reading",,,2019-12-16,,0.93,36,24,Allocation CA1c in Local Plan. Current temporary planning permission for temporary accommodation.. Development for residential. https://www.reading.gov.uk/media/10410/Reading-Borough-Council-Local-Plan/pdf/Local_Plan_Adopted_November_2019.pdf,local-authority-eng:RDG,owned by a public authority,,,not permissioned,,POINT(-0.949822 51.477175),BL5010,https://www.reading.gov.uk/media/8110/Brownfield-Register-Maps-BL5001-5012/pdf/Brownfield_Land_Register_Maps_2019_5001_to_5012.pdf,2017-12-15,brownfield-land/local-authority-eng/RDG/BL5010
"Caversham Park House, Caversham, Reading",,,2019-12-16,,0.74,45,40,Allocation CA2 in Local Plan. Potential conversion of the listed house only from offices to residential. https://www.reading.gov.uk/media/10410/Reading-Borough-Council-Local-Plan/pdf/Local_Plan_Adopted_November_2019.pdf,local-authority-eng:RDG,owned by a public authority,,,not permissioned,,POINT(-0.957946 51.480844),BL5011,https://www.reading.gov.uk/media/8110/Brownfield-Register-Maps-BL5001-5012/pdf/Brownfield_Land_Register_Maps_2019_5001_to_5012.pdf,2017-12-15,brownfield-land/local-authority-eng/RDG/BL5011
"2 Priory Avenue, Caversham, Reading",yes,,2019-12-16,,0.03,6,6,Permission 181716. Change of use and conversion of the building from doctors surgery to residential in the form of 4 x 1-bed flats and 2 x 2-bed flats including provision of bin and cycle storage.,local-authority-eng:RDG,not owned by a public authority,2019-05-09,,permissioned,full planning permission,POINT(-0.976052 51.467759),BL5012,https://www.reading.gov.uk/media/8110/Brownfield-Register-Maps-BL5001-5012/pdf/Brownfield_Land_Register_Maps_2019_5001_to_5012.pdf,2019-12-16,brownfield-land/local-authority-eng/RDG/BL5012
