site-address,deliverable,end-date,entry-date,hazardous-substances,hectares,maximum-net-dwellings,minimum-net-dwellings,notes,organisation,ownership-status,planning-permission-date,planning-permission-history,planning-permission-status,planning-permission-type,point,site,site-plan-url,start-date,slug
"Friar Street and Station Road, Reading",,,2019-12-16,,1.0,69,43,"Allocation CR11a in Local Plan - remainder of site unpermitted shown here. There will be active retail and leisure uses on the ground floor along Friar Street and Station Road, with a mix of uses on higher floors. Development should enhance linkages in a north-south direction to link to the Station Hill area. Listed buildings and their settings in the area will be conserved, and opportunities to improve the environment of Merchants Place will be sought.. https://www.reading.gov.uk/media/10410/Reading-Borough-Council-Local-Plan/pdf/Local_Plan_Adopted_November_2019.pdf",local-authority-eng:RDG,not owned by a public authority,,,not permissioned,,POINT(-0.973021 51.457239),BL1001,https://www.reading.gov.uk/media/8109/Brownfield-Register-Maps-BL1001-1052/pdf/Brownfield_Land_Register_Maps_2019_1001_to_1052.pdf,2017-12-15,brownfield-land/local-authority-eng/RDG/BL1001
"29-35 Station Road, Reading",yes,,2019-12-16,,0.05,33,33,Prior approval 170772. Alternative permission 181930 now in place for redevelopment for hotel. Forms part of allocation in Local Plan (ref CR11a). Change of use from offices to residential under prior approval.. https://www.reading.gov.uk/media/10410/Reading-Borough-Council-Local-Plan/pdf/Local_Plan_Adopted_November_2019.pdf,local-authority-eng:RDG,not owned by a public authority,2017-07-10,,permissioned,full planning permission,POINT(-0.972447 51.457764),BL1002,https://www.reading.gov.uk/media/8109/Brownfield-Register-Maps-BL1001-1052/pdf/Brownfield_Land_Register_Maps_2019_1001_to_1052.pdf,2017-12-15,brownfield-land/local-authority-eng/RDG/BL1002
"30-31 Friar Street, Reading",,,2019-12-16,,0.08,25,25,Prior approval 150829 expired July 2018. Forms part of allocation in Local Plan (ref CR11a). Change of use of upper floors from offices to 25 flats.,local-authority-eng:RDG,not owned by a public authority,,,not permissioned,,POINT(-0.973402 51.456919),BL1004,https://www.reading.gov.uk/media/8109/Brownfield-Register-Maps-BL1001-1052/pdf/Brownfield_Land_Register_Maps_2019_1001_to_1052.pdf,2017-12-15,brownfield-land/local-authority-eng/RDG/BL1004
"35-38 Friar Street, Reading",,,2019-12-16,,0.1,25,25,Prior approval 160232 expired April 2019. Forms part of allocation in Local Plan (ref CR11a). Change of use of 1st to 3rd floor from offices to 25 flats,local-authority-eng:RDG,not owned by a public authority,,,not permissioned,,POINT(-0.97382 51.456913),BL1005,https://www.reading.gov.uk/media/8109/Brownfield-Register-Maps-BL1001-1052/pdf/Brownfield_Land_Register_Maps_2019_1001_to_1052.pdf,2017-12-15,brownfield-land/local-authority-eng/RDG/BL1005
"52-55 Friar Street and 12 Greyfriars Road, Reading",,,2019-12-16,,0.26,135,135,"Full permission 162210. Forms part of allocation in Local Plan (ref CR11b). Demolition of existing building and structures (Class A1) and erection of 3 new buildings ranging between 6 - 12 (and basement) storeys in height to provide 135 (1xstudio, 54x1, 73x2 & 7x3-bed) residential units (Class C3), a flexible Class A1-A5 use at ground floor level fronting onto Friar St, a flexible Class A1-5, B1(a) or D2 (gym only) use at ground floor level fronting onto Greyfriars Rd, with associated access, parking, servicing, landscaping and engineering works.",local-authority-eng:RDG,not owned by a public authority,2018-03-20,,permissioned,full planning permission,POINT(-0.975342 51.457052),BL1006,https://www.reading.gov.uk/media/8109/Brownfield-Register-Maps-BL1001-1052/pdf/Brownfield_Land_Register_Maps_2019_1001_to_1052.pdf,2017-12-15,brownfield-land/local-authority-eng/RDG/BL1006
"Station Hill, Reading",yes,,2019-12-16,,2.87,570,380,"Outline permissions 190441 and 190442 cover the site, and would result in up to 538 dwellings. Reserved matters for parts of site under consideration. Some demolition complete, much of remainder underway. Forms allocation in Local Plan (ref CR11c), and dwelling range in this entry derived from draft policy rather than permission, which is a maximum.. Redevelopment of site for offices, town centre uses including retail, leisure and residential, infrastructure, public realm works.. https://www.reading.gov.uk/media/10410/Reading-Borough-Council-Local-Plan/pdf/Local_Plan_Adopted_November_2019.pdf",local-authority-eng:RDG,not owned by a public authority,2019-12-06,,permissioned,outline planning permission,POINT(-0.978008 51.4582),BL1007,https://www.reading.gov.uk/media/8109/Brownfield-Register-Maps-BL1001-1052/pdf/Brownfield_Land_Register_Maps_2019_1001_to_1052.pdf,2017-12-15,brownfield-land/local-authority-eng/RDG/BL1007
"1-3 Greyfriars Road, Reading",,,2019-12-16,,0.03,8,8,"Application for development of 12 dwellings refused (070944), but a reduced scheme may be suitable. Change of use or redevelopment of offices to residential",local-authority-eng:RDG,not owned by a public authority,,,not permissioned,,POINT(-0.976045 51.457176),BL1008,https://www.reading.gov.uk/media/8109/Brownfield-Register-Maps-BL1001-1052/pdf/Brownfield_Land_Register_Maps_2019_1001_to_1052.pdf,2017-12-15,brownfield-land/local-authority-eng/RDG/BL1008
"Greyfriars House, 30 Greyfriars Road, Reading",,,2019-12-16,,0.12,43,43,"Prior approval 170229. Forms part of allocation in Local Plan (ref CR11b).. Change of use from Class B1(a) (offices) to C3 (dwelling houses) to comprise of 43 apartments comprising 23 one bed flats, 19 two bed flats and a single three bed flat.. https://www.reading.gov.uk/media/10410/Reading-Borough-Council-Local-Plan/pdf/Local_Plan_Adopted_November_2019.pdf",local-authority-eng:RDG,not owned by a public authority,2017-04-05,,permissioned,full planning permission,POINT(-0.97568 51.457397),BL1009,https://www.reading.gov.uk/media/8109/Brownfield-Register-Maps-BL1001-1052/pdf/Brownfield_Land_Register_Maps_2019_1001_to_1052.pdf,2017-12-15,brownfield-land/local-authority-eng/RDG/BL1009
"Brunel Arcade and Apex Plaza, Forbury Road, Reading",,,2019-12-16,,1.51,380,250,"Allocation CR11d in Local Plan. This area will be developed for a mix of uses at high density, including residential and/or offices. Retail and/or leisure uses will activate the ground floor facing the southern station square.. https://www.reading.gov.uk/media/10410/Reading-Borough-Council-Local-Plan/pdf/Local_Plan_Adopted_November_2019.pdf",local-authority-eng:RDG,mixed ownership,,,not permissioned,,POINT(-0.97084 51.458209),BL1011,https://www.reading.gov.uk/media/8109/Brownfield-Register-Maps-BL1001-1052/pdf/Brownfield_Land_Register_Maps_2019_1001_to_1052.pdf,2017-12-15,brownfield-land/local-authority-eng/RDG/BL1011
"3-10 Market Place, Abbey Hall and Abbey Square, Reading",,,2018-12-16,,0.29,70,46,"Allocation CR14e in Local Plan. Development for retail and related uses on ground floor with residential and/or offices on upper floors, designed to enhance contribution of site to Conservation Area.. https://www.reading.gov.uk/media/10410/Reading-Borough-Council-Local-Plan/pdf/Local_Plan_Adopted_November_2019.pdf",local-authority-eng:RDG,not owned by a public authority,,,not permissioned,,POINT(-0.968884 51.455584),BL1012,https://www.reading.gov.uk/media/8109/Brownfield-Register-Maps-BL1001-1052/pdf/Brownfield_Land_Register_Maps_2019_1001_to_1052.pdf,2017-12-15,brownfield-land/local-authority-eng/RDG/BL1012
"Jackson's Corner, 1-5 Kings Road, Reading",yes,,2019-12-16,,0.1,33,33,"Planning permission 160849, now underway. See also permission 141713 for alternative scheme for 28 dwellings.. Retention/enlargement of commercial and conversion of upper floors to 18 residential units. Demolition of commercial to rear and construction of 15 dwellings.",local-authority-eng:RDG,not owned by a public authority,2017-03-10,,permissioned,full planning permission,POINT(-0.968765 51.455098),BL1013,https://www.reading.gov.uk/media/8109/Brownfield-Register-Maps-BL1001-1052/pdf/Brownfield_Land_Register_Maps_2019_1001_to_1052.pdf,2017-12-15,brownfield-land/local-authority-eng/RDG/BL1013
"1-5 King Street, Reading",,,2019-12-16,,0.08,24,16,Allocation CR14f in Local Plan. Alternative permission 181566 for change of use to offices.. Change of use of listed building to ground floor town centre uses and residential on upper floors. https://www.reading.gov.uk/media/10410/Reading-Borough-Council-Local-Plan/pdf/Local_Plan_Adopted_November_2019.pdf,local-authority-eng:RDG,not owned by a public authority,,,not permissioned,,POINT(-0.969526 51.455176),BL1014,https://www.reading.gov.uk/media/8109/Brownfield-Register-Maps-BL1001-1052/pdf/Brownfield_Land_Register_Maps_2019_1001_to_1052.pdf,2017-12-15,brownfield-land/local-authority-eng/RDG/BL1014
"Bristol and West Arcade, 173-175 Friar Street and 27-32 Market Place, Reading",yes,,2019-12-16,,0.18,43,43,"Allocation CR14d in Local Plan. Permission 180358.. Change of use of listed buildings and development of remainder for residential, office and retail.. https://www.reading.gov.uk/media/10410/Reading-Borough-Council-Local-Plan/pdf/Local_Plan_Adopted_November_2019.pdf",local-authority-eng:RDG,not owned by a public authority,2019-01-09,,permissioned,full planning permission,POINT(-0.970238 51.456154),BL1015,https://www.reading.gov.uk/media/8109/Brownfield-Register-Maps-BL1001-1052/pdf/Brownfield_Land_Register_Maps_2019_1001_to_1052.pdf,2017-12-15,brownfield-land/local-authority-eng/RDG/BL1015
"160-163 Friar Street, Reading",,,2019-12-16,,0.06,28,28,Prior approval 160212 expired April 2019. Change of use from offices to 28 flats.,local-authority-eng:RDG,not owned by a public authority,,,not permissioned,,POINT(-0.970881 51.456357),BL1016,https://www.reading.gov.uk/media/8109/Brownfield-Register-Maps-BL1001-1052/pdf/Brownfield_Land_Register_Maps_2019_1001_to_1052.pdf,2017-12-15,brownfield-land/local-authority-eng/RDG/BL1016
"149-150 Friar Street and 2-4 Queen Victoria Street, Reading",yes,,2019-12-16,,0.02,7,7,"Permission 170210, under construction at April 2019. Proposed conversion of vacant office accommodation at first, second and third floor levels to create 7 x 2 bed residential units with part of ground floor and basement for ancillary storage space.",local-authority-eng:RDG,not owned by a public authority,2017-04-28,,permissioned,full planning permission,POINT(-0.972243 51.456603),BL1017,https://www.reading.gov.uk/media/8109/Brownfield-Register-Maps-BL1001-1052/pdf/Brownfield_Land_Register_Maps_2019_1001_to_1052.pdf,2017-12-15,brownfield-land/local-authority-eng/RDG/BL1017
"38-40 Oxford Road and 3-7 Cheapside, Reading",,,2019-12-16,,0.3,8,8,Previous permission for change of use to 8 dwellings (091455) now expired.. Proposed refurbishment and change of use - Floors 1-3 inclusive change of use of office accommodation to 8 flats and refurbishment of existing first floor flat.,local-authority-eng:RDG,not owned by a public authority,,,not permissioned,,POINT(-0.975789 51.455735),BL1019,https://www.reading.gov.uk/media/8109/Brownfield-Register-Maps-BL1001-1052/pdf/Brownfield_Land_Register_Maps_2019_1001_to_1052.pdf,2017-12-15,brownfield-land/local-authority-eng/RDG/BL1019
"North of the Station, Vastern Road, Reading",,,2019-12-16,,6.71,960,640,"Allocation CR11e in Local Plan. Permission 110024 was for up to 434 dwellings, retail, hotel, offices on part of site, but has now expired. There will be retail and leisure development on the ground floor activating the streets and spaces including the new northern station square, with other uses including residential and offices on upper floors. Retail will have good pedestrian links to, and will not have a detrimental impact on, the rest of the retail core of the centre. Public car parking will be provided.. https://www.reading.gov.uk/media/10410/Reading-Borough-Council-Local-Plan/pdf/Local_Plan_Adopted_November_2019.pdf",local-authority-eng:RDG,not owned by a public authority,,,not permissioned,,POINT(-0.973668 51.460482),BL1020,https://www.reading.gov.uk/media/8109/Brownfield-Register-Maps-BL1001-1052/pdf/Brownfield_Land_Register_Maps_2019_1001_to_1052.pdf,2017-12-15,brownfield-land/local-authority-eng/RDG/BL1020
"West of Caversham Road, Caversham Road, Reading",,,2019-12-16,,0.92,115,75,Allocation CR11f in Local Plan. This area will be developed for residential with on-site open space.. https://www.reading.gov.uk/media/10410/Reading-Borough-Council-Local-Plan/pdf/Local_Plan_Adopted_November_2019.pdf,local-authority-eng:RDG,not owned by a public authority,,,not permissioned,,POINT(-0.975944 51.461671),BL1021,https://www.reading.gov.uk/media/8109/Brownfield-Register-Maps-BL1001-1052/pdf/Brownfield_Land_Register_Maps_2019_1001_to_1052.pdf,2017-12-15,brownfield-land/local-authority-eng/RDG/BL1021
"Riverside, Vastern Road, Reading",,,2019-12-16,,1.24,370,250,"Allocation CR11g in Local Plan. Development should continue the high quality route including a green link from the north of the station to the Christchurch Bridge, with potential for an area of open space at the riverside. The main use of the site should be residential, although some small-scale offices and leisure will also be appropriate.. https://www.reading.gov.uk/media/10410/Reading-Borough-Council-Local-Plan/pdf/Local_Plan_Adopted_November_2019.pdf",local-authority-eng:RDG,not owned by a public authority,,,not permissioned,,POINT(-0.971483 51.461632),BL1022,https://www.reading.gov.uk/media/8109/Brownfield-Register-Maps-BL1001-1052/pdf/Brownfield_Land_Register_Maps_2019_1001_to_1052.pdf,2017-12-15,brownfield-land/local-authority-eng/RDG/BL1022
"Napier Road Junction/Former Cooper BMW, Napier Road, Reading",yes,,2019-12-16,,0.49,335,335,"Planning permission 162166 for 315 residential units under construction. Subsequent application 190809 to extend to 335 units has resolution to grant permission subject to Section 106. Allocation CR11h in Local Plan.. Erection of a part 13-storey, part 23 storey building comprising 335 apartments in a mix of studio, one-bedroom, two-bedroom and three- bedroom units, residents' lounges, tech-hub, dining room, and cinema room, various rooftop outdoor amenity spaces, concierge/reception with coffee meeting area, gym, residents' storage facilities, post room, ancillary back-of-house facilities, 335 secure cycle parking spaces, car parking spaces, landscaping, and associated works.. https://www.reading.gov.uk/media/10410/Reading-Borough-Council-Local-Plan/pdf/Local_Plan_Adopted_November_2019.pdf",local-authority-eng:RDG,not owned by a public authority,2017-11-23,,permissioned,full planning permission,POINT(-0.967751 51.459207),BL1023,https://www.reading.gov.uk/media/8109/Brownfield-Register-Maps-BL1001-1052/pdf/Brownfield_Land_Register_Maps_2019_1001_to_1052.pdf,2017-12-15,brownfield-land/local-authority-eng/RDG/BL1023
"Napier Court, Napier Road, Reading",,,2019-12-16,,1.62,310,210,"Allocation CR11i in Local Plan. This area will be developed for residential. The design must avoid detrimental effects on the adjacent Thames Valley Major Landscape Feature, and building heights should reduce from west to east across the site.. https://www.reading.gov.uk/media/10410/Reading-Borough-Council-Local-Plan/pdf/Local_Plan_Adopted_November_2019.pdf",local-authority-eng:RDG,mixed ownership,,,not permissioned,,POINT(-0.964631 51.459054),BL1024,https://www.reading.gov.uk/media/8109/Brownfield-Register-Maps-BL1001-1052/pdf/Brownfield_Land_Register_Maps_2019_1001_to_1052.pdf,2017-12-15,brownfield-land/local-authority-eng/RDG/BL1024
"Reading Prison, Forbury Road, Reading",,,2019-12-16,,1.44,90,65,"Allocation CR13a in Local Plan. Subject to adopted Supplementary Planning Document - Site of Reading Prison Planning Framework.. The prison building itself is of historical significance and is listed, and its historic significance will be retainedconserved and where possible enhanced. The building would be used for residential or student accommodation, commercial offices or a hotel, and could include some cultural or heritage element or related retail and leisure that draws on its significance. The site is part of a scheduled ancient monument, and therefore any additional development will be dependent on a thorough demonstration that it would not have detrimental impacts on the significant archaeological interest. The prison adjoins the Abbey Quarter, and development should therefore enhance that area as a heritage destination.. https://www.reading.gov.uk/media/10410/Reading-Borough-Council-Local-Plan/pdf/Local_Plan_Adopted_November_2019.pdf",local-authority-eng:RDG,owned by a public authority,,,not permissioned,,POINT(-0.964115 51.456441),BL1025,https://www.reading.gov.uk/media/8109/Brownfield-Register-Maps-BL1001-1052/pdf/Brownfield_Land_Register_Maps_2019_1001_to_1052.pdf,2017-12-15,brownfield-land/local-authority-eng/RDG/BL1025
"Forbury Retail Park, Forbury Road, Reading",,,2019-12-16,,3.97,1075,465,"Allocation CR13b in Local Plan. Planning permission now granted on part of the allocation, see BL1026b.. This site would be the focus of the new residential community, and, alongside residential, additional retail, leisure and community uses at a scale to serve the Kenavon Drive area would be appropriate. It should include a new area of open space and enhance the frontage to the canal, including a buffer zone to the canal bank to reflect its wildlife significance. Implementing this policy may involve complete redevelopment or using new additional development to improve the existing urban form of the area.. https://www.reading.gov.uk/media/10410/Reading-Borough-Council-Local-Plan/pdf/Local_Plan_Adopted_November_2019.pdf",local-authority-eng:RDG,not owned by a public authority,,,not permissioned,,POINT(-0.962647 51.457687),BL1026a,https://www.reading.gov.uk/media/8109/Brownfield-Register-Maps-BL1001-1052/pdf/Brownfield_Land_Register_Maps_2019_1001_to_1052.pdf,2017-12-15,brownfield-land/local-authority-eng/RDG/BL1026a
Kenavon Drive,yes,,2019-12-16,,2.8,765,765,"Permission 170509, for which demolition complete. Current planning application for an uplift in dwellings undetermined. Part of allocation CR13b in Local Plan. Demolition of retail (Homebase and former Toys R Us) and erection of 765 (18 x studio, 302x1, 409x2 and 36x3- bed) dwellings units, 5 commercial units, public realm, landscaping, accesses, parking and associated works.",local-authority-eng:RDG,not owned by a public authority,2018-10-10,,permissioned,full planning permission,POINT(-0.961075 51.456549),BL1026b,https://www.reading.gov.uk/media/8109/Brownfield-Register-Maps-BL1001-1052/pdf/Brownfield_Land_Register_Maps_2019_1001_to_1052.pdf,2017-12-15,brownfield-land/local-authority-eng/RDG/BL1026b
"Forbury Business Park & Kenavon Drive, Reading",yes,,2019-12-16,,2.07,285,190,"Allocation CR13c in Local Plan. This site would be largely residential in nature, although opportunities to create an area of open space close to the Kennet should be sought.. https://www.reading.gov.uk/media/10410/Reading-Borough-Council-Local-Plan/pdf/Local_Plan_Adopted_November_2019.pdf",local-authority-eng:RDG,not owned by a public authority,,,not permissioned,,POINT(-0.958055 51.457107),BL1027,https://www.reading.gov.uk/media/8109/Brownfield-Register-Maps-BL1001-1052/pdf/Brownfield_Land_Register_Maps_2019_1001_to_1052.pdf,2017-12-15,brownfield-land/local-authority-eng/RDG/BL1027
"Former Gas Works Building, Gas Works Road, Reading",,,2019-12-16,,0.07,20,20,"Permission 160378 expired October 2019.. Change of use, conversion, extensions and various associated works to former Gas Works Buildings to create a part 4, 5 and 6 storey building and a 3 storey building, providing 20 (10x1, 9x2 and 1x3-bed) residential units (Class C3).",local-authority-eng:RDG,not owned by a public authority,,,not permissioned,,POINT(-0.96034 51.455365),BL1028,https://www.reading.gov.uk/media/8109/Brownfield-Register-Maps-BL1001-1052/pdf/Brownfield_Land_Register_Maps_2019_1001_to_1052.pdf,2017-12-15,brownfield-land/local-authority-eng/RDG/BL1028
"28-30 Richfield Avenue, Reading",,,2019-12-16,,0.78,80,50,Allocation WR3c in Local Plan. Permission 172259 for alternative development for extension and refurbishment of existing showroom.. Development for residential.. https://www.reading.gov.uk/media/10410/Reading-Borough-Council-Local-Plan/pdf/Local_Plan_Adopted_November_2019.pdf,local-authority-eng:RDG,not owned by a public authority,,,not permissioned,,POINT(-0.981229 51.46418),BL1029,https://www.reading.gov.uk/media/8109/Brownfield-Register-Maps-BL1001-1052/pdf/Brownfield_Land_Register_Maps_2019_1001_to_1052.pdf,2017-12-15,brownfield-land/local-authority-eng/RDG/BL1029
"2 Ross Road and part of Meadow Road, Reading",,,2019-12-16,,0.6,60,36,Allocation WR3b in Local Plan. Development for residential.. https://www.reading.gov.uk/media/10410/Reading-Borough-Council-Local-Plan/pdf/Local_Plan_Adopted_November_2019.pdf,local-authority-eng:RDG,not owned by a public authority,,,not permissioned,,POINT(-0.979528 51.462331),BL1030,https://www.reading.gov.uk/media/8109/Brownfield-Register-Maps-BL1001-1052/pdf/Brownfield_Land_Register_Maps_2019_1001_to_1052.pdf,2017-12-15,brownfield-land/local-authority-eng/RDG/BL1030
"Land at Junction of Addison Road and Meadow Road, Reading",yes,,2019-12-16,,0.07,5,5,Permission 130882 under construction.. Construction of 5 x 3 bedroom dwellings with associated parking.,local-authority-eng:RDG,not owned by a public authority,2016-02-25,,permissioned,full planning permission,POINT(-0.979104 51.461968),BL1031,https://www.reading.gov.uk/media/8109/Brownfield-Register-Maps-BL1001-1052/pdf/Brownfield_Land_Register_Maps_2019_1001_to_1052.pdf,2017-12-15,brownfield-land/local-authority-eng/RDG/BL1031
"Former Cox & Wyman Site, Cardiff Road, Reading",yes,,2019-12-16,,1.31,96,96,"Allocation WR3a in Local Plan. Planning permission 171814.. Demolition of existing site buildings and boundary treatments and erection of 96 no. dwellings including associated surface car parking, public realm and landscaping on land at the former Cox & Wyman building, Cardiff Road.. https://www.reading.gov.uk/media/10410/Reading-Borough-Council-Local-Plan/pdf/Local_Plan_Adopted_November_2019.pdf",local-authority-eng:RDG,not owned by a public authority,2018-11-19,,permissioned,full planning permission,POINT(-0.980422 51.461611),BL1032,https://www.reading.gov.uk/media/8109/Brownfield-Register-Maps-BL1001-1052/pdf/Brownfield_Land_Register_Maps_2019_1001_to_1052.pdf,2017-12-15,brownfield-land/local-authority-eng/RDG/BL1032
"Cattle Market, Great Knollys Street, Reading",,,2018-12-16,,2.46,490,330,"Allocation CR12a in Local Plan. This site will be developed for a mix of edge-of-centre retail uses, which may include bulky goods, and residential development, along with public car parking. The retail may include bulky goods, but should not include a significant element of non-bulky comparison goods retail, and must be designed to mesh into the urban fabric and a single storey retail warehouse will not be permitted.. https://www.reading.gov.uk/media/10410/Reading-Borough-Council-Local-Plan/pdf/Local_Plan_Adopted_November_2019.pdf",local-authority-eng:RDG,owned by a public authority,,,not permissioned,,POINT(-0.97917 51.459001),BL1033,https://www.reading.gov.uk/media/8109/Brownfield-Register-Maps-BL1001-1052/pdf/Brownfield_Land_Register_Maps_2019_1001_to_1052.pdf,2017-12-15,brownfield-land/local-authority-eng/RDG/BL1033
"Great Knollys Street and Weldale Street, Reading",,,2019-12-16,,1.41,69,69,"Proposed allocation CR12b in Submission Draft Local Plan.. This area will be developed primarily for residential. Any development which would result in the loss of small business units should seek to replace some of those units, preferably on site. Most of allocation now covered by a planning permission, for which see BL1034b.. https://www.reading.gov.uk/media/10410/Reading-Borough-Council-Local-Plan/pdf/Local_Plan_Adopted_November_2019.pdf",local-authority-eng:RDG,mixed ownership,,,not permissioned,,POINT(-0.979194 51.457922),BL1034a,https://www.reading.gov.uk/media/8109/Brownfield-Register-Maps-BL1001-1052/pdf/Brownfield_Land_Register_Maps_2019_1001_to_1052.pdf,2017-12-15,brownfield-land/local-authority-eng/RDG/BL1034a
Land between Weldale Street and Chatham Street,yes,,2019-12-16,,1.32,427,427,"Planning permission 170326. Part of allocation CR12b in Local Plan.. Erection of 427 (233x1, 182x2 & 12x3-bed) residential units and 1 flexible ground floor retail shop (Class A1) or restaurant and cafe (Class A3) unit, with new public realm, landscaping, accesses, parking and associated works.",local-authority-eng:RDG,not owned by a public authority,2018-03-15,,permissioned,full planning permission,POINT(-0.979085 51.457022),BL1034b,https://www.reading.gov.uk/media/8109/Brownfield-Register-Maps-BL1001-1052/pdf/Brownfield_Land_Register_Maps_2019_1001_to_1052.pdf,2017-12-15,brownfield-land/local-authority-eng/RDG/BL1034b
"Unit 16 North Street, Reading",yes,,2019-12-16,,0.04,10,10,Application 191086 has resolution to grant permission subject to Section 106. Part of allocation CR12b in Local Plan.. Redevelopment of site to provide 295sqm of office space (Class B1(a)) and 6no. 1-bed apartments and 4no. 2-bed apartments (Class C3) including cycle and bin storage.,local-authority-eng:RDG,not owned by a public authority,,,pending decision,,POINT(-0.980208 51.457661),BL1034c,https://www.reading.gov.uk/media/8109/Brownfield-Register-Maps-BL1001-1052/pdf/Brownfield_Land_Register_Maps_2019_1001_to_1052.pdf,2019-12-16,brownfield-land/local-authority-eng/RDG/BL1034c
