site-address,deliverable,end-date,entry-date,hazardous-substances,hectares,maximum-net-dwellings,minimum-net-dwellings,notes,organisation,ownership-status,planning-permission-date,planning-permission-history,planning-permission-status,planning-permission-type,point,site,site-plan-url,start-date,slug
Global House Victoria Street Basingstoke,yes,,2020-12-21,,0.12128,40,40,The site gained prior approval for 40 units in September 2018 (18/02398/GPDOFF). Following this full planning permision was granted in Feburary 2019 (18/03684/FUL). Previously the site had prior approval (17/01714/GPDOFF) and full planning permission (17/03275/FUL) for 37 units. As of 1 April 2020 all units were recorded as started on site. The site is deliverable within five years.,local-authority-eng:BAN,not owned by a public authority,2019-02-25,,permissioned,full planning permission,POINT(-1.08919 51.260733),18/03684/FUL,https://planning.basingstoke.gov.uk/online-applications/applicationDetails.do?activeTab=summary&keyVal=PJZODJCRGW900,2017-12-31,brownfield-land/local-authority-eng/BAN/18-03684-FUL
Minchens Court Minchens Lane Bramley,yes,,2020-12-21,,0.188227,14,14,Prior approval granted for 14 flats (18/01517/GPDOFF) in October 2018. External alterations were then approved in April 2019 (19/00373/FUL). As of 1 April 2020 all units were recorded as having started on site. The site is deliverable within five years.,local-authority-eng:BAN,not owned by a public authority,2019-02-05,,permissioned,full planning permission,POINT(-1.067293 51.331126),19/00373/FUL,https://planning.basingstoke.gov.uk/online-applications/applicationDetails.do?activeTab=summary&keyVal=PMH8UOCRIRD00,2019-05-14,brownfield-land/local-authority-eng/BAN/19-00373-FUL
Unity Place Lime Tree Way Chineham,yes,,2020-12-21,,3.138532,270,270,A prior notification was approved for the conversion of the building to residential use (19/00717/GPDOFF) in April 2019.An application for condition discharge was submitted in early May (19/01269/CONDN). A later prior notification was approved for the conversion of the building into 270 flats (19/01664/GPDOFF). The site is deliverable within five years.,local-authority-eng:BAN,not owned by a public authority,2019-04-30,,permissioned,full planning permission,POINT(-1.064105 51.298152),19/01664/GPDOFF,https://planning.basingstoke.gov.uk/online-applications/applicationDetails.do?activeTab=summary&keyVal=PTG1ABCR0AQ00,2019-05-14,brownfield-land/local-authority-eng/BAN/19-01664-GPDOFF
Basing View Basingstoke,,,2020-12-21,,25.85579,300,300,"The regeneration of Basing View is being actively pursued by the borough council. This is reflected in Local Plan policy SS8 which supports the redevelopment of the area for a mix of uses including a residential component of approximately 300 units. The site is in a suitable location for housing development, lying in a highly accessible location with good access to public transport interchanges, town centre facilities and employment opportunities. The Council has recently published the Basing View Masterplan which includes provision for residential development. The site plan shows the whole of basing view reflecting the local plan allocation. The precise location of the residential element will be determined through site masterplanning.",local-authority-eng:BAN,owned by a public authority,,,not permissioned,,POINT(-1.076987 51.268749),BAS004,https://www.basingstoke.gov.uk/SHELAA,2017-12-31,brownfield-land/local-authority-eng/BAN/BAS004
Police Station London Road Basingstoke,,,2020-12-21,,0.325571,30,30,The site is a SHELAA site (BAS012) which falls within the built up area of Basingstoke and within the SPB in an area of predominantly residential development in close proximity to the town. The current use as a police station is due to cease (as part of the wider review of Hampshire Constabulary sites) and the site is currently being marketed for redevelopment. An applicaton was submited in Feburary 2019 (19/00436/FUL) for 55 retirements apartments. The application was refused and turned away at appeal due to insufficient information to validate. Another application for 56 returment appartments (19/01822/FUL was refused in February 2020 with an appeal lodged in March 2020.,local-authority-eng:BAN,not owned by a public authority,,,pending decision,,POINT(-1.082542 51.262864),BAS012,https://www.basingstoke.gov.uk/SHELAA,2017-12-31,brownfield-land/local-authority-eng/BAN/BAS012
Land At Former Newman Bassett House Basingstoke,,,2020-12-21,,0.380557,12,12,"Consent was originally granted on the wider site for the demolition of the Former Newman Bassett House building and a replacement smaller ‘respite unit’ which has now been completed. (Hindson House).Therefore, this retains the facility and service use and frees up the remainder of the land for residential redevelopment. The land is vacant but not currently available as it is being used as a temporary construction compound, the requirement for which is due to cease in late 2018. Afterwhich HCC confirm that they intend to apply for planning permission for residential development.",local-authority-eng:BAN,owned by a public authority,,,not permissioned,,POINT(-1.123164 51.270351),BAS031,https://www.basingstoke.gov.uk/SHELAA,2017-12-31,brownfield-land/local-authority-eng/BAN/BAS031
Cheam Hawtreys Newbury Road Headley,,,2020-12-21,,0.284375,6,6,"The site is the remainder of a larger scheme for tied staff accommodation at Cheam Hawtreys School (BDB/63103, approved 2006). The school has confirmed, through the site monitoring consultation, that whilst the site will be delivered in due course, at present they have no intention to build out the remaining 6 units within the plan period. The site has therefore been phased beyond the plan period and its future delivery will continue to be reviewed through the annual monitoring process.",local-authority-eng:BAN,owned by a public authority,2006-06-21,,permissioned,full planning permission,POINT(-1.257512 51.354703),BDB/63103,https://planning.basingstoke.gov.uk/online-applications/applicationDetails.do?activeTab=summary&keyVal=ZZZTBZCRBJ724,2017-12-31,brownfield-land/local-authority-eng/BAN/BDB-63103
Police Station Dances Lane Whitchurch,,,2020-12-21,,0.430117,15,15,The site is allocated for approximately 15 dwellings in the Whitchurch Neighbourhood Plan (Policy HA1) which was made in October 2017 . The brownfield site is currently in use as a police station and is therefore not currently available. The Police Commissioners have confirmed that this site will cease to be used for its present purpose and will be available for housing development within the Plan Period which ends in 2029.,local-authority-eng:BAN,owned by a public authority,,,not permissioned,,POINT(-1.334432 51.23491),WHIT004,https://www.basingstoke.gov.uk/SHELAA,2017-12-31,brownfield-land/local-authority-eng/BAN/WHIT004
57 Winchester Road (Whitchurch Car Centre) Whitchurch,,,2020-12-21,,0.166308,10,10,"The site is allocated for approximately 10 dwellings in the Whitchurch Neighbourhood Plan (Policy HA3) which was made in October 2017 . The brownfield site is currently in use as a car centre and is therefore not currently available. However, the owners have confirmed their intention to redevelop the site for housings over the Local Plan period which runs to 2029.",local-authority-eng:BAN,not owned by a public authority,,,not permissioned,,POINT(-1.337708 51.227053),WHIT007,https://www.basingstoke.gov.uk/SHELAA,2017-12-31,brownfield-land/local-authority-eng/BAN/WHIT007
Festival Place Hampstead House Kensington House Chelsea House and Westminster House Basingstoke,,,2020-12-21,,0.42074,300,300,The site has been promoted for development through the council's Call for Sites in 2019 and the council consider this site to be potentially developable for 300 dwellings within a 5-9 year time period,local-authority-eng:BAN,owned by a public authority,,,not permissioned,,POINT(-1.088227 51.26569),BAS009,https://www.basingstoke.gov.uk/SHELAA,2019-12-23,brownfield-land/local-authority-eng/BAN/BAS009
Former Fort Hill Community School,,,2020-12-21,,7.252993,74,74,The site has been promoted for development through the council's Call for Sites in 2019 by HCC. The site is considered to be potentially developable for 74 dwellings within a 5-10 year time period.,local-authority-eng:BAN,owned by a public authority,,,not permissioned,,POINT(-1.122203 51.271896),BAS054,https://www.basingstoke.gov.uk/SHELAA,2019-12-23,brownfield-land/local-authority-eng/BAN/BAS054
Camrose Stadium Winchester Road,,20201221,2020-12-21,,1.8563,160,160,The site has been promoted for development through the council's Call for Sites in 2019. An application for 89 dwellings was refused at appeal in 2020 (19/01110/OUT). It is unclear whether the site is deliverable so has been removed from the BLR,local-authority-eng:BAN,not owned by a public authority,,,not permissioned,,POINT(-1.110423 51.252002),BAS024,https://www.basingstoke.gov.uk/SHELAA,2019-12-23,brownfield-land/local-authority-eng/BAN/BAS024
Land west of 2 Kite Hill,,,2020-12-21,,0.471514,10,10,The site has been promoted for development through the council's Call for Sites in 2019 and the council consider this site to be potentially developable for 10 dwellings within a 5-9 year time period,local-authority-eng:BAN,not owned by a public authority,,,not permissioned,,POINT(-1.14002 51.254913),BAS029,https://www.basingstoke.gov.uk/SHELAA,2019-12-23,brownfield-land/local-authority-eng/BAN/BAS029
Land off Ashford Way,,20201221,2020-12-21,,0.52485,18,18,The site has been promoted for development through the council's Call for Sites in 2019 by HCC and the council consider this site to be potentially developable for 18 dwellings within a 5-9 year time period,local-authority-eng:BAN,owned by a public authority,,,not permissioned,,POINT(-1.114918 51.274304),BAS032,https://www.basingstoke.gov.uk/SHELAA,2019-12-23,brownfield-land/local-authority-eng/BAN/BAS032
The Hollies Aldermaston Road,yes,,2020-12-21,,0.316458,21,21,The site has been promoted for development through the council's Call for Sites in 2019 . The site has outline permission for 21 dwellings (19/02449/OUT). The site is considered to be deliverablefor 21 dwellings within a 5 year time period.,local-authority-eng:BAN,not owned by a public authority,2020-01-31,,permissioned,outline planning permission,POINT(-1.111776 51.284059),19/02449/OUT,https://planning.basingstoke.gov.uk/online-applications/applicationDetails.do?activeTab=summary&keyVal=PXF0GKCRKI300,2019-12-23,brownfield-land/local-authority-eng/BAN/19-02449-OUT
Boundary Place,yes,,2020-12-21,,0.17569,17,17,The site gained permission in October 2019 for 17 dwellings (17/03849/FUL). The site is considered deliverable within the next 5 year period.,local-authority-eng:BAN,not owned by a public authority,2019-10-15,,permissioned,full planning permission,POINT(-1.145752 51.358206),19/00579/FUL,https://planning.basingstoke.gov.uk/online-applications/applicationDetails.do?activeTab=summary&keyVal=PNJZMICRJOC00,2019-12-23,brownfield-land/local-authority-eng/BAN/19-00579-FUL
Ashwood Park Ashwood Way Basingstoke,,,2020-12-21,,1.541263,133,133,The site was approved as prior approval not required in September 2020. The site is considered to be deliverable within 5-9 years.,local-authority-eng:BAN,not owned by a public authority,2020-09-23,,permissioned,full planning permission,POINT(-1.113303 51.274621),20/01926/GPDOFF,https://planning.basingstoke.gov.uk/online-applications/applicationDetails.do?activeTab=summary&keyVal=QDTF2UCR0AQ00,2020-12-21,brownfield-land/local-authority-eng/BAN/20-01926-GPDOFF
Normandy House Basingstoke,,,2020-12-21,,0.540093,114,114,The site was approved as prior approval not required in September 2020. The site is considered to be deliverable within 5-9 years.,local-authority-eng:BAN,not owned by a public authority,2020-09-30,,permissioned,full planning permission,POINT(-1.084806 51.268244),20/02039/GPDOFF,https://planning.basingstoke.gov.uk/online-applications/applicationDetails.do?activeTab=summary&keyVal=QE7ZRXCR0AQ00,2020-12-21,brownfield-land/local-authority-eng/BAN/20-02039-GPDOFF
