site-address,deliverable,end-date,entry-date,hazardous-substances,hectares,maximum-net-dwellings,minimum-net-dwellings,notes,organisation,ownership-status,planning-permission-date,planning-permission-history,planning-permission-status,planning-permission-type,point,site,site-plan-url,start-date,slug
Three Barrels Winklebury Centre Basingstoke,yes,,2020-12-21,,0.059338,5,5,Small site granted permission (13/00747/FUL) in Feburary 2014. Currently under construction and considered deliverable within five years.,local-authority-eng:BAN,not owned by a public authority,2014-02-11,,permissioned,full planning permission,POINT(-1.124352 51.268051),13/00747/FUL,https://planning.basingstoke.gov.uk/online-applications/applicationDetails.do?activeTab=summary&keyVal=MO0ZDBCRAT000,2017-12-31,brownfield-land/local-authority-eng/BAN/13-00747-FUL
Main Hall Park Prewett Northbrook Crescent Basingstoke,yes,,2020-12-21,,0.253897,19,19,"Planning permission was granted for a net gain of 19 units in March 2015 (13/02321/FUL) . Construction started on site in December 2015. A planning application was been submitted to provide an additional 9 units in the hall (17/00565/FUL), but this has been withdrawn. The site is deliverable within five years.",local-authority-eng:BAN,not owned by a public authority,2015-03-20,,permissioned,full planning permission,POINT(-1.119274 51.280815),13/02321/FUL,https://planning.basingstoke.gov.uk/online-applications/applicationDetails.do?activeTab=summary&keyVal=MVYE55CRAT000,2017-12-31,brownfield-land/local-authority-eng/BAN/13-02321-FUL
Cranbourne House The Harrow Way,yes,20191223,2019-12-23,,0.056245,7,7,Small site granted permission (14/03214/FUL) in July 2015. The site is considered deliverable within five years.,local-authority-eng:BAN,not owned by a public authority,2015-07-28,,permissioned,full planning permission,POINT(-1.100087 51.249227),14/03214/FUL,https://planning.basingstoke.gov.uk/online-applications/applicationDetails.do?activeTab=summary&keyVal=NDWLC6CRL0M00,2018-12-31,brownfield-land/local-authority-eng/BAN/14-03214-FUL
The Railway Inn Station Road,yes,20191223,2019-12-23,,0.138729,5,5,Small site granted permission for 5 dwellings in July 2015 (14/03880/FUL). No starts recorded on site at 1 April 2018 but site considered deliverable within five years.,local-authority-eng:BAN,not owned by a public authority,2015-07-07,,permissioned,full planning permission,POINT(-1.337771 51.237067),14/03880/FUL,https://planning.basingstoke.gov.uk/online-applications/applicationDetails.do?activeTab=summary&keyVal=NGU8J8CRFND00,2018-12-31,brownfield-land/local-authority-eng/BAN/14-03880-FUL
Leamington Court Andover Road Newfound,yes,,2020-12-21,,0.496163,13,13,Planning permission was granted in May 2016 for the conversion of offices to 7 units and erection of 6 further units on site (15/00975/FUL). Site is under construction. At 1 April 2020 there were 4 dwellings outstanding. The site is deliverable within five years.,local-authority-eng:BAN,not owned by a public authority,2016-05-13,,permissioned,full planning permission,POINT(-1.172445 51.257887),15/00975/FUL,https://planning.basingstoke.gov.uk/online-applications/applicationDetails.do?activeTab=summary&keyVal=NLGY47CRJBL00,2017-12-31,brownfield-land/local-authority-eng/BAN/15-00975-FUL
Land between Elmdene and Fairholm Aldermaston Road Pamber End,yes,,2020-12-21,,1.025137,12,12,Outline planning permission was granted for 12 units in Feburary 2016 (15/03029/OUT). A reserved matters application was submitted in December 2018 which is pending consideration (18/03729/RES). The site is deliverable within five years.,local-authority-eng:BAN,not owned by a public authority,2016-05-25,,permissioned,outline planning permission,POINT(-1.125348 51.323459),15/03029/OUT,https://planning.basingstoke.gov.uk/online-applications/applicationDetails.do?activeTab=summary&keyVal=NTLFAVCRMW700,2019-05-14,brownfield-land/local-authority-eng/BAN/15-03029-OUT
Wella (Gb) Wella Road Basingstoke,yes,,2020-12-21,,0.668655,70,70,A prior notification was approved for the conversion of the building to residential use (14/02433/GPDOFF) encompassing 12 units. A new application for 70 units on the site (15/03170/FUL) was granted permission in December 2016. The site has been cleared to enable development to take place and start on site was recorded in recorded 2017. The site is deliverable within five years.,local-authority-eng:BAN,not owned by a public authority,2016-12-23,,permissioned,full planning permission,POINT(-1.10259 51.252623),15/03170/FUL,https://planning.basingstoke.gov.uk/online-applications/applicationDetails.do?activeTab=summary&keyVal=NUB80JCRFS600,2017-12-31,brownfield-land/local-authority-eng/BAN/15-03170-FUL
Queen Marys College Land Adjacent To Cliddesden Road Basingstoke,yes,20191223,2019-12-23,,0.228597,6,6,Outline planning permission grated under reference BDB/74060 in July 2016. Reserved matters approval graned July 2017 (15/04469/RES). As at the 1 April 2018 construction was yet to start. Site considered deliverable within five years.,local-authority-eng:BAN,,2016-07-15,,permissioned,reserved matters approval,POINT(-1.086105 51.255992),15/04469/RES,https://planning.basingstoke.gov.uk/online-applications/applicationDetails.do?activeTab=summary&keyVal=NZI3KXCRKV200,2017-12-31,brownfield-land/local-authority-eng/BAN/15-04469-RES
Royal British Legion The Street Bramley,yes,20201221,2020-12-21,,0.522844,9,9,Small site granted permission (15/04506/FUL) in November 2016. Complete,local-authority-eng:BAN,not owned by a public authority,2016-11-11,,permissioned,full planning permission,POINT(-1.066886 51.328843),15/04506/FUL,https://planning.basingstoke.gov.uk/online-applications/applicationDetails.do?activeTab=summary&keyVal=NZPT71CRL0V00,2017-12-31,brownfield-land/local-authority-eng/BAN/15-04506-FUL
Brickells Yard Oakley Lane Oakley,yes,,2020-12-21,,0.266285,10,10,A full application (15/04534/FUL) for 10 units was granted in September 2016. All 10 units have started on site. It is considered that the site is deliverable within five years.,local-authority-eng:BAN,not owned by a public authority,2016-09-09,,permissioned,full planning permission,POINT(-1.172679 51.252745),15/04534/FUL,https://planning.basingstoke.gov.uk/online-applications/applicationDetails.do?activeTab=summary&keyVal=NZT4PMCR0AQ00,2017-12-31,brownfield-land/local-authority-eng/BAN/15-04534-FUL
Vantage (Fairfield House) Victoria Street Basingstoke,yes,,2020-12-21,,0.13657,37,37,A prior notification was approved for the conversion of the building to residential use (14/03542/GPDOFF) for 29 units in January 2015 with a further 1 unit added through an application in January 2016 (15/03960/FUL). An application for 7 additional units on an additional floor was granted in December 2016 (16/00971/FUL). The development is under construction. The site is deliverable within five years.,local-authority-eng:BAN,not owned by a public authority,2016-12-16,,permissioned,full planning permission,POINT(-1.089371 51.261669),16/00971/FUL,https://planning.basingstoke.gov.uk/online-applications/applicationDetails.do?activeTab=summary&keyVal=O470CHCRG9B00,2017-12-31,brownfield-land/local-authority-eng/BAN/16-00971-FUL
Brackenwood House 1st & 2nd Floor Kimbell Road Basingstoke,yes,20191223,2019-12-23,,0.020575,6,6,Small site granted consent via prior approval (16/01362/GPDOFF) in September 2016. No start on site has been recorded at 1 April 2018 but the site considered deliverable within five years.,local-authority-eng:BAN,not owned by a public authority,2016-09-27,,permissioned,full planning permission,POINT(-1.104813 51.253292),16/01362/GPDOFF,https://planning.basingstoke.gov.uk/online-applications/applicationDetails.do?activeTab=summary&keyVal=O5U024CR0FP00,2017-12-31,brownfield-land/local-authority-eng/BAN/16-01362-GPDOFF
21 & 23 Church Street Basingstoke,yes,,2020-12-21,,0.046766,5,5,Small site granted permission (16/01585/FUL) in November 2016. Currently under construction and considered deliverable within five years.,local-authority-eng:BAN,not owned by a public authority,2016-11-09,,permissioned,full planning permission,POINT(-1.0878 51.263274),16/01585/FUL,https://planning.basingstoke.gov.uk/online-applications/applicationDetails.do?activeTab=summary&keyVal=O6LSBICRI7100,2017-12-31,brownfield-land/local-authority-eng/BAN/16-01585-FUL
Raja Newbury Road Headley,yes,20201221,2020-12-21,,0.113733,6,6,Small site granted permission (16/02465/FUL) in November 2016. The site completed in 2019/20,local-authority-eng:BAN,not owned by a public authority,2016-11-28,,permissioned,full planning permission,POINT(-1.257537 51.357905),16/02465/FUL,https://planning.basingstoke.gov.uk/online-applications/applicationDetails.do?activeTab=summary&keyVal=O9URSKCRLFM00,2017-12-31,brownfield-land/local-authority-eng/BAN/16-02465-FUL
JA Hirst & Sons Recycling Yard Hurstbourne Station Stoke Lane,yes,,2020-12-21,,2.440332,44,44,This site has detailed planning permission (16/02664/FUL) granted in November 2017. The site is deliverable within five years.,local-authority-eng:BAN,not owned by a public authority,2017-11-09,,permissioned,full planning permission,POINT(-1.380698 51.239902),16/02664/FUL,https://planning.basingstoke.gov.uk/online-applications/applicationDetails.do?activeTab=summary&keyVal=OAO18FCRMAW00,2018-12-31,brownfield-land/local-authority-eng/BAN/16-02664-FUL
20 Winchester Street Basingstoke,yes,,2020-12-21,,0.08928,14,14,Planning permission was granted in October 2013 for the conversion of the upper floors of the building to form 14 residential units (BDB/75489). A further application has since been granted for one additional flat (16/02676/FUL in September 2016). All units were recorded as started as of 1 April 2020. The site is deliverable within five years.,local-authority-eng:BAN,not owned by a public authority,2016-10-20,,permissioned,full planning permission,POINT(-1.088352 51.262632),16/02676/FUL,https://planning.basingstoke.gov.uk/online-applications/applicationDetails.do?activeTab=summary&keyVal=OAPTJXCRMDS00,2017-12-31,brownfield-land/local-authority-eng/BAN/16-02676-FUL
Whitway Farm Whitway Newbury,yes,,2020-12-21,,1.009092,5,5,Small site granted permission (16/03918/OUT) in April 2017. No start on site recorded at 1 April 2020 but site considered deliverable within five years.,local-authority-eng:BAN,not owned by a public authority,2017-04-11,,permissioned,outline planning permission,POINT(-1.342471 51.330098),16/03918/OUT,https://planning.basingstoke.gov.uk/online-applications/applicationDetails.do?activeTab=summary&keyVal=OFCTUICRJ1O00,2018-12-31,brownfield-land/local-authority-eng/BAN/16-03918-OUT
Mulfords Hill Centre 37-39 Mulfords Hill,yes,20191223,2019-12-23,,0.150465,8,8,Small site granted permission for 8 self contained apartments (C3) in March 2017 (16/04074/FUL). As at the 1 April 2018 construction was yet to start. Site considered deliverable within five years.,local-authority-eng:BAN,not owned by a public authority,2017-03-02,,permissioned,full planning permission,POINT(-1.141565 51.354178),16/04074/FUL,https://planning.basingstoke.gov.uk/online-applications/applicationDetails.do?activeTab=summary&keyVal=OG0M89CRJN700,2018-12-31,brownfield-land/local-authority-eng/BAN/16-04074-FUL
The Former Lamb Inn Hackwood Road,yes,20201221,2020-12-21,,0.128013,10,10,The site gained full planning permission for 10 units in May 2017 (16/04288/FUL). The site completed in 2019/20.,local-authority-eng:BAN,not owned by a public authority,2017-05-19,,permissioned,full planning permission,POINT(-1.084192 51.259787),16/04288/FUL,https://planning.basingstoke.gov.uk/online-applications/applicationDetails.do?activeTab=summary&keyVal=OGUIDVCRKFQ00,2017-12-31,brownfield-land/local-authority-eng/BAN/16-04288-FUL
5-9 Summerlea Court Herriard,yes,20191223,2019-12-23,,0.143079,5,5,Small site granted permission via prior approval (16/04684/GPDOFF) in April 2017. Site under construction and considered deliverable within five years.,local-authority-eng:BAN,not owned by a public authority,2017-04-26,,permissioned,full planning permission,POINT(-1.041119 51.198029),16/04684/GPDOFF,https://planning.basingstoke.gov.uk/online-applications/applicationDetails.do?activeTab=summary&keyVal=OIFK4QCR0GT00,2018-12-31,brownfield-land/local-authority-eng/BAN/16-04684-GPDOFF
10 Winchester Street Basingstoke,yes,20191223,2019-12-23,,0.018705,5,5,Small site granted permission (16/04685/FUL) in March 2017. No start on site has been recorded at 1 April 2018 but the site considered deliverable within five years.,local-authority-eng:BAN,not owned by a public authority,2017-03-01,,permissioned,full planning permission,POINT(-1.087786 51.262598),16/04685/FUL,https://planning.basingstoke.gov.uk/online-applications/applicationDetails.do?activeTab=summary&keyVal=OIFLPRCRLST00,2017-12-31,brownfield-land/local-authority-eng/BAN/16-04685-FUL
Former Dairy Farm Reading Road Sherfield On Loddon,yes,20191223,2019-12-23,,0.2798,9,9,Small site granted permission (16/04693/FUL) in March 2017. The site is under construction. Site considered deliverable within five years.,local-authority-eng:BAN,not owned by a public authority,2017-03-08,,permissioned,full planning permission,POINT(-1.043469 51.298139),16/04693/FUL,https://planning.basingstoke.gov.uk/online-applications/applicationDetails.do?activeTab=summary&keyVal=OIGOOFCRLTU00,2017-12-31,brownfield-land/local-authority-eng/BAN/16-04693-FUL
4 Fairfields Road,yes,,2020-12-21,,0.087623,8,8,Small site granted permission (16/04730/FUL) in June 2017. Another application (19/03391/FUL) was approved on 14 August 2020 for 8 units. As at the 1 April 2020 construction was yet to start. Site considered deliverable within five years.,local-authority-eng:BAN,not owned by a public authority,2017-06-09,,permissioned,full planning permission,POINT(-1.086323 51.258794),16/04730/FUL,https://planning.basingstoke.gov.uk/online-applications/applicationDetails.do?activeTab=summary&keyVal=OIKXLMCRLY000,2018-12-31,brownfield-land/local-authority-eng/BAN/16-04730-FUL
32 Copenhagen Court New Street,yes,,2020-12-21,,0.187878,38,38,The site gained prior approval for 38 units in June 2017 (17/00135/GPDOFF). A further application for 20 units (17/02933/FUL) was refused in December 2017. The site is deliverable within five years.,local-authority-eng:BAN,not owned by a public authority,2017-06-05,,permissioned,full planning permission,POINT(-1.089319 51.262634),17/00135/GPDOFF,https://planning.basingstoke.gov.uk/online-applications/applicationDetails.do?activeTab=summary&keyVal=OJQ2J6CR0AP00,2017-12-31,brownfield-land/local-authority-eng/BAN/17-00135-GPDOFF
Churchill Plaza Churchill Way Basingstoke,yes,20201221,2019-12-23,,0.825477,285,285,A prior notification was first approved for the conversion of the building to residential use (16/00504/GPDOFF) in May 2016 for 257 flats. This was increased to 283 flats by a further prior notification in April 2017 (17/00416/GPDOFF) and for an additional 2 (penthouse) flats also in April (17/00625/FUL). The development of all units was completed 2019/20,local-authority-eng:BAN,not owned by a public authority,2017-04-20,,permissioned,full planning permission,POINT(-1.084429 51.266218),17/00625/FUL,https://planning.basingstoke.gov.uk/online-applications/applicationDetails.do?activeTab=summary&keyVal=OLIJC5CRGQO00,2017-12-31,brownfield-land/local-authority-eng/BAN/17-00625-FUL
Bank Top Spring Hill Lane St Mary Bourne,yes,,2020-12-21,,0.813264,8,8,Small site granted permission (17/00965/FUL ) in December 2017. As at the 1 April 2020 construction on all 8 units had started on site. Site considered deliverable within five years.,local-authority-eng:BAN,not owned by a public authority,2017-12-11,,permissioned,full planning permission,POINT(-1.396959 51.25304),17/00965/FUL,https://planning.basingstoke.gov.uk/online-applications/applicationDetails.do?activeTab=summary&keyVal=OMRFGNCR0GT00,2018-12-31,brownfield-land/local-authority-eng/BAN/17-00965-FUL
Land Adjacent To 96 Paddock Road Basingstoke,yes,20191223,2019-12-23,,0.115217,5,5,Planning permission granted in July 2017 for 5 affordable units (17/01207/FUL). The site is vacant and has been cleared. It is considered that the site is deliverable within five years.,local-authority-eng:BAN,owned by a public authority,2017-07-31,,permissioned,full planning permission,POINT(-1.120503 51.254494),17/01207/FUL,https://planning.basingstoke.gov.uk/online-applications/applicationDetails.do?activeTab=summary&keyVal=ONKV6ZCRILM00,2017-12-31,brownfield-land/local-authority-eng/BAN/17-01207-FUL
15 New Road Basingstoke,yes,,2020-12-21,,0.126114,10,10,The site gained permission for 10 units in December 2017 (17/01292/FUL). The original building has been demolished and all units on site are recorded as started as of 1 April 2020. The site is deliverable within five years.,local-authority-eng:BAN,not owned by a public authority,2017-12-07,,permissioned,full planning permission,POINT(-1.08413 51.264585),17/01292/FUL,https://planning.basingstoke.gov.uk/online-applications/applicationDetails.do?activeTab=summary&keyVal=ONW5XNCRIWO00,2018-12-31,brownfield-land/local-authority-eng/BAN/17-01292-FUL
Land At Chapel Hill Kingsclere Road Basingstoke,yes,,2020-12-21,,2.023111,491,491,Outline planning permission granted for 578 units (14/00865/OUT) in January 2015. Reserved matters consent for the full 578 units (15/03667/RES) was granted in May 2016. Work has commenced on site and the first 12 units were completed in 2016/17 and 115 in 2017/18 and 132 in 2018/19. 56 of the units are to be delivered in the existing 'white building' and an application to increase this to 96 units (17/02279/FUL) was granted in March 2018. The site is deliverable within five years.,local-authority-eng:BAN,not owned by a public authority,2018-03-23,,permissioned,full planning permission,POINT(-1.096966 51.270089),17/02279/FUL,https://planning.basingstoke.gov.uk/online-applications/applicationDetails.do?activeTab=summary&keyVal=OSBDQHCRN0Q00,2017-12-31,brownfield-land/local-authority-eng/BAN/17-02279-FUL
Spinnaker House Lime Tree Way Chineham Basingstoke,yes,20201221,2020-12-21,,0.411764,36,36,A prior approval application for conversion from office to residential was approved in February 2017 (16/04426/GPDOFF) for 33 units. A further prior approval application (17/02516/GPDOFF) for 36 units was granted in December 2017. The development completed in 2019/20,local-authority-eng:BAN,not owned by a public authority,2017-12-20,,permissioned,full planning permission,POINT(-1.05982 51.29757),17/02516/GPDOFF,https://planning.basingstoke.gov.uk/online-applications/applicationDetails.do?activeTab=summary&keyVal=OTDRNXCR0GT00,2018-12-31,brownfield-land/local-authority-eng/BAN/17-02516-GPDOFF
Spectrum House 8 Woodlands Business Village Coronation Road Basingstoke,yes,20201221,2020-12-21,,0.204516,18,18,Prior notification was approved for 13 flats on the site in December 2015 (15/03777/GPDOFF). A further prior notification was approved for 18 flats in September 2017 (17/02605/GDPOFF). All 18 units completed 2019/20,local-authority-eng:BAN,not owned by a public authority,2017-09-20,,permissioned,full planning permission,POINT(-1.073896 51.272301),17/02605/GPDOFF,https://planning.basingstoke.gov.uk/online-applications/applicationDetails.do?activeTab=summary&keyVal=OTP7K2CR0GT00,2017-12-31,brownfield-land/local-authority-eng/BAN/17-02605-GPDOFF
Centenary House 10 Winchester Road,yes,,2020-12-21,,0.811121,9,9,Small site granted outline permission for 9 dwellings in March 2017 (17/03309/OUT). Reserved matters (19/00761/RES). All 9 units were recorded as starts at 1 April 2020. The site is considered deliverable within five years.,local-authority-eng:BAN,not owned by a public authority,2017-03-01,,permissioned,outline planning permission,POINT(-1.090731 51.261103),17/03309/OUT,https://planning.basingstoke.gov.uk/online-applications/applicationDetails.do?activeTab=summary&keyVal=OX1TGCCRJY000,2018-12-31,brownfield-land/local-authority-eng/BAN/17-03309-OUT
Deeside Alliston Way,yes,,2020-12-21,,0.344844,15,15,This site gained planning permission in (17/03673/FUL). Soverign who are taking the site forward state that the site will be completed by 2020/21. All units were recorded as starts as of 1 April 2020. The site is deliverable within five years.,local-authority-eng:BAN,owned by a public authority,2019-02-11,,permissioned,full planning permission,POINT(-1.126015 51.255129),17/03673/FUL,https://planning.basingstoke.gov.uk/online-applications/applicationDetails.do?activeTab=summary&keyVal=OYQJP6CRLFS00,2018-12-31,brownfield-land/local-authority-eng/BAN/17-03673-FUL
Sandringham Court Paddock Road Basingstoke,yes,,2020-12-21,,0.156739,13,13,The site gained full planning permission in Feburary 2019 (17/04029/FUL). The site is being actively persued by a housing association. The site is deliverable within five years.,local-authority-eng:BAN,owned by a public authority,2019-02-19,,permissioned,full planning permission,POINT(-1.1191 51.255846),17/04029/FUL,https://planning.basingstoke.gov.uk/online-applications/applicationDetails.do?activeTab=summary&keyVal=P0544CCRMRI00,2017-12-31,brownfield-land/local-authority-eng/BAN/17-04029-FUL
Chineham House Shakespeare Road Basingstoke,yes,20201221,2020-12-21,,0.12983,10,10,Planning permission for the conversion of this council owned building was granted in October 2014 (14/00759/FUL). This permission lapsed in 2018 and a new permission was granted in September 2018 (17/04259/FUL). The site is deliverable within five years.,local-authority-eng:BAN,owned by a public authority,2018-05-25,,permissioned,full planning permission,POINT(-1.075252 51.280971),17/04259/FUL,https://planning.basingstoke.gov.uk/online-applications/applicationDetails.do?activeTab=summary&keyVal=P19XN0CRFZC00,2017-12-31,brownfield-land/local-authority-eng/BAN/17-04259-FUL
Burnham Copse Infant School New Church Road Tadley,yes,20201221,2020-12-21,,1.408238,36,36,Outline planning permission for 36 residential units was granted in March 2016 (14/02200/OUT) and reserved matters approval in October 2018 (18/00524/RES). The site completed in 2019/20,local-authority-eng:BAN,owned by a public authority,2018-10-08,,permissioned,reserved matters approval,POINT(-1.150834 51.355794),18/00524/RES,https://planning.basingstoke.gov.uk/online-applications/applicationDetails.do?activeTab=summary&keyVal=P4EQ9KCRIHF00,2017-12-31,brownfield-land/local-authority-eng/BAN/18-00524-RES
Site Of Harlech Hall Harlech Close Winklebury Basingstoke,yes,,2020-12-21,,0.192581,7,7,This site benefits from full planning permission granted in June 2018 (18/01184/FUL). 7 units started on site as of 1 April 2020. The site is considered deliverable within five years.,local-authority-eng:BAN,owned by a public authority,2018-06-19,,permissioned,full planning permission,POINT(-1.122148 51.267083),18/01184/FUL,https://planning.basingstoke.gov.uk/online-applications/applicationDetails.do?activeTab=summary&keyVal=P7NBIVCRLCN00,2017-12-31,brownfield-land/local-authority-eng/BAN/18-01184-FUL
12 London Street Basingstoke,yes,,2020-12-21,,0.031583,10,10,This site gained planning permission in July 2018 (18/01270/FUL) for 10 units. All units were recorded as started as of 1 April 2020. The site is deliverable within five years.,local-authority-eng:BAN,not owned by a public authority,2018-07-13,,permissioned,full planning permission,POINT(-1.085914 51.262597),18/01270/FUL,https://planning.basingstoke.gov.uk/online-applications/applicationDetails.do?activeTab=summary&keyVal=P820CXCRLQC00,2018-12-31,brownfield-land/local-authority-eng/BAN/18-01270-FUL
Innovation Court New Street Basingstoke,yes,20201221,2020-12-21,,0.409138,46,46,A prior notification was approved for the conversion of the building to residential use (16/00031/GPDOFF) in March 2016 for 35 flats. A further prior notification was approved to take the number of units up to 46 was approved in August 2018 (18/01504/GPDOFF). A Further Planning application has permitted 6 further units as a third floor extension (20/00414/FUL) in April 2020.,local-authority-eng:BAN,not owned by a public authority,2018-08-09,,permissioned,full planning permission,POINT(-1.089891 51.26301),18/01504/GPDOFF,https://planning.basingstoke.gov.uk/online-applications/applicationDetails.do?activeTab=summary&keyVal=P9862DCR0AQ00,2017-12-31,brownfield-land/local-authority-eng/BAN/18-01504-GPDOFF
Kings School Brambleys Close Basingstoke,yes,,2020-12-21,,0.182657,9,9,This site benefits from permission in principle granted in October 2018 (18/02735/PIP). The site is currently being marketed. The site is deliverable within five years.,local-authority-eng:BAN,not owned by a public authority,2018-10-19,,permissioned,full planning permission,POINT(-1.092578 51.26266),18/02735/PIP,https://planning.basingstoke.gov.uk/online-applications/applicationDetails.do?activeTab=summary&keyVal=PF1WD8CR0AP00,2018-12-31,brownfield-land/local-authority-eng/BAN/18-02735-PIP
Riverside View Basing Road Old Basing,yes,,2020-12-21,,0.323839,11,11,A prior notification was approved for the conversion of the building to residential use (18/03671/GPDOFF) in May 2019. The site is deliverable within five years.,local-authority-eng:BAN,not owned by a public authority,2019-05-09,,permissioned,full planning permission,POINT(-1.054928 51.271564),18/03671/GPDOFF,https://planning.basingstoke.gov.uk/online-applications/applicationDetails.do?activeTab=summary&keyVal=PJXX6TCR0AP00,2019-05-14,brownfield-land/local-authority-eng/BAN/18-03671-GPDOFF
