site-address,deliverable,end-date,entry-date,hazardous-substances,hectares,maximum-net-dwellings,minimum-net-dwellings,notes,organisation,ownership-status,planning-permission-date,planning-permission-history,planning-permission-status,planning-permission-type,point,site,site-plan-url,start-date,slug
"Harveys Furnishing Group Ltd, 230-250 Purley Way",,,2017-12-31,,0.46,78,21,"Redevelopment of this area to a mixture of residential, retail and commercial use, healthcare facility (if required by the NHS) and community uses to form the basis of a new residential community. As the site is partly within a Flood Zone 3 it will be sub. https://www.croydon.gov.uk/sites/default/files/articles/downloads/Background%20evidence%20for%20each%20Detailed%20Proposal%20site%20-%20Proposed%20Submission%20%281%29_0.pdf",local-authority-eng:CRY,not owned by a public authority,,,not permissioned,,POINT(-0.120019 51.37493),349,http://www.planvu.co.uk/croydon2016/index.php?map=proposed,2017-12-31,brownfield-land/local-authority-eng/CRY/349
"Wing Yip, 544 Purley Way",,,2017-12-31,,1.53,260,69,"Redevelopment of a mix of residential, retail, commercial and community uses to form the basis of a new residential community. https://www.croydon.gov.uk/sites/default/files/articles/downloads/Background%20evidence%20for%20each%20Detailed%20Proposal%20site%20-%20Proposed%20Submission%20%281%29_0.pdf",local-authority-eng:CRY,not owned by a public authority,,,not permissioned,,POINT(-0.119253 51.362409),350,http://www.planvu.co.uk/croydon2016/index.php?map=proposed,2017-12-31,brownfield-land/local-authority-eng/CRY/350
"Furniture Village, 222 Purley Way",,,2017-12-31,,0.71,120,32,"Redevelopment of this area to a mixture of residential, retail, healthcare facility (if required by NHS) and community uses to form the basis of a new residential community. https://www.croydon.gov.uk/sites/default/files/articles/downloads/Background%20evidence%20for%20each%20Detailed%20Proposal%20site%20-%20Proposed%20Submission%20%281%29_0.pdf",local-authority-eng:CRY,not owned by a public authority,,,not permissioned,,POINT(-0.120845 51.376166),351,http://www.planvu.co.uk/croydon2016/index.php?map=proposed,2017-12-31,brownfield-land/local-authority-eng/CRY/351
"Decathlon, 2 Trafaglar Way",,,2017-12-31,,1.3,221,59,"Redevelopment of this area to a mixture of residential, retail, healthcare facility (if required by the NHS) and community uses to form the basis of a new residential community. https://www.croydon.gov.uk/sites/default/files/articles/downloads/Background%20evidence%20for%20each%20Detailed%20Proposal%20site%20-%20Proposed%20Submission%20%281%29_0.pdf",local-authority-eng:CRY,not owned by a public authority,,,not permissioned,,POINT(-0.117926 51.375859),355,http://www.planvu.co.uk/croydon2016/index.php?map=proposed,2017-12-31,brownfield-land/local-authority-eng/CRY/355
"Stubbs Mead Depot, Factory Lane",yes,,2017-12-31,,2.71,440,157,Mixed residential and employment (industry and warehousing). https://www.croydon.gov.uk/sites/default/files/articles/downloads/Background%20evidence%20for%20each%20Detailed%20Proposal%20site%20-%20Proposed%20Submission%20%281%29_0.pdf,local-authority-eng:CRY,owned by a public authority,,,not permissioned,,POINT(-0.111525 51.376385),946,http://www.planvu.co.uk/croydon2016/index.php?map=proposed,2017-12-31,brownfield-land/local-authority-eng/CRY/946
"Oban House, 46 Bramley Hill",,,2017-12-31,,0.29,61,61,,local-authority-eng:CRY,not owned by a public authority,,,not permissioned,,POINT(-0.106482 51.362779),17080087,https://www.croydon.gov.uk/sites/default/files/articles/downloads/All%20SHLAA%20sites%20in%20Brownfield%20Register.pdf,2017-12-31,brownfield-land/local-authority-eng/CRY/17080087
"Toby Carvery, Brantwood Road",,,2017-12-31,,0.37,30,27,,local-authority-eng:CRY,not owned by a public authority,,,not permissioned,,POINT(-0.099867 51.349398),17080088,https://www.croydon.gov.uk/sites/default/files/articles/downloads/All%20SHLAA%20sites%20in%20Brownfield%20Register.pdf,2017-12-31,brownfield-land/local-authority-eng/CRY/17080088
Car Showrooms Brighton Road,,,2017-12-31,,1.2,96,86,,local-authority-eng:CRY,not owned by a public authority,,,not permissioned,,POINT(-0.100915 51.348381),17080089,https://www.croydon.gov.uk/sites/default/files/articles/downloads/All%20SHLAA%20sites%20in%20Brownfield%20Register.pdf,2017-12-31,brownfield-land/local-authority-eng/CRY/17080089
"Renault Croydon, 305 Brighton Road",,,2017-12-31,,0.84,122,122,,local-authority-eng:CRY,not owned by a public authority,,,not permissioned,,POINT(-0.140218 51.313633),17080091,https://www.croydon.gov.uk/sites/default/files/articles/downloads/All%20SHLAA%20sites%20in%20Brownfield%20Register.pdf,2017-12-31,brownfield-land/local-authority-eng/CRY/17080091
Bupa Nursing Home,,,2017-12-31,,0.7,70,70,,local-authority-eng:CRY,not owned by a public authority,,,not permissioned,,POINT(-0.090078 51.368978),17080098,https://www.croydon.gov.uk/sites/default/files/articles/downloads/All%20SHLAA%20sites%20in%20Brownfield%20Register.pdf,2017-12-31,brownfield-land/local-authority-eng/CRY/17080098
Coulsdon Community Centre,yes,,2017-12-31,,0.29,42,42,,local-authority-eng:CRY,owned by a public authority,,,not permissioned,,POINT(-0.147351 51.320005),17080127,https://www.croydon.gov.uk/sites/default/files/articles/downloads/All%20SHLAA%20sites%20in%20Brownfield%20Register.pdf,2017-12-31,brownfield-land/local-authority-eng/CRY/17080127
"Motor Village Croydon, 121 Canterbury Road",,,2017-12-31,,0.35,28,28,,local-authority-eng:CRY,not owned by a public authority,,,not permissioned,,POINT(-0.119955 51.385271),17080144,https://www.croydon.gov.uk/sites/default/files/articles/downloads/All%20SHLAA%20sites%20in%20Brownfield%20Register.pdf,2017-12-31,brownfield-land/local-authority-eng/CRY/17080144
"Old Waddon Goods Yard, Purley Way",,,2017-12-31,,0.85,191,133,,local-authority-eng:CRY,not owned by a public authority,,,not permissioned,,POINT(-0.117748 51.367583),17080148,https://www.croydon.gov.uk/sites/default/files/articles/downloads/All%20SHLAA%20sites%20in%20Brownfield%20Register.pdf,2017-12-31,brownfield-land/local-authority-eng/CRY/17080148
"AIG Building, 2-8 Altyre Road",,,2017-12-31,,0.13,59,59,,local-authority-eng:CRY,not owned by a public authority,,,not permissioned,,POINT(-0.092193 51.374427),17080149,https://www.croydon.gov.uk/sites/default/files/articles/downloads/All%20SHLAA%20sites%20in%20Brownfield%20Register.pdf,2017-12-31,brownfield-land/local-authority-eng/CRY/17080149
The Forestdale Centre,,,2017-12-31,,0.437114,35,35,,local-authority-eng:CRY,not owned by a public authority,,,not permissioned,,POINT(-0.038176 51.351025),17080152,https://www.croydon.gov.uk/sites/default/files/articles/downloads/All%20SHLAA%20sites%20in%20Brownfield%20Register.pdf,2017-12-31,brownfield-land/local-authority-eng/CRY/17080152
45 Lansdowne Road,,,2017-12-31,,0.26,117,117,,local-authority-eng:CRY,not owned by a public authority,,,not permissioned,,POINT(-0.094224 51.378129),17080173,https://www.croydon.gov.uk/sites/default/files/articles/downloads/All%20SHLAA%20sites%20in%20Brownfield%20Register.pdf,2017-12-31,brownfield-land/local-authority-eng/CRY/17080173
20-28 Addiscombe Road (Go Ahead House & Easy Hotel),,,2017-12-31,,0.13,59,59,,local-authority-eng:CRY,not owned by a public authority,,,not permissioned,,POINT(-0.09015 51.374852),17080174,https://www.croydon.gov.uk/sites/default/files/articles/downloads/All%20SHLAA%20sites%20in%20Brownfield%20Register.pdf,2017-12-31,brownfield-land/local-authority-eng/CRY/17080174
Direct Line House,,,2017-12-31,,0.28,126,113,,local-authority-eng:CRY,not owned by a public authority,,,not permissioned,,POINT(-0.097832 51.370121),17080200,https://www.croydon.gov.uk/sites/default/files/articles/downloads/All%20SHLAA%20sites%20in%20Brownfield%20Register.pdf,2017-12-31,brownfield-land/local-authority-eng/CRY/17080200
140 & 140a Hermitage Road,,,2017-12-31,,0.43,62,62,,local-authority-eng:CRY,not owned by a public authority,,,not permissioned,,POINT(-0.092455 51.420986),17080241,https://www.croydon.gov.uk/sites/default/files/articles/downloads/All%20SHLAA%20sites%20in%20Brownfield%20Register.pdf,2017-12-31,brownfield-land/local-authority-eng/CRY/17080241
"Sainsburys, Trafalgar Way",,,2017-12-31,,0.83,120,108,,local-authority-eng:CRY,not owned by a public authority,,,not permissioned,,POINT(-0.117572 51.375727),17080249,https://www.croydon.gov.uk/sites/default/files/articles/downloads/All%20SHLAA%20sites%20in%20Brownfield%20Register.pdf,2017-12-31,brownfield-land/local-authority-eng/CRY/17080249
Blackhorse Lane Station,,,2017-12-31,,0.407487,61,61,,local-authority-eng:CRY,owned by a public authority,,,not permissioned,,POINT(-0.070542 51.384962),17080267,https://www.croydon.gov.uk/sites/default/files/articles/downloads/All%20SHLAA%20sites%20in%20Brownfield%20Register.pdf,2017-12-31,brownfield-land/local-authority-eng/CRY/17080267
Shirley Wyevale Garden Centre,,,2017-12-31,,0.39,31,31,,local-authority-eng:CRY,not owned by a public authority,,,not permissioned,,POINT(-0.052658 51.37356),17080371,https://www.croydon.gov.uk/sites/default/files/articles/downloads/All%20SHLAA%20sites%20in%20Brownfield%20Register.pdf,2017-12-31,brownfield-land/local-authority-eng/CRY/17080371
Waitrose,,,2017-12-31,,0.73,47,47,,local-authority-eng:CRY,not owned by a public authority,,,not permissioned,,POINT(-0.074659 51.332044),17080439,https://www.croydon.gov.uk/sites/default/files/articles/downloads/All%20SHLAA%20sites%20in%20Brownfield%20Register.pdf,2017-12-31,brownfield-land/local-authority-eng/CRY/17080439
West Croydon Bus Station,,,2017-12-31,,0.315109,142,142,,local-authority-eng:CRY,owned by a public authority,,,not permissioned,,POINT(-0.101141 51.379032),17080450,https://www.croydon.gov.uk/sites/default/files/articles/downloads/All%20SHLAA%20sites%20in%20Brownfield%20Register.pdf,2017-12-31,brownfield-land/local-authority-eng/CRY/17080450
"Strand House, Zion Road",,,2017-12-31,,0.26,59,59,,local-authority-eng:CRY,not owned by a public authority,,,not permissioned,,POINT(-0.094062 51.396543),17080464,https://www.croydon.gov.uk/sites/default/files/articles/downloads/All%20SHLAA%20sites%20in%20Brownfield%20Register.pdf,2017-12-31,brownfield-land/local-authority-eng/CRY/17080464
"Former Essex House, 101, George Street",yes,,2017-12-31,,0.17,305,305,"Erection of two buildings of 17 and 32 storeys comprising 305 residential units, 4 commercial units (use classes A1-A5), and a gym (use class D2); provision of new public piazza and associated landscaping, car parking, cycle and refuse storage. http://publicaccess2.croydon.gov.uk/online-applications/applicationDetails.do?activeTab=summary&keyVal=ZZZW0MJLXB651",local-authority-eng:CRY,not owned by a public authority,2015-09-29,http://publicaccess2.croydon.gov.uk/online-applications/applicationDetails.do?activeTab=summary&keyVal=ZZZW0MJLXB651,permissioned,full planning permission,POINT(-0.093926 51.37423),14/01594/P,http://publicaccess2.croydon.gov.uk/online-applications/applicationDetails.do?activeTab=summary&keyVal=ZZZW0MJLXB651,2017-12-31,brownfield-land/local-authority-eng/CRY/14-01594-P
"Land Adjacent To Croydon College, College Road",yes,,2017-12-31,,0.187,159,159,"Erection of part 16/38 storey building (plus basement and mezzanine levels) comprising 159 residential units, 225 bedroom hotel and restaurant (within use class A3); provision of associated amenity areas, landscaping and car/cycle parking and alterations/partial enclosure of access ramp. http://publicaccess2.croydon.gov.uk/online-applications/applicationDetails.do?activeTab=summary&keyVal=ZZZW0MJLXB647",local-authority-eng:CRY,not owned by a public authority,2015-12-04,http://publicaccess2.croydon.gov.uk/online-applications/applicationDetails.do?activeTab=summary&keyVal=ZZZW0MJLXB647,permissioned,full planning permission,POINT(-0.093618 51.373694),14/01603/P,http://publicaccess2.croydon.gov.uk/online-applications/applicationDetails.do?activeTab=summary&keyVal=ZZZW0MJLXB647,2017-12-31,brownfield-land/local-authority-eng/CRY/14-01603-P
"Stonewest Ltd, Lambert's Place",yes,,2017-12-31,,0.123,25,25,"Demolition of existing buildings; erection of four/five storey building comprising 9 one bedroom flats, 10 two bedroom flats and 6 three bedroom flats; formation of vehicular access and provision of associated parking. http://publicaccess2.croydon.gov.uk/online-applications/applicationDetails.do?activeTab=summary&keyVal=ZZZW0LJLXB895",local-authority-eng:CRY,not owned by a public authority,2015-06-12,http://publicaccess2.croydon.gov.uk/online-applications/applicationDetails.do?activeTab=summary&keyVal=ZZZW0LJLXB895,permissioned,full planning permission,POINT(-0.091022 51.380828),14/04070/P,http://publicaccess2.croydon.gov.uk/online-applications/applicationDetails.do?activeTab=summary&keyVal=ZZZW0LJLXB895,2017-12-31,brownfield-land/local-authority-eng/CRY/14-04070-P
"18, Oakfield Road",yes,,2017-12-31,,0.05,5,5,Alterations; construction of second floor and conversion to form 1 three bedroom and 5 one bedroom flats. http://publicaccess2.croydon.gov.uk/online-applications/applicationDetails.do?activeTab=summary&keyVal=ZZZW0HJLXB852,local-authority-eng:CRY,not owned by a public authority,2015-06-12,http://publicaccess2.croydon.gov.uk/online-applications/applicationDetails.do?activeTab=summary&keyVal=ZZZW0HJLXB852,permissioned,full planning permission,POINT(-0.102534 51.379747),15/01196/P,http://publicaccess2.croydon.gov.uk/online-applications/applicationDetails.do?activeTab=summary&keyVal=ZZZW0HJLXB852,2017-12-31,brownfield-land/local-authority-eng/CRY/15-01196-P
"6-44 Station Road And Queens Hall Car Park, Station Road & Poplar Walk",yes,,2017-12-31,,0.14,225,225,"Demolition of 6-44 Station Road and all but the facade of 6-12 Station Road; erection of two buildings comprising 25 storeys (plus partial basement and mezzanine) and 21 storeys (plus mezzanine) to provide 232 residential units and 947 M2 of commercial floorspace (for use within Class A1,A2,A3,A4 or A5) ; new public square including area for retail use, works to church car park , cycle parking, disabled parking and sustainable energy measures.. http://publicaccess2.croydon.gov.uk/online-applications/applicationDetails.do?activeTab=summary&keyVal=ZZZW0HJLXB466",local-authority-eng:CRY,not owned by a public authority,2017-03-31,http://publicaccess2.croydon.gov.uk/online-applications/applicationDetails.do?activeTab=summary&keyVal=ZZZW0HJLXB466,permissioned,full planning permission,POINT(-0.101638 51.378483),15/01419/P,http://publicaccess2.croydon.gov.uk/online-applications/applicationDetails.do?activeTab=summary&keyVal=ZZZW0HJLXB466,2017-12-31,brownfield-land/local-authority-eng/CRY/15-01419-P
"Top Nox, Crossland Road",yes,,2017-12-31,,0.015,7,7,"Alterations and refurbishment of ground floor and construction of first, second, third and fourth floors to provide 1 one bedroom, 2 two bedroom, 2 three bedroom and 2 studio flats; provision of balconies, roof garden and roof terraces; provision of internal garage. http://publicaccess2.croydon.gov.uk/online-applications/applicationDetails.do?activeTab=summary&keyVal=ZZZW0GJLXB367",local-authority-eng:CRY,not owned by a public authority,2015-08-05,http://publicaccess2.croydon.gov.uk/online-applications/applicationDetails.do?activeTab=summary&keyVal=ZZZW0GJLXB367,permissioned,full planning permission,POINT(-0.110584 51.388411),15/02627/P,http://publicaccess2.croydon.gov.uk/online-applications/applicationDetails.do?activeTab=summary&keyVal=ZZZW0GJLXB367,2017-12-31,brownfield-land/local-authority-eng/CRY/15-02627-P
"167, Handcroft Road",yes,,2017-12-31,,0.148,29,29,"Demolition of all existing buildings; erection of 1 part single-, part two-, part three-storey building and 1 part two-, part four-storey building comprising a total of 14 one bedroom, 13 two and 2 three bedroom flats; formation of vehicular access and provision of 2 no. disabled parking spaces.. http://publicaccess2.croydon.gov.uk/online-applications/applicationDetails.do?activeTab=summary&keyVal=ZZZW0FJLXB763",local-authority-eng:CRY,not owned by a public authority,2016-07-27,http://publicaccess2.croydon.gov.uk/online-applications/applicationDetails.do?activeTab=summary&keyVal=ZZZW0FJLXB763,permissioned,full planning permission,POINT(-0.108944 51.382872),15/03248/P,http://publicaccess2.croydon.gov.uk/online-applications/applicationDetails.do?activeTab=summary&keyVal=ZZZW0FJLXB763,2017-12-31,brownfield-land/local-authority-eng/CRY/15-03248-P
"393, Wickham Road",yes,,2017-12-31,,0.075,6,6,Demolition of the existing dwelling; erection of a three storey building with lower ground floor comprising 7 two bedroom flats with associated access and forecourt parking. http://publicaccess2.croydon.gov.uk/online-applications/applicationDetails.do?activeTab=summary&keyVal=ZZZW0EJLXB779,local-authority-eng:CRY,not owned by a public authority,2016-05-06,http://publicaccess2.croydon.gov.uk/online-applications/applicationDetails.do?activeTab=summary&keyVal=ZZZW0EJLXB779,permissioned,full planning permission,POINT(-0.041766 51.376283),15/04202/P,http://publicaccess2.croydon.gov.uk/online-applications/applicationDetails.do?activeTab=summary&keyVal=ZZZW0EJLXB779,2017-12-31,brownfield-land/local-authority-eng/CRY/15-04202-P
"5, Cairo New Road",yes,,2017-12-31,,0.359,113,113,"Demolition of existing buildings; Erection of a 4/14 (with plant above) storey building comprising 43 two bedroom, 32 studio, 30 one bedroom and 8 three bedroom flats, a use within A3 (restaurant/cafe) and D1 (non residential institution) on the ground floor and new public square including area for commercial use. http://publicaccess2.croydon.gov.uk/online-applications/applicationDetails.do?activeTab=summary&keyVal=ZZZW0EJLXB175",local-authority-eng:CRY,not owned by a public authority,2016-05-06,http://publicaccess2.croydon.gov.uk/online-applications/applicationDetails.do?activeTab=summary&keyVal=ZZZW0EJLXB175,permissioned,full planning permission,POINT(-0.105954 51.374884),15/04748/P,http://publicaccess2.croydon.gov.uk/online-applications/applicationDetails.do?activeTab=summary&keyVal=ZZZW0EJLXB175,2017-12-31,brownfield-land/local-authority-eng/CRY/15-04748-P
"28-30, Addiscombe Grove",yes,,2017-12-31,,0.594,74,74,"Demolition of the existing buildings and construction of a part 12, part 8 storey building providing 74 flats and 106m2 flexible commercial floorspace (Use Class A2, B1, D1 and D2) on the ground floor; provision of access, parking and servicing arrangements and landscaping.. http://publicaccess2.croydon.gov.uk/online-applications/applicationDetails.do?activeTab=summary&keyVal=ZZZW0EJLXB477",local-authority-eng:CRY,not owned by a public authority,2016-08-24,http://publicaccess2.croydon.gov.uk/online-applications/applicationDetails.do?activeTab=summary&keyVal=ZZZW0EJLXB477,permissioned,full planning permission,POINT(-0.090194 51.374484),15/04869/P,http://publicaccess2.croydon.gov.uk/online-applications/applicationDetails.do?activeTab=summary&keyVal=ZZZW0EJLXB477,2017-12-31,brownfield-land/local-authority-eng/CRY/15-04869-P
"Marshalls Yard, 55, Edward Road",yes,,2017-12-31,,0.065,9,9,Demolition of existing buildings and erection of 2 storey residential development 3no 2 bedroom terraced houses and 6 no 1 bedroom flats; provision of associated parking and landscaping. http://publicaccess2.croydon.gov.uk/online-applications/applicationDetails.do?activeTab=summary&keyVal=ZZZW0DJLXB912,local-authority-eng:CRY,not owned by a public authority,2016-05-26,http://publicaccess2.croydon.gov.uk/online-applications/applicationDetails.do?activeTab=summary&keyVal=ZZZW0DJLXB912,permissioned,full planning permission,POINT(-0.137605 51.320057),15/05118/P,http://publicaccess2.croydon.gov.uk/online-applications/applicationDetails.do?activeTab=summary&keyVal=ZZZW0DJLXB912,2017-12-31,brownfield-land/local-authority-eng/CRY/15-05118-P
"30, Fairfield Road",yes,,2017-12-31,,0.081,8,8,"Demolition of existing buildings and erection of three/four storey building containing 8 two bedroom and 1 three bedroom flats; formation of access; provision of associated parking, cycle storage and refuse storage (amended description). http://publicaccess2.croydon.gov.uk/online-applications/applicationDetails.do?activeTab=summary&keyVal=ZZZW0DJLXB386",local-authority-eng:CRY,not owned by a public authority,2016-02-16,http://publicaccess2.croydon.gov.uk/online-applications/applicationDetails.do?activeTab=summary&keyVal=ZZZW0DJLXB386,permissioned,full planning permission,POINT(-0.087555 51.3723),15/05542/P,http://publicaccess2.croydon.gov.uk/online-applications/applicationDetails.do?activeTab=summary&keyVal=ZZZW0DJLXB386,2017-12-31,brownfield-land/local-authority-eng/CRY/15-05542-P
"Electric House, 3, Wellesley Road",yes,,2017-12-31,,2.699,40,40,"Internal alterations and clean external elevations of the existing buildings, replacement windows and change of use to provide a mixed use conversion including 40 residential units and 2,810m2 (GIA) commercial space (flexible A1/A2/A3/D1/D2 uses) including associated car parking, cycle parking, hard and soft landscaping and refuse and recycling facilities.. http://publicaccess2.croydon.gov.uk/online-applications/applicationDetails.do?activeTab=summary&keyVal=ZZZW0DJLXB869",local-authority-eng:CRY,not owned by a public authority,2016-06-30,http://publicaccess2.croydon.gov.uk/online-applications/applicationDetails.do?activeTab=summary&keyVal=ZZZW0DJLXB869,permissioned,full planning permission,POINT(-0.097639 51.374767),15/05761/P,http://publicaccess2.croydon.gov.uk/online-applications/applicationDetails.do?activeTab=summary&keyVal=ZZZW0DJLXB869,2017-12-31,brownfield-land/local-authority-eng/CRY/15-05761-P
"393, Wickham Road",yes,,2017-12-31,,0.08,6,6,Demolition of the existing dwelling; erection of a three storey building with lower ground floor comprising 7 two bedroom flats with associated access and forecourt parking. http://publicaccess2.croydon.gov.uk/online-applications/applicationDetails.do?activeTab=summary&keyVal=ONIQJHJLGYE00,local-authority-eng:CRY,not owned by a public authority,2016-08-04,http://publicaccess2.croydon.gov.uk/online-applications/applicationDetails.do?activeTab=summary&keyVal=ONIQJHJLGYE00,permissioned,full planning permission,POINT(-0.041766 51.376283),16/00274/P,http://publicaccess2.croydon.gov.uk/online-applications/applicationDetails.do?activeTab=summary&keyVal=ONIQJHJLGYE00,2017-12-31,brownfield-land/local-authority-eng/CRY/16-00274-P
"9, Dickensons Lane",yes,,2017-12-31,,0.08,5,5,"Demolition of existing commercial buildings; erection of a terrace of five, three-storey, three-bedroom houses and provision of parking spaces.. http://publicaccess2.croydon.gov.uk/online-applications/applicationDetails.do?activeTab=summary&keyVal=ZZZW0CJLXB555",local-authority-eng:CRY,not owned by a public authority,2016-04-12,http://publicaccess2.croydon.gov.uk/online-applications/applicationDetails.do?activeTab=summary&keyVal=ZZZW0CJLXB555,permissioned,full planning permission,POINT(-0.071369 51.388555),16/00609/P,http://publicaccess2.croydon.gov.uk/online-applications/applicationDetails.do?activeTab=summary&keyVal=ZZZW0CJLXB555,2017-12-31,brownfield-land/local-authority-eng/CRY/16-00609-P
"Ye Olde Clocktower Public House, 35, Whitehorse Road",yes,,2017-12-31,,0.024,5,5,"Alterations ; Provision of rear garden associated to existing pub use; Erection of ground and first floor extensions ; construction of an additional two floors; use of first, second and third floors as 5 two bedroom flats ; provision of associated refuse storage and cycle storage to rear (amended description). http://publicaccess2.croydon.gov.uk/online-applications/applicationDetails.do?activeTab=summary&keyVal=ZZZW0CJLXB116",local-authority-eng:CRY,not owned by a public authority,2016-04-29,http://publicaccess2.croydon.gov.uk/online-applications/applicationDetails.do?activeTab=summary&keyVal=ZZZW0CJLXB116,permissioned,full planning permission,POINT(-0.09795 51.384601),16/01048/P,http://publicaccess2.croydon.gov.uk/online-applications/applicationDetails.do?activeTab=summary&keyVal=ZZZW0CJLXB116,2017-12-31,brownfield-land/local-authority-eng/CRY/16-01048-P
"173, Brigstock Road",yes,,2017-12-31,,0.042,11,11,Use as a house in multiple occupation with 11 Bedsits; erection of single storey side/rear extension and dormer extension in rear roof slope.. http://publicaccess2.croydon.gov.uk/online-applications/applicationDetails.do?activeTab=summary&keyVal=ZZZW0CJLXB093,local-authority-eng:CRY,not owned by a public authority,2016-10-18,http://publicaccess2.croydon.gov.uk/online-applications/applicationDetails.do?activeTab=summary&keyVal=ZZZW0CJLXB093,permissioned,full planning permission,POINT(-0.113063 51.393478),16/01087/P,http://publicaccess2.croydon.gov.uk/online-applications/applicationDetails.do?activeTab=summary&keyVal=ZZZW0CJLXB093,2017-12-31,brownfield-land/local-authority-eng/CRY/16-01087-P
"73-81, Addington Road",yes,,2017-12-31,,0.2,32,32,"Demolition of existing buildings; erection of a two/three storey building to provide 37 sheltered flats for the elderly (comprising 22 one bedroom and 15 two bedroom flats); communal facilities; formation of vehicular access, provision of 14 car parking spaces, and associated landscaping. http://publicaccess2.croydon.gov.uk/online-applications/simpleSearchResults.do?action=firstPage",local-authority-eng:CRY,not owned by a public authority,2016-10-07,http://publicaccess2.croydon.gov.uk/online-applications/simpleSearchResults.do?action=firstPage,permissioned,full planning permission,POINT(-0.066249 51.341555),16/01371/P,http://publicaccess2.croydon.gov.uk/online-applications/simpleSearchResults.do?action=firstPage,2017-12-31,brownfield-land/local-authority-eng/CRY/16-01371-P
