site-address,deliverable,end-date,entry-date,hazardous-substances,hectares,maximum-net-dwellings,minimum-net-dwellings,notes,organisation,ownership-status,planning-permission-date,planning-permission-history,planning-permission-status,planning-permission-type,point,site,site-plan-url,start-date,slug
"226, Whitehorse Road",yes,,2017-12-31,,0.1,9,9,External alterations associated with the refurbishment and reconfiguration of the existing building for class B1 use; construction of first and second floor extension to create 4 three bedroom and 5 two bedroom flats; provision of associated parking and landscaping works.. http://publicaccess2.croydon.gov.uk/online-applications/applicationDetails.do?activeTab=summary&keyVal=ZZZW0BJLXB556,local-authority-eng:CRY,not owned by a public authority,2016-06-13,http://publicaccess2.croydon.gov.uk/online-applications/applicationDetails.do?activeTab=summary&keyVal=ZZZW0BJLXB556,permissioned,full planning permission,POINT(-0.093934 51.390282),16/01614/P,http://publicaccess2.croydon.gov.uk/online-applications/applicationDetails.do?activeTab=summary&keyVal=ZZZW0BJLXB556,2017-12-31,brownfield-land/local-authority-eng/CRY/16-01614-P
"121-123, Lower Addiscombe Road",yes,,2017-12-31,,0.06,5,5,"Demolition of existing buildings at rear and erection of single storey building at rear for use as MOT centre; Alterations and use of main building as 5 two bedroom, 3 one bedroom and 1 three bedroom flats; erection of a three storey rear and basement extension; provision of 4no. car parking spaces and asociated vehicular crossovers. http://publicaccess2.croydon.gov.uk/online-applications/applicationDetails.do?activeTab=summary&keyVal=ZZZW0CJLXB267",local-authority-eng:CRY,not owned by a public authority,2016-09-22,http://publicaccess2.croydon.gov.uk/online-applications/applicationDetails.do?activeTab=summary&keyVal=ZZZW0CJLXB267,permissioned,full planning permission,POINT(-0.081935 51.379574),16/01683/P,http://publicaccess2.croydon.gov.uk/online-applications/applicationDetails.do?activeTab=summary&keyVal=ZZZW0CJLXB267,2017-12-31,brownfield-land/local-authority-eng/CRY/16-01683-P
"35, Cornwall Road",yes,,2017-12-31,,0.2,32,32,Demolition of existing buildings; erection of four storey building comprising 13 one bedroom 16 two bedroom and 3 three bedroom flats formation of vehicular access and provision of landscaping and associated parking spaces. http://publicaccess2.croydon.gov.uk/online-applications/applicationDetails.do?activeTab=summary&keyVal=ZZZW0BJLXB669,local-authority-eng:CRY,not owned by a public authority,2016-12-15,http://publicaccess2.croydon.gov.uk/online-applications/applicationDetails.do?activeTab=summary&keyVal=ZZZW0BJLXB669,permissioned,full planning permission,POINT(-0.109654 51.375762),16/01880/P,http://publicaccess2.croydon.gov.uk/online-applications/applicationDetails.do?activeTab=summary&keyVal=ZZZW0BJLXB669,2017-12-31,brownfield-land/local-authority-eng/CRY/16-01880-P
"23, Melville Avenue",yes,,2017-12-31,,0.08,5,5,"Alterations; use of building as 5 two bedroom flats; erection of two/three storey rear extension with accommodation in roofspace and first floor side extension including balconies; erection of rear raised patio with pergola; formation of vehicular access and provision of associated parking, boundary wall railings and gate and cycle and refuse store. http://publicaccess2.croydon.gov.uk/online-applications/applicationDetails.do?activeTab=summary&keyVal=ZZZW0BJLXB043",local-authority-eng:CRY,not owned by a public authority,2016-08-04,http://publicaccess2.croydon.gov.uk/online-applications/applicationDetails.do?activeTab=summary&keyVal=ZZZW0BJLXB043,permissioned,full planning permission,POINT(-0.079308 51.361293),16/02023/P,http://publicaccess2.croydon.gov.uk/online-applications/applicationDetails.do?activeTab=summary&keyVal=ZZZW0BJLXB043,2017-12-31,brownfield-land/local-authority-eng/CRY/16-02023-P
"1516, London Road",yes,,2017-12-31,,0.145,22,22,"Alterations and refurbishment of the existing police station to provide 188m2 D1/D2 floorspace on the ground floor and 8 one bedroom flats on first and second floors; erection of three/four storey building at rear comprising 8 three bedroom,5 two bedroom and 1 one bedroom flats; provision of associated landscaping, cycle parking, refuse storage and ancillary works. http://publicaccess2.croydon.gov.uk/online-applications/applicationDetails.do?activeTab=summary&keyVal=ZZZW0AJLXB929",local-authority-eng:CRY,not owned by a public authority,2017-05-12,http://publicaccess2.croydon.gov.uk/online-applications/applicationDetails.do?activeTab=summary&keyVal=ZZZW0AJLXB929,permissioned,full planning permission,POINT(-0.12399 51.413078),16/02158/P,http://publicaccess2.croydon.gov.uk/online-applications/applicationDetails.do?activeTab=summary&keyVal=ZZZW0AJLXB929,2017-12-31,brownfield-land/local-authority-eng/CRY/16-02158-P
"Land North Of Shannon Court, 1, Tavistock Road",yes,,2017-12-31,,0.078,5,5,"Erection of three storey building comprising of 4 two bedroom and, 1 one bedroom flats and provision of bicycle parking and bin storage. http://publicaccess2.croydon.gov.uk/online-applications/applicationDetails.do?activeTab=summary&keyVal=ZZZW0BJLXB346",local-authority-eng:CRY,not owned by a public authority,2016-10-13,http://publicaccess2.croydon.gov.uk/online-applications/applicationDetails.do?activeTab=summary&keyVal=ZZZW0BJLXB346,permissioned,full planning permission,POINT(-0.097644 51.379866),16/02362/P,http://publicaccess2.croydon.gov.uk/online-applications/applicationDetails.do?activeTab=summary&keyVal=ZZZW0BJLXB346,2017-12-31,brownfield-land/local-authority-eng/CRY/16-02362-P
"10, Blunt Road",yes,,2017-12-31,,0.041,6,6,"Demolition of existing house; erection of a three / four storey building containing 1 x one bedroom, 5 x two bedroom and 1 x three bedroom flats; Provision of one parking space and associated landscaping.. http://publicaccess2.croydon.gov.uk/online-applications/applicationDetails.do?activeTab=summary&keyVal=ZZZW0AJLXB169",local-authority-eng:CRY,not owned by a public authority,2016-08-24,http://publicaccess2.croydon.gov.uk/online-applications/applicationDetails.do?activeTab=summary&keyVal=ZZZW0AJLXB169,permissioned,full planning permission,POINT(-0.094079 51.362919),16/03181/P,http://publicaccess2.croydon.gov.uk/online-applications/applicationDetails.do?activeTab=summary&keyVal=ZZZW0AJLXB169,2017-12-31,brownfield-land/local-authority-eng/CRY/16-03181-P
"47, Shirley Road",yes,,2017-12-31,,0.19,18,18,"Erection of 6 two storey buildings with accomodation in roofspace comprising 6 one bedroom, 8 two bedroom and 4 three bedroom flats; formation of access road and provision of associated parking, cycle and refuse. http://publicaccess2.croydon.gov.uk/online-applications/applicationDetails.do?activeTab=summary&keyVal=ZZZW0AJLXB110",local-authority-eng:CRY,not owned by a public authority,2017-03-10,http://publicaccess2.croydon.gov.uk/online-applications/applicationDetails.do?activeTab=summary&keyVal=ZZZW0AJLXB110,permissioned,full planning permission,POINT(-0.062777 51.381308),16/03514/P,http://publicaccess2.croydon.gov.uk/online-applications/applicationDetails.do?activeTab=summary&keyVal=ZZZW0AJLXB110,2017-12-31,brownfield-land/local-authority-eng/CRY/16-03514-P
"Surrey House, 2, Scarbrook Road",yes,,2017-12-31,,0.091,6,6,Alterations; use of first floor as 4 one bedroom and 2 two bedroom flats.. http://publicaccess2.croydon.gov.uk/online-applications/applicationDetails.do?activeTab=summary&keyVal=ZZZW09JLXB555,local-authority-eng:CRY,not owned by a public authority,2016-09-27,http://publicaccess2.croydon.gov.uk/online-applications/applicationDetails.do?activeTab=summary&keyVal=ZZZW09JLXB555,permissioned,full planning permission,POINT(-0.100951 51.371835),16/03773/P,http://publicaccess2.croydon.gov.uk/online-applications/applicationDetails.do?activeTab=summary&keyVal=ZZZW09JLXB555,2017-12-31,brownfield-land/local-authority-eng/CRY/16-03773-P
"169-183, Brighton Road",yes,,2017-12-31,,0.292,26,26,"Demolition of the existing frontage buildings; erection of 3 two storey buildings with accommodation in roofspace comprising 21 one bedroom, 9 two bedroom and 3 three bedroom flats; formation of vehicular accesses and provision of associated parking. http://publicaccess2.croydon.gov.uk/online-applications/applicationDetails.do?activeTab=summary&keyVal=ZZZW09JLXB509",local-authority-eng:CRY,not owned by a public authority,2016-10-28,http://publicaccess2.croydon.gov.uk/online-applications/applicationDetails.do?activeTab=summary&keyVal=ZZZW09JLXB509,permissioned,full planning permission,POINT(-0.126778 51.328644),16/03859/P,http://publicaccess2.croydon.gov.uk/online-applications/applicationDetails.do?activeTab=summary&keyVal=ZZZW09JLXB509,2017-12-31,brownfield-land/local-authority-eng/CRY/16-03859-P
"7-11, High Street",yes,,2017-12-31,,0.1,9,9,Alteration and erection of extensions at first and second floors and use of these upper floors as 5 one bedroom and 4 two bedroom flats. http://publicaccess2.croydon.gov.uk/online-applications/applicationDetails.do?activeTab=summary&keyVal=OBORR2JLGLJ00,local-authority-eng:CRY,not owned by a public authority,2017-02-28,http://publicaccess2.croydon.gov.uk/online-applications/applicationDetails.do?activeTab=summary&keyVal=OBORR2JLGLJ00,permissioned,full planning permission,POINT(-0.100095 51.373422),16/04113/FUL,http://publicaccess2.croydon.gov.uk/online-applications/applicationDetails.do?activeTab=summary&keyVal=OBORR2JLGLJ00,2017-12-31,brownfield-land/local-authority-eng/CRY/16-04113-FUL
"108, Purley Downs Road",yes,,2017-12-31,,0.39,7,7,"Demolition of the existing buildings and the construction of 8 four bedroom two storey detached houses with accomodation in roofspace. Provision for access, parking and landscaping.. http://publicaccess2.croydon.gov.uk/online-applications/applicationDetails.do?activeTab=summary&keyVal=ON83BMJLGRN00",local-authority-eng:CRY,not owned by a public authority,2017-01-20,http://publicaccess2.croydon.gov.uk/online-applications/applicationDetails.do?activeTab=summary&keyVal=ON83BMJLGRN00,permissioned,full planning permission,POINT(-0.089954 51.33742),16/04186/FUL,http://publicaccess2.croydon.gov.uk/online-applications/applicationDetails.do?activeTab=summary&keyVal=ON83BMJLGRN00,2017-12-31,brownfield-land/local-authority-eng/CRY/16-04186-FUL
"49 - 53, High Street",yes,,2017-12-31,,0.08,6,6,"Alterations; conversion of the first and second floor to residential use including loft extension to comprise 2 one bedroom, 2 two bedroom and 2 three bedroom flats. http://publicaccess2.croydon.gov.uk/online-applications/applicationDetails.do?activeTab=summary&keyVal=OCF1QJJLH5W00",local-authority-eng:CRY,not owned by a public authority,2016-10-25,http://publicaccess2.croydon.gov.uk/online-applications/applicationDetails.do?activeTab=summary&keyVal=OCF1QJJLH5W00,permissioned,full planning permission,POINT(-0.100066 51.372036),16/04420/FUL,http://publicaccess2.croydon.gov.uk/online-applications/applicationDetails.do?activeTab=summary&keyVal=OCF1QJJLH5W00,2017-12-31,brownfield-land/local-authority-eng/CRY/16-04420-FUL
"Works, 23-31, Dennett Road",yes,,2017-12-31,,0.068,12,12,"Erection of three storey building to provide 7 studio and 5 one bedroom flats and a meeting room for the use of people recovering from mental ill health, and associated landscaping works. http://publicaccess2.croydon.gov.uk/online-applications/applicationDetails.do?activeTab=summary&keyVal=OCGE57JLH6D00",local-authority-eng:CRY,not owned by a public authority,2016-12-07,http://publicaccess2.croydon.gov.uk/online-applications/applicationDetails.do?activeTab=summary&keyVal=OCGE57JLH6D00,permissioned,full planning permission,POINT(-0.110569 51.383537),16/04426/FUL,http://publicaccess2.croydon.gov.uk/online-applications/applicationDetails.do?activeTab=summary&keyVal=OCGE57JLH6D00,2017-12-31,brownfield-land/local-authority-eng/CRY/16-04426-FUL
"1-3 Bridge Brigade, Waddon Road",yes,,2017-12-31,,0.037,9,9,Alterations; conversion to form 2 two bedroom and 7 one bedroom flats and construction of first floor level with dormer extensions. Provision of amenity space and bike storage. http://publicaccess2.croydon.gov.uk/online-applications/applicationDetails.do?activeTab=summary&keyVal=OCS5WNJLHDO00,local-authority-eng:CRY,not owned by a public authority,2016-11-09,http://publicaccess2.croydon.gov.uk/online-applications/applicationDetails.do?activeTab=summary&keyVal=OCS5WNJLHDO00,permissioned,full planning permission,POINT(-0.111671 51.371774),16/04519/FUL,http://publicaccess2.croydon.gov.uk/online-applications/applicationDetails.do?activeTab=summary&keyVal=OCS5WNJLHDO00,2017-12-31,brownfield-land/local-authority-eng/CRY/16-04519-FUL
"2, Plough Lane",yes,,2017-12-31,,0.1,18,18,"Demolition of no.2 Plough Lane. Erection of 1 four storey building with accommodation in roofspace and 1 two storey building comprising 6 one bedroom, 12 two bedroom and 1 three bedroom flats. Formation of vehicular access and provision of associated car parking (12 spaces, 10 standard and 2 disabled spaces), cycle parking (32 spaces) and landscaping.. http://publicaccess2.croydon.gov.uk/online-applications/applicationDetails.do?activeTab=summary&keyVal=OCS5XWJLHDQ00",local-authority-eng:CRY,not owned by a public authority,2017-03-01,http://publicaccess2.croydon.gov.uk/online-applications/applicationDetails.do?activeTab=summary&keyVal=OCS5XWJLHDQ00,permissioned,full planning permission,POINT(-0.122807 51.341171),16/04520/FUL,http://publicaccess2.croydon.gov.uk/online-applications/applicationDetails.do?activeTab=summary&keyVal=OCS5XWJLHDQ00,2017-12-31,brownfield-land/local-authority-eng/CRY/16-04520-FUL
"45, Enmore Road",yes,,2017-12-31,,0.2,7,7,"Demolition of a single storey garage block. Erection of 2 three bedroom and 1 two bedroom houses and a three storey building comprising 3 one bedroom and 1 two bedroom flats. Construction one new refuse store to the front of the site, and one replacement refuse store to the rear. Associated landscaping works.. http://publicaccess2.croydon.gov.uk/online-applications/applicationDetails.do?activeTab=summary&keyVal=ODEFDEJLHS700",local-authority-eng:CRY,not owned by a public authority,2016-12-05,http://publicaccess2.croydon.gov.uk/online-applications/applicationDetails.do?activeTab=summary&keyVal=ODEFDEJLHS700,permissioned,full planning permission,POINT(-0.071346 51.39252),16/04727/FUL,http://publicaccess2.croydon.gov.uk/online-applications/applicationDetails.do?activeTab=summary&keyVal=ODEFDEJLHS700,2017-12-31,brownfield-land/local-authority-eng/CRY/16-04727-FUL
"349, Grange Road",yes,,2017-12-31,,0.15,8,8,Alterations ; Alterations to existing building; erection of extension to side of building to form lift core; construction of roof extension to form an additional 4 one bedroom flats; erection of two storey building to rear to form terrace of 4 two bedroom townhouses; provision of associated vehicle access and parking ; provision of associated refuse and cycle stores (amended description). http://publicaccess2.croydon.gov.uk/online-applications/applicationDetails.do?activeTab=summary&keyVal=ODFKV3JLHSD00,local-authority-eng:CRY,not owned by a public authority,2016-11-16,http://publicaccess2.croydon.gov.uk/online-applications/applicationDetails.do?activeTab=summary&keyVal=ODFKV3JLHSD00,permissioned,full planning permission,POINT(-0.089486 51.40976),16/04729/FUL,http://publicaccess2.croydon.gov.uk/online-applications/applicationDetails.do?activeTab=summary&keyVal=ODFKV3JLHSD00,2017-12-31,brownfield-land/local-authority-eng/CRY/16-04729-FUL
"10, Croham Valley Road",yes,,2017-12-31,,0.1,7,7,"Demolition of existing dwelling, erection of a building comprising 8 two bedroom flats, formation of vehicular access and provision of parking area with 8 spaces, cycle and refuse stores.. http://publicaccess2.croydon.gov.uk/online-applications/applicationDetails.do?activeTab=summary&keyVal=ODW8SQJLI4C00",local-authority-eng:CRY,not owned by a public authority,2017-05-12,http://publicaccess2.croydon.gov.uk/online-applications/applicationDetails.do?activeTab=summary&keyVal=ODW8SQJLI4C00,permissioned,outline planning permission,POINT(-0.076883 51.357458),16/04907/OUT,http://publicaccess2.croydon.gov.uk/online-applications/applicationDetails.do?activeTab=summary&keyVal=ODW8SQJLI4C00,2017-12-31,brownfield-land/local-authority-eng/CRY/16-04907-OUT
"98, Hyde Road",yes,,2017-12-31,,0.1,6,6,"Demolition of existing dwelling. Erection of a building with lower ground floor and accomodation in roofspace comprising 7 two bedroom apartments. formation of revised vehicular access and provision of associated parking spaces, bicycle storages and refuse store.. http://publicaccess2.croydon.gov.uk/online-applications/applicationDetails.do?activeTab=summary&keyVal=OE9SD9JLIHN00",local-authority-eng:CRY,not owned by a public authority,2017-02-14,http://publicaccess2.croydon.gov.uk/online-applications/applicationDetails.do?activeTab=summary&keyVal=OE9SD9JLIHN00,permissioned,full planning permission,POINT(-0.093012 51.331193),16/05057/FUL,http://publicaccess2.croydon.gov.uk/online-applications/applicationDetails.do?activeTab=summary&keyVal=OE9SD9JLIHN00,2017-12-31,brownfield-land/local-authority-eng/CRY/16-05057-FUL
"2 Willis Court, Dunheved Road North",yes,,2017-12-31,,0.03,7,7,"Alterations to roof ; Construction of third floor to provide 1 one bed room, 4 two bedroom and 2 studio flats, alterations to street facade South elevation ; alterations to parking layout and provision of associated parking ; provision of refuse and cycle storage (amended description). http://publicaccess2.croydon.gov.uk/online-applications/applicationDetails.do?activeTab=summary&keyVal=OEMHBAJLIQU00",local-authority-eng:CRY,not owned by a public authority,2017-01-11,http://publicaccess2.croydon.gov.uk/online-applications/applicationDetails.do?activeTab=summary&keyVal=OEMHBAJLIQU00,permissioned,full planning permission,POINT(-0.114041 51.391021),16/05198/FUL,http://publicaccess2.croydon.gov.uk/online-applications/applicationDetails.do?activeTab=summary&keyVal=OEMHBAJLIQU00,2017-12-31,brownfield-land/local-authority-eng/CRY/16-05198-FUL
"32a, Reedham Drive",yes,,2017-12-31,,0.1,7,7,"Demolition of existing building and erection of four storey building comprising 4 two bedroom and 3 three bedroom flats, associated parking and refuse store. http://publicaccess2.croydon.gov.uk/online-applications/applicationDetails.do?activeTab=summary&keyVal=OEXPJDJLIXH00",local-authority-eng:CRY,not owned by a public authority,2017-03-24,http://publicaccess2.croydon.gov.uk/online-applications/applicationDetails.do?activeTab=summary&keyVal=OEXPJDJLIXH00,permissioned,full planning permission,POINT(-0.118773 51.328885),16/05287/FUL,http://publicaccess2.croydon.gov.uk/online-applications/applicationDetails.do?activeTab=summary&keyVal=OEXPJDJLIXH00,2017-12-31,brownfield-land/local-authority-eng/CRY/16-05287-FUL
"759, London Road",yes,,2017-12-31,,0.03,6,6,Erection of three storey building in car park comprising 6 one bedroom flats. http://publicaccess2.croydon.gov.uk/online-applications/applicationDetails.do?activeTab=summary&keyVal=OFALDTJLJ5J00,local-authority-eng:CRY,not owned by a public authority,2017-01-09,http://publicaccess2.croydon.gov.uk/online-applications/applicationDetails.do?activeTab=summary&keyVal=OFALDTJLJ5J00,permissioned,full planning permission,POINT(-0.115298 51.394018),16/05397/FUL,http://publicaccess2.croydon.gov.uk/online-applications/applicationDetails.do?activeTab=summary&keyVal=OFALDTJLJ5J00,2017-12-31,brownfield-land/local-authority-eng/CRY/16-05397-FUL
"37a, Smitham Bottoms Lane",yes,,2017-12-31,,0.032,5,5,"Alterations and erection of a two storey rear extension with extension to the existing roof to provide 2 one bedroom and 3 two bedroom flats. Provision of associated parking, cycle and refuse storage. http://publicaccess2.croydon.gov.uk/online-applications/applicationDetails.do?activeTab=summary&keyVal=OFLQSCJLJCN00",local-authority-eng:CRY,not owned by a public authority,2017-01-20,http://publicaccess2.croydon.gov.uk/online-applications/applicationDetails.do?activeTab=summary&keyVal=OFLQSCJLJCN00,permissioned,full planning permission,POINT(-0.13934 51.334267),16/05498/FUL,http://publicaccess2.croydon.gov.uk/online-applications/applicationDetails.do?activeTab=summary&keyVal=OFLQSCJLJCN00,2017-12-31,brownfield-land/local-authority-eng/CRY/16-05498-FUL
"84-146, Mayday Road",yes,,2017-12-31,,0.043,9,9,Erection of four storey building comprising 8 one bedroom and 1 two bedroom flats. formation of vehicular access and provision of associated parking. http://publicaccess2.croydon.gov.uk/online-applications/applicationDetails.do?activeTab=summary&keyVal=OFM1XWJLJD500,local-authority-eng:CRY,not owned by a public authority,2016-12-22,http://publicaccess2.croydon.gov.uk/online-applications/applicationDetails.do?activeTab=summary&keyVal=OFM1XWJLJD500,permissioned,full planning permission,POINT(-0.115123 51.39442),16/05502/FUL,http://publicaccess2.croydon.gov.uk/online-applications/applicationDetails.do?activeTab=summary&keyVal=OFM1XWJLJD500,2017-12-31,brownfield-land/local-authority-eng/CRY/16-05502-FUL
"36, Beulah Road",yes,,2017-12-31,,0.096,9,9,"Demolition of existing buildings ; Erection of a three storey building comprising 6 one bedroom, and 3 two bedroom flats; provision of associated parking, provision of refuse and cycle storage. http://publicaccess2.croydon.gov.uk/online-applications/applicationDetails.do?activeTab=summary&keyVal=OFNWKZJLJEJ00",local-authority-eng:CRY,not owned by a public authority,2017-01-25,http://publicaccess2.croydon.gov.uk/online-applications/applicationDetails.do?activeTab=summary&keyVal=OFNWKZJLJEJ00,permissioned,full planning permission,POINT(-0.101195 51.400993),16/05522/FUL,http://publicaccess2.croydon.gov.uk/online-applications/applicationDetails.do?activeTab=summary&keyVal=OFNWKZJLJEJ00,2017-12-31,brownfield-land/local-authority-eng/CRY/16-05522-FUL
"745, London Road",yes,,2017-12-31,,0.069,20,20,"Demolition of existing public house and erection of four / five storey mixed use development comprising use within A1 (retail) or B1 (business) on part ground floor and 4 one bedroom, 8 two bedroom, 8 three bedroom flats in remainder of building, formation of part basement storage / plant room and associated parking. http://publicaccess2.croydon.gov.uk/online-applications/applicationDetails.do?activeTab=summary&keyVal=OGSRIKJLK4P00",local-authority-eng:CRY,not owned by a public authority,2017-03-09,http://publicaccess2.croydon.gov.uk/online-applications/applicationDetails.do?activeTab=summary&keyVal=OGSRIKJLK4P00,permissioned,full planning permission,POINT(-0.114883 51.393625),16/05856/FUL,http://publicaccess2.croydon.gov.uk/online-applications/applicationDetails.do?activeTab=summary&keyVal=OGSRIKJLK4P00,2017-12-31,brownfield-land/local-authority-eng/CRY/16-05856-FUL
"The Horseshoe Public House, 745, London Road",yes,,2017-12-31,,0.068,20,20,"Demolition of existing public house and erection of four / five storey mixed use development comprising use within A1 (retail) or B1 (business) on part ground floor and 4 one bedroom, 8 two bedroom, 8 three bedroom flats in remainder of building, formation of part basement storage / plant room and associated parking. http://publicaccess2.croydon.gov.uk/online-applications/applicationDetails.do?activeTab=summary&keyVal=OGSRIKJLK4P00",local-authority-eng:CRY,not owned by a public authority,2017-05-18,http://publicaccess2.croydon.gov.uk/online-applications/applicationDetails.do?activeTab=summary&keyVal=OGSRIKJLK4P00,permissioned,full planning permission,POINT(-0.114883 51.393625),16/05856/P,http://publicaccess2.croydon.gov.uk/online-applications/applicationDetails.do?activeTab=summary&keyVal=OGSRIKJLK4P00,2017-12-31,brownfield-land/local-authority-eng/CRY/16-05856-P
"83, 85 & 113, Hermitage Road",yes,,2017-12-31,,0.128,9,9,"Erection of a part three part four storey building comprising no. 6 two bedroom and 1 one bedroom flats and 1 two storey two bedroom and 1 three storey three bedroom house together with car parking, landscaping and associated works. http://publicaccess2.croydon.gov.uk/online-applications/applicationDetails.do?activeTab=summary&keyVal=OGZXRKJLK8E00",local-authority-eng:CRY,not owned by a public authority,2017-04-27,http://publicaccess2.croydon.gov.uk/online-applications/applicationDetails.do?activeTab=summary&keyVal=OGZXRKJLK8E00,permissioned,full planning permission,POINT(-0.094842 51.420323),16/05891/FUL,http://publicaccess2.croydon.gov.uk/online-applications/applicationDetails.do?activeTab=summary&keyVal=OGZXRKJLK8E00,2017-12-31,brownfield-land/local-authority-eng/CRY/16-05891-FUL
"226, Whitehorse Road",yes,,2017-12-31,,0.56,38,38,"Demolition of existing buildings. Erection of two and four storey buildings comprising a total of 12 one bedroom, 9 two bedroom and 11 three bedroom flats and 5 two bedroom and 1 one bedroom houses, provision of ancillary car parking, hard and soft landscaping. http://publicaccess2.croydon.gov.uk/online-applications/applicationDetails.do?activeTab=summary&keyVal=OQD4N0JLJ3J00",local-authority-eng:CRY,not owned by a public authority,2017-02-17,http://publicaccess2.croydon.gov.uk/online-applications/applicationDetails.do?activeTab=summary&keyVal=OQD4N0JLJ3J00,permissioned,full planning permission,POINT(-0.093978 51.390265),16/05972/FUL,http://publicaccess2.croydon.gov.uk/online-applications/applicationDetails.do?activeTab=summary&keyVal=OQD4N0JLJ3J00,2017-12-31,brownfield-land/local-authority-eng/CRY/16-05972-FUL
