site-address,deliverable,end-date,entry-date,hazardous-substances,hectares,maximum-net-dwellings,minimum-net-dwellings,notes,organisation,ownership-status,planning-permission-date,planning-permission-history,planning-permission-status,planning-permission-type,point,site,site-plan-url,start-date,slug
"20-20c, Oxford Road",yes,,2017-12-31,,0.13,5,5,"Demolition of existing demountable houses and erection of 4 two storey buildings comprising 5 two bedroom and 3 one bedroom flats and 1 three bedroom house with provision of associated car parking, landscaping and associated works.. http://publicaccess2.croydon.gov.uk/online-applications/applicationDetails.do?activeTab=summary&keyVal=OH6UCDJLKEF00",local-authority-eng:CRY,not owned by a public authority,2017-03-17,http://publicaccess2.croydon.gov.uk/online-applications/applicationDetails.do?activeTab=summary&keyVal=OH6UCDJLKEF00,permissioned,full planning permission,POINT(-0.092074 51.420827),16/05976/FUL,http://publicaccess2.croydon.gov.uk/online-applications/applicationDetails.do?activeTab=summary&keyVal=OH6UCDJLKEF00,2017-12-31,brownfield-land/local-authority-eng/CRY/16-05976-FUL
"122-124, Chertsey Crescent",yes,,2017-12-31,,0.09,7,7,Demolition of garages and erection of 4 two bedroom and 3 three bedroom houses with provision of landscaping and associated works.. http://publicaccess2.croydon.gov.uk/online-applications/applicationDetails.do?activeTab=summary&keyVal=OH7DV5JLKFD00,local-authority-eng:CRY,owned by a public authority,2017-04-11,http://publicaccess2.croydon.gov.uk/online-applications/applicationDetails.do?activeTab=summary&keyVal=OH7DV5JLKFD00,permissioned,full planning permission,POINT(-0.014734 51.339812),16/05998/FUL,http://publicaccess2.croydon.gov.uk/online-applications/applicationDetails.do?activeTab=summary&keyVal=OH7DV5JLKFD00,2017-12-31,brownfield-land/local-authority-eng/CRY/16-05998-FUL
"485-487, King Henry's Drive",yes,,2017-12-31,,0.07,7,7,"Demolition of garages and erection of four two/three storey buildings comprising 4 one bedroom, 1 two bedroom flats and 2 three bedroom houses, provision of car parking, landscaping and associated works.. http://publicaccess2.croydon.gov.uk/online-applications/applicationDetails.do?activeTab=summary&keyVal=OH7I3LJLKFK00",local-authority-eng:CRY,owned by a public authority,2017-04-07,http://publicaccess2.croydon.gov.uk/online-applications/applicationDetails.do?activeTab=summary&keyVal=OH7I3LJLKFK00,permissioned,full planning permission,POINT(0.000023 51.334751),16/06000/FUL,http://publicaccess2.croydon.gov.uk/online-applications/applicationDetails.do?activeTab=summary&keyVal=OH7I3LJLKFK00,2017-12-31,brownfield-land/local-authority-eng/CRY/16-06000-FUL
"89 - 157, Regina Road",yes,,2017-12-31,,0.34,19,19,"Demolition of garages. Erection of four storey building comprising 5 one bedroom and 6 two bedroom flats. Erection of 1 three bedroom and 2 one bedroom single storey houses and 5 two storey one bedroom houses with provision of car parking, landscaping and associated works.. http://publicaccess2.croydon.gov.uk/online-applications/applicationDetails.do?activeTab=summary&keyVal=OHCTSVJLKI000",local-authority-eng:CRY,owned by a public authority,2017-04-20,http://publicaccess2.croydon.gov.uk/online-applications/applicationDetails.do?activeTab=summary&keyVal=OHCTSVJLKI000,permissioned,full planning permission,POINT(-0.069319 51.401722),16/06023/FUL,http://publicaccess2.croydon.gov.uk/online-applications/applicationDetails.do?activeTab=summary&keyVal=OHCTSVJLKI000,2017-12-31,brownfield-land/local-authority-eng/CRY/16-06023-FUL
"Land East Of 22-32, Northbrook Road",yes,,2017-12-31,,0.056,11,11,"Erection of a three/ four storey building comprising 6 one bedroom and 5 two bedroom flats with provision of car parking, landscaping and associated works.. http://publicaccess2.croydon.gov.uk/online-applications/applicationDetails.do?activeTab=summary&keyVal=OHCTYBJLKI200",local-authority-eng:CRY,owned by a public authority,2017-04-07,http://publicaccess2.croydon.gov.uk/online-applications/applicationDetails.do?activeTab=summary&keyVal=OHCTYBJLKI200,permissioned,full planning permission,POINT(-0.094981 51.393123),16/06024/FUL,http://publicaccess2.croydon.gov.uk/online-applications/applicationDetails.do?activeTab=summary&keyVal=OHCTYBJLKI200,2017-12-31,brownfield-land/local-authority-eng/CRY/16-06024-FUL
"Malton House, 193, Selhurst Road",yes,,2017-12-31,,0.05,9,9,"Demolition of garages. erection of single/three storey building comprising 4 two bedroom and 5 one bedroom flats .provision of associated car parking, landscaping and associated works.. http://publicaccess2.croydon.gov.uk/online-applications/applicationDetails.do?activeTab=summary&keyVal=OHCWOEJLKIE00",local-authority-eng:CRY,owned by a public authority,2017-04-07,http://publicaccess2.croydon.gov.uk/online-applications/applicationDetails.do?activeTab=summary&keyVal=OHCWOEJLKIE00,permissioned,full planning permission,POINT(-0.083037 51.396516),16/06029/FUL,http://publicaccess2.croydon.gov.uk/online-applications/applicationDetails.do?activeTab=summary&keyVal=OHCWOEJLKIE00,2017-12-31,brownfield-land/local-authority-eng/CRY/16-06029-FUL
"94-96, Uvedale Crescent",yes,,2017-12-31,,0.08,6,6,"Demolition of garages and erection of 4 part single part two storey buildings comprising 2 houses and 4 flats with provision of car parking, landscaping and associated works.. http://publicaccess2.croydon.gov.uk/online-applications/applicationDetails.do?activeTab=summary&keyVal=OHCWU2JLKIG00",local-authority-eng:CRY,owned by a public authority,2017-04-13,http://publicaccess2.croydon.gov.uk/online-applications/applicationDetails.do?activeTab=summary&keyVal=OHCWU2JLKIG00,permissioned,full planning permission,POINT(-0.003363 51.336787),16/06030/FUL,http://publicaccess2.croydon.gov.uk/online-applications/applicationDetails.do?activeTab=summary&keyVal=OHCWU2JLKIG00,2017-12-31,brownfield-land/local-authority-eng/CRY/16-06030-FUL
"75-135, Kingsdown Avenue",yes,,2017-12-31,,1.3,34,34,"Demolition of existing garages and erection of 1 six storey building comprising 9 two bedroom, 1 one bedroom and 1 three bedroom flats, 1 four storey building comprising 4 two bedroom and 2 one bedroom flats and 13 three bedroom and 4 two bedroom houses. Provision of associated car parking, landscaping and associated works. http://publicaccess2.croydon.gov.uk/online-applications/applicationDetails.do?activeTab=summary&keyVal=OHCX5NJLKII00",local-authority-eng:CRY,owned by a public authority,2017-04-25,http://publicaccess2.croydon.gov.uk/online-applications/applicationDetails.do?activeTab=summary&keyVal=OHCX5NJLKII00,permissioned,full planning permission,POINT(-0.107112 51.345739),16/06031/FUL,http://publicaccess2.croydon.gov.uk/online-applications/applicationDetails.do?activeTab=summary&keyVal=OHCX5NJLKII00,2017-12-31,brownfield-land/local-authority-eng/CRY/16-06031-FUL
"15, South End",yes,,2017-12-31,,0.04,9,9,"Alterations and refurbishment for use of ground floor for the purposes within class A3 (restaurant), new shopfront, erection of first floor extension and construction of second and third floors. use of rear ground floor and upper floors as 6 one bedroom, 2 studio and 1 two bedroom flats.. http://publicaccess2.croydon.gov.uk/online-applications/applicationDetails.do?activeTab=summary&keyVal=OHIHTMJLKN000",local-authority-eng:CRY,not owned by a public authority,2017-01-25,http://publicaccess2.croydon.gov.uk/online-applications/applicationDetails.do?activeTab=summary&keyVal=OHIHTMJLKN000,permissioned,full planning permission,POINT(-0.098758 51.367177),16/06103/FUL,http://publicaccess2.croydon.gov.uk/online-applications/applicationDetails.do?activeTab=summary&keyVal=OHIHTMJLKN000,2017-12-31,brownfield-land/local-authority-eng/CRY/16-06103-FUL
"15, Purley Rise",yes,,2017-12-31,,0.1,7,7,Demolition of existing building and construction of a basement and two storeys plus roofspace building to provide 8 self contained flats. Provision of 4 car parking spaces and cycle and refuse store. http://publicaccess2.croydon.gov.uk/online-applications/applicationDetails.do?activeTab=summary&keyVal=OHXHRCJL0DU00,local-authority-eng:CRY,not owned by a public authority,2017-05-17,http://publicaccess2.croydon.gov.uk/online-applications/applicationDetails.do?activeTab=summary&keyVal=OHXHRCJL0DU00,permissioned,full planning permission,POINT(-0.122306 51.335173),16/06245/FUL,http://publicaccess2.croydon.gov.uk/online-applications/applicationDetails.do?activeTab=summary&keyVal=OHXHRCJL0DU00,2017-12-31,brownfield-land/local-authority-eng/CRY/16-06245-FUL
"25-39, Drovers Road",yes,,2017-12-31,,0.15,9,9,"Erection of a three-storey building comprising 9 one bedroom flats together with provision of car parking, landscaping and other associated works. http://publicaccess2.croydon.gov.uk/online-applications/applicationDetails.do?activeTab=summary&keyVal=OI327DJLL0G00",local-authority-eng:CRY,not owned by a public authority,2017-06-23,http://publicaccess2.croydon.gov.uk/online-applications/applicationDetails.do?activeTab=summary&keyVal=OI327DJLL0G00,permissioned,full planning permission,POINT(-0.096691 51.361244),16/06276/FUL,http://publicaccess2.croydon.gov.uk/online-applications/applicationDetails.do?activeTab=summary&keyVal=OI327DJLL0G00,2017-12-31,brownfield-land/local-authority-eng/CRY/16-06276-FUL
"38-40, Thorneloe Gardens",yes,,2017-12-31,,0.1,10,10,"Demolition of garages and erection of a two to three-storey building comprising 6 one bedroom and 4 two bedroom flats together with car parking, landscaping and other associated works.. http://publicaccess2.croydon.gov.uk/online-applications/applicationDetails.do?activeTab=summary&keyVal=OI8I4SJLL4K00",local-authority-eng:CRY,not owned by a public authority,2017-06-22,http://publicaccess2.croydon.gov.uk/online-applications/applicationDetails.do?activeTab=summary&keyVal=OI8I4SJLL4K00,permissioned,full planning permission,POINT(-0.111495 51.361052),16/06337/FUL,http://publicaccess2.croydon.gov.uk/online-applications/applicationDetails.do?activeTab=summary&keyVal=OI8I4SJLL4K00,2017-12-31,brownfield-land/local-authority-eng/CRY/16-06337-FUL
"19-21, Russell Hill",yes,,2017-12-31,,0.3,20,20,"Demolition of existing buildings, erection of two storey detached building with basement and accomodation in roofspace comprising 2 three bedroom, 5 two bedroom and 9 one bedroom flats and erection of 6 three bedroom semi detached house. Provision of associated access, parking and landscaping.. http://publicaccess2.croydon.gov.uk/online-applications/applicationDetails.do?activeTab=summary&keyVal=OI9UILJLL5500",local-authority-eng:CRY,not owned by a public authority,2017-08-14,http://publicaccess2.croydon.gov.uk/online-applications/applicationDetails.do?activeTab=summary&keyVal=OI9UILJLL5500,permissioned,full planning permission,POINT(-0.123594 51.342289),16/06352/FUL,http://publicaccess2.croydon.gov.uk/online-applications/applicationDetails.do?activeTab=summary&keyVal=OI9UILJLL5500,2017-12-31,brownfield-land/local-authority-eng/CRY/16-06352-FUL
"Land Adjacent To, Academy Gardens",yes,,2017-12-31,,0.153,9,9,Erection of a three-storey building comprising 9 one bedroom with landscaping and other associated works. http://publicaccess2.croydon.gov.uk/online-applications/applicationDetails.do?activeTab=summary&keyVal=OIAGVIJLL6B00,local-authority-eng:CRY,owned by a public authority,2017-06-01,http://publicaccess2.croydon.gov.uk/online-applications/applicationDetails.do?activeTab=summary&keyVal=OIAGVIJLL6B00,permissioned,full planning permission,POINT(-0.079247 51.379242),16/06366/FUL,http://publicaccess2.croydon.gov.uk/online-applications/applicationDetails.do?activeTab=summary&keyVal=OIAGVIJLL6B00,2017-12-31,brownfield-land/local-authority-eng/CRY/16-06366-FUL
"2, Harold Road",yes,,2017-12-31,,0.59,28,28,"Demolition of garages. Erection of four/ five/ six storey building comprising 14 two bedroom and 1 one bedroom flats. Erection of 2 three-storey and 11 two-storey three bedroom houses with associated car parking, landscaping and associated works.. http://publicaccess2.croydon.gov.uk/online-applications/applicationDetails.do?activeTab=summary&keyVal=OIBMF8JLL6J00",local-authority-eng:CRY,not owned by a public authority,2017-06-22,http://publicaccess2.croydon.gov.uk/online-applications/applicationDetails.do?activeTab=summary&keyVal=OIBMF8JLL6J00,permissioned,full planning permission,POINT(-0.090821 51.413945),16/06374/FUL,http://publicaccess2.croydon.gov.uk/online-applications/applicationDetails.do?activeTab=summary&keyVal=OIBMF8JLL6J00,2017-12-31,brownfield-land/local-authority-eng/CRY/16-06374-FUL
"Homefield House, 57, Homefield Road",yes,,2017-12-31,,0.25,24,24,"Demolition of former care home. Erection of 1 three storey building comprising 5 one bedroom and 5 two bedroom flats. Erection of 6 two bedroom and 8 three bedroom houses. Formation of vehicular access and provision of associated car parking, landscaping and other associated works.. http://publicaccess2.croydon.gov.uk/online-applications/applicationDetails.do?activeTab=summary&keyVal=OIFY5UJLL9B00",local-authority-eng:CRY,owned by a public authority,2017-06-22,http://publicaccess2.croydon.gov.uk/online-applications/applicationDetails.do?activeTab=summary&keyVal=OIFY5UJLL9B00,permissioned,full planning permission,POINT(-0.112211 51.299525),16/06400/FUL,http://publicaccess2.croydon.gov.uk/online-applications/applicationDetails.do?activeTab=summary&keyVal=OIFY5UJLL9B00,2017-12-31,brownfield-land/local-authority-eng/CRY/16-06400-FUL
", Malling Close",yes,,2017-12-31,,1,41,41,"Demolition of a single-storey temporary structure and garages. Erection of a four/ six storey building, 3 three-storey buildings and 1 two/four storey building to provide a total of 18 one bedroom and 23 two bedroom flats. Formation of vehicular access and provision of associated car parking, landscaping and other associated works. http://publicaccess2.croydon.gov.uk/online-applications/applicationDetails.do?activeTab=summary&keyVal=OIHN8MJLLAU00",local-authority-eng:CRY,owned by a public authority,2017-06-22,http://publicaccess2.croydon.gov.uk/online-applications/applicationDetails.do?activeTab=summary&keyVal=OIHN8MJLLAU00,permissioned,full planning permission,POINT(-0.060096 51.389654),16/06422/FUL,http://publicaccess2.croydon.gov.uk/online-applications/applicationDetails.do?activeTab=summary&keyVal=OIHN8MJLLAU00,2017-12-31,brownfield-land/local-authority-eng/CRY/16-06422-FUL
"Henderson Works, Henderson Road",yes,,2017-12-31,,0.065,9,9,"Demolition of existing buildings: Erection of single/two/three storey building comprising 1 three bedroom, 2 two bedroom and 6 one bedroom flats: alterations to vehicular access and provision of , with associated car parking, cycle storage and bin stores,. http://publicaccess2.croydon.gov.uk/online-applications/applicationDetails.do?activeTab=summary&keyVal=OIKZU2JLLD300",local-authority-eng:CRY,not owned by a public authority,2017-03-17,http://publicaccess2.croydon.gov.uk/online-applications/applicationDetails.do?activeTab=summary&keyVal=OIKZU2JLLD300,permissioned,full planning permission,POINT(-0.095255 51.391014),16/06470/FUL,http://publicaccess2.croydon.gov.uk/online-applications/applicationDetails.do?activeTab=summary&keyVal=OIKZU2JLLD300,2017-12-31,brownfield-land/local-authority-eng/CRY/16-06470-FUL
"26, Fairfield Road",yes,,2017-12-31,,0.085,6,6,"Erection of three storey building at rear comprising 6 x one bedroom flats, with associated cycle and refuse storage and landscaping. http://publicaccess2.croydon.gov.uk/online-applications/applicationDetails.do?activeTab=summary&keyVal=OILF93JLLDM00",local-authority-eng:CRY,not owned by a public authority,2017-05-22,http://publicaccess2.croydon.gov.uk/online-applications/applicationDetails.do?activeTab=summary&keyVal=OILF93JLLDM00,permissioned,full planning permission,POINT(-0.088003 51.372227),16/06484/FUL,http://publicaccess2.croydon.gov.uk/online-applications/applicationDetails.do?activeTab=summary&keyVal=OILF93JLLDM00,2017-12-31,brownfield-land/local-authority-eng/CRY/16-06484-FUL
"24, Station Road",yes,,2017-12-31,,0.05,14,14,Erection of a four/ five storey building comprising 10 one bedroom and 4 two bedroom flats and 227 sq m commercial space (Flexible Use Class A1 - A3 and D1) together with landscaping and other associated works.. http://publicaccess2.croydon.gov.uk/online-applications/applicationDetails.do?activeTab=summary&keyVal=OIMP23JLLE500,local-authority-eng:CRY,not owned by a public authority,2017-06-22,http://publicaccess2.croydon.gov.uk/online-applications/applicationDetails.do?activeTab=summary&keyVal=OIMP23JLLE500,permissioned,full planning permission,POINT(-0.076079 51.397553),16/06491/FUL,http://publicaccess2.croydon.gov.uk/online-applications/applicationDetails.do?activeTab=summary&keyVal=OIMP23JLLE500,2017-12-31,brownfield-land/local-authority-eng/CRY/16-06491-FUL
"Goodenough Way, Ellis Road",yes,,2017-12-31,,2,40,40,"Demolition of existing garages, substation, refuse stores and community centre. Erection of 7 buildings varying in height between two and three storeys comprising 18 three bedroom and 4 two bedroom houses and 14 two bedroom and 4 one bedroom flats and 161 sq m community centre space (Use Class D1) . provision of associated car parking, landscaping and other associated works.. http://publicaccess2.croydon.gov.uk/online-applications/applicationDetails.do?activeTab=summary&keyVal=OIN32UJLLEZ00",local-authority-eng:CRY,owned by a public authority,2017-06-23,http://publicaccess2.croydon.gov.uk/online-applications/applicationDetails.do?activeTab=summary&keyVal=OIN32UJLLEZ00,permissioned,full planning permission,POINT(-0.123249 51.299378),16/06505/FUL,http://publicaccess2.croydon.gov.uk/online-applications/applicationDetails.do?activeTab=summary&keyVal=OIN32UJLLEZ00,2017-12-31,brownfield-land/local-authority-eng/CRY/16-06505-FUL
", Longheath Gardens",yes,,2017-12-31,,0.7,53,53,"Demolition of existing garages and erection of 6 buildings varying in height between two and six storeys comprising a total of 23 two bedroom and 30 one bedroom flats. Provision of associated car parking, landscaping and other associated works.. http://publicaccess2.croydon.gov.uk/online-applications/applicationDetails.do?activeTab=summary&keyVal=OIN4M3JLLF400",local-authority-eng:CRY,owned by a public authority,2017-06-15,http://publicaccess2.croydon.gov.uk/online-applications/applicationDetails.do?activeTab=summary&keyVal=OIN4M3JLLF400,permissioned,full planning permission,POINT(-0.05406 51.393025),16/06508/FUL,http://publicaccess2.croydon.gov.uk/online-applications/applicationDetails.do?activeTab=summary&keyVal=OIN4M3JLLF400,2017-12-31,brownfield-land/local-authority-eng/CRY/16-06508-FUL
", Heathfield Road",yes,,2017-12-31,,0.15,20,20,"Demolition of the existing garages, relocation of existing substation and erection of one three-storey building comprising ten flats and one part three, part four storey building comprising seven flats and three houses together with external stores and substation reprovision, car parking, landscaping and other associated works (AMENDED PLANS RECEIVED - BLOCK B REDUCED IN DEPTH, BLOCK A PART- INCREASED IN HEIGHT BY 1 STOREY, 2 ADDITIONAL PARKING SPACES, ALTERATIONS TO LANDSCAPING AND INTERNAL LAYOUTS). http://publicaccess2.croydon.gov.uk/online-applications/applicationDetails.do?activeTab=summary&keyVal=OIND2DJLLFK00",local-authority-eng:CRY,owned by a public authority,2017-06-23,http://publicaccess2.croydon.gov.uk/online-applications/applicationDetails.do?activeTab=summary&keyVal=OIND2DJLLFK00,permissioned,full planning permission,POINT(-0.097836 51.366892),16/06514/FUL,http://publicaccess2.croydon.gov.uk/online-applications/applicationDetails.do?activeTab=summary&keyVal=OIND2DJLLFK00,2017-12-31,brownfield-land/local-authority-eng/CRY/16-06514-FUL
"Thomas Farley Public House, 61, High Street",yes,,2017-12-31,,0.036,7,7,Continued use of the ground and lower ground floors as a public house and social hall. Alterations and conversion of the upper floors to form 2 two bedroom and 5 one bedroom flats. Erection of a first floor rear extension. http://publicaccess2.croydon.gov.uk/online-applications/applicationDetails.do?activeTab=summary&keyVal=OIYHNWJL0DU00,local-authority-eng:CRY,not owned by a public authority,2017-02-24,http://publicaccess2.croydon.gov.uk/online-applications/applicationDetails.do?activeTab=summary&keyVal=OIYHNWJL0DU00,permissioned,full planning permission,POINT(-0.095848 51.398533),16/06538/FUL,http://publicaccess2.croydon.gov.uk/online-applications/applicationDetails.do?activeTab=summary&keyVal=OIYHNWJL0DU00,2017-12-31,brownfield-land/local-authority-eng/CRY/16-06538-FUL
"52, Bensham Grove",yes,,2017-12-31,,0.05,8,8,"Demolition of existing buildings ; Alterations to frontage; Erection of three storey building comprising B1(b) / B1 (c) Use to ground and part first floor (to rear) and ancillary Place of Worship to ground floor ; use of part first floor (to front) and second floors as 3 one bedroom, 2 two bedroom and 3 studio flats ; provision of terrace areas at first floor ; alterations to vehicular access and provision of associated off-street parking spaces ; provision of associated refuse storage areas and cycle storage (amended description). http://publicaccess2.croydon.gov.uk/online-applications/applicationDetails.do?activeTab=summary&keyVal=OJTA8JJLM1500",local-authority-eng:CRY,not owned by a public authority,2017-05-22,http://publicaccess2.croydon.gov.uk/online-applications/applicationDetails.do?activeTab=summary&keyVal=OJTA8JJLM1500,permissioned,full planning permission,POINT(-0.100977 51.406601),17/00198/FUL,http://publicaccess2.croydon.gov.uk/online-applications/applicationDetails.do?activeTab=summary&keyVal=OJTA8JJLM1500,2017-12-31,brownfield-land/local-authority-eng/CRY/17-00198-FUL
"55, Bensham Grove",yes,,2017-12-31,,0.077,9,9,Demolition of existing buildings: erection of three storey building comprising 5 one bedroom and 4 two bedroom flats: formation of vehicular access and provision of associated off-street parking ; provision of traffic-light system to vehicle access ; provision of refuse storage and cycle storage ; provision of associated landscaping and boundary treatment (amended description). http://publicaccess2.croydon.gov.uk/online-applications/applicationDetails.do?activeTab=summary&keyVal=OK0OWYJLM5X00,local-authority-eng:CRY,not owned by a public authority,2017-03-17,http://publicaccess2.croydon.gov.uk/online-applications/applicationDetails.do?activeTab=summary&keyVal=OK0OWYJLM5X00,permissioned,full planning permission,POINT(-0.101428 51.405781),17/00260/FUL,http://publicaccess2.croydon.gov.uk/online-applications/applicationDetails.do?activeTab=summary&keyVal=OK0OWYJLM5X00,2017-12-31,brownfield-land/local-authority-eng/CRY/17-00260-FUL
"139, South Norwood Hill",yes,,2017-12-31,,0.078,8,8,"Demolition of existing building. Erection of three storey building comprising 4 two bedroom, 2 one bedroom and 2 three bedroom and 1 studio flat. Provision of associated parking. http://publicaccess2.croydon.gov.uk/online-applications/applicationDetails.do?activeTab=summary&keyVal=OK11HLJLM6G00",local-authority-eng:CRY,not owned by a public authority,2017-05-12,http://publicaccess2.croydon.gov.uk/online-applications/applicationDetails.do?activeTab=summary&keyVal=OK11HLJLM6G00,permissioned,full planning permission,POINT(-0.083063 51.405176),17/00265/FUL,http://publicaccess2.croydon.gov.uk/online-applications/applicationDetails.do?activeTab=summary&keyVal=OK11HLJLM6G00,2017-12-31,brownfield-land/local-authority-eng/CRY/17-00265-FUL
"4, Rectory Park",yes,,2017-12-31,,0.071,5,5,"Demolition of existing building and erection of a two-storey building comprising 6 x 2 bedroom flats, with accommodation of roof level, provision of associated vehicular access and provision of associated parking spaces, cycle storage and refuse store. http://publicaccess2.croydon.gov.uk/online-applications/applicationDetails.do?activeTab=summary&keyVal=OL3XM9JLMX800",local-authority-eng:CRY,not owned by a public authority,2017-06-23,http://publicaccess2.croydon.gov.uk/online-applications/applicationDetails.do?activeTab=summary&keyVal=OL3XM9JLMX800,permissioned,full planning permission,POINT(-0.083211 51.333156),17/00687/FUL,http://publicaccess2.croydon.gov.uk/online-applications/applicationDetails.do?activeTab=summary&keyVal=OL3XM9JLMX800,2017-12-31,brownfield-land/local-authority-eng/CRY/17-00687-FUL
"123, Foxley Lane",yes,,2017-12-31,,0.062,8,8,"Demolition of the existing building: erection of two storey building with accommodation in roofspace comprising 1 one bedroom and 8 two bedroom flats: formation of vehicular access and provision of associated parking, bins and bike storage. http://publicaccess2.croydon.gov.uk/online-applications/applicationDetails.do?activeTab=summary&keyVal=OLK8Z5JLFIL00",local-authority-eng:CRY,not owned by a public authority,2017-06-23,http://publicaccess2.croydon.gov.uk/online-applications/applicationDetails.do?activeTab=summary&keyVal=OLK8Z5JLFIL00,permissioned,full planning permission,POINT(-0.141352 51.340621),17/00843/FUL,http://publicaccess2.croydon.gov.uk/online-applications/applicationDetails.do?activeTab=summary&keyVal=OLK8Z5JLFIL00,2017-12-31,brownfield-land/local-authority-eng/CRY/17-00843-FUL
