site-address,deliverable,end-date,entry-date,hazardous-substances,hectares,maximum-net-dwellings,minimum-net-dwellings,notes,organisation,ownership-status,planning-permission-date,planning-permission-history,planning-permission-status,planning-permission-type,point,site,site-plan-url,start-date
"Rear of 382 Ashley Road, Poole, BH14 9DQ",yes,,2018-12-01,,0.09,8,8,Outline application to construct a block of eight apartments with associated parking and access.,local-authority-eng:POL,not owned by a public authority,2017-08-22,https://boppa.poole.gov.uk/online-applications/applicationDetails.do?activeTab=documents&keyVal=_POOLE_DCAPR_250327,permissioned,outline planning permission,POINT(-1.938458 50.729406),P/BLR/0135,https://boppa.poole.gov.uk/online-applications/applicationDetails.do?activeTab=documents&keyVal=_POOLE_DCAPR_250327,2018-12-01
"11 Martello Road South, Poole, BH13 7HF",yes,,2018-12-01,,0.25,13,13,Erection of 13 unit apartment building with associated access and parking.,local-authority-eng:POL,not owned by a public authority,2018-02-05,https://boppa.poole.gov.uk/online-applications/applicationDetails.do?activeTab=documents&keyVal=_POOLE_DCAPR_250395,permissioned,full planning permission,POINT(-1.918166 50.706823),P/BLR/0136,https://boppa.poole.gov.uk/online-applications/applicationDetails.do?activeTab=documents&keyVal=_POOLE_DCAPR_250395,2018-12-01
"245 Blandford Road, Hamworthy, Poole, BH15 4AZ",yes,,2018-12-01,,0.11,8,8,Outline planning application for demolition of British Legion Club house and erect 4x 1 bed houses and 4x 3 bed houses (total 8 units) with parking and new estate road.,local-authority-eng:POL,not owned by a public authority,2017-11-17,https://boppa.poole.gov.uk/online-applications/applicationDetails.do?activeTab=documents&keyVal=_POOLE_DCAPR_250704,permissioned,outline planning permission,POINT(-2.008148 50.716021),P/BLR/0137,https://boppa.poole.gov.uk/online-applications/applicationDetails.do?activeTab=documents&keyVal=_POOLE_DCAPR_250704,2018-12-01
"9-11 Parkstone Road, Poole, BH15 2NN",yes,,2018-12-01,,0.23,12,12,Convert existing B1(a) offices to 12 x C3 flats over two floors.,local-authority-eng:POL,not owned by a public authority,2017-09-19,https://boppa.poole.gov.uk/online-applications/applicationDetails.do?activeTab=documents&keyVal=_POOLE_DCAPR_250821,permissioned,full planning permission,POINT(-1.975891 50.720204),P/BLR/0138,https://boppa.poole.gov.uk/online-applications/applicationDetails.do?activeTab=documents&keyVal=_POOLE_DCAPR_250821,2018-12-01
"25 Nelson Road, Poole, BH12 1ER",yes,,2018-12-01,,0.07,6,6,Conversion and extension of existing building to create 6 self-contained flats.,local-authority-eng:POL,not owned by a public authority,2017-09-22,https://boppa.poole.gov.uk/online-applications/applicationDetails.do?activeTab=documents&keyVal=_POOLE_DCAPR_250947,permissioned,full planning permission,POINT(-1.905817 50.726416),P/BLR/0139,https://boppa.poole.gov.uk/online-applications/applicationDetails.do?activeTab=documents&keyVal=_POOLE_DCAPR_250947,2018-12-01
"Pergins, 21 Christopher Crescent, Poole, BH15 3HW",yes,,2018-12-01,,0.35,4,4,"Convert 4 shared flats at ground and first floor levels into 8 self-contained flats (4no.1 bed, and 4no. 2bed).",local-authority-eng:POL,not owned by a public authority,2018-01-08,https://boppa.poole.gov.uk/online-applications/applicationDetails.do?activeTab=documents&keyVal=_POOLE_DCAPR_251024,permissioned,full planning permission,POINT(-1.986319 50.733594),P/BLR/0140,https://boppa.poole.gov.uk/online-applications/applicationDetails.do?activeTab=documents&keyVal=_POOLE_DCAPR_251024,2018-12-01
"21 West Quay Road, Poole, BH15 1JF",yes,,2018-12-01,,0.02,7,7,"Demolish building and erect 8 flats, with balconies and undercroft parking.",local-authority-eng:POL,not owned by a public authority,2018-01-25,https://boppa.poole.gov.uk/online-applications/applicationDetails.do?activeTab=documents&keyVal=_POOLE_DCAPR_251427,permissioned,full planning permission,POINT(-1.99021 50.714949),P/BLR/0141,https://boppa.poole.gov.uk/online-applications/applicationDetails.do?activeTab=documents&keyVal=_POOLE_DCAPR_251427,2018-12-01
"6 Pinewood Road, Poole, BH13 6JS",yes,,2018-12-01,,0.1,4,4,Outline application to demolish the existing bungalow and erect a block of 5no. self contained flats (4no. 2 bed & 1no. 3 bed) with basement parking.,local-authority-eng:POL,not owned by a public authority,2017-11-28,https://boppa.poole.gov.uk/online-applications/applicationDetails.do?activeTab=documents&keyVal=_POOLE_DCAPR_251524,permissioned,outline planning permission,POINT(-1.906502 50.712865),P/BLR/0142,https://boppa.poole.gov.uk/online-applications/applicationDetails.do?activeTab=documents&keyVal=_POOLE_DCAPR_251524,2018-12-01
"118 High Street, Poole, BH15 1DF",yes,,2018-12-01,,0.05,8,8,"Redevelopment/change of use of the 1st floor ancillary space for eight flats, 7 no. 1 bed flats and 1 studio.",local-authority-eng:POL,not owned by a public authority,2018-03-01,https://boppa.poole.gov.uk/online-applications/applicationDetails.do?activeTab=documents&keyVal=_POOLE_DCAPR_251883,permissioned,full planning permission,POINT(-1.983907 50.716345),P/BLR/0143,https://boppa.poole.gov.uk/online-applications/applicationDetails.do?activeTab=documents&keyVal=_POOLE_DCAPR_251883,2018-12-01
"Crown Offices, Park Road, Poole, BH15 2RP",yes,,2018-12-01,,0.3,47,47,Prior approval for the change of use from class B1(a) (offices) to class C3 (dwellinghouses).,local-authority-eng:POL,owned by a public authority,2018-01-10,https://boppa.poole.gov.uk/online-applications/applicationDetails.do?activeTab=documents&keyVal=_POOLE_DCAPR_251949,permissioned,full planning permission,POINT(-1.960014 50.722454),P/BLR/0144,https://boppa.poole.gov.uk/online-applications/applicationDetails.do?activeTab=documents&keyVal=_POOLE_DCAPR_251949,2018-12-01
"19 Canford Cliffs Road, Poole, BH13 7AG",yes,,2018-12-01,,0.4,1,1,"Demolition of existing detached garage, sever land to erect a detached dwelling and creation of a new vehicular access off Canford Cliffs Road.",local-authority-eng:POL,not owned by a public authority,2018-02-28,https://boppa.poole.gov.uk/online-applications/applicationDetails.do?activeTab=documents&keyVal=_POOLE_DCAPR_252201,permissioned,full planning permission,POINT(-1.92441 50.720893),P/BLR/0145,https://boppa.poole.gov.uk/online-applications/applicationDetails.do?activeTab=documents&keyVal=_POOLE_DCAPR_252201,2018-12-01
