site-address,deliverable,end-date,entry-date,hazardous-substances,hectares,maximum-net-dwellings,minimum-net-dwellings,notes,organisation,ownership-status,planning-permission-date,planning-permission-history,planning-permission-status,planning-permission-type,point,site,site-plan-url,start-date,slug
The Larks Nest Larkfield Road Nuthall,yes,,2018-12-18,,0.07,6,6,Change use of public house (Class A4) to dwelling house (Class C3) to include six flats and erect two storey rear/side extension (revised scheme),local-authority-eng:BRT,not owned by a public authority,2016-01-06,,permissioned,full planning permission,POINT(-1.244764 52.997018),SHLAA/00690/AVA,http://www.arcgis.com/apps/webappviewer/index.html?id=08f516e5e14b48cfa555e52edb7e58f6&query=External_Layes_3711%2CSITEREFERENCE%2CSHLAA%2F00690%2FAVA#http://www.arcgis.com/apps/webappviewer/index.html?id=08f516e5e14b48cfa555e52edb7e58f6&query=External_Layes_3711%2CSITEREFERENCE%2CSHLAA%2F00690%2FAVA,2017-12-13,brownfield-land/local-authority-eng/BRT/SHLAA-00690-AVA
Car Park On Corner Of The Poplars Wollaton Road Beeston,yes,,2018-12-18,,0.03,10,10,Construct 10 apartments,local-authority-eng:BRT,not owned by a public authority,2015-08-28,,permissioned,full planning permission,POINT(-1.217931 52.929262),SHLAA/00761/AVA,http://www.arcgis.com/apps/webappviewer/index.html?id=08f516e5e14b48cfa555e52edb7e58f6&query=External_Layes_3711%2CSITEREFERENCE%2CSHLAA%2F00761%2FAVA#http://www.arcgis.com/apps/webappviewer/index.html?id=08f516e5e14b48cfa555e52edb7e58f6&query=External_Layes_3711%2CSITEREFERENCE%2CSHLAA%2F00761%2FAVA,2017-12-13,brownfield-land/local-authority-eng/BRT/SHLAA-00761-AVA
22 High Road Chilwell,yes,,2018-12-18,,0.09,9,9,"Outline application to demolish existing buildings and construct 9 N° one and two bed apartments, in one, two and three storey blocks with 7 N° parking spaces and communal gardens with all matters reserved except layout",local-authority-eng:BRT,not owned by a public authority,2015-01-14,,permissioned,outline planning permission,POINT(-1.221731 52.922284),SHLAA/00634/AVA,http://www.arcgis.com/apps/webappviewer/index.html?id=08f516e5e14b48cfa555e52edb7e58f6&query=External_Layes_3711%2CSITEREFERENCE%2CSHLAA%2F00634%2FAVA#http://www.arcgis.com/apps/webappviewer/index.html?id=08f516e5e14b48cfa555e52edb7e58f6&query=External_Layes_3711%2CSITEREFERENCE%2CSHLAA%2F00634%2FAVA,2017-12-13,brownfield-land/local-authority-eng/BRT/SHLAA-00634-AVA
Units 12-15 Pinfold Trading Estate Nottingham Road Stapleford,yes,,2018-12-18,,1.09,10,10,"Hybrid planning application comprising: Full Application to construct shop (Class A1) including solar panels and with associated car parking, access and landscaping on a 0.78 ha site:. Hybrid planning application comprising: Outline Application to construct dwellings (Class C3) on 0.29 ha, with all matters reserved apart from the access.",local-authority-eng:BRT,not owned by a public authority,2016-02-26,,permissioned,outline planning permission,POINT(-1.271252 52.931678),SHLAA/00051/AVA,http://www.arcgis.com/apps/webappviewer/index.html?id=08f516e5e14b48cfa555e52edb7e58f6&query=External_Layes_3711%2CSITEREFERENCE%2CSHLAA%2F00051%2FAVA#http://www.arcgis.com/apps/webappviewer/index.html?id=08f516e5e14b48cfa555e52edb7e58f6&query=External_Layes_3711%2CSITEREFERENCE%2CSHLAA%2F00051%2FAVA,2017-12-13,brownfield-land/local-authority-eng/BRT/SHLAA-00051-AVA
"Moults Yard, 68-70 Nottingham Road, Stapleford",yes,,2018-12-18,,0.32,15,15,Construct 15 N° dwellings,local-authority-eng:BRT,not owned by a public authority,2015-03-03,,permissioned,full planning permission,POINT(-1.269068 52.931521),SHLAA/00012/AVA,http://www.arcgis.com/apps/webappviewer/index.html?id=08f516e5e14b48cfa555e52edb7e58f6&query=External_Layes_3711%2CSITEREFERENCE%2CSHLAA%2F00012%2FAVA#http://www.arcgis.com/apps/webappviewer/index.html?id=08f516e5e14b48cfa555e52edb7e58f6&query=External_Layes_3711%2CSITEREFERENCE%2CSHLAA%2F00012%2FAVA,2017-12-13,brownfield-land/local-authority-eng/BRT/SHLAA-00012-AVA
Myford Machine Tools Wilmot Lane Beeston,yes,,2018-12-18,,1.79,47,47,"13/00003/OUT - Redevelopment and change use of existing industrial site for residential/commercial uses (to include Classes A1; A2; A3; A4; A5; B1(a); C2; C3; and D1 uses) - now lapsed. Construct 47 dwellings, retail unit (Class A1), car parking and highway infrastructure",local-authority-eng:BRT,not owned by a public authority,,,pending decision,,POINT(-1.219673 52.92175),SHLAA/00408/AVA,http://www.arcgis.com/apps/webappviewer/index.html?id=08f516e5e14b48cfa555e52edb7e58f6&query=External_Layes_3711%2CSITEREFERENCE%2CSHLAA%2F00408%2FAVA#http://www.arcgis.com/apps/webappviewer/index.html?id=08f516e5e14b48cfa555e52edb7e58f6&query=External_Layes_3711%2CSITEREFERENCE%2CSHLAA%2F00408%2FAVA,2017-12-13,brownfield-land/local-authority-eng/BRT/SHLAA-00408-AVA
Beeston Business Park Technology Drive Beeston,yes,,2018-12-18,,19.55,310,310,Hybrid planning application comprising: Outline application for up to 310 residential units and community building with means of access included (all other matters reserved).,local-authority-eng:BRT,not owned by a public authority,2017-11-03,,permissioned,outline planning permission,POINT(-1.209459 52.917385),SHLAA/00499/AVA,http://www.arcgis.com/apps/webappviewer/index.html?id=08f516e5e14b48cfa555e52edb7e58f6&query=External_Layes_3711%2CSITEREFERENCE%2CSHLAA%2F00499%2FAVA#http://www.arcgis.com/apps/webappviewer/index.html?id=08f516e5e14b48cfa555e52edb7e58f6&query=External_Layes_3711%2CSITEREFERENCE%2CSHLAA%2F00499%2FAVA,2017-12-13,brownfield-land/local-authority-eng/BRT/SHLAA-00499-AVA
Former Bartons Bus Depot Queens Road West Chilwell,yes,,2018-12-18,,2.23,250,250,"Full permission for 29 dwellings, outline permission for up to 221 further dwellings. Hybrid planning application comprising: Full application to construct 29 dwellings, including access, associated road infrastructure, car parking and landscaping. Outline application (including access) with some matters reserved to construct up to 221 dwellings and units with flexible uses (Classes D1, D2, A1, A2, A3, A4 and A5), following demolition of buildings",local-authority-eng:BRT,not owned by a public authority,2017-11-17,,permissioned,other,POINT(-1.222026 52.919886),SHLAA/00195/AVA,http://www.arcgis.com/apps/webappviewer/index.html?id=08f516e5e14b48cfa555e52edb7e58f6&query=External_Layes_3711%2CSITEREFERENCE%2CSHLAA%2F00195%2FAVA#http://www.arcgis.com/apps/webappviewer/index.html?id=08f516e5e14b48cfa555e52edb7e58f6&query=External_Layes_3711%2CSITEREFERENCE%2CSHLAA%2F00195%2FAVA,2017-12-13,brownfield-land/local-authority-eng/BRT/SHLAA-00195-AVA
The Boots Company Beeston site,yes,,2018-12-18,,14.68,400,400,"This site crossed the boundary with Nottingham City Council therefore the number of dwellings in the description is not expected to be delivered in its entirety within Broxtowe.. Outline application for mixed-use development comprising: up to 82,000sqm of employment floorspace, comprising office units (B1a); research and development (B1b); industrial process (B1c); general industrial (B2); storage and distribution (B8); residential institutions (C2); non-residential institutions (D1); up to 2,500sqm retail & food/drink (A1, A2, A3, A4 and A5); up to 675 residential units (C3); and associated works including demolition of existing structures; earthworks; remediation; access; car parking; pedestrian and cycle routes; open space; utilities; sustainable drainage systems",local-authority-eng:BRT,not owned by a public authority,,,pending decision,,POINT(-1.191882 52.921294),SHLAA/00237/AVA,http://www.arcgis.com/apps/webappviewer/index.html?id=08f516e5e14b48cfa555e52edb7e58f6&query=External_Layes_3711%2CSITEREFERENCE%2CSHLAA%2F00237%2FAVA#http://www.arcgis.com/apps/webappviewer/index.html?id=08f516e5e14b48cfa555e52edb7e58f6&query=External_Layes_3711%2CSITEREFERENCE%2CSHLAA%2F00237%2FAVA,2017-12-13,brownfield-land/local-authority-eng/BRT/SHLAA-00237-AVA
Chetwynd Barracks Chetwynd Road Chilwell,,,2018-12-18,,94.57,500,500,"Owned by the Ministry of Defence, a private body has ownership interest in the existing on-site residential units to the north.. Residential led allocation in the emerging Local Plan (not yet allocated).",local-authority-eng:BRT,mixed ownership,,,not permissioned,,POINT(-1.250618 52.912681),SHLAA/00193/AVA,http://www.arcgis.com/apps/webappviewer/index.html?id=08f516e5e14b48cfa555e52edb7e58f6&query=External_Layes_3711%2CSITEREFERENCE%2CSHLAA%2F00193%2FAVA#http://www.arcgis.com/apps/webappviewer/index.html?id=08f516e5e14b48cfa555e52edb7e58f6&query=External_Layes_3711%2CSITEREFERENCE%2CSHLAA%2F00193%2FAVA,2017-12-13,brownfield-land/local-authority-eng/BRT/SHLAA-00193-AVA
Land Fronting Wollaton Road Beeston,,,2018-12-18,,0.06,12,12,Residential allocation in the emerging Local Plan (not adopted).,local-authority-eng:BRT,not owned by a public authority,,,not permissioned,,POINT(-1.218254 52.929489),SHLAA/00571/AVA,http://www.arcgis.com/apps/webappviewer/index.html?id=08f516e5e14b48cfa555e52edb7e58f6&query=External_Layes_3711%2CSITEREFERENCE%2CSHLAA%2F00571%2FAVA#http://www.arcgis.com/apps/webappviewer/index.html?id=08f516e5e14b48cfa555e52edb7e58f6&query=External_Layes_3711%2CSITEREFERENCE%2CSHLAA%2F00571%2FAVA,2017-12-13,brownfield-land/local-authority-eng/BRT/SHLAA-00571-AVA
Works Bailey Street Stapleford,,,2018-12-18,,0.3,15,15,Outline permission to demolish existing commercial units and construct 15 N° dwellings lapsed.. Construct 15 N° dwellings,local-authority-eng:BRT,not owned by a public authority,,,not permissioned,,POINT(-1.282252 52.924167),SHLAA/00239/AVA,http://www.arcgis.com/apps/webappviewer/index.html?id=08f516e5e14b48cfa555e52edb7e58f6&query=External_Layes_3711%2CSITEREFERENCE%2CSHLAA%2F00239%2FAVA#http://www.arcgis.com/apps/webappviewer/index.html?id=08f516e5e14b48cfa555e52edb7e58f6&query=External_Layes_3711%2CSITEREFERENCE%2CSHLAA%2F00239%2FAVA,2017-12-13,brownfield-land/local-authority-eng/BRT/SHLAA-00239-AVA
Beeston Cement Depot Station Road Beeston,,,2018-12-18,,1.19,21,21,Owned by Network Rail. Residential allocation in the emerging Local Plan (not adopted).,local-authority-eng:BRT,not owned by a public authority,,,not permissioned,,POINT(-1.206268 52.921922),SHLAA/00449/AVA,http://www.arcgis.com/apps/webappviewer/index.html?id=08f516e5e14b48cfa555e52edb7e58f6&query=External_Layes_3711%2CSITEREFERENCE%2CSHLAA%2F00449%2FAVA#http://www.arcgis.com/apps/webappviewer/index.html?id=08f516e5e14b48cfa555e52edb7e58f6&query=External_Layes_3711%2CSITEREFERENCE%2CSHLAA%2F00449%2FAVA,2017-12-13,brownfield-land/local-authority-eng/BRT/SHLAA-00449-AVA
"Beeston Maltings, Dovecote Lane, Beeston",,,2018-12-18,,1.32,56,56,Residential allocation in the emerging Local Plan (not yet allocated).,local-authority-eng:BRT,not owned by a public authority,,,not permissioned,,POINT(-1.210537 52.919478),SHLAA/00150/AVA,http://www.arcgis.com/apps/webappviewer/index.html?id=08f516e5e14b48cfa555e52edb7e58f6&query=External_Layes_3711%2CSITEREFERENCE%2CSHLAA%2F00150%2FAVA#http://www.arcgis.com/apps/webappviewer/index.html?id=08f516e5e14b48cfa555e52edb7e58f6&query=External_Layes_3711%2CSITEREFERENCE%2CSHLAA%2F00150%2FAVA,2017-12-13,brownfield-land/local-authority-eng/BRT/SHLAA-00150-AVA
The Square Beeston,,,2018-12-18,,1.39,100,100,Owned by Broxtowe Borough Council.. Mixed use allocation in the emerging Local Plan (not adopted) with a minimum of 100 homes.,local-authority-eng:BRT,owned by a public authority,,,not permissioned,,POINT(-1.214809 52.92588),SHLAA/00771/AVA,http://www.arcgis.com/apps/webappviewer/index.html?id=08f516e5e14b48cfa555e52edb7e58f6&query=External_Layes_3711%2CSITEREFERENCE%2CSHLAA%2F00771%2FAVA#http://www.arcgis.com/apps/webappviewer/index.html?id=08f516e5e14b48cfa555e52edb7e58f6&query=External_Layes_3711%2CSITEREFERENCE%2CSHLAA%2F00771%2FAVA,2017-12-13,brownfield-land/local-authority-eng/BRT/SHLAA-00771-AVA
Walker Street Eastwood,yes,,2018-12-18,,7.47,200,200,"Planning permission granetd at appeal with one year timelimit (which has now lapsed).. Construct 113 apartments, 27 bungalows, energy centre and associated access road, car parking, amenity space and landscaping.",local-authority-eng:BRT,owned by a public authority,,,not permissioned,,POINT(-1.299296 53.01916),SHLAA/00138/AVA,http://www.arcgis.com/apps/webappviewer/index.html?id=08f516e5e14b48cfa555e52edb7e58f6&query=External_Layes_3711%2CSITEREFERENCE%2CSHLAA%2F00138%2FAVA#http://www.arcgis.com/apps/webappviewer/index.html?id=08f516e5e14b48cfa555e52edb7e58f6&query=External_Layes_3711%2CSITEREFERENCE%2CSHLAA%2F00138%2FAVA,2017-12-13,brownfield-land/local-authority-eng/BRT/SHLAA-00138-AVA
"Land at Lilac Grove, Beeston",yes,,2018-12-18,,12.95,150,150,Owned by Severn Trent. Residential allocation in the emerging Local Plan (not adopted).,local-authority-eng:BRT,not owned by a public authority,,,not permissioned,,POINT(-1.195329 52.92067),SHLAA/00258/AVA,http://www.arcgis.com/apps/webappviewer/index.html?id=08f516e5e14b48cfa555e52edb7e58f6&query=External_Layes_3711%2CSITEREFERENCE%2CSHLAA%2F00258%2FAVA#http://www.arcgis.com/apps/webappviewer/index.html?id=08f516e5e14b48cfa555e52edb7e58f6&query=External_Layes_3711%2CSITEREFERENCE%2CSHLAA%2F00258%2FAVA,2017-12-13,brownfield-land/local-authority-eng/BRT/SHLAA-00258-AVA
132 Chewton Street Eastwood,yes,,2018-12-18,,0.28,13,13,Construct 13 N° dwellings (revised scheme),local-authority-eng:BRT,not owned by a public authority,2016-07-15,,permissioned,full planning permission,POINT(-1.30554 53.010909),SHLAA/00163/AVA,http://www.arcgis.com/apps/webappviewer/index.html?id=08f516e5e14b48cfa555e52edb7e58f6&query=External_Layes_3711%2CSITEREFERENCE%2CSHLAA%2F00163%2FAVA#http://www.arcgis.com/apps/webappviewer/index.html?id=08f516e5e14b48cfa555e52edb7e58f6&query=External_Layes_3711%2CSITEREFERENCE%2CSHLAA%2F00163%2FAVA,2017-12-13,brownfield-land/local-authority-eng/BRT/SHLAA-00163-AVA
