name,site-address,deliverable,end-date,entry-date,hazardous-substances,hectares,maximum-net-dwellings,minimum-net-dwellings,notes,organisation,ownership-status,planning-permission-date,planning-permission-history,planning-permission-status,planning-permission-type,point,site,site-plan-url,start-date,slug
5066,"Bungalow and New Dolphin Garage, Front Street, Newbiggin-by-the-Sea",,,2017-12-17,,0.45,14,14,"Reserved matters consent approved for demolition and remediation of site, followed by redevelopment of 14 homes - 11/02989/REM. Initial outline consent - 07/00557/OUT. Planning permission has been implemented through commencement of site works",local-authority-eng:NBL,not owned by a public authority,2012-03-23,https://publicaccess.northumberland.gov.uk/online-applications/propertyDetails.do?activeTab=relatedCases&keyVal=00IC2CTGLI000,permissioned,reserved matters approval,POINT(-1.511984 55.185943),5066,http://northumberland.maps.arcgis.com/apps/webappviewer/index.html?id=c1b801d50f8040efbf8c9bc9f916cfae,2016-06-30,/brownfield-land/local-authority-eng/NBL/5066
5079,"Land to North of Market Place, Bedlington",yes,,2017-12-17,,0.6,23,23,"Outline application for extensive mixed-use development on part of site permitted July 2017 (post latest SHLAA update)- 17/00444/OUT. The focus of this development is on retail, employment and leisure uses but also includes 12 dwellings",local-authority-eng:NBL,,2017-07-11,https://publicaccess.northumberland.gov.uk/online-applications/propertyDetails.do?activeTab=relatedCases&keyVal=00IU7DTGLI000,permissioned,outline planning permission,POINT(-1.5945 55.131683),5079,http://northumberland.maps.arcgis.com/apps/webappviewer/index.html?id=c1b801d50f8040efbf8c9bc9f916cfae,2017-12-17,/brownfield-land/local-authority-eng/NBL/5079
5083,Land adjacent to Cambois First School,,,2017-12-17,,2.64,30,30,No relevant planning history,local-authority-eng:NBL,,,,not permissioned,,POINT(-1.523069 55.147958),5083,http://northumberland.maps.arcgis.com/apps/webappviewer/index.html?id=c1b801d50f8040efbf8c9bc9f916cfae,2017-12-17,/brownfield-land/local-authority-eng/NBL/5083
4573,"Former Bates Colliery Site (Phase/Area 1), Blyth",yes,,2017-12-17,,13.8,257,257,"Application for 'phase 1' of wider development permitted October 2017 (post latest SHLAA updated), being for 145 two-, three- and four-bed semi and detached dwellings - 16/04622/FUL. This follow a reserved matters application for overall site involving remediation of former colliery land followed by construction of 257 dwellings - 12/03370/REM. Further The latter overall consent has been implemented and therefore the consent will remain live",local-authority-eng:NBL,not owned by a public authority,2013-02-01,https://publicaccess.northumberland.gov.uk/online-applications/propertyDetails.do?activeTab=relatedCases&keyVal=MDJ9Z5QS04P00,permissioned,full planning permission,POINT(-1.523369 55.13333),4573,http://northumberland.maps.arcgis.com/apps/webappviewer/index.html?id=c1b801d50f8040efbf8c9bc9f916cfae,2016-06-30,/brownfield-land/local-authority-eng/NBL/4573
4655,"Westfield, Church Street, Cramlington",,,2017-12-17,,0.18,7,7,Application has lapsed for demolition and replacement with 6 unit apartment block and 3 cottages initially refused but allowed on appeal - B/07/00598/FUL,local-authority-eng:NBL,not owned by a public authority,2008-04-02,https://publicaccess.northumberland.gov.uk/online-applications/propertyDetails.do?activeTab=relatedCases&keyVal=KRLX15LW00A00,not permissioned,,POINT(-1.582286 55.084654),4655,http://northumberland.maps.arcgis.com/apps/webappviewer/index.html?id=c1b801d50f8040efbf8c9bc9f916cfae,2016-06-30,/brownfield-land/local-authority-eng/NBL/4655
4663,"Land around and including Malvins House Close, Blyth",yes,,2017-12-17,,0.45,48,48,"Planning permission in place for scheme of 48 dwellings on part of site, comprising 33 flats, 9 terraced houses, 4 detached houses and 2 bungalows - 10/S/00290/VARYCO. This extended the time limit of original application - 06/00225/FUL. Permission due to lapse in April 2017",local-authority-eng:NBL,not owned by a public authority,2014-01-12,https://publicaccess.northumberland.gov.uk/online-applications/propertyDetails.do?activeTab=relatedCases&keyVal=L5YDNIQS04N00,permissioned,full planning permission,POINT(-1.529614 55.126444),4663,http://northumberland.maps.arcgis.com/apps/webappviewer/index.html?id=c1b801d50f8040efbf8c9bc9f916cfae,2016-06-30,/brownfield-land/local-authority-eng/NBL/4663
4669x,"Link House Buildings and Land, Links Road, Blyth (brownfield parcel)",,,2017-12-17,,0.51,15,15,"Application submitted for mixed-use development, including 15 new build dwellings and a pub/hotel, but lapsed without progress - B/09/S/00330/OUT",local-authority-eng:NBL,not owned by a public authority,2010-03-14,https://publicaccess.northumberland.gov.uk/online-applications/propertyDetails.do?activeTab=relatedCases&keyVal=005V3VTGLI000,not permissioned,,POINT(-1.501168 55.108782),4669x,http://northumberland.maps.arcgis.com/apps/webappviewer/index.html?id=c1b801d50f8040efbf8c9bc9f916cfae,2017-12-17,/brownfield-land/local-authority-eng/NBL/4669x
4713,Cramlington Fire Station,,,2017-12-17,,0.57,13,13,Change of use of former fire station to office to storage/distribution approved - 15/00205/COU,local-authority-eng:NBL,,,https://publicaccess.northumberland.gov.uk/online-applications/propertyDetails.do?activeTab=relatedCases&keyVal=OD6I2LQS0CE02,not permissioned,,POINT(-1.569223 55.102014),4713,http://northumberland.maps.arcgis.com/apps/webappviewer/index.html?id=c1b801d50f8040efbf8c9bc9f916cfae,2016-06-30,/brownfield-land/local-authority-eng/NBL/4713
4736,"Commissioners Quay, Quay Road, Blyth",yes,,2017-12-17,,2.11,49,49,Planning consent in place for scheme of 49 two- three- and four-bed dwellings - 15/01941/FUL,local-authority-eng:NBL,,2016-03-31,https://publicaccess.northumberland.gov.uk/online-applications/propertyDetails.do?activeTab=relatedCases&keyVal=NBL2PIQS0CE00,permissioned,full planning permission,POINT(-1.499901 55.12612),4736,http://northumberland.maps.arcgis.com/apps/webappviewer/index.html?id=c1b801d50f8040efbf8c9bc9f916cfae,2016-06-30,/brownfield-land/local-authority-eng/NBL/4736
4754,"13 Allensgreen, Church Street, Cramlington",,,2017-12-17,,0.08,5,5,"Proposal for development of 5 units permitted, including 3 two-bed apartments and a one-bedroom apartment at second floor level, alongside a three-bed townhouse -16/00880/FUL. Previous permission lapsed before commencement - 11/01565/FUL",local-authority-eng:NBL,not owned by a public authority,2011-10-31,https://publicaccess.northumberland.gov.uk/online-applications/propertyDetails.do?activeTab=relatedCases&keyVal=005RVCTGLI000,permissioned,full planning permission,POINT(-1.581814 55.084922),4754,http://northumberland.maps.arcgis.com/apps/webappviewer/index.html?id=c1b801d50f8040efbf8c9bc9f916cfae,2016-06-30,/brownfield-land/local-authority-eng/NBL/4754
4757,"East Cramlington Farm House, The Paddock, Cramlington",,,2017-12-17,,0.76,8,8,Previous outline planning permission for up to 24 units lapsed without implementation - 07/00533/OUT,local-authority-eng:NBL,not owned by a public authority,2007-12-04,https://publicaccess.northumberland.gov.uk/online-applications/propertyDetails.do?activeTab=relatedCases&keyVal=KRRIJSLW00A00,not permissioned,,POINT(-1.565728 55.081801),4757,http://northumberland.maps.arcgis.com/apps/webappviewer/index.html?id=c1b801d50f8040efbf8c9bc9f916cfae,2017-12-17,/brownfield-land/local-authority-eng/NBL/4757
4772,"Units 21E-21G Briardale Road & 29-33 Cowpen Hall Road, Blyth",,,2017-12-17,,0.06,6,6,Consent previously secured for 6 maisonettes (1.5 storey) above retail unit but scheme has not been progressed and has now lapsed - 07/00539/FUL,local-authority-eng:NBL,not owned by a public authority,2007-12-04,https://publicaccess.northumberland.gov.uk/online-applications/advancedSearchResults.do?action=firstPage,not permissioned,,POINT(-1.540532 55.127519),4772,http://northumberland.maps.arcgis.com/apps/webappviewer/index.html?id=c1b801d50f8040efbf8c9bc9f916cfae,2016-06-30,/brownfield-land/local-authority-eng/NBL/4772
4791,"Land at Bebside Motors, Front Street, Bebside",,,2017-12-17,,0.26,15,15,"Outline consent for 15 dwellings previously secured but lapsed without progress - 07/00601/OUT. A number of other applications relate to existing uses - 14/04264/COU, 16/03225/FUL",local-authority-eng:NBL,,2008-02-05,https://publicaccess.northumberland.gov.uk/online-applications/applicationDetails.do?activeTab=summary&keyVal=JSGWU7DC03L00,not permissioned,,POINT(-1.561048 55.127209),4791,http://northumberland.maps.arcgis.com/apps/webappviewer/index.html?id=c1b801d50f8040efbf8c9bc9f916cfae,2016-06-30,/brownfield-land/local-authority-eng/NBL/4791
4796,"Second Hand Shop, King Street, Blyth",,,2017-12-17,,0.03,6,6,"Approval for mixed-use scheme, including provision of 6 flats above ground floor retail/commercial units, lapsed without implementation - B/08/00054/FUL. Extension of time limit refused - 11/00064/VARYCO. Previous proposal refused, with appeal dismissed - APP/P2935/A/12/2189282",local-authority-eng:NBL,,2008-04-01,https://publicaccess.northumberland.gov.uk/online-applications/propertyDetails.do?activeTab=relatedCases&keyVal=L1WEOWQS04O00,not permissioned,,POINT(-1.511189 55.031211),4796,http://northumberland.maps.arcgis.com/apps/webappviewer/index.html?id=c1b801d50f8040efbf8c9bc9f916cfae,2017-12-17,/brownfield-land/local-authority-eng/NBL/4796
4812,"Former Nursery site and Car Park adjoining Newsham First School, Wharton Street, Blyth",yes,,2017-12-17,,0.34,14,14,Application for 14 bungalows for affordable rent permitted June 2017 (post latest SHLAA update) - 16/04102/FUL. Previous application was withdrawn - 10/S/00163/FUL,local-authority-eng:NBL,owned by a public authority,2017-06-23,https://publicaccess.northumberland.gov.uk/online-applications/propertyDetails.do?activeTab=relatedCases&keyVal=OCCVJRQS0GA01,permissioned,full planning permission,POINT(-1.529717 55.113649),4812,http://northumberland.maps.arcgis.com/apps/webappviewer/index.html?id=c1b801d50f8040efbf8c9bc9f916cfae,2016-06-30,/brownfield-land/local-authority-eng/NBL/4812
5020,"Essendene, Kenilworth Road, Ashington",,,2017-12-17,,0.3,12,12,No relevant planning history,local-authority-eng:NBL,not owned by a public authority,,,not permissioned,,POINT(-1.573344 55.181491),5020,http://northumberland.maps.arcgis.com/apps/webappviewer/index.html?id=c1b801d50f8040efbf8c9bc9f916cfae,2016-06-30,/brownfield-land/local-authority-eng/NBL/5020
5021,"Pembroke Court, Woodlea, Newbiggin-by-the-Sea",,,2017-12-17,,0.28,6,6,Previous permission now lapsed for conversion of mansard-type roof space to 6 flats - 11/01075/FUL. Resubmission following initial refused application - 10/S/00393/FUL,local-authority-eng:NBL,not owned by a public authority,2012-07-13,https://publicaccess.northumberland.gov.uk/online-applications/propertyDetails.do?activeTab=relatedCases&keyVal=00IWKYTGLI000,not permissioned,,POINT(-1.511775 55.187622),5021,http://northumberland.maps.arcgis.com/apps/webappviewer/index.html?id=c1b801d50f8040efbf8c9bc9f916cfae,2016-06-30,/brownfield-land/local-authority-eng/NBL/5021
5028,"West End Service Station, North Seaton Road, Newbiggin-by-the-Sea",,,2017-12-17,,0.09,12,12,Planning consent for demolition of petrol station and redevelopment of site for 12 apartments but has lapsed without commencement - 10/S/00536/VARYCO. This consent extended the original outline permission - 06/00393/OUT,local-authority-eng:NBL,not owned by a public authority,2011-07-26,https://publicaccess.northumberland.gov.uk/online-applications/propertyDetails.do?activeTab=relatedCases&keyVal=NMSK8XQS0CE00,not permissioned,,POINT(-1.519734 55.178803),5028,http://northumberland.maps.arcgis.com/apps/webappviewer/index.html?id=c1b801d50f8040efbf8c9bc9f916cfae,2016-06-30,/brownfield-land/local-authority-eng/NBL/5028
5035,"23 Station Road, Bedlington",,,2017-12-17,,0.07,10,10,Permission lapsed without implementation for scheme of 10 apartments - 07/00250/FUL. A subsequent application to extend time limit was withdrawn - 10/S/00570/VARYCO,local-authority-eng:NBL,,2008-02-13,https://publicaccess.northumberland.gov.uk/online-applications/propertyDetails.do?activeTab=relatedCases&keyVal=00ITU8TGLI000,not permissioned,,POINT(-1.571009 55.138638),5035,http://northumberland.maps.arcgis.com/apps/webappviewer/index.html?id=c1b801d50f8040efbf8c9bc9f916cfae,2016-06-30,/brownfield-land/local-authority-eng/NBL/5035
5037,"Land to the rear 91 North Seaton Road, Ashington",,,2017-12-17,,0.05,10,10,Proposal for scheme of 8 flats and 2 houses granted consent but application has now lapsed - 08/00113/FUL,local-authority-eng:NBL,,2008-06-26,https://publicaccess.northumberland.gov.uk/online-applications/propertyDetails.do?activeTab=relatedCases&keyVal=00J00PTGLI000,not permissioned,,POINT(-1.568425 55.18044),5037,http://northumberland.maps.arcgis.com/apps/webappviewer/index.html?id=c1b801d50f8040efbf8c9bc9f916cfae,2016-06-30,/brownfield-land/local-authority-eng/NBL/5037
3074x,"St George's Hospital (land north), Morpeth (brownfield parcel)",yes,,2017-12-17,,20.8,282,282,"Hybrid application currently pending a decision (minded to grant) for large mixed-use scheme, including up to 875 dwellings and a wide variety of supporting infrastructure, services and facilities - 16/00994/FUL",local-authority-eng:NBL,,,https://publicaccess.northumberland.gov.uk/online-applications/propertyDetails.do?activeTab=relatedCases&keyVal=NOP3EVQS0GA00,pending decision,,POINT(-1.689111 55.179019),3074x,http://northumberland.maps.arcgis.com/apps/webappviewer/index.html?id=c1b801d50f8040efbf8c9bc9f916cfae,2017-12-17,/brownfield-land/local-authority-eng/NBL/3074x
3076,"Lynemouth Garage, West Market Street, Lynemouth",,,2017-12-17,,0.05,6,6,"Permitted application across Sites 3049 and 3076 has lapsed, proposal involved demolition of existing buildings and new build scheme of 6 apartments - CM/20090251 . Previous application withdrawn - CM/20080727",local-authority-eng:NBL,,2009-06-05,https://publicaccess.northumberland.gov.uk/online-applications/propertyDetails.do?activeTab=relatedCases&keyVal=00BD53TGLI000,not permissioned,,POINT(-1.537466 55.212334),3076,http://northumberland.maps.arcgis.com/apps/webappviewer/index.html?id=c1b801d50f8040efbf8c9bc9f916cfae,2016-06-30,/brownfield-land/local-authority-eng/NBL/3076
3084,"Ponteland Library, Thornhill Road, Ponteland",yes,,2017-12-17,,0.08,25,25,Full application for development of 25 apartments in two blocks approved August 2017 (post latest SHLAA update) - 16/04427/FUL,local-authority-eng:NBL,not owned by a public authority,2017-08-24,https://publicaccess.northumberland.gov.uk/online-applications/propertyDetails.do?activeTab=relatedCases&keyVal=00BC75TGLI000,permissioned,full planning permission,POINT(-1.744118 55.051205),3084,http://northumberland.maps.arcgis.com/apps/webappviewer/index.html?id=c1b801d50f8040efbf8c9bc9f916cfae,2017-12-17,/brownfield-land/local-authority-eng/NBL/3084
3088,"Telephone Exchange, Newgate Street, Morpeth",,,2017-12-17,,0.37,15,15,No relevant planning history,local-authority-eng:NBL,,,,not permissioned,,POINT(-1.69295 55.1698),3088,http://northumberland.maps.arcgis.com/apps/webappviewer/index.html?id=c1b801d50f8040efbf8c9bc9f916cfae,2017-12-17,/brownfield-land/local-authority-eng/NBL/3088
3101,Lynemouth Conveyor (south),,,2017-12-17,,42.83,200,200,"Outline application for mixed-use scheme, including up to 200 homes, employment and community uses, currently pending a decision - CM/20090157",local-authority-eng:NBL,not owned by a public authority,2008-02-20,https://publicaccess.northumberland.gov.uk/online-applications/propertyDetails.do?activeTab=relatedCases&keyVal=KHOJ57LW00500,pending decision,,POINT(-1.527835 55.208164),3101,http://northumberland.maps.arcgis.com/apps/webappviewer/index.html?id=c1b801d50f8040efbf8c9bc9f916cfae,2016-06-30,/brownfield-land/local-authority-eng/NBL/3101
3133,"Pegswood Garage (former), Longhirst Road, Pegswood",,,2017-12-17,,0.17,5,5,Proposal for a part change of use from garage to provide 10 residential units was withdrawn in June 2017 - 15/04227/FUL,local-authority-eng:NBL,,,https://publicaccess.northumberland.gov.uk/online-applications/propertyDetails.do?activeTab=relatedCases&keyVal=MALFAQQS04N01,not permissioned,,POINT(-1.645508 55.182296),3133,http://northumberland.maps.arcgis.com/apps/webappviewer/index.html?id=c1b801d50f8040efbf8c9bc9f916cfae,2016-06-30,/brownfield-land/local-authority-eng/NBL/3133
9008,"Stannington Nurseries Tea Room, Stannington Station",yes,,2017-12-17,,0.59,27,27,Full application pending consideration (minded to grant) for development of 34 homes across a larger site area - 16/03693/FUL. Outline planning consent already in place for the erection of up to 27 dwellings - 15/01760/OUT,local-authority-eng:NBL,,2016-02-19,https://publicaccess.northumberland.gov.uk/online-applications/propertyDetails.do?activeTab=relatedCases&keyVal=LXJELCQS04P01,permissioned,outline planning permission,POINT(-1.656413 55.128683),9008,http://northumberland.maps.arcgis.com/apps/webappviewer/index.html?id=c1b801d50f8040efbf8c9bc9f916cfae,2017-12-17,/brownfield-land/local-authority-eng/NBL/9008
9012,"Buildings Surrounding Lesbury House, Lesbury",yes,,2017-12-17,,1.92,5,5,Full planning permission granted for 5 dwellings (3 net additions) through conversion and change of use scheme - 15/02771/FUL. Permitted scheme is resubmission of earlier withdrawn proposal -15/00645/FUL,local-authority-eng:NBL,,2015-10-14,https://publicaccess.northumberland.gov.uk/online-applications/propertyDetails.do?activeTab=relatedCases&keyVal=MS8SONQS0CE00,permissioned,full planning permission,POINT(-1.632312 55.397896),9012,http://northumberland.maps.arcgis.com/apps/webappviewer/index.html?id=c1b801d50f8040efbf8c9bc9f916cfae,2017-12-17,/brownfield-land/local-authority-eng/NBL/9012
9019,"8 Sussex Street, Blyth",,,2017-12-17,,0.04,9,9,Outline application for development of 9 residential flats permitted - 15/01774/OUT,local-authority-eng:NBL,,2015-07-27,https://publicaccess.northumberland.gov.uk/online-applications/propertyDetails.do?activeTab=relatedCases&keyVal=005QEETGLI000,permissioned,outline planning permission,POINT(-1.503012 55.128145),9019,http://northumberland.maps.arcgis.com/apps/webappviewer/index.html?id=c1b801d50f8040efbf8c9bc9f916cfae,2017-12-17,/brownfield-land/local-authority-eng/NBL/9019
9022,"Railway Inn and New Dolphin Inn, Front Street, Newbiggin-by-the-Sea",yes,,2017-12-17,,0.11,6,6,Mixed-use scheme permitted for demolition and redevelopment of site providing 8 two-bed bungalows for affordable rent - 15/01569/CCD,local-authority-eng:NBL,,2015-10-26,https://publicaccess.northumberland.gov.uk/online-applications/propertyDetails.do?activeTab=relatedCases&keyVal=00IRUETGLI000,permissioned,full planning permission,POINT(-1.511597 55.185492),9022,http://northumberland.maps.arcgis.com/apps/webappviewer/index.html?id=c1b801d50f8040efbf8c9bc9f916cfae,2017-12-17,/brownfield-land/local-authority-eng/NBL/9022
9028,"Narrowgate House, Narrowgate, Alnwick",yes,,2017-12-17,,0.13,7,7,"Permitted scheme for 8 dwellings (7 net additions) through conversion of listed building and new-build, alongside supporting uses - 15/02603/FUL",local-authority-eng:NBL,not owned by a public authority,2016-10-14,https://publicaccess.northumberland.gov.uk/online-applications/propertyDetails.do?activeTab=relatedCases&keyVal=0007JFTGLI000,permissioned,full planning permission,POINT(-1.709093 55.415031),9028,http://northumberland.maps.arcgis.com/apps/webappviewer/index.html?id=c1b801d50f8040efbf8c9bc9f916cfae,2017-12-17,/brownfield-land/local-authority-eng/NBL/9028
5090,"Storey Cresent (Land at), Newbiggin-by-the-Sea",,,2017-12-17,,2.92,78,78,Allocated housing site - capacity of 78 dwellings outlined,local-authority-eng:NBL,,,,not permissioned,,POINT(-1.523427 55.187731),5090,http://northumberland.maps.arcgis.com/apps/webappviewer/index.html?id=c1b801d50f8040efbf8c9bc9f916cfae,2016-06-30,/brownfield-land/local-authority-eng/NBL/5090
5094,"Welwyn Electronics Park Site A, Bedlington",,,2017-12-17,,3.23,97,97,No relevant planning history,local-authority-eng:NBL,not owned by a public authority,,,not permissioned,,POINT(-1.570113 55.146165),5094,http://northumberland.maps.arcgis.com/apps/webappviewer/index.html?id=c1b801d50f8040efbf8c9bc9f916cfae,2016-06-30,/brownfield-land/local-authority-eng/NBL/5094
5098,"Vald Birn UK Ltd, Cambois",,,2017-12-17,,7.61,180,180,"Outline application for comprehensive mixed-use redevelopment of wider site withdrawn, included site remediation and construction of 323 houses, along with retail, health facilities and infrastructure - 08/00403/OUTES. This revised the original proposal for 467 homes and a range of supporting uses",local-authority-eng:NBL,,,https://publicaccess.northumberland.gov.uk/online-applications/propertyDetails.do?activeTab=relatedCases&keyVal=00J2B4TGLI000,not permissioned,,POINT(-1.526532 55.156329),5098,http://northumberland.maps.arcgis.com/apps/webappviewer/index.html?id=c1b801d50f8040efbf8c9bc9f916cfae,2017-12-17,/brownfield-land/local-authority-eng/NBL/5098
5116x,"Woodhorn Road, Newbiggin-by-the-Sea (brownfield parcel)",,,2017-12-17,,0.16,6,6,No relevant planning history,local-authority-eng:NBL,,,,not permissioned,,POINT(-1.515801 55.185877),5116x,http://northumberland.maps.arcgis.com/apps/webappviewer/index.html?id=c1b801d50f8040efbf8c9bc9f916cfae,2017-12-17,/brownfield-land/local-authority-eng/NBL/5116x
5121,"Land at Debdon House, Cambois",,,2017-12-17,,0.26,5,5,No relevant planning history,local-authority-eng:NBL,,,,not permissioned,,POINT(-1.524193 55.151081),5121,http://northumberland.maps.arcgis.com/apps/webappviewer/index.html?id=c1b801d50f8040efbf8c9bc9f916cfae,2017-12-17,/brownfield-land/local-authority-eng/NBL/5121
5133,"Coulson Park First School, Alexandra Road, Ashington",,,2017-12-17,,0.74,25,25,No relevant planning history,local-authority-eng:NBL,owned by a public authority,,,not permissioned,,POINT(-1.550916 55.173476),5133,http://northumberland.maps.arcgis.com/apps/webappviewer/index.html?id=c1b801d50f8040efbf8c9bc9f916cfae,2016-06-30,/brownfield-land/local-authority-eng/NBL/5133
5135,"Bernicea, Cambois",,,2017-12-17,,0.17,6,6,Outline permission was granted for 6 three-bed dwellings following demolition but not commenced and has lapsed - 12/03080/OUT. Previous application for 6 units withdrawn - 12/00219/OUT,local-authority-eng:NBL,not owned by a public authority,2013-08-22,https://publicaccess.northumberland.gov.uk/online-applications/propertyDetails.do?activeTab=relatedCases&keyVal=00ITXWTGLI000,not permissioned,,POINT(-1.525355 55.153655),5135,http://northumberland.maps.arcgis.com/apps/webappviewer/index.html?id=c1b801d50f8040efbf8c9bc9f916cfae,2017-12-17,/brownfield-land/local-authority-eng/NBL/5135
5136,"St Cuthbert's Church Hall, Front Street, Bedlington",yes,,2017-12-17,,0.14,19,19,"A number of proposals relate to site. Application allowed on appeal for residential development of 19 flats, technically implemented through commencement of site works and will not lapse - 03/00442/FUL. Application for change of use from church hall to 3 dwellings refused - 08/00133/FUL. Further scheme for demolition and erection of 12 units also refused - 09/00003/FUL",local-authority-eng:NBL,not owned by a public authority,2014-02-01,https://publicaccess.northumberland.gov.uk/online-applications/propertyDetails.do?activeTab=relatedCases&keyVal=OP4JS1QS0CE02,permissioned,full planning permission,POINT(-1.593666 55.130449),5136,http://northumberland.maps.arcgis.com/apps/webappviewer/index.html?id=c1b801d50f8040efbf8c9bc9f916cfae,2016-06-30,/brownfield-land/local-authority-eng/NBL/5136
5141,"Site of Demolished Houses - Woodhorn Villas, Blyth Terrace, Ashington",,,2017-12-17,,0.44,12,12,No relevant planning history,local-authority-eng:NBL,not owned by a public authority,,,not permissioned,,POINT(-1.553005 55.18459),5141,http://northumberland.maps.arcgis.com/apps/webappviewer/index.html?id=c1b801d50f8040efbf8c9bc9f916cfae,2016-06-30,/brownfield-land/local-authority-eng/NBL/5141
5152,"21-29 High Market, Ashington",,,2017-12-17,,0.36,11,11,Application for change of use from first floor flat/office to tattoo studio covers part of site (involves loss of a single dwelling) - 15/01566/COU,local-authority-eng:NBL,not owned by a public authority,,https://publicaccess.northumberland.gov.uk/online-applications/propertyDetails.do?activeTab=relatedCases&keyVal=00IE09TGLI000,not permissioned,,POINT(-1.591868 55.183621),5152,http://northumberland.maps.arcgis.com/apps/webappviewer/index.html?id=c1b801d50f8040efbf8c9bc9f916cfae,2017-12-17,/brownfield-land/local-authority-eng/NBL/5152
5172,"Welwyn Electronics Park Site B, Bedlington",,,2017-12-17,,5.56,111,111,No relevant planning history,local-authority-eng:NBL,not owned by a public authority,,,not permissioned,,POINT(-1.568138 55.144469),5172,http://northumberland.maps.arcgis.com/apps/webappviewer/index.html?id=c1b801d50f8040efbf8c9bc9f916cfae,2016-06-30,/brownfield-land/local-authority-eng/NBL/5172
5176,"Warehouse to the rear of Jubilee Terrace, Bedlington",,,2017-12-17,,0.05,6,6,Consent previously granted for construction of 6 flats but this has now lapsed - 08/00326/FUL. An earlier application was refused for scheme of 6 units - 08/00259/FUL,local-authority-eng:NBL,,2008-10-22,https://publicaccess.northumberland.gov.uk/online-applications/propertyDetails.do?activeTab=relatedCases&keyVal=MJP7QVQS04P00,not permissioned,,POINT(-1.569789 55.138346),5176,http://northumberland.maps.arcgis.com/apps/webappviewer/index.html?id=c1b801d50f8040efbf8c9bc9f916cfae,2017-12-17,/brownfield-land/local-authority-eng/NBL/5176
