name,site-address,deliverable,end-date,entry-date,hazardous-substances,hectares,maximum-net-dwellings,minimum-net-dwellings,notes,organisation,ownership-status,planning-permission-date,planning-permission-history,planning-permission-status,planning-permission-type,point,site,site-plan-url,start-date,slug
BFR1,"Land adjoining Shermans Oak, Coldharbour Road, Upper Dicker",yes,,2019-12-04,,0.4,6,6,"This site was previously granted outline planning permission under planning reference WD/2015/0854/O on 19/06/2015 and was later approved under a reserved matters application WD/2017/0873/RM on 14/07/2017 that is still extant.. Total of 2 pairs of semi-detached houses, 1 detached house and 1 bungalow",local-authority-eng:WEA,not owned by a public authority,2019-06-07,http://www.planning.wealden.gov.uk/searchresults.aspx?SearchType=15&ApplicationNumber=2019/0446,permissioned,reserved matters approval,POINT(0.201156 50.865374),BFR1,http://www.wealden.gov.uk/Wealden/Residents/Planning_and_Building_Control/Planning_Policy/Brownfield_Register/PPolicy_Brownfield_Register.aspx,2017-12-13,/brownfield-land/local-authority-eng/WEA/BFR1
BFR2,"Charlwood Manor, Snatts Road, Uckfield",yes,,2017-12-13,,1.2,5,5,This site was granted full planning permission under planning reference WD/2014/1177/F on the 15/07/2014 but this is no longer extant.. Total of 5 units comprising of 4 semi-detached houses and one house,local-authority-eng:WEA,not owned by a public authority,2017-10-24,http://www.planning.wealden.gov.uk/searchresults.aspx?SearchType=15&ApplicationNumber=2017/0550,permissioned,full planning permission,POINT(0.093152 50.979027),BFR2,http://www.wealden.gov.uk/Wealden/Residents/Planning_and_Building_Control/Planning_Policy/Brownfield_Register/PPolicy_Brownfield_Register.aspx,2017-12-13,/brownfield-land/local-authority-eng/WEA/BFR2
BFR8,"Land at Heatherlea, Newick Lane, Heathfield",yes,,2019-12-04,,2.13,5,5,"This site was previously granted full planning permission under planning reference WD/2017/0258/F for the demolition of a existing dwelling, annexe, static mobile home, workshops and outbuildings and the erection of a residential development comprising 7 dwellings on 10/06/2017. The site was also granted full planning permission under planning reference WD/2017/2954/F for the demolition of a static mobile home, annexe, workshops and outbuildings, alterations and additions to existing dwelling and erection of resdential development comprising six dwellings on 27/04/2018. The latest planning application refers the latter planning application for six dwellings.. Total of 6 new detached dwellings",local-authority-eng:WEA,not owned by a public authority,2019-09-06,http://www.planning.wealden.gov.uk/searchresults.aspx?SearchType=15&ApplicationNumber=2019/0609,permissioned,full planning permission,POINT(0.266465 50.975279),BFR8,http://www.wealden.gov.uk/Wealden/Residents/Planning_and_Building_Control/Planning_Policy/Brownfield_Register/PPolicy_Brownfield_Register.aspx,2017-12-13,/brownfield-land/local-authority-eng/WEA/BFR8
BFR10,"Rockington Nursery, Blackness Road, Crowborough",yes,,2017-12-13,,2.04,34,34,Total of 34 units comprising of 22 houses and 12 affordable houses,local-authority-eng:WEA,not owned by a public authority,2016-10-21,http://www.planning.wealden.gov.uk/searchresults.aspx?SearchType=15&ApplicationNumber=2016/1677,permissioned,outline planning permission,POINT(0.17659 51.046492),BFR10,http://www.wealden.gov.uk/Wealden/Residents/Planning_and_Building_Control/Planning_Policy/Brownfield_Register/PPolicy_Brownfield_Register.aspx,2017-12-13,/brownfield-land/local-authority-eng/WEA/BFR10
BFR13,"Beechwood House, Beechwood Lane, Heathfield",yes,,2019-12-04,,0.28,10,10,"This site was previously granted full planning permission under planning reference WD/2015/2220/MAJ for the demolition of a existing nursery school, associated buildings and swimming pool and residential development comprising 9 new dwellings and conversion of existing lodge (total of 10 dwelling units) on 08/03/2016. In addition, the site had an application for a minor material amendment approved on 13/06/2018.. Total of 10 units comprising of one two bedroom, 4 three bedroom, 1 four bedroom and 4 five bedroom houses",local-authority-eng:WEA,not owned by a public authority,2019-11-28,http://www.planning.wealden.gov.uk/searchresults.aspx?SearchType=15&ApplicationNumber=2019/1875,permissioned,full planning permission,POINT(0.263207 50.960718),BFR13,http://www.wealden.gov.uk/Wealden/Residents/Planning_and_Building_Control/Planning_Policy/Brownfield_Register/PPolicy_Brownfield_Register.aspx,2017-12-13,/brownfield-land/local-authority-eng/WEA/BFR13
BFR14,"The Cart Barn, Burwash Road, Heathfield",yes,,2017-12-13,,0.32,15,15,"Total of 15 residential units comprising of 12 three bedroom houses, along with 1 three bedroom and 2 two bedroom affordable houses",local-authority-eng:WEA,not owned by a public authority,2016-12-15,http://www.planning.wealden.gov.uk/searchresults.aspx?SearchType=15&ApplicationNumber=2015/2438,permissioned,outline planning permission,POINT(0.263916 50.973835),BFR14,http://www.wealden.gov.uk/Wealden/Residents/Planning_and_Building_Control/Planning_Policy/Brownfield_Register/PPolicy_Brownfield_Register.aspx,2017-12-13,/brownfield-land/local-authority-eng/WEA/BFR14
BFR17,"The Regent, The Broadway, Crowborough",yes,,2019-12-04,,0.04,7,7,"This site was granted full planning permission for 10 (net) dwellings comprising 10 residential flats on 18/05/2017 under reference WD/2017/0323/MAJ that is extant at the time of writing. In addition, under planning reference WD/2019/0073/P01 the Council approved a scheme under the General Permitted Development Order procedure for the conversion of the first and third floors of the building to 7 residential flats.. Total of 7 units comprising of 7 residential apartments",local-authority-eng:WEA,not owned by a public authority,2019-10-14,http://www.planning.wealden.gov.uk/searchresults.aspx?SearchType=15&ApplicationNumber=2019/1645,permissioned,full planning permission,POINT(0.162903 51.058959),BFR17,http://www.wealden.gov.uk/Wealden/Residents/Planning_and_Building_Control/Planning_Policy/Brownfield_Register/PPolicy_Brownfield_Register.aspx,2017-12-13,/brownfield-land/local-authority-eng/WEA/BFR17
BFR24,"Mayfield Children's Home, East Street, Mayfield",yes,,2018-12-13,,0.42,11,11,Total of 11 residential units comprising 7 three bedroom houses and 4 four bedroom houses,local-authority-eng:WEA,not owned by a public authority,2018-04-12,http://www.planning.wealden.gov.uk/searchresults.aspx?SearchType=15&ApplicationNumber=2017/0299,permissioned,full planning permission,POINT(0.27889 51.019539),BFR24,http://www.wealden.gov.uk/Wealden/Residents/Planning_and_Building_Control/Planning_Policy/Brownfield_Register/PPolicy_Brownfield_Register.aspx,2018-12-13,/brownfield-land/local-authority-eng/WEA/BFR24
BFR25,"Kensington Domestic Appliances Ltd., Tilsmore Road, Heathfield",yes,,2018-12-13,,0.07,9,9,Total of 9 residential units comprising 8 two bedroom apartments and 1 one bedroom apartment,local-authority-eng:WEA,not owned by a public authority,2018-03-28,http://www.planning.wealden.gov.uk/searchresults.aspx?SearchType=15&ApplicationNumber=2017/2236,permissioned,full planning permission,POINT(0.24769 50.969966),BFR25,http://www.wealden.gov.uk/Wealden/Residents/Planning_and_Building_Control/Planning_Policy/Brownfield_Register/PPolicy_Brownfield_Register.aspx,2018-12-13,/brownfield-land/local-authority-eng/WEA/BFR25
BFR26,"The Old Loom Mill, Ersham Road, Hailsham",yes,,2018-12-13,,4.67,24,24,"Total of 24 residential units comprising a mixture of 3, 4, and 5 bedroom houses",local-authority-eng:WEA,not owned by a public authority,2017-10-13,http://www.planning.wealden.gov.uk/searchresults.aspx?SearchType=15&ApplicationNumber=2017/0839,permissioned,outline planning permission,POINT(0.254879 50.842439),BFR26,http://www.wealden.gov.uk/Wealden/Residents/Planning_and_Building_Control/Planning_Policy/Brownfield_Register/PPolicy_Brownfield_Register.aspx,2018-12-13,/brownfield-land/local-authority-eng/WEA/BFR26
BFR27,"Windmill Feeds, Lewes Road, Cross-in-Hand",yes,,2018-12-13,,0.28,5,5,Total of 5 residential units comprising 2 dwelling houses and 3 apartments,local-authority-eng:WEA,not owned by a public authority,2018-02-20,http://www.planning.wealden.gov.uk/searchresults.aspx?SearchType=15&ApplicationNumber=2016/2918,permissioned,outline planning permission,POINT(0.217668 50.973949),BFR27,http://www.wealden.gov.uk/Wealden/Residents/Planning_and_Building_Control/Planning_Policy/Brownfield_Register/PPolicy_Brownfield_Register.aspx,2018-12-13,/brownfield-land/local-authority-eng/WEA/BFR27
BFR29,"Land at Royal Mail Delivery Office, 74 High Street, Polegate",,,2019-12-04,,0.14,6,6,"This site is contained within the Submission Wealden Local Plan (January, 2019) under Policy SWGA 40 (page 219). The document can be found at the following webpage: http://www.wealden.gov.uk/Wealden/Residents/Planning_and_Building_Control/Planning_Policy/Wealden_Local_Plan/Wealden_Local_Plan_Submission_Library.aspx",local-authority-eng:WEA,not owned by a public authority,,,not permissioned,,POINT(0.244915 50.823357),BFR29,http://www.wealden.gov.uk/Wealden/Residents/Planning_and_Building_Control/Planning_Policy/Brownfield_Register/PPolicy_Brownfield_Register.aspx,2018-12-13,/brownfield-land/local-authority-eng/WEA/BFR29
BFR30,"Cadence, Battle Road, Punnetts Town, Heathfield",yes,,2019-12-04,,0.37,5,5,Total of 6 units comprising one four bedroom dwelling and 5 two bedroom dwellings.,local-authority-eng:WEA,not owned by a public authority,2019-02-27,http://www.planning.wealden.gov.uk/searchresults.aspx?SearchType=15&ApplicationNumber=2018/2235,permissioned,outline planning permission,POINT(0.3098 50.96),BFR30,http://www.wealden.gov.uk/Wealden/Residents/Planning_and_Building_Control/Planning_Policy/Brownfield_Register/PPolicy_Brownfield_Register.aspx,2019-12-04,/brownfield-land/local-authority-eng/WEA/BFR30
BFR31,"Hamelsham Manor, 80 London Road, Hailsham",yes,,2019-12-04,,0.2,7,7,This site was granted outline planning permission for 3 (net) dwellings reference under planning reference WD/2016/1326/O that is extant at the time of writing.. Total of 7 units comprising of 6 residential apartments and a single detached bungalow.,local-authority-eng:WEA,not owned by a public authority,2018-02-09,http://www.planning.wealden.gov.uk/searchresults.aspx?SearchType=15&ApplicationNumber=2017/1997,permissioned,outline planning permission,POINT(0.2513 50.869),BFR31,http://www.wealden.gov.uk/Wealden/Residents/Planning_and_Building_Control/Planning_Policy/Brownfield_Register/PPolicy_Brownfield_Register.aspx,2019-12-04,/brownfield-land/local-authority-eng/WEA/BFR31
BFR32,"Land adjacent the Drive, Hellingly Hospital, Hellingly",yes,,2019-12-04,,0.15,8,8,Total of 8 units comprising of 8 residential apartments,local-authority-eng:WEA,not owned by a public authority,2018-12-06,http://www.planning.wealden.gov.uk/searchresults.aspx?SearchType=15&ApplicationNumber=2016/3095,permissioned,full planning permission,POINT(0.2687 50.889),BFR32,http://www.wealden.gov.uk/Wealden/Residents/Planning_and_Building_Control/Planning_Policy/Brownfield_Register/PPolicy_Brownfield_Register.aspx,2019-12-04,/brownfield-land/local-authority-eng/WEA/BFR32
BFR33,"Crown Inn, High Street, Blackboys",yes,,2019-12-04,,0.21,6,6,Total of 6 units comprising of 6 residential apartments,local-authority-eng:WEA,not owned by a public authority,2019-05-23,http://www.planning.wealden.gov.uk/searchresults.aspx?SearchType=15&ApplicationNumber=2019/0697,permissioned,full planning permission,POINT(0.1735 50.966),BFR33,http://www.wealden.gov.uk/Wealden/Residents/Planning_and_Building_Control/Planning_Policy/Brownfield_Register/PPolicy_Brownfield_Register.aspx,2019-12-04,/brownfield-land/local-authority-eng/WEA/BFR33
BFR34,"Former Shep Plastics, Lower Dicker",yes,,2019-12-04,,0.02,8,8,Total of 8 units comprising of 8 residential apartments,local-authority-eng:WEA,not owned by a public authority,2019-05-28,http://www.planning.wealden.gov.uk/searchresults.aspx?SearchType=15&ApplicationNumber=2019/0688,permissioned,full planning permission,POINT(0.2461 50.968),BFR34,http://www.wealden.gov.uk/Wealden/Residents/Planning_and_Building_Control/Planning_Policy/Brownfield_Register/PPolicy_Brownfield_Register.aspx,2019-12-04,/brownfield-land/local-authority-eng/WEA/BFR34
BFR35,"Quicken Trust, West End, Herstmonceux",yes,,2019-12-04,,0.03,6,6,Total of 6 units comprising of 6 residential apartments,local-authority-eng:WEA,not owned by a public authority,2019-04-30,http://www.planning.wealden.gov.uk/searchresults.aspx?SearchType=15&ApplicationNumber=2019/0072,permissioned,full planning permission,POINT(0.2279 50.879),BFR35,http://www.wealden.gov.uk/Wealden/Residents/Planning_and_Building_Control/Planning_Policy/Brownfield_Register/PPolicy_Brownfield_Register.aspx,2019-12-04,/brownfield-land/local-authority-eng/WEA/BFR35
BFR36,"Holdenhurst, Mill Road, Heathfield",yes,,2019-12-04,,0.57,12,12,Demolition of existing sheltered accommodation and the erection of 48 unit extra care facility (Use Class C3) with associated communal facilities,local-authority-eng:WEA,not owned by a public authority,2016-10-20,http://www.planning.wealden.gov.uk/searchresults.aspx?SearchType=15&ApplicationNumber=2016/1724,permissioned,full planning permission,POINT(0.3215 50.89),BFR36,http://www.wealden.gov.uk/Wealden/Residents/Planning_and_Building_Control/Planning_Policy/Brownfield_Register/PPolicy_Brownfield_Register.aspx,2019-12-04,/brownfield-land/local-authority-eng/WEA/BFR36
