site-address,deliverable,end-date,entry-date,hazardous-substances,hectares,maximum-net-dwellings,minimum-net-dwellings,notes,organisation,ownership-status,planning-permission-date,planning-permission-history,planning-permission-status,planning-permission-type,point,site,site-plan-url,start-date,slug
"Sawmills Industrial Park, Wickham Road, Fareham",yes,,2020-10-23,,2.2,72,72,"Site is currently occupied by a series of industrial uses and is in single ownership. Grade II Listed building is located adjacent to the site. Site is within the Welborne boundary as shown in Local Plan Part 3: The Welborne Plan (June 2015).. Demolition, Site Clearance And Remediation With The Erection Of 72 C3 Residential Dwellings And Associated Access, Parking, Ancillary Infrastructure And Landscaping Works. http://www.fareham.gov.uk/casetrackerplanning/ApplicationDetails.aspx?reference=P/17/0189/FP&uprn=100062408858",local-authority-eng:FAR,not owned by a public authority,,http://www.fareham.gov.uk/casetrackerplanning/ApplicationDetails.aspx?reference=P/17/0189/FP&uprn=100062408858,pending decision,full planning permission,POINT(-1.180587 50.883688),37,https://www.fareham.gov.uk/downloads/BLR_Plans/SitePlan-93.jpg,2017-12-01,brownfield-land/local-authority-eng/FAR/37
Hammond Industrial Park,yes,,2020-10-23,,0.6,36,36,Site is not recommended for retention in the Employment Land Review. Suitable site for residential development. Consideration of noise impact required due to proximity of airport runway.. https://www.fareham.gov.uk/planning/publicationplanevidence.aspx,local-authority-eng:FAR,not owned by a public authority,,,not permissioned,,POINT(-1.213089 50.815595),93,https://www.fareham.gov.uk/downloads/BLR_Plans/SitePlan-37.jpg,2020-10-23,brownfield-land/local-authority-eng/FAR/93
"3-33 West Street, Portchester",yes,,2020-10-23,,0.25,26,26,Site is located in Portchester District Centre. Development proposed above existing retail and residential units.. Additional 1 and 2 storeys on the existing building to provide 26 apartments. https://www.fareham.gov.uk/planning/publicationplanevidence.aspx,local-authority-eng:FAR,not owned by a public authority,,http://www.fareham.gov.uk/casetrackerplanning/ApplicationDetails.aspx?reference=P%2F19%2F1040%2FOA,pending decision,outline planning permission,POINT(-1.124891 50.846588),203,https://www.fareham.gov.uk/downloads/BLR_Plans/SitePlan-203.jpg,2019-12-01,brownfield-land/local-authority-eng/FAR/203
"Fareham Station East, Fareham",yes,,2020-10-23,,1.58,120,120,"Site is identified as a Development Opportunity Area in the adopted Fareham Local Plan Part 2 (2015) and identified as a proposed Fareham Town Centre housing allocation in the Draft Local Plan (2017). This identifies a capacity of 120 dwellings for the site. Immediate and surrounding uses include a public transport hub and interchange, low-key industrial service industries, fire station and some residential. Relocation of existing fire station or incorporation into a redevelopment would be required.. https://www.fareham.gov.uk/planning/publicationplanevidence.aspx",local-authority-eng:FAR,mixed ownership,,,not permissioned,,POINT(-1.191472 50.853452),211,https://www.fareham.gov.uk/downloads/BLR_Plans/SitePlan-211.jpg,2017-12-01,brownfield-land/local-authority-eng/FAR/211
"Fareham Station West, Fareham",yes,,2020-10-23,,1.05,94,94,"Site is an adopted housing allocation in the adopted Fareham Local Plan Part 2 (2015) and identified as a proposed Fareham Town Centre housing allocation in the Draft Local Plan (2017). This identifies a capacity of 94 dwellings for the site. Industrial and service industries, car garage and residential are located to the west and train station to the east. Area with TPOs is also located adjacent to the west. Indicative capacity of 30 dwellings and a care home or 75 dwellings is also identified for Fareham Station East in the Local Plan Part 2 Sites and Policies document (adopted June 2015).. https://www.fareham.gov.uk/planning/publicationplanevidence.aspx",local-authority-eng:FAR,not owned by a public authority,,,not permissioned,,POINT(-1.193139 50.853735),212,https://www.fareham.gov.uk/downloads/BLR_Plans/SitePlan-212.jpg,2017-12-01,brownfield-land/local-authority-eng/FAR/212
"Wynton Way, Fareham",yes,,2020-10-23,,0.43,13,13,Site is an adopted housing allocation in the adopted Fareham Local Plan Part 2 (2015) and proposed for retention in Draft Local Plan (2017). Constitutes a D Class use and a garage block.. https://www.fareham.gov.uk/planning/publicationplanevidence.aspx,local-authority-eng:FAR,not owned by a public authority,,,not permissioned,,POINT(-1.215644 50.862323),1058,https://www.fareham.gov.uk/downloads/BLR_Plans/SitePlan-1058.jpg,2017-12-01,brownfield-land/local-authority-eng/FAR/1058
"335-357 Gosport Road, Fareham",yes,,2020-10-23,,0.2,8,8,Site is an adopted housing allocation in the adopted Fareham Local Plan Part 2 (2015) and proposed for retention in Draft Local Plan (2017). Site is currently vacant and located adjacent to the Bus Rapid Transit (BRT) route along the former railway line. Site is owned by Hampshire County Council.. https://www.fareham.gov.uk/planning/publicationplanevidence.aspx,local-authority-eng:FAR,owned by a public authority,,,not permissioned,,POINT(-1.180995 50.838329),1076,https://www.fareham.gov.uk/downloads/BLR_Plans/SitePlan-1076.jpg,2017-12-01,brownfield-land/local-authority-eng/FAR/1076
"Swanwick Marina, Bridge Road",yes,,2020-10-23,,4.66,50,50,"Permission remains extant due to groundworks commencement having initially been granted in 2008 (P/07/0764/FP). South eastern portion of the site is located adjacent to Swanwick Shore Conservation Area and Listed Buildings. Latest consent (P/15/0424/VC) relates to a variation of condition for an additional affordable dwelling increasing the proposed total to 50. Majority of site located in Flood Zone 3.. Comprehensive Redevelopment Of Marina Comprising Retail, Bar, Restaurant, Offices, And Storage Revised Marina Layout & 49 Dwellings: Variation Of Planning Condition 2 Of P/07/0764/Fp - Minor Amendments To Block A Residential, To Create Additional Unit For Affordable Housing. https://www.fareham.gov.uk/planning/publicationplanevidence.aspx",local-authority-eng:FAR,not owned by a public authority,2015-07-03,http://www.fareham.gov.uk/casetrackerplanning/ApplicationDetails.aspx?reference=P/15/0424/VC&uprn=10012134300,permissioned,other,POINT(-1.299308 50.882614),1203,https://www.fareham.gov.uk/downloads/BLR_Plans/SitePlan-1203.jpg,2017-12-01,brownfield-land/local-authority-eng/FAR/1203
"Crofton Conservatories, Fareham",yes,,2020-10-23,,0.24,49,49,Site is an adopted housing allocation in the adopted Fareham Local Plan Part 2 (2015) and proposed for retention in the Draft Local Plan (2017). This identifies a capacity of 49 dwellings for the site. Access is from Maytree Road. The site is currently under retail use.. https://www.fareham.gov.uk/planning/publicationplanevidence.aspx,local-authority-eng:FAR,not owned by a public authority,,,not permissioned,,POINT(-1.188618 50.852425),1325,https://www.fareham.gov.uk/downloads/BLR_Plans/SitePlan-1325.jpg,2017-12-01,brownfield-land/local-authority-eng/FAR/1325
"Market Quay, Fareham",yes,,2020-10-23,,1.48,100,100,Site is identified as a Development Opportunity Area in the adopted Fareham Local Plan Part 2 (2015) and identified as a proposed Fareham Town Centre mixed use allocation in the Draft Local Plan (2017). This identifies a capacity of 100 dwellings for the site (excluding potential hotel use on upper floors). A car park currently serves the commercial shopping and retail core forming the town centre. The A27 is located within proximity to the south.. https://www.fareham.gov.uk/planning/publicationplanevidence.aspx,local-authority-eng:FAR,owned by a public authority,,,not permissioned,,POINT(-1.177444 50.851458),1425,https://www.fareham.gov.uk/downloads/BLR_Plans/SitePlan-3040.jpg,2017-12-01,brownfield-land/local-authority-eng/FAR/1425
Northfield Park,yes,,2020-10-23,,0.92,22,22,"Suitable reptile receptor sites should be sought, especially in combination with other site allocations within the local area. Buffer boundaries and provision of dark corridors to provide strategic corridors for nocturnal species in the wider landscape.. Use Of Land For Stationing Of Aged Persons' Residential Park Homes. https://www.fareham.gov.uk/planning/publicationplanevidence.aspx",local-authority-eng:FAR,not owned by a public authority,,http://www.fareham.gov.uk/casetrackerplanning/ApplicationDetails.aspx?reference=P%2F18%2F1437%2FFP,pending decision,full planning permission,POINT(-1.140119 50.852859),3040,https://www.fareham.gov.uk/downloads/BLR_Plans/SitePlan-1425.jpg,2020-10-23,brownfield-land/local-authority-eng/FAR/3040
"Magistrates Court, Fareham",yes,,2020-10-23,,0.22,45,45,Site is identified as a proposed Fareham Town Centre housing allocation in the Draft Local Plan (2017). This identifies a capacity of 45 dwellings for the site. Former Magistrates Court building identified as surplus to requirements.. Demolition of Fareham Magistrates Court and redevelopment of the site which comprises up to 45 apartments. https://www.fareham.gov.uk/planning/publicationplanevidence.aspx,local-authority-eng:FAR,owned by a public authority,,http://www.fareham.gov.uk/casetrackerplanning/ApplicationDetails.aspx?reference=P%2F18%2F1261%2FOA,pending decision,outline planning permission,POINT(-1.183124 50.853384),3070,https://www.fareham.gov.uk/downloads/BLR_Plans/SitePlan-3070.jpg,2017-12-01,brownfield-land/local-authority-eng/FAR/3070
"Warsash Maritime Academy, Warsash",yes,,2020-10-23,,2.46,100,100,Site is identified as a proposed housing allocation in the Draft Local Plan (2017). This identifies an indicative capacity of 100 dwellings for the site which are deliverable within 5 years. Listed Buildings and TPOs on the site. Site is also located adjacent to sensitive environmental designations and Flood Zone 3. Site is identified as surplus to requirements by Southampton Solent University.. https://www.fareham.gov.uk/planning/publicationplanevidence.aspx,local-authority-eng:FAR,not owned by a public authority,,,not permissioned,,POINT(-1.302721 50.84543),3088,https://www.fareham.gov.uk/downloads/BLR_Plans/SitePlan-3088.jpg,2017-12-01,brownfield-land/local-authority-eng/FAR/3088
"Cherry Tree Industrial Park, Burridge",yes,,2020-10-23,,0.92,15,15,Site currently in operational use. SHELAA (October 2019) shows that 80% of the site is developable at 20 dph with an indicative dwellings yield of 15 dwellings. TPO trees located on front part of the site.. https://www.fareham.gov.uk/planning/publicationplanevidence.aspx,local-authority-eng:FAR,not owned by a public authority,,,not permissioned,,POINT(-1.261813 50.893823),3116,https://www.fareham.gov.uk/downloads/BLR_Plans/SitePlan-3116.jpg,2019-12-01,brownfield-land/local-authority-eng/FAR/3116
"The Grange, Oakcroft Lane, Stubbington",yes,,2020-10-23,,0.72,9,9,"Site promoted for redevelopment of 9 dwellings.. Development comprising 9 dwellings, together with access, landscaping, car parking and associated works. https://www.fareham.gov.uk/planning/publicationplanevidence.aspx",local-authority-eng:FAR,not owned by a public authority,,http://www.fareham.gov.uk/casetrackerplanning/ApplicationDetails.aspx?reference=P%2F19%2F0483%2FFP,pending decision,full planning permission,POINT(-1.219356 50.835902),3120,https://www.fareham.gov.uk/downloads/BLR_Plans/SitePlan-3120.jpg,2019-12-01,brownfield-land/local-authority-eng/FAR/3120
"1 Station Industrial Park, Duncan Road, Park Gate",yes,,2020-10-23,,0.09,15,15,"Prior approval required and subsequently granted for conversion of the existing office building into flats.. Part 3, Class O: Change Of Use From B1(A) Offices Into C3 Dwellinghouses - Proposal For 15No. Studio Flats. https://www.fareham.gov.uk/planning/publicationplanevidence.aspx",local-authority-eng:FAR,not owned by a public authority,2017-10-31,http://www.fareham.gov.uk/casetrackerplanning/ApplicationDetails.aspx?reference=P/17/1219/PC,permissioned,other,POINT(-1.266528 50.875288),3142,https://www.fareham.gov.uk/downloads/BLR_Plans/SitePlan-3142.jpg,2017-12-01,brownfield-land/local-authority-eng/FAR/3142
"189-199 West Street, Fareham",yes,,2020-10-23,,0.17,8,8,This prior approval application (P/17/0293/PC) was made prior to an approved full planning application for 6 units (P/17/0338/FP). Ground floor is classed as secondary retail frontage for the purposes of the adopted Local Plan.. Prior Approval For Change Of Use Of Upper Two Floors From Office Use (Class B1) To Residential Use (Class C3) To Provide 4 One-Bedroom And 4 Two-Bedroom Flats With Access From Ground Floor And Designated Off-Site Parking. https://www.fareham.gov.uk/planning/publicationplanevidence.aspx,local-authority-eng:FAR,not owned by a public authority,2017-05-17,http://www.fareham.gov.uk/casetrackerplanning/ApplicationDetails.aspx?reference=P/17/0293/PC&uprn=100062407518,permissioned,other,POINT(-1.185406 50.852947),3145,https://www.fareham.gov.uk/downloads/BLR_Plans/SitePlan-3145.jpg,2017-12-01,brownfield-land/local-authority-eng/FAR/3145
"Former Wavemar Electronics Building, Fareham",yes,,2020-10-23,,0.12,9,9,"Site is located in Park Gate Local Centre.. Demolition Of Existing Factory And Erection Of 9 One Bed Flats, 2 Self Contained Offices, Parking, Cycle And Bin Storage. https://www.fareham.gov.uk/planning/publicationplanevidence.aspx",local-authority-eng:FAR,not owned by a public authority,2016-10-12,http://www.fareham.gov.uk/casetrackerplanning/ApplicationDetails.aspx?reference=P/16/0914/FP&uprn=200002901456,permissioned,full planning permission,POINT(-1.268668 50.87277),3146,https://www.fareham.gov.uk/downloads/BLR_Plans/SitePlan-3146.jpg,2017-12-01,brownfield-land/local-authority-eng/FAR/3146
"Former Scout Hut, Coldeast Way, Sarisbury Green",yes,,2020-10-23,,0.15,7,7,"Site forms part of the wider Coldeast development. Permission granted for demolition of Scout hut and construction of apartments.. Outline Application For 3No. 1 Bedroom Apartments and 4No 2 Bedroom Apartments(Starter Homes/Shared Ownership), Following The Demolition Of The Existing Scout Hut Building. https://www.fareham.gov.uk/planning/publicationplanevidence.aspx",local-authority-eng:FAR,owned by a public authority,,http://www.fareham.gov.uk/casetrackerplanning/ApplicationDetails.aspx?reference=P/17/1420/OA,permissioned,outline planning permission,POINT(-1.209422 50.860466),3149,https://www.fareham.gov.uk/downloads/BLR_Plans/SitePlan-3149.jpg,2017-12-01,brownfield-land/local-authority-eng/FAR/3149
22-27a Stubbington Green,yes,,2020-10-23,,0.09,9,9,Site is located in Stubbington Local Centre. Application for change of use of first floor to residential dwellings.. Change of use of first floor from sports club to nine flats. https://www.fareham.gov.uk/planning/publicationplanevidence.aspx,local-authority-eng:FAR,not owned by a public authority,,http://www.fareham.gov.uk/casetrackerplanning/ApplicationDetails.aspx?reference=P%2F18%2F1410%2FFP,pending decision,full planning permission,POINT(-1.288645 50.868817),3206,https://www.fareham.gov.uk/downloads/BLR_Plans/SitePlan-3206.jpg,2019-12-01,brownfield-land/local-authority-eng/FAR/3206
Locks Heath District Centre,yes,,2020-10-23,,0.27,35,35,"Suitable urban site, subject to appropriate parking provision.. https://www.fareham.gov.uk/planning/publicationplanevidence.aspx",local-authority-eng:FAR,not owned by a public authority,,,not permissioned,,POINT(-1.273786 50.862864),3227,https://www.fareham.gov.uk/downloads/BLR_Plans/SitePlan-3227.jpg,2020-10-23,brownfield-land/local-authority-eng/FAR/3227
68 Titchfield Park Road,yes,,2020-10-23,,0.19,9,9,"Conversion of the existing building to apartments would be acceptable, subject to the creation of suitable access and appropriate tree protection.. https://www.fareham.gov.uk/planning/publicationplanevidence.aspx",local-authority-eng:FAR,not owned by a public authority,,,not permissioned,,POINT(-1.251397 50.861411),3228,https://www.fareham.gov.uk/downloads/BLR_Plans/SitePlan-3228.jpg,2020-10-23,brownfield-land/local-authority-eng/FAR/3228
"Former Filing Station, Locks Heath Centre",yes,,2020-10-23,,0.31,30,30,Suitable urban site for development.. https://www.fareham.gov.uk/planning/publicationplanevidence.aspx,local-authority-eng:FAR,not owned by a public authority,,,not permissioned,,POINT(-1.272467 50.863563),3235,https://www.fareham.gov.uk/downloads/BLR_Plans/SitePlan-3235.jpg,2020-10-23,brownfield-land/local-authority-eng/FAR/3235
Assheton Court,yes,,2020-10-23,,0.44,27,27,The site is in a sustainable location. Redevelopment will achieve improved capacity for the site. Flood risk assessment required.. https://www.fareham.gov.uk/planning/publicationplanevidence.aspx,local-authority-eng:FAR,owned by a public authority,,,not permissioned,,POINT(-1.124121 50.844942),3244,https://www.fareham.gov.uk/downloads/BLR_Plans/SitePlan-3244.jpg,2020-10-23,brownfield-land/local-authority-eng/FAR/3244
