name,site-address,deliverable,end-date,entry-date,hazardous-substances,hectares,maximum-net-dwellings,minimum-net-dwellings,notes,organisation,ownership-status,planning-permission-date,planning-permission-history,planning-permission-status,planning-permission-type,point,site,site-plan-url,start-date,slug
BFR1127,"Connaught House, 32 Connaught Street",yes,18/12/2019,2019-12-18,,0.03,6,6,"No longer suitable for development. No permission, SAMLAA identified this site is not recommended for allocation.",local-authority-eng:NOR,not owned by a public authority,,,not permissioned,,POINT(-0.894114 52.242713),BFR1127,https://www.northampton.gov.uk/download/downloads/id/10100/bfr1127,2016-06-29,/brownfield-land/local-authority-eng/NOR/BFR1127
BFR1129,104 - 104A Abington Street,,18/12/2019,2019-12-18,,0.01,5,5,Removed as site has been developed.,local-authority-eng:NOR,not owned by a public authority,,,,,POINT(-0.889876 52.239344),BFR1129,https://www.northampton.gov.uk/download/downloads/id/10103/bfr1129,2017-12-13,/brownfield-land/local-authority-eng/NOR/BFR1129
BFR1801,13 - 17 Bridge Street,yes,,2018-12-21,,0.04,16,16,N/2017/0747 five storey rear extension to create 41-bed student accommodation,local-authority-eng:NOR,not owned by a public authority,2018-10-26,,permissioned,full planning permission,POINT(-0.897 52.236256),BFR1801,https://www.northampton.gov.uk/download/downloads/id/10708/bfr1801,2018-12-21,/brownfield-land/local-authority-eng/NOR/BFR1801
BFR1802,59 Clarke Road,yes,,2019-12-18,,0.05,9,9,"N/2019/0527, Prior Notification of Change of Use from Offices (Use Class B1) to 9 Dwellings (Use Class C3) approved 4/7/19.",local-authority-eng:NOR,not owned by a public authority,2019-07-04,,permissioned,other,POINT(-0.873034 52.247739),BFR1802,https://www.northampton.gov.uk/download/downloads/id/10707/bfr1802,2018-12-21,/brownfield-land/local-authority-eng/NOR/BFR1802
BFR1803,"41A Eastfield Road, Duston",yes,,2019-12-18,,0.04,5,5,"N/2017/1610 Demolition of 2no existing houses and construction of 5no new build bed person social houses, under construction April 2019",local-authority-eng:NOR,not owned by a public authority,2018-03-14,,permissioned,full planning permission,POINT(-0.946857 52.250905),BFR1803,https://www.northampton.gov.uk/download/downloads/id/10712/bfr1803,2018-12-21,/brownfield-land/local-authority-eng/NOR/BFR1803
BFR1804,61A Spencer Bridge Road,yes,,2019-12-18,,0.02,7,7,N/2017/1651 conversion/change of use to 7no flats. Under construction April 2019,local-authority-eng:NOR,not owned by a public authority,2018-05-18,,permissioned,full planning permission,POINT(-0.912915 52.242209),BFR1804,https://www.northampton.gov.uk/download/downloads/id/10714/bfr1804,2018-12-21,/brownfield-land/local-authority-eng/NOR/BFR1804
BFR1805,"The Tanners PH, 32 Farmfield Court",yes,,2018-12-21,,0.31,17,17,N/2017/1653 Demolition of existing buildings and proposed development of 17no. new dwellingswith 400 sqm of retail unit and retail unit/takeaway,local-authority-eng:NOR,not owned by a public authority,2018-10-24,,permissioned,full planning permission,POINT(-0.840167 52.27191),BFR1805,https://www.northampton.gov.uk/download/downloads/id/10725/bfr1805,2018-12-21,/brownfield-land/local-authority-eng/NOR/BFR1805
BFR1807,Riverside House,yes,,2019-12-18,,0.57,192,60,"N/2018/0247 Change of Use from Offices to residential comprising 60no units. Also N/2018/0136, Prior Notification of Change of Use from Offices (Use Class B1a) to (192) Studio Apartments (Use Class C3), approved 18/4/2018.",local-authority-eng:NOR,owned by a public authority,2018-04-18,,permissioned,other,POINT(-0.881197 52.233197),BFR1807,https://www.northampton.gov.uk/download/downloads/id/10717/bfr1807,2018-12-21,/brownfield-land/local-authority-eng/NOR/BFR1807
BFR1808,19 - 21 Harding Terrace,,18/12/2019,2019-12-18,,0.02,6,6,Removed as planning application invalid,local-authority-eng:NOR,not owned by a public authority,,,,,POINT(-0.902197 52.243935),BFR1808,https://www.northampton.gov.uk/download/downloads/id/10709/bfr1808,2018-12-21,/brownfield-land/local-authority-eng/NOR/BFR1808
BFR1809,"Plough Hotel, Bridge Street",,18/12/2019,2019-12-18,,0.25,38,38,Removed as no planning permission.,local-authority-eng:NOR,not owned by a public authority,,,,,POINT(-0.896826 52.233986),BFR1809,https://www.northampton.gov.uk/download/downloads/id/10718/bfr1809,2018-12-21,/brownfield-land/local-authority-eng/NOR/BFR1809
BFR1810,55 - 57 Abington Street,yes,,2018-12-21,,0.07,53,53,N/2018/0741 add one additional floor to building and conversion of part first and second floor from retail to serviced apartments providing 53 units,local-authority-eng:NOR,not owned by a public authority,2018-10-02,,permissioned,full planning permission,POINT(-0.892228 52.23899),BFR1810,https://www.northampton.gov.uk/download/downloads/id/10711/bfr1810,2018-12-21,/brownfield-land/local-authority-eng/NOR/BFR1810
BFR1811,98 - 100 Abington Street,yes,,2018-12-21,,0.05,13,13,"N/2018/0795 extensions to provide 13 apartments comprising x studios, x 1-bedroom and x 2-bedroom self-contained apartments",local-authority-eng:NOR,not owned by a public authority,2018-08-09,,permissioned,full planning permission,POINT(-0.890198 52.23904),BFR1811,https://www.northampton.gov.uk/download/downloads/id/10710/bfr1811,2018-12-21,/brownfield-land/local-authority-eng/NOR/BFR1811
BFR1812,353 Wellingborough Road,yes,,2018-12-21,,0.01,5,5,N/2018/0798 Part change of use to create 5no apartments,local-authority-eng:NOR,not owned by a public authority,2018-09-14,,permissioned,full planning permission,POINT(-0.872399 52.24396),BFR1812,https://www.northampton.gov.uk/download/downloads/id/10713/bfr1812,2018-12-21,/brownfield-land/local-authority-eng/NOR/BFR1812
BFR1813,25 Drapery,,18/12/2019,2019-12-18,,0.03,5,5,Removed as site has been developed.,local-authority-eng:NOR,not owned by a public authority,,,,,POINT(-0.897657 52.237692),BFR1813,https://www.northampton.gov.uk/download/downloads/id/10719/bfr1813,2018-12-21,/brownfield-land/local-authority-eng/NOR/BFR1813
BFR1814,"Land At Former British Timken Site, Main Road, Duston",yes,,2019-12-18,,5.83,138,138,Allocated in emerging Local Plan (Part 2). N/2018/1207 Erection of 138 no dwellings - Approved in Principle 2019.,local-authority-eng:NOR,not owned by a public authority,,,pending decision,permission in principle,POINT(-0.93744 52.245),BFR1814,https://www.northampton.gov.uk/download/downloads/id/10726/bfr1814,2018-12-21,/brownfield-land/local-authority-eng/NOR/BFR1814
BFR1816,"St James Works, Vicarage Road",yes,,2019-12-18,,0.41,20,20,N/2018/1587 Demolition and construction of 20no affordable dwellings - Approved in Principle 2019,local-authority-eng:NOR,not owned by a public authority,,,pending decision,permission in principle,POINT(-0.916162 52.243541),BFR1816,https://www.northampton.gov.uk/download/downloads/id/10724/bfr1816,2018-12-21,/brownfield-land/local-authority-eng/NOR/BFR1816
BFR1817,"Eastern District Social Club, Crestwood Road",yes,,2019-12-18,,0.2,5,5,Allocated in emerging Local Plan (Part 2). N/2016/1022 (FULL) Erection of 5 family houses.,local-authority-eng:NOR,not owned by a public authority,2017-05-10,,permissioned,full planning permission,POINT(-0.829548 52.26753),BFR1817,https://www.northampton.gov.uk/download/downloads/id/11731/bfr1817.pdf,2019-12-02,/brownfield-land/local-authority-eng/NOR/BFR1817
BFR1818,Land adj 46 Spencer Street NN5 5JX,yes,,2019-12-18,,0.14,25,25,"Allocated in emerging Local Plan (Part 2). N/2016/1679 (VOC) Erection Of 25No. Dwellings Comprising 9x2 bed Dwelling Houses, A Block Of 16No. (8x1 bed and 8 x 2 bed) Self Contained Flats With Associated Parking And Landscaping (As Amended By Revised Plans Received On 23/06/2014 & 30/06/2014).",local-authority-eng:NOR,not owned by a public authority,2017-04-13,,permissioned,full planning permission,POINT(-0.914483 52.236229),BFR1818,https://www.northampton.gov.uk/download/downloads/id/11735/bfr1818.pdf,2019-12-02,/brownfield-land/local-authority-eng/NOR/BFR1818
BFR1819,"Sofa King, Tivoli House Towcester Road NN4 8LB",yes,,2019-12-18,,0.15,40,40,N/2017/0127 (FULL) Demolition of existing building. Erection of 40no dwellings (Use Class C3) with associated car parking and ancillary space and 130.10m2 of retail space (Use Class A1),local-authority-eng:NOR,not owned by a public authority,2018-01-12,,permissioned,full planning permission,POINT(-0.902956 52.227819),BFR1819,https://www.northampton.gov.uk/download/downloads/id/11734/bfr1819.pdf,2019-12-02,/brownfield-land/local-authority-eng/NOR/BFR1819
BFR1820,Berkeley House Horsemarket NN1 2RG,yes,,2019-12-18,,0.93,126,126,"N/2019/0456 (FULL) Demolition of 4no residential buildings, garages and associated areas known as Berkeley House and 3no residential buildings and associated areas known as St Mary's Court. New development of 126no affordable dwellings consisting of 62no one bed apartments, 40no two bed apartments, 5no two bed houses, 17no three bed houses and 2no four bed houses with associated works.",local-authority-eng:NOR,owned by a public authority,2019-08-06,,permissioned,full planning permission,POINT(-0.901279 52.238476),BFR1820,https://www.northampton.gov.uk/download/downloads/id/11732/bfr1820.pdf,2019-12-02,/brownfield-land/local-authority-eng/NOR/BFR1820
BFR1821,"Ryland Soans Ford Garage, Harlestone Road",yes,,2019-12-18,,2.46,62,62,Allocated in emerging Local Plan (Part 2). SAMLAA identified this site to be suitable for development.,local-authority-eng:NOR,not owned by a public authority,,,not permissioned,,POINT(-0.942393 52.254776),BFR1821,https://www.northampton.gov.uk/download/downloads/id/11733/bfr1821.pdf,2019-12-01,/brownfield-land/local-authority-eng/NOR/BFR1821
