name,site-address,deliverable,end-date,entry-date,hazardous-substances,hectares,maximum-net-dwellings,minimum-net-dwellings,notes,organisation,ownership-status,planning-permission-date,planning-permission-history,planning-permission-status,planning-permission-type,point,site,site-plan-url,start-date,slug
BD072,Trough Laithe Farm,yes,,2019-10-14,,0.512,10,10,Outline: Erection of 5 No. dwelling houses and improvements to access from Wheatley Lane Road (Access and Layout only). No work has been started been started on this site as yet.,local-authority-eng:PEN,not owned by a public authority,2018-08-13,https://publicaccess.pendle.gov.uk/online-applications/,permissioned,outline planning permission,POINT(-2.2313 53.8472),BD072,https://www.pendle.gov.uk/downloads/download/3052/brownfield_register_site_plans,2019-10-14,/brownfield-land/local-authority-eng/PEN/BD072
BK045,"Land at Kirkstall Drive, Barnoldswick",yes,2019-12-17,2019-10-14,,0.11,6,6,Erection of 6 two-storey houses in three blocks Complete,local-authority-eng:PEN,not owned by a public authority,2005-06-08,https://publicaccess.pendle.gov.uk/online-applications/,permissioned,full planning permission,POINT(-2.1735 53.9209),BK045,https://www.pendle.gov.uk/downloads/download/3052/brownfield_register_site_plans,2017-12-14,/brownfield-land/local-authority-eng/PEN/BK045
BK090,"Land to the rear of the Greyhound Pub, Manchester Road, Barnoldswick",yes,,2019-10-14,,0.22,9,9,"Full: Erection of 9 dwellings with associated access, parking and landscaping. Work has not started at this site. A further application at the site was dismissed at appeal. It is unclear as to the owners intentions. No Building Control records available. The owner has returned the Housing Land Survey form and indicated that they intend to start development within 1 year and complete it within 2-5 years.",local-authority-eng:PEN,not owned by a public authority,2015-04-02,https://publicaccess.pendle.gov.uk/online-applications/,permissioned,full planning permission,POINT(-2.1882 53.9126),BK090,https://www.pendle.gov.uk/downloads/download/3052/brownfield_register_site_plans,2017-12-14,/brownfield-land/local-authority-eng/PEN/BK090
BK110,"B Preston Joinery Works, Bank Street, Barnoldswick",yes,,2019-10-14,,0.034,5,5,"Full: Erection of 5 dwellings with associated curtilages, landscaping and parking area to side.Development at the site has not yet started. The demolition of the existing workshop building has now been carried out. No Building Control records available. Owner has returned the Housing Land Survey form indicating they intend to start the development within 1 year and complete it within 2-5 years.",local-authority-eng:PEN,not owned by a public authority,2015-11-25,https://publicaccess.pendle.gov.uk/online-applications/,permissioned,full planning permission,POINT(-2.1839 53.9178),BK110,https://www.pendle.gov.uk/downloads/download/3052/brownfield_register_site_plans,2017-12-14,/brownfield-land/local-authority-eng/PEN/BK110
BK115,"Briercliffe Lodge, Rainhall Crescent, Barnoldswick",yes,,2019-10-14,,0.14,5,5,"Outline: Demolition of existing nursing home and construction of 5 dwelling houses in a terrace row (Access, Layout and Scale).No work has started at this site - Outline permission only. No Reserved Matters application submitted. No Building Control records available. Owner has returned the Housing Land Survey form indicating that they intend to start and complete the site within 2-5 years.",local-authority-eng:PEN,not owned by a public authority,2016-06-13,https://publicaccess.pendle.gov.uk/online-applications/,not permissioned,other,POINT(-2.1716 53.9199),BK115,https://www.pendle.gov.uk/downloads/download/3052/brownfield_register_site_plans,2017-12-14,/brownfield-land/local-authority-eng/PEN/BK115
BK116,"St Andrews Methodist Church, Mosley Street, Barnoldswick",yes,,2019-10-14,,0.14,6,6,"Full: Part demolition of school building and conversion to six 1 and 2 bed apartments and erection of two storey extension to rear, erection of single storey extension to rear of church.No work has started at this site. A Building Control application for the extension has been submitted. Owner did not return the Housing Land Survey form.",local-authority-eng:PEN,not owned by a public authority,2016-07-06,https://publicaccess.pendle.gov.uk/online-applications/,permissioned,full planning permission,POINT(-2.1851 53.9156),BK116,https://www.pendle.gov.uk/downloads/download/3052/brownfield_register_site_plans,2017-12-14,/brownfield-land/local-authority-eng/PEN/BK116
BK132 / P077,"Gisburn Street Works, Barnoldswick",yes,,2019-10-14,,0.093,3,3,"Full: Demolition of garage, joiners workshop and office and erection of 7 dwelling houses. Work has started on site",local-authority-eng:PEN,not owned by a public authority,2019-02-27,https://publicaccess.pendle.gov.uk/online-applications/,permissioned,full planning permission,POINT(-2.1885 53.9207),BK132 / P077,https://www.pendle.gov.uk/downloads/download/3052/brownfield_register_site_plans,2019-10-14,/brownfield-land/local-authority-eng/PEN/BK132---P077
BR037,"Four Oaks, The Crescent, Brierfield",yes,,2019-10-14,,0.39,9,9,"Erection of 9 dwellinghouses (Extension of time). Development at the site has not yet started, although Building Control records indicate that some foundations for one of the dwellings has now been laid. Owner did not return the Housing Land Survey form.",local-authority-eng:PEN,not owned by a public authority,2013-09-04,https://publicaccess.pendle.gov.uk/online-applications/,permissioned,full planning permission,POINT(-2.2309 53.8185),BR037,https://www.pendle.gov.uk/downloads/download/3052/brownfield_register_site_plans,2017-12-14,/brownfield-land/local-authority-eng/PEN/BR037
BR072,"Marsden Cross, 30 Higher Reedley Road, Brierfield",yes,,2019-10-14,,0.26,10,4,"Full: Major: Conversion of former Public House into 10 No. one bed flats, car parking and access. Work has started on this site",local-authority-eng:PEN,not owned by a public authority,2019-12-19,https://publicaccess.pendle.gov.uk/online-applications/,permissioned,full planning permission,POINT(-2.2205 53.8224),BR072,https://www.pendle.gov.uk/downloads/download/3052/brownfield_register_site_plans,2017-12-14,/brownfield-land/local-authority-eng/PEN/BR072
BY011,"Barley House Farm, Barley Lane, Barley",yes,,2019-10-14,,0.25,5,5,"Reserved Matters: Erection of 5 detached dwelling houses (Appearance, Landscaping, Layout and Scale) of Planning Permission 13/15/0290P and formation of access road (Re-Submission). Work has not started at this site - Outline permission only. A Reserved Matters application has not been submitted. No Building Control records available. Owner did not return the Housing Land Survey form.",local-authority-eng:PEN,not owned by a public authority,2015-09-15,https://publicaccess.pendle.gov.uk/online-applications/,permissioned,outline planning permission,POINT(-2.2725 53.8603),BY011,https://www.pendle.gov.uk/downloads/download/3052/brownfield_register_site_plans,2017-12-14,/brownfield-land/local-authority-eng/PEN/BY011
CE078,"Oak Mill, Skipton Road, Colne",yes,,2019-10-14,,0.78,32,32,"Full: Major: Erection of 32 dwellings with associated works including parking, highways and landscaping. A new planning permission has been granted at this site. The site is now in the Council's ownership and is being brought forward by the Joint Venture Partnership PEARL. No Building Control records available.",local-authority-eng:PEN,owned by a public authority,2016-12-12,https://publicaccess.pendle.gov.uk/online-applications/,permissioned,full planning permission,POINT(-2.1617 53.8621),CE078,https://www.pendle.gov.uk/downloads/download/3052/brownfield_register_site_plans,2017-12-14,/brownfield-land/local-authority-eng/PEN/CE078
CE197 / P167,"Site of Former 1 to 34 Bright Street, Colne",yes,,2019-10-14,,0.287,9,9,Full: Major: Erection of 10 semi-detached bungalows with associated bin storage and parking. Work has started on site,local-authority-eng:PEN,not owned by a public authority,2018-12-07,https://publicaccess.pendle.gov.uk/online-applications/,permissioned,full planning permission,POINT(-2.1714 53.8581),CE197 / P167,https://www.pendle.gov.uk/downloads/download/3052/brownfield_register_site_plans,2019-10-14,/brownfield-land/local-authority-eng/PEN/CE197---P167
CE198,"Colne Commercial Centre, Exchange Street, Colne",yes,,2019-10-14,,0.033,1,1,Prior Approval Notification: (Class O - Offices to Dwelling Houses) Change of use of B1(a) Office to up to 16 dwellings C3. The owner intends to start this year.,local-authority-eng:PEN,not owned by a public authority,2018-10-24,https://publicaccess.pendle.gov.uk/online-applications/,permissioned,other,POINT(-2.1709 53.8559),CE198,https://www.pendle.gov.uk/downloads/download/3052/brownfield_register_site_plans,2019-10-14,/brownfield-land/local-authority-eng/PEN/CE198
CE200,"Garage site to the rear of 10-24 Essex Street, Colne",yes,,2019-10-14,,0.274,5,5,Full: Major: Erection of 15 residential units including 9 dwelling houses and 6 apartments with 26 car parking spaces (resubmission). No work has been started been started on this site as yet.,local-authority-eng:PEN,not owned by a public authority,2019-01-14,https://publicaccess.pendle.gov.uk/online-applications/,permissioned,full planning permission,POINT(-2.1683 53.8543),CE200,https://www.pendle.gov.uk/downloads/download/3052/brownfield_register_site_plans,2019-10-14,/brownfield-land/local-authority-eng/PEN/CE200
CE201,"58-60 Brown Street West, Colne",yes,,2019-10-14,,0.058,2,2,Full: Major: Change of use from light industrial (Use Class B1) to 10 residential apartments (Use Class C3). Work has started on site,local-authority-eng:PEN,not owned by a public authority,2019-03-11,https://publicaccess.pendle.gov.uk/online-applications/,permissioned,full planning permission,POINT(-2.1802 53.8557),CE201,https://www.pendle.gov.uk/downloads/download/3052/brownfield_register_site_plans,2019-10-14,/brownfield-land/local-authority-eng/PEN/CE201
CE203,"45 Market Street, Colne",yes,,2019-10-14,,0.013,1,1,"Full: Change of use of first, second and third floors to provide 5x apartments (Use Class C3), replacement of upper floor windows to three elevations and installation of security shutter to re. Work has started on site",local-authority-eng:PEN,not owned by a public authority,2019-03-18,https://publicaccess.pendle.gov.uk/online-applications/,permissioned,full planning permission,POINT(-2.1662 53.8574),CE203,https://www.pendle.gov.uk/downloads/download/3052/brownfield_register_site_plans,2019-10-14,/brownfield-land/local-authority-eng/PEN/CE203
EY054,"Ace Case Ltd, Pennine House, New Road, Earby",yes,,2019-10-14,,0.06,5,5,Full: Demolition of Pennine House and erection of five houses and on-site parking (Re-Submission). No work has commenced at this site. No Building Control records available for this development. Owner did not return the Housing Land Survey form.,local-authority-eng:PEN,not owned by a public authority,2016-02-09,https://publicaccess.pendle.gov.uk/online-applications/,not permissioned,other,POINT(-2.144 53.9151),EY054,https://www.pendle.gov.uk/downloads/download/3052/brownfield_register_site_plans,2017-12-14,/brownfield-land/local-authority-eng/PEN/EY054
EY082,"Coronation Hall, Cemetery Road, Earby",yes,2019-12-17,2019-10-14,,0.036,9,9,Full: Change of use from Library (Use Class D1) to 9 No. residential apartments (Use Class C3) with some external alterations. Complete,local-authority-eng:PEN,not owned by a public authority,2019-03-04,https://publicaccess.pendle.gov.uk/online-applications/,permissioned,full planning permission,POINT(-2.1406 53.917),EY082,https://www.pendle.gov.uk/downloads/download/3052/brownfield_register_site_plans,2019-10-14,/brownfield-land/local-authority-eng/PEN/EY082
FO034,"Weston Electrical Units Ltd, County Brook Lane, Foulridge",yes,,2019-10-14,,0.99,22,22,"Full: Major: Demolition of commercial buildings, erection of twenty two dwelling houses (3 terraced, 16 semis and 3 detached) accessed off Station Road and Whitemoor Lane including estate roads. Work has not started at this site. No Building Control records available.",local-authority-eng:PEN,not owned by a public authority,2015-07-10,https://publicaccess.pendle.gov.uk/online-applications/,not permissioned,other,POINT(-2.1724 53.8774),FO034,https://www.pendle.gov.uk/downloads/download/3052/brownfield_register_site_plans,2017-12-14,/brownfield-land/local-authority-eng/PEN/FO034
LE023,Land to North West of Laneshawbridge,yes,,2019-10-14,,0.25,5,5,Outline: Major: Residential development of land 0.25ha for ten dwellinghouses (Access only). No work has been started been started on this site as yet.,local-authority-eng:PEN,not owned by a public authority,2018-06-26,https://publicaccess.pendle.gov.uk/online-applications/,permissioned,outline planning permission,POINT(-2.1214 53.8626),LE023,https://www.pendle.gov.uk/downloads/download/3052/brownfield_register_site_plans,2019-10-14,/brownfield-land/local-authority-eng/PEN/LE023
NH008,"Former Spen Brook Mill, Spen Brook Road, Spen Brook",yes,,2019-10-14,,1.98,28,28,"Full: Major: Demolition of industrial buildings, conversion of Spenbrook Mill to 10 No. residential units and erection of 18 No. residential units with associated landscaping, access, car parking and associated works. Development at the site has not yet started. This site is a major development and a site specific viability appraisal was carried out as part of the planning application process. This appraisal indicated that the development of the site is viable. No Building Control records available.",local-authority-eng:PEN,not owned by a public authority,2015-04-02,https://publicaccess.pendle.gov.uk/online-applications/,permissioned,full planning permission,POINT(-2.2682 53.8454),NH008,https://www.pendle.gov.uk/downloads/download/3052/brownfield_register_site_plans,2017-12-14,/brownfield-land/local-authority-eng/PEN/NH008
NN103,"Marsden Hall Farm, Walton Lane, Nelson",yes,2019-12-17,2019-10-14,,0.3,8,8,Full: Major: Demolition of barn and green houses; erection of 8 no. dwellings; alterations to Marsden Park Cottage; part demolition and erection of two storey side extension to Farm Cottage; and alterations to perimeter wall. Complete,local-authority-eng:PEN,not owned by a public authority,2015-01-06,https://publicaccess.pendle.gov.uk/online-applications/,permissioned,full planning permission,POINT(-2.1852 53.8391),NN103,https://www.pendle.gov.uk/downloads/download/3052/brownfield_register_site_plans,2017-12-14,/brownfield-land/local-authority-eng/PEN/NN103
NN124,"Barkerhouse Road Day Nursery, Barkerhouse Road, Nelson",yes,,2019-10-14,,0.32,12,12,Outline: Major: Residential development for twelve dwelling house (Access and Layout only) and demolition of existing nursery building. Development at this site has not started - Outline permission only. A Reserved Matters application has not been submitted. The planning permission is due to expire in December 2017. No Building Control records available. Unclear as to whether the site will come forward. Retain in five year supply until end of 2017/18. The agent for the owner has moved away.,local-authority-eng:PEN,not owned by a public authority,2014-12-03,https://publicaccess.pendle.gov.uk/online-applications/,not permissioned,other,POINT(-2.1976 53.8355),NN124,https://www.pendle.gov.uk/downloads/download/3052/brownfield_register_site_plans,2017-12-14,/brownfield-land/local-authority-eng/PEN/NN124
NN128,"Land adjacent to Ambulance Station, Rakeshouse Road, Nelson",yes,,2019-10-14,,0.09,8,8,"Full: Erection of 8 apartments in two, 2 storey blocks with associated car parking and landscaping. Development at this site has not started. A new planning application was approved in April 2017. No Building Control records available.",local-authority-eng:PEN,not owned by a public authority,2014-07-01,https://publicaccess.pendle.gov.uk/online-applications/,permissioned,outline planning permission,POINT(-2.2037 53.8445),NN128,https://www.pendle.gov.uk/downloads/download/3052/brownfield_register_site_plans,2017-12-14,/brownfield-land/local-authority-eng/PEN/NN128
NN143,"Nelson Discount Furniture, Cooper Street, Nelson",yes,,2019-10-14,,0.04,5,5,Full: Conversion and partial demolition of existing building to create 5 dwellings with associated external alterations. Work has not started at this site. No Building Control records available. Owner did not return the Housing Land Survey form.,local-authority-eng:PEN,not owned by a public authority,2015-12-23,https://publicaccess.pendle.gov.uk/online-applications/,not permissioned,other,POINT(-2.2132 53.8405),NN143,https://www.pendle.gov.uk/downloads/download/3052/brownfield_register_site_plans,2017-12-14,/brownfield-land/local-authority-eng/PEN/NN143
NN154,"68-70 Manchester Road, Nelson",yes,,2019-10-14,,0.02,8,8,Full: Conversion of HMO to 8 self-contained flats and insertion of two window openings to first and second floors at side. Work has not started at this site. A Building Control application for the proposal was refused. Owner did not return the Housing Land Survey form.,local-authority-eng:PEN,not owned by a public authority,2017-02-10,https://publicaccess.pendle.gov.uk/online-applications/,permissioned,full planning permission,POINT(-2.2176 53.8355),NN154,https://www.pendle.gov.uk/downloads/download/3052/brownfield_register_site_plans,2017-12-14,/brownfield-land/local-authority-eng/PEN/NN154
NN166,"Eastern House, 29-37 Macleod Street, Nelson",yes,,2019-10-14,,2.025,20,20,Full: Demolition of warehouse (29 - 37 McLeod St) and erection of a row of five dwellinghouses. No work has been started been started on this site as yet.,local-authority-eng:PEN,not owned by a public authority,2018-07-12,https://publicaccess.pendle.gov.uk/online-applications/,permissioned,full planning permission,POINT(-2.2208 53.836),NN166,https://www.pendle.gov.uk/downloads/download/3052/brownfield_register_site_plans,2019-10-14,/brownfield-land/local-authority-eng/PEN/NN166
NN169,Pendle Rise Estates Phoenix Chambers,yes,,2019-10-14,,0.093,39,39,No work has been started been started on this site as yet.,local-authority-eng:PEN,not owned by a public authority,2018-11-19,https://publicaccess.pendle.gov.uk/online-applications/,not permissioned,other,POINT(-2.213 53.8367),NN169,https://www.pendle.gov.uk/downloads/download/3052/brownfield_register_site_plans,2019-10-14,/brownfield-land/local-authority-eng/PEN/NN169
P022,"Walk Mill, Green Road / Spring Gardens Road, Colne",yes,,2019-10-14,,2.99,120,101,The Council's viability model suggests that this type of site is unlikely to be viable to develop. The owners of the site are consolidating their premises and have indicated their intention to release the site for housing. The current economic circumstances are restricting the progress of this scheme. There is no up-to-date information available as to the current intentions of the owner to bring the site forward. The site could come forward in the 11-15 year period.,local-authority-eng:PEN,not owned by a public authority,,,not permissioned,,POINT(-2.1743 53.8533),P022,https://www.pendle.gov.uk/downloads/download/3052/brownfield_register_site_plans,2017-12-14,/brownfield-land/local-authority-eng/PEN/P022
P023,"Spring Gardens Mill, Green Road, Colne",yes,,2019-10-14,,3.11,207,124,"The Council's viability model suggests that this type of site is unlikely to be viable to develop. The owners of the site are consolidating their premises and have indicated their intention to release the site for housing. The mill building has now been demolished. The current economic circumstances are restricting the progress of this scheme. The owner has returned the Housing Land Survey form indicating that the site is still available. However, there have been some discussions as to whether the site could be developed for an alternative use (e.g. employment). The site could come forward within the 6-15 year period.",local-authority-eng:PEN,not owned by a public authority,,,not permissioned,,POINT(-2.1708 53.8525),P023,https://www.pendle.gov.uk/downloads/download/3052/brownfield_register_site_plans,2017-12-14,/brownfield-land/local-authority-eng/PEN/P023
P026,"Riverside Mill, Charles Street, Nelson",yes,,2019-10-14,,2.56,102,100,The Council's viability model suggests that this type of site is unlikely to be viable to develop. The site is allocated for housing in the Bradley Area Action Plan. The owners have indicated that the availability of finance is the key issue affecting the delivery of this site. The site is currently for sale and it is unclear whether the new owner will pursue a housing development at the site. There have been discussion as to whether the site could be developed for alternative uses (e.g. employment). The site could come forward towards the end of the 5 year period.,local-authority-eng:PEN,not owned by a public authority,,,not permissioned,,POINT(-2.2106 53.8424),P026,https://www.pendle.gov.uk/downloads/download/3052/brownfield_register_site_plans,2017-12-14,/brownfield-land/local-authority-eng/PEN/P026
P052,"Former Railway Sidings, Clitheroe Road, Brierfield",yes,,2019-10-14,,1.59,64,60,The Council's viability model suggests that this type of site is unlikely to be viable to develop. This site was identified in the Railway Street SPD as a key regeneration site in Brierfield. The site is partially in commercial use and the economic circumstances are restricting the site from coming forward. The owner has returned the Housing Land Survey form indicating their intention to bring the site forward within 1 year.,local-authority-eng:PEN,not owned by a public authority,,,not permissioned,,POINT(-2.2374 53.8221),P052,https://www.pendle.gov.uk/downloads/download/3052/brownfield_register_site_plans,2017-12-14,/brownfield-land/local-authority-eng/PEN/P052
P053,"Green Works, Knotts Lane, Colne",yes,,2019-10-14,,0.29,26,9,The Council's viability model suggests that this type of site is unlikely to be viable to develop. This site has a number of contamination issues that need to be resolved before development can be undertaken. The owner of the site has previously indicated that the current economic circumstances are having an impact on development timescales. The owner has returned the Housing Land Survey form indicating their intention to bring the site forward within 2-5 years.,local-authority-eng:PEN,not owned by a public authority,,,not permissioned,,POINT(-2.1786 53.8524),P053,https://www.pendle.gov.uk/downloads/download/3052/brownfield_register_site_plans,2017-12-14,/brownfield-land/local-authority-eng/PEN/P053
P064,"Brook Shed, New Road, Earby",yes,,2019-10-14,,1.32,65,40,The Council's viability model indicates that this type of site is viable to develop. This site was previously submitted to the call for sites consultation with the owner indicating an intention to develop it for housing. Pre-application discussions have previously taken place regarding the potential redevelopment of the site for housing. The owner has not returned the Housing Land Survey form.,local-authority-eng:PEN,not owned by a public authority,,,not permissioned,,POINT(-2.1432 53.9139),P064,https://www.pendle.gov.uk/downloads/download/3052/brownfield_register_site_plans,2017-12-14,/brownfield-land/local-authority-eng/PEN/P064
BK132,"Gisburn Street Works, Barnoldswick",yes,,2019-10-14,,0.09,8,3,"Full: Demolition of garage, joiners workshop and office and erection of 7 dwelling houses..The Council's viability model indicates that this type of site is viable to develop. This site is currently in employment use and there may be competing uses for the site. The site is located in a mainly residential area. The owner has returned the Housing Land Survey form indicating their intention to bring the site forward within 2-5 years.",local-authority-eng:PEN,not owned by a public authority,2019-02-27,https://publicaccess.pendle.gov.uk/online-applications/,permissioned,full planning permission,POINT(-2.1884 53.9208),BK132,https://www.pendle.gov.uk/downloads/download/3052/brownfield_register_site_plans,2017-12-14,/brownfield-land/local-authority-eng/PEN/BK132
P090,"Black Carr Mill, Skipton Road, Trawden",yes,,2019-10-14,,0.72,29,15,This site is located within the village of Trawden. The site is also within Flood Zones 2&3. A flood risk assessment would be required as part of any planning application that is submitted setting out appropriate mitigation. The site is currently in use. The owner has returned the Housing Land Survey form indicating that the site is available for development and could come forward within 1 year.,local-authority-eng:PEN,not owned by a public authority,,,not permissioned,,POINT(-2.1359 53.8476),P090,https://www.pendle.gov.uk/downloads/download/3052/brownfield_register_site_plans,2017-12-14,/brownfield-land/local-authority-eng/PEN/P090
