name,site-address,deliverable,end-date,entry-date,hazardous-substances,hectares,maximum-net-dwellings,minimum-net-dwellings,notes,organisation,ownership-status,planning-permission-date,planning-permission-history,planning-permission-status,planning-permission-type,point,site,site-plan-url,start-date,slug
BR068 / P097,"Brierfield Mills, Glen Way, Brierfield",yes,,2019-10-14,,3.04,52,52,"Full: Major: Conversion of mill building to 52 residential apartments (C3) to third floor, part of 2nd and 1st floors, ground floor offices (B1a and A2) and flexible use of 1st, 2nd and 3rd floor of cafe (A3) and drinking establishment (A4)..This building is within the urban area of Brierfield. The Council own the building and with its development partner are progressing its regeneration. The Council's viability model suggests that this type of site is unlikely to be viable to develop. There is potential for part of the building to be converted into residential accommodation and plans are progressing with the specific details of the conversion. There is a planning application pending on the site for the conversion to 52 apartments. Part of this site has permission with part yet to apply for permission.",local-authority-eng:PEN,owned by a public authority,2017-12-18,https://publicaccess.pendle.gov.uk/online-applications/,permissioned,full planning permission,POINT(-2.2375 53.825),BR068 / P097,https://www.pendle.gov.uk/downloads/download/3052/brownfield_register_site_plans,2017-12-14,/brownfield-land/local-authority-eng/PEN/BR068---P097
CE197,"Land at Bright Street, Colne",yes,,2019-10-14,,0.29,12,6,"This site is within the Settlement Boundary for Colne. The site was cleared as part of the Housing Market Renewal Initiative, however, no new development has yet taken place on the site. The Council's viability model suggests that this type of site is unlikely to be viable to develop. This site is owned by Pendle Borough Council. The Council and its development partner are looking at bringing this site forward in the future once a viable scheme can be prepared.",local-authority-eng:PEN,owned by a public authority,2019-02-27,https://publicaccess.pendle.gov.uk/online-applications/,permissioned,full planning permission,POINT(-2.1715 53.8581),CE197,https://www.pendle.gov.uk/downloads/download/3052/brownfield_register_site_plans,2017-12-14,/brownfield-land/local-authority-eng/PEN/CE197
P211,"Land off Fry Street, Nelson",yes,,2019-10-14,,0.42,30,13,"This is a vacant, former horticultural nursery site in Nelson. The Council's viability model suggests that this type of site is unlikely to be viable to develop. The site has been actively marketed and a planning application has recently been submitted but has since been withdrawn. The owner has returned the Housing Land Survey form indicating that the site is available and development could come forward within 1 year.",local-authority-eng:PEN,not owned by a public authority,,,not permissioned,,POINT(-2.1991 53.8373),P211,https://www.pendle.gov.uk/downloads/download/3052/brownfield_register_site_plans,2017-12-14,/brownfield-land/local-authority-eng/PEN/P211
P257,"Land at Giles Street, Nelson",yes,,2019-10-14,,0.93,37,35,This is a cleared housing site in Nelson. The site has been allocated for housing development in the Bradley Area Action Plan. The site is owned by Pendle Borough Council and is likely to be developed by the Council's development partner. New site specific viability work will be carried out as part the development scheme for the site.,local-authority-eng:PEN,owned by a public authority,,,not permissioned,,POINT(-2.2097 53.8396),P257,https://www.pendle.gov.uk/downloads/download/3052/brownfield_register_site_plans,2017-12-14,/brownfield-land/local-authority-eng/PEN/P257
P267,"Former LCC Depot, Halifax Road, Brierfield",yes,,2019-10-14,,0.25,10,9,This is a former depot site in Brierfield. The previous Outline planning permission has now expired. The site has been marketed for residential development. The site has been submitted to the Council's call for sites consultation and there may be interest in bringing the site forward in the future. The owner of the site has not returned the Housing Land Survey form and it is unclear when the site will come forward.,local-authority-eng:PEN,not owned by a public authority,,,not permissioned,,POINT(-2.2273 53.8247),P267,https://www.pendle.gov.uk/downloads/download/3052/brownfield_register_site_plans,2017-12-14,/brownfield-land/local-authority-eng/PEN/P267
SH013,"Salterforth Mill, Earby Road, Salterforth",yes,,2019-10-14,,0.13,14,4,Full: Major: Conversion of mill building to 14 one and two bed flats on three floors with garages at ground floor and parking accessed off Kelbrook Road.. This is a mill building which is currently occupied by a number of businesses. A planning permission was previously granted at the site for conversion. However the permission has now expired. There have been some pre-application interest from the owner/developer about bringing the site forward.,local-authority-eng:PEN,not owned by a public authority,2012-12-05,https://publicaccess.pendle.gov.uk/online-applications/,not permissioned,other,POINT(-2.1687 53.905),SH013,https://www.pendle.gov.uk/downloads/download/3052/brownfield_register_site_plans,2017-12-14,/brownfield-land/local-authority-eng/PEN/SH013
CE143,"Former Cement Works, Knotts Lane, Colne",yes,2019-10-14,2019-10-14,,0.29,5,5,Full: Erection of five detached dwelling houses with garages. Complete,local-authority-eng:PEN,not owned by a public authority,2016-02-05,https://publicaccess.pendle.gov.uk/online-applications/,permissioned,full planning permission,POINT(-2.17601 53.8497),CE143,https://www.pendle.gov.uk/downloads/download/3052/brownfield_register_site_plans,2017-12-14,/brownfield-land/local-authority-eng/PEN/CE143
NN127,"6-18 Scotland Road and 7-17 Leeds Road, Nelson",yes,2019-10-14,2017-12-14,,0.07,12,12,"Full: Demolition of 11 Leeds Road, conversion and extension at 7-9 Leeds Road to form 9 flats and external alterations to 9-17 Leeds Road and 6-18 Scotland Road including access ramp and new shop fronts. Complete",local-authority-eng:PEN,not owned by a public authority,2014-06-18,https://publicaccess.pendle.gov.uk/online-applications/,permissioned,full planning permission,POINT(-2.21423 53.8371),NN127,https://www.pendle.gov.uk/downloads/download/3052/brownfield_register_site_plans,2017-12-14,/brownfield-land/local-authority-eng/PEN/NN127
NN135,"Reedyford Mill, Pendle Street, Nelson",,,2017-12-14,,1.42,65,65,"Outline: Major: (Access only): Erection of 65 dwellings with access from Pendle Street, Erection of 2040 Sq.m of commercial floor space (B1(c), B2 and B8 use) with access off Westfield, Full: Erection of petrol filling station (Sui Generis) 472 Sq.m. Expired planning permission",local-authority-eng:PEN,not owned by a public authority,2015-06-23,https://publicaccess.pendle.gov.uk/online-applications/,not permissioned,other,POINT(-2.21875 53.8412),NN135,https://www.pendle.gov.uk/downloads/download/3052/brownfield_register_site_plans,2017-12-14,/brownfield-land/local-authority-eng/PEN/NN135
P309,"Land at Ouzledale Foundary, Long Ing Lane, Barnoldswick",,,2019-12-17,,7.68,120,87,This is large brownfield site that is situated within the settlement boundary. It is a possible site for mixed use.,local-authority-eng:PEN,not owned by a public authority,,,not permissioned,,POINT(-2.178664 53.918335),P309,https://www.pendle.gov.uk/downloads/download/3052/brownfield_register_site_plans,2019-12-17,/brownfield-land/local-authority-eng/PEN/P309
CE069,"Former Garage Site, South Of 12 North Street (formerly Land off North Street)",,,2019-12-17,,0.95,5,5,"Outline: Major: Residential development (0.5ha) (Access only) (Re-Submission). Previously had planning permission, now expired.",local-authority-eng:PEN,not owned by a public authority,2016-07-09,https://publicaccess.pendle.gov.uk/online-applications/,not permissioned,other,POINT(-2.156192 53.910277),CE069,https://www.pendle.gov.uk/downloads/download/3052/brownfield_register_site_plans,2019-12-17,/brownfield-land/local-authority-eng/PEN/CE069
CE160,"Linden Business Centre, Linden Road",yes,,2019-12-17,,0.24,20,20,"Prior Notification Office Use Class (B1(a) to Dwellinghouses Use Class (C3): Conversion of B1 offices to 20 flats. retain 21 parking spaces, retain office to ground floor and theatre store to first floor. Old office building which is being converted into residential flats which is inside the settlement boundary.",local-authority-eng:PEN,not owned by a public authority,2020-11-11,https://publicaccess.pendle.gov.uk/online-applications/,permissioned,other,POINT(-2.175465 53.856287),CE160,https://www.pendle.gov.uk/downloads/download/3052/brownfield_register_site_plans,2019-12-17,/brownfield-land/local-authority-eng/PEN/CE160
P060,Former Mansfield High School,yes,,2019-12-17,,1.54,59,59,An old browfield site that used to be a school,local-authority-eng:PEN,owned by a public authority,,,not permissioned,,POINT(-2.187628 53.849591),P060,https://www.pendle.gov.uk/downloads/download/3052/brownfield_register_site_plans,2019-12-17,/brownfield-land/local-authority-eng/PEN/P060
BK124,"Masonic Hall, Vicarage Road",yes,,2019-12-17,,0.34,7,7,Full: Erection of 7 dwelling houses. A brownfield site within the settlement boundary.,local-authority-eng:PEN,not owned by a public authority,2017-12-21,https://publicaccess.pendle.gov.uk/online-applications/,permissioned,full planning permission,POINT(-2.183626 53.921374),BK124,https://www.pendle.gov.uk/downloads/download/3052/brownfield_register_site_plans,2019-12-17,/brownfield-land/local-authority-eng/PEN/BK124
FO042,"The Vicarage, Skipton Road",yes,,2019-12-17,,0.35,9,9,Outline: Use of land for residential development (0.35ha) for up to 9 dwellinghouses (Access only). An old brownfield site,local-authority-eng:PEN,not owned by a public authority,2018-03-15,https://publicaccess.pendle.gov.uk/online-applications/,permissioned,outline planning permission,POINT(-2.16871 53.87394),FO042,https://www.pendle.gov.uk/downloads/download/3052/brownfield_register_site_plans,2019-12-17,/brownfield-land/local-authority-eng/PEN/FO042
BK129,"Ambulance Station, Brogden View",yes,,2019-12-17,,0.25,9,9,"Full: Demolition of ambulance station and erection of nine dwelling houses, four semi-detached with access off Brogden View and five detached accessed off Brogden Lane. A brownfield site in Barnoldswick.",local-authority-eng:PEN,not owned by a public authority,2017-09-28,https://publicaccess.pendle.gov.uk/online-applications/,permissioned,full planning permission,POINT(-2.195259 53.924582),BK129,https://www.pendle.gov.uk/downloads/download/3052/brownfield_register_site_plans,2019-12-17,/brownfield-land/local-authority-eng/PEN/BK129
CE142,Haverholt Day Nursery,yes,,2019-12-17,,0.24,6,6,Full: Erection of six bungalows (Re-Submission).,local-authority-eng:PEN,not owned by a public authority,2016-03-18,https://publicaccess.pendle.gov.uk/online-applications/,permissioned,full planning permission,POINT(-2.180362 53.860136),CE142,https://www.pendle.gov.uk/downloads/download/3052/brownfield_register_site_plans,2019-12-17,/brownfield-land/local-authority-eng/PEN/CE142
CE187,"Colne Health Centre Pharmacy, Richmonds Court, Market Street",yes,,2019-12-17,,0.17,11,11,Full: Major: Demolition of health centre (Use Class D1) and construction of mixed use building comprising 4 No. retail units (Use Class A1) and 11 No. 2 and 1 bed apartments (Use Class C3). An old health centre brownfield site in Colne Town centre boundary.,local-authority-eng:PEN,not owned by a public authority,2017-10-04,https://publicaccess.pendle.gov.uk/online-applications/,permissioned,full planning permission,POINT(-2.167671 53.857395),CE187,https://www.pendle.gov.uk/downloads/download/3052/brownfield_register_site_plans,2019-12-17,/brownfield-land/local-authority-eng/PEN/CE187
NN033,"Land at Former Garage Site, Marsden Hall Road",yes,,2019-12-17,,0.49,30,30,Major: Reserved Matters: Erection of 30 apartments in 7 two storey blocks with associated car parking,local-authority-eng:PEN,not owned by a public authority,2005-02-25,https://publicaccess.pendle.gov.uk/online-applications/,permissioned,reserved matters approval,POINT(-2.197387 53.83683),NN033,https://www.pendle.gov.uk/downloads/download/3052/brownfield_register_site_plans,2019-12-17,/brownfield-land/local-authority-eng/PEN/NN033
