site-address,deliverable,end-date,entry-date,hazardous-substances,hectares,maximum-net-dwellings,minimum-net-dwellings,notes,organisation,ownership-status,planning-permission-date,planning-permission-history,planning-permission-status,planning-permission-type,point,site,site-plan-url,start-date,slug
22 London Road Chatteris Cambridgeshire PE16 6AU,yes,,2020-12-19,,0.276,6,6,Erection of 6no single storey dwellings comprising of 2 x 2-bed and 4 x 3-bed; change of use of office building (LB) to 2-storey 5-bed dwelling involving part demolition of Listed Building and demolition of warehouse and outbuildings,local-authority-eng:FEN,not owned by a public authority,2019-10-03,https://www.fenland.gov.uk/publicaccess/applicationDetails.do?activeTab=documents&keyVal=PPNB86HE01U00,permissioned,full planning permission,POINT(0.046817 52.449657),BLR0038,https://fenland.gov.uk/media/17400/Brownfield-Register-Site-Maps/pdf/BLR-2020-Site-Plans.pdf,2020-12-19,brownfield-land/local-authority-eng/FEN/BLR0038
Old School House Dartford Road March Cambridgeshire PE15 8AE,yes,,2020-12-19,,0.293,28,28,"Change of use from office (B1) to 28no flats (C3), comprising of 5 x 2-bed and 23 x 1-bed | Old School House Dartford Road March Cambridgeshire PE15 8AE",local-authority-eng:FEN,not owned by a public authority,2019-07-15,https://www.fenland.gov.uk/publicaccess/applicationDetails.do?activeTab=documents&keyVal=PRI32PHE01U00,permissioned,full planning permission,POINT(0.086366 52.552103),BLR0039,https://fenland.gov.uk/media/17400/Brownfield-Register-Site-Maps/pdf/BLR-2020-Site-Plans.pdf,2020-12-19,brownfield-land/local-authority-eng/FEN/BLR0039
Nelson House 22 Norwood Road March Cambridgeshire,yes,,2020-12-19,,0.125,5,5,Erect 5 dwellings (comprising of 3 x 1-bed and 2 x 2-bed flats) and associated parking,local-authority-eng:FEN,not owned by a public authority,2019-09-12,https://www.fenland.gov.uk/publicaccess/applicationDetails.do?activeTab=documents&keyVal=PSQ22LHE03000,permissioned,full planning permission,POINT(0.084309 52.561776),BLR0040,https://fenland.gov.uk/media/17400/Brownfield-Register-Site-Maps/pdf/BLR-2020-Site-Plans.pdf,2020-12-19,brownfield-land/local-authority-eng/FEN/BLR0040
11 - 12 High Street Wisbech Cambridgeshire,yes,,2020-12-19,,0.029,15,15,Erect 5-storey mixed use development (1 x retail unit to ground floor and 11 x 1-bed and 4 x 2-bed flats to remaining floors) involving demolition of existing derelict structures in a Conservation Area,local-authority-eng:FEN,not owned by a public authority,2019-10-10,https://www.fenland.gov.uk/publicaccess/applicationDetails.do?activeTab=documents&keyVal=PSW4YAHE01U00,permissioned,full planning permission,POINT(0.159501 52.664725),BLR0041,https://fenland.gov.uk/media/17400/Brownfield-Register-Site-Maps/pdf/BLR-2020-Site-Plans.pdf,2020-12-19,brownfield-land/local-authority-eng/FEN/BLR0041
"26, Bridge Street, Chatteris, PE16 6RF",yes,,2020-12-19,,0.029,6,6,Erection of a 3-storey block of 6 x flats comprising of 4 x 2 bed and 2 x 1-bed flats involving the demolition of existing building.,local-authority-eng:FEN,not owned by a public authority,2017-03-17,https://www.fenland.gov.uk/publicaccess/applicationDetails.do?activeTab=documents&keyVal=O9L03LHE06P00,permissioned,full planning permission,POINT(0.044803 52.461078),BLR0042,https://fenland.gov.uk/media/17400/Brownfield-Register-Site-Maps/pdf/BLR-2020-Site-Plans.pdf,2020-12-19,brownfield-land/local-authority-eng/FEN/BLR0042
34 Station Road March Cambridgeshire PE15 8LE,yes,,2020-12-19,,0.365,9,9,Change of use from Education Centre (D1) to 9no dwellings (C3) comprising of 1 x 3-bed 2-storey dwelling and 4 x 2-bed and 4 x 1-bed flats involving partial demolition,local-authority-eng:FEN,not owned by a public authority,2020-02-04,https://www.fenland.gov.uk/publicaccess/applicationDetails.do?activeTab=documents&keyVal=PX9EBWHE01U00,permissioned,full planning permission,POINT(0.089599 52.552132),BLR0043,https://fenland.gov.uk/media/17400/Brownfield-Register-Site-Maps/pdf/BLR-2020-Site-Plans.pdf,2020-12-19,brownfield-land/local-authority-eng/FEN/BLR0043
The College Of West Anglia Elm High Road Wisbech Cambridgeshire,yes,,2020-12-19,,6.112,137,137,"Erection of 137 dwellings, alterations to Ramnoth Road and Elm High Road junction to form a new vehicular & pedestrian access and associated works & infrastructure",local-authority-eng:FEN,not owned by a public authority,2020-03-23,https://www.fenland.gov.uk/publicaccess/applicationDetails.do?activeTab=documents&keyVal=OC05NIHE01U00,permissioned,full planning permission,POINT(0.173129 52.65435),BLR0044,https://fenland.gov.uk/media/17400/Brownfield-Register-Site-Maps/pdf/BLR-2020-Site-Plans.pdf,2020-12-19,brownfield-land/local-authority-eng/FEN/BLR0044
Wisbech Vehicle Exchange Old Lynn Road Wisbech Cambridgeshire,yes,,2020-12-19,,0.241,9,9,"Erect 9 x dwellings (4 x 1-storey 2-bed and 5 x 2-storey 3-bed), 4 x garages (2 x twin) and a 1.8m high (max height) fence fronting Lynn Road involving demolition of existing building(s)",local-authority-eng:FEN,not owned by a public authority,2020-01-17,https://www.fenland.gov.uk/publicaccess/applicationDetails.do?activeTab=documents&keyVal=PZIISGHE06P00,permissioned,full planning permission,POINT(0.17655 52.674847),BLR0045,https://fenland.gov.uk/media/17400/Brownfield-Register-Site-Maps/pdf/BLR-2020-Site-Plans.pdf,2020-12-19,brownfield-land/local-authority-eng/FEN/BLR0045
Site Of Old British Gas Depot Chase Street Wisbech Cambridgeshire,yes,,2020-12-19,,0.525,19,19,Erect 19 x 2-storey 3-bed dwellings including extension to existing footway and demolition of buildings,local-authority-eng:FEN,not owned by a public authority,2020-02-18,https://www.fenland.gov.uk/publicaccess/applicationDetails.do?activeTab=documents&keyVal=Q0V66XHE01U00,permissioned,full planning permission,POINT(0.16147 52.668995),BLR0046,https://fenland.gov.uk/media/17400/Brownfield-Register-Site-Maps/pdf/BLR-2020-Site-Plans.pdf,2020-12-19,brownfield-land/local-authority-eng/FEN/BLR0046
Land East Of 3 Woodville Drive Westry March Cambridgeshire,yes,,2020-12-19,,0.296,8,8,"Reserved Matters application relating to detailed matters of access, appearance, landscaping, layout and scale pursuant to F/YR19/0307/O for the erection of 8 x 3-storey 4-bed",local-authority-eng:FEN,not owned by a public authority,2020-03-13,https://www.fenland.gov.uk/publicaccess/applicationDetails.do?activeTab=documents&keyVal=Q037LPHE01U00,permissioned,reserved matters approval,POINT(0.065453 52.563976),BLR0047,https://fenland.gov.uk/media/17400/Brownfield-Register-Site-Maps/pdf/BLR-2020-Site-Plans.pdf,2020-12-19,brownfield-land/local-authority-eng/FEN/BLR0047
15 Station Road March Cambridgeshire PE15 8LB,yes,,2020-12-19,,0.081,26,26,"Erection of a part 2-storey, part 3 storey and part 4-storey building comprising of: 1 x retail unit (A1) and up to 26 x flats involving demolition of existing building (outline application with matters committed in respect of layout and scale)",local-authority-eng:FEN,not owned by a public authority,2019-11-08,https://www.fenland.gov.uk/publicaccess/applicationDetails.do?activeTab=documents&keyVal=PIYBVKHE06P00,permissioned,outline planning permission,POINT(0.08916 52.550976),BLR0048,https://fenland.gov.uk/media/17400/Brownfield-Register-Site-Maps/pdf/BLR-2020-Site-Plans.pdf,2020-12-19,brownfield-land/local-authority-eng/FEN/BLR0048
