site-address,deliverable,end-date,entry-date,hazardous-substances,hectares,maximum-net-dwellings,minimum-net-dwellings,notes,organisation,ownership-status,planning-permission-date,planning-permission-history,planning-permission-status,planning-permission-type,point,site,site-plan-url,start-date,slug
"Sherwood Works, Brighton Road, Handcross",yes,2018-12-13,2017-12-13,,0.16,7,7,"Planning Permission Reference: DM/15/0458 - Demolition of existing buildings and erection of 7 four bedroom dwellings with associated parking, access and landscaping works",local-authority-eng:MSS,not owned by a public authority,2015-07-24,http://www.midsussex.gov.uk/,permissioned,full planning permission,POINT(-0.200476 51.051117),SHLAAID762,https://www.midsussex.gov.uk/planning-building/evidence-supporting-documents/,2017-12-13,brownfield-land/local-authority-eng/MSS/SHLAAID762
"Slaugham Manor, Slaugham Place, Slaugham.",yes,2020-12-08,2017-12-13,,2.3,24,24,"Planning Permission Reference: DM/16/2531 - Hybrid application consisting of demolition of 6 buildings and outline application (access, landscaping, layout, and scale) for construction of 15 new dwellings, and full application for the conversion and extension of the retained Manor House into 9 flats and change of use and extension of Ryders into a single dwelling.",local-authority-eng:MSS,not owned by a public authority,2016-12-21,https://pa.midsussex.gov.uk/online-applications/,permissioned,full planning permission,POINT(-0.204499 51.034154),SHLAAID765,https://www.midsussex.gov.uk/planning-building/evidence-supporting-documents/,2017-12-13,brownfield-land/local-authority-eng/MSS/SHLAAID765
"11 Boltro Road, Haywards Heath",yes,2020-12-08,2017-12-13,,0.014,7,7,Planning Permission Reference: DM/15/3360 - Determination as to whether prior notification is required for the change of use of office (B1) to 7 no. residential units,local-authority-eng:MSS,not owned by a public authority,2015-10-09,https://pa.midsussex.gov.uk/online-applications/,permissioned,full planning permission,POINT(-0.106356 51.003728),SHLAAID767,https://www.midsussex.gov.uk/planning-building/evidence-supporting-documents/,2017-12-13,brownfield-land/local-authority-eng/MSS/SHLAAID767
"Superdrug, 78 London Road, East Grinstead",yes,,2017-12-13,,0.44,11,11,Planning Permission Reference: DM/18/0285 - Demolition of 1st and 2nd floor of building (retaining ground floor and basement) and construction of new upper floors to provide 11 No flats comprising 6 No one-bedroom flats and 5 No two-bedroom flats arranged over three new floors,local-authority-eng:MSS,not owned by a public authority,2020-02-04,https://pa.midsussex.gov.uk/online-applications/,permissioned,full planning permission,POINT(-0.009938 51.126007),SHLAAID773,https://www.midsussex.gov.uk/planning-building/evidence-supporting-documents/,2017-12-13,brownfield-land/local-authority-eng/MSS/SHLAAID773
"Wallis Centre, De La Warr Road, East Grinstead",yes,2020-12-08,2017-12-13,,0.18,7,7,Planning Permission Reference: DM/16/3196 - Demolition of existing community centre (D1) and the erection of 7 residential units,local-authority-eng:MSS,not owned by a public authority,2017-02-28,https://pa.midsussex.gov.uk/online-applications/,permissioned,full planning permission,POINT(-0.004775 51.126423),SHLAAID778,https://www.midsussex.gov.uk/planning-building/evidence-supporting-documents/,2017-12-13,brownfield-land/local-authority-eng/MSS/SHLAAID778
"Palmers Autocare Centre, Turners Hill Road, Crawley Down",yes,,2017-12-13,,0.18,8,8,Planning Permission reference: DM/17/1660 - Erection of eight dwellings following demolition of previous commercial building.,local-authority-eng:MSS,not owned by a public authority,2017-08-04,https://pa.midsussex.gov.uk/online-applications/,permissioned,full planning permission,POINT(-0.087955 51.124944),SHLAAID488,https://www.midsussex.gov.uk/planning-building/evidence-supporting-documents/,2017-12-13,brownfield-land/local-authority-eng/MSS/SHLAAID488
"Martlets Shopping Centre, Burgess Hill",yes,,2017-12-13,,2.27,142,142,"Planning Permission Reference: DM/15/3858 - Demolition of multi-storey car park, public library, community building and offices. Provision of additional retail floor space (Class A1-A5), residential units (Class C3), a multi-screen cinema (Class D2), public library (Class D1), a hotel (Class C1), the reconfiguration and expansion of existing car park, amendments to the site access, public realm improvements including landscaping and other associated works.",local-authority-eng:MSS,mixed ownership,2016-02-26,https://pa.midsussex.gov.uk/online-applications/,permissioned,full planning permission,POINT(-0.132781 50.955813),SHLAAID528,https://www.midsussex.gov.uk/planning-building/evidence-supporting-documents/,2017-12-13,brownfield-land/local-authority-eng/MSS/SHLAAID528
"Victoria House, College Road, Ardingly",yes,2020-12-08,2017-12-13,,0.09,5,5,"Planning Permission Reference: DM/15/4856 - Residential development of 5 two storey dwellings: 2x 4 bedroom semi-detached, 2x 3 bedroom semi-detached, 1x 3 bedroom detached. Together with ancillary site development",local-authority-eng:MSS,not owned by a public authority,2016-05-17,https://pa.midsussex.gov.uk/online-applications/,permissioned,full planning permission,POINT(-0.078872 51.048308),SHLAAID430,https://www.midsussex.gov.uk/planning-building/evidence-supporting-documents/,2017-12-13,brownfield-land/local-authority-eng/MSS/SHLAAID430
49 Queens Road East Grinstead,yes,,2018-12-13,,0.15,14,14,"Planning Permission Reference: DM/17/2725 - Conversion of a D1 educational building to 14 no. residential apartments with new additional set back third floor and infilling of existing undercroft areas. Associated car parking, landscaping, cycle spaces, amenity areas, 1.1m high metal fence and new ramp.",local-authority-eng:MSS,not owned by a public authority,2018-01-26,https://pa.midsussex.gov.uk/online-applications/,permissioned,full planning permission,POINT(-0.010515 51.125217),SHLAAID923,https://www.midsussex.gov.uk/planning-building/evidence-supporting-documents/,2018-12-13,brownfield-land/local-authority-eng/MSS/SHLAAID923
18 Station Road East Grinstead,yes,2020-12-08,2018-12-13,,0.02,6,6,Planning Permission Reference: DM/17/1634 - Proposed Change of Use from ground floor to second floor of office (B1) building to residential (C3) comprising 6 x one bed residential units.,local-authority-eng:MSS,not owned by a public authority,2017-06-06,https://pa.midsussex.gov.uk/online-applications/,permissioned,Other,POINT(-0.016199 51.127975),SHLAAID926,https://www.midsussex.gov.uk/planning-building/evidence-supporting-documents/,2018-12-13,brownfield-land/local-authority-eng/MSS/SHLAAID926
3 Heath Sqaure Boltro Road Haywards Heath,yes,2020-12-08,2018-12-13,,0.011,6,6,Planning Permission Reference: DM/17/2328 - Proposed change of use from office use (Class B1(a)) to 6 no. dwellings (Class C3),local-authority-eng:MSS,not owned by a public authority,2017-07-24,https://pa.midsussex.gov.uk/online-applications/,permissioned,Other,POINT(-0.106979 51.002775),SHLAAID954,https://www.midsussex.gov.uk/planning-building/evidence-supporting-documents/,2018-12-13,brownfield-land/local-authority-eng/MSS/SHLAAID954
Sussex House London Road East Grinstead,yes,,2018-12-13,,0.24,8,8,"Planning Permission Reference: DM/18/1038 - The application seeks confirmation of the lawfulness of the completion of the development permitted in a Decision Notice dated 27th January 2014 under reference 13/04040/FUL for a vertical extension to the existing building to form 8 residential units and formation of a new commercial A1, A3, B1 and A2 at the above address.",local-authority-eng:MSS,not owned by a public authority,2018-05-14,https://pa.midsussex.gov.uk/online-applications/,permissioned,Other,POINT(-0.012926 51.127317),SHLAAID409,https://www.midsussex.gov.uk/planning-building/evidence-supporting-documents/,2018-12-13,brownfield-land/local-authority-eng/MSS/SHLAAID409
1-5 Queens Walk and 22-26 London Road East Grinstead,,,2018-12-13,,0.35,160,160,No further details available.,local-authority-eng:MSS,not owned by a public authority,,https://pa.midsussex.gov.uk/online-applications/,Not permissioned,,POINT(-0.009474 51.124498),SHLAAID961,https://www.midsussex.gov.uk/planning-building/evidence-supporting-documents/,2018-12-13,brownfield-land/local-authority-eng/MSS/SHLAAID961
The Oak Inn Street Lane Ardingly,yes,,2020-12-08,,0.2,5,5,"Conversion of former Oak Inn public house to two residential dwellings, and the redevelopment of the public house car park to provide a terrace of three new houses",local-authority-eng:MSS,not owned by a public authority,2019-02-01,http://www.midsussex.gov.uk/,permissioned,full planning permission,POINT(-0.080589 51.049227),SHLAAID1009,https://www.midsussex.gov.uk/planning-building/evidence-supporting-documents/,2020-12-08,brownfield-land/local-authority-eng/MSS/SHLAAID1009
Jubilee House Cyprus Road Burgess Hill,yes,,2020-12-08,,0.1,14,14,Prior approval for change of use from B1 Office to C3 Dwellings(14 Flats),local-authority-eng:MSS,not owned by a public authority,2019-03-14,http://www.midsussex.gov.uk/,permissioned,Other,POINT(-0.13064 50.95595),SHLAAID975,https://www.midsussex.gov.uk/planning-building/evidence-supporting-documents/,2020-12-08,brownfield-land/local-authority-eng/MSS/SHLAAID975
Day Centre Royal George Road Burgess Hill,yes,,2020-12-08,,0.16,8,8,Demolition of existing day centre and construction of 8 dwellings (4 x 2 bedroom and 4 x 3 bedroom) with associated parking and landscaping,local-authority-eng:MSS,not owned by a public authority,2019-08-09,http://www.midsussex.gov.uk/,permissioned,full planning permission,POINT(-0.143911 50.957367),SHLAAID981,https://www.midsussex.gov.uk/planning-building/evidence-supporting-documents/,2020-12-08,brownfield-land/local-authority-eng/MSS/SHLAAID981
