site-address,deliverable,end-date,entry-date,hazardous-substances,hectares,maximum-net-dwellings,minimum-net-dwellings,notes,organisation,ownership-status,planning-permission-date,planning-permission-history,planning-permission-status,planning-permission-type,point,site,site-plan-url,start-date,slug
"14 Bath Road And Land To Rear Of 12-24 Bath Road, Old Town",yes,2020-12-23,2020-12-23,,0.13,12,12,18HMR005 - S/14/0886 | Erection of 10no. dwellings and change of use from office to 2no. flats,local-authority-eng:SWD,not owned by a public authority,2015-02-03,https://pa1.swindon.gov.uk/publicaccess/applicationDetails.do?activeTab=documents&keyVal=N68LSEPT0FL00,permissioned,full planning permission,POINT(-1.778704 51.55303),18HMR005,https://pa1.swindon.gov.uk/publicaccess/applicationDetails.do?activeTab=documents&keyVal=N68LSEPT0FL00,2019-04-05,brownfield-land/local-authority-eng/SWD/18HMR005
"Abbey Stadium, Lady Lane, Swindon (Residual)",yes,,2020-12-23,,6.4,100,100,"18HMR006 - S/OUT/14/0833 | Outline application for a mixed use development comprising up to 100no. dwellings, car parking in association with stadium events, fire station and associated facilities, access works, landscaping and open space.",local-authority-eng:SWD,not owned by a public authority,2015-04-02,https://pa1.swindon.gov.uk/publicaccess/applicationDetails.do?activeTab=documents&keyVal=N5PKY5PT97000,permissioned,outline planning permission,POINT(-1.791156 51.606531),18HMR006,https://pa1.swindon.gov.uk/publicaccess/applicationDetails.do?activeTab=documents&keyVal=N5PKY5PT97000,2019-04-05,brownfield-land/local-authority-eng/SWD/18HMR006
"Land At Clevedon House, 29 Woodland View, Wroughton",yes,,2020-12-23,,0.6,10,10,18HMR010 - S/OUT/15/1338 | Outline application for the demolition of 3no. existing dwellings and the erection of up to 10no. dwellings,local-authority-eng:SWD,not owned by a public authority,2016-04-15,https://pa1.swindon.gov.uk/publicaccess/applicationDetails.do?activeTab=documents&keyVal=NSX5RKPT04V00,permissioned,outline planning permission,POINT(-1.793776 51.522148),18HMR010,https://pa1.swindon.gov.uk/publicaccess/applicationDetails.do?activeTab=documents&keyVal=NSX5RKPT04V00,2019-04-05,brownfield-land/local-authority-eng/SWD/18HMR010
"Land At Nursery Close, Wroughton, Swindon",yes,2020-12-23,2020-12-23,,0.08,5,5,"18HMR012 - S/15/0467 | Erection of 5 no. dwellings, a detached garage",local-authority-eng:SWD,not owned by a public authority,2015-11-26,https://pa1.swindon.gov.uk/publicaccess/applicationDetails.do?activeTab=documents&keyVal=NLK10IPT97000,permissioned,full planning permission,POINT(-1.780443 51.564704),18HMR012,https://pa1.swindon.gov.uk/publicaccess/applicationDetails.do?activeTab=documents&keyVal=NLK10IPT97000,2018-12-31,brownfield-land/local-authority-eng/SWD/18HMR012
"3-5 Lagos Street, Swindon, SN1 2BU",yes,,2020-12-23,,0.12,8,8,18HMR015 - S/16/1911 | Erection of 8no. flats,local-authority-eng:SWD,not owned by a public authority,2017-01-18,https://pa1.swindon.gov.uk/publicaccess/applicationDetails.do?activeTab=documents&keyVal=OG26DDPTJP200,permissioned,full planning permission,POINT(-1.79342 51.597808),18HMR015,https://pa1.swindon.gov.uk/publicaccess/applicationDetails.do?activeTab=documents&keyVal=OG26DDPTJP200,2018-12-31,brownfield-land/local-authority-eng/SWD/18HMR015
44 Victoria RoadOld TownSwindonSN1 3AY,yes,,2020-12-23,,0.01,5,5,18HMR016 - S/17/1150 | Change of use of house in multiple occupation (HMO) to 5no. flats,local-authority-eng:SWD,not owned by a public authority,2017-09-12,https://pa1.swindon.gov.uk/publicaccess/applicationDetails.do?activeTab=documents&keyVal=OSQ72TPTGAM00,permissioned,full planning permission,POINT(-1.819241 51.562092),18HMR016,https://pa1.swindon.gov.uk/publicaccess/applicationDetails.do?activeTab=documents&keyVal=OSQ72TPTGAM00,2018-12-31,brownfield-land/local-authority-eng/SWD/18HMR016
"Abbeymeads Medical Practice, Elstree Way, Abbey Meads, Swindon",yes,,2020-12-23,,0.19,7,7,18HMR019 - S/16/1059 | Erection of a new dental practice and adjoining opticians (Class A1) with 3no. flats above. and 4 no. dwellings,local-authority-eng:SWD,not owned by a public authority,2016-08-19,https://pa1.swindon.gov.uk/publicaccess/applicationDetails.do?activeTab=documents&keyVal=O8K8VHPTHYQ00,permissioned,full planning permission,POINT(-1.816581 51.559986),18HMR019,https://pa1.swindon.gov.uk/publicaccess/applicationDetails.do?activeTab=documents&keyVal=O8K8VHPTHYQ00,2018-12-31,brownfield-land/local-authority-eng/SWD/18HMR019
"The Quadrant, Stonehill Green, Swindon",yes,2020-12-23,2020-12-23,,0.62,100,100,18HMR023 - S/PRIORC/16/0477 | Prior Approval Notification for the change of use from offices (class B1(a)) to dwelling houses (class C3) (100no. flats),local-authority-eng:SWD,not owned by a public authority,2016-03-11,https://pa1.swindon.gov.uk/publicaccess/applicationDetails.do?activeTab=documents&keyVal=O41CUTPT0IN00,permissioned,full planning permission,POINT(-1.800472 51.60946),18HMR023,https://pa1.swindon.gov.uk/publicaccess/applicationDetails.do?activeTab=documents&keyVal=O41CUTPT0IN00,2018-12-31,brownfield-land/local-authority-eng/SWD/18HMR023
"Minerva House, Delta 800, Welton Road, Westlea, Swindon",yes,,2020-12-23,,0.42,38,38,18HMR024 - S/PRIORC/16/0988 | Prior Approval Notification for the change of use from offices (Class B1a) to dwellings (Class C3) (38no. apartments).,local-authority-eng:SWD,not owned by a public authority,2016-07-18,https://pa1.swindon.gov.uk/publicaccess/applicationDetails.do?activeTab=documents&keyVal=O83M09PT0IN00,permissioned,permission in principle,POINT(-1.756112 51.588008),18HMR024,https://pa1.swindon.gov.uk/publicaccess/applicationDetails.do?activeTab=documents&keyVal=O83M09PT0IN00,2018-12-31,brownfield-land/local-authority-eng/SWD/18HMR024
"Land At Abbey Farm, Tadpole Lane Blunsdon St. Andrew Swindon",yes,,2020-12-23,,0.08,6,6,18HMR025 - S/17/0775 | Erection of 2no. retail units with 6no. flats above,local-authority-eng:SWD,not owned by a public authority,2018-01-10,https://pa1.swindon.gov.uk/publicaccess/applicationDetails.do?activeTab=documents&keyVal=OPHJ2GPTMNV00,permissioned,full planning permission,POINT(-1.719676 51.587405),18HMR025,https://pa1.swindon.gov.uk/publicaccess/applicationDetails.do?activeTab=documents&keyVal=OPHJ2GPTMNV00,2018-12-31,brownfield-land/local-authority-eng/SWD/18HMR025
"Former Hertz Rent A Car, Hyde Road, Stratton St Margaret, Swindon",yes,,2020-12-23,,0.23,19,19,18HMR027 - S/18/1903 | Erection of 19no. dwellings and associated works.,local-authority-eng:SWD,not owned by a public authority,2019-05-02,https://pa1.swindon.gov.uk/publicaccess/applicationDetails.do?activeTab=documents&keyVal=PIN6ZVPT0FL00,permissioned,full planning permission,POINT(-1.775882 51.550054),18HMR027,https://pa1.swindon.gov.uk/publicaccess/applicationDetails.do?activeTab=documents&keyVal=PIN6ZVPT0FL00,2018-12-31,brownfield-land/local-authority-eng/SWD/18HMR027
South Marston Hotel And Spa Old Vicarage LaneSouth Marston Swindon SN3 4SH,yes,,2020-12-23,,2.59,69,69,18HMR029 - S/RES/18/1145 | Reserved matters to S/OUT/15/1985 - Erection of 69no. Dwellings,local-authority-eng:SWD,not owned by a public authority,2019-03-19,https://pa1.swindon.gov.uk/publicaccess/applicationDetails.do?activeTab=documents&keyVal=PBHKXEPTGWA00,permissioned,reserved matters approval,POINT(-1.751255 51.574131),18HMR029,https://pa1.swindon.gov.uk/publicaccess/applicationDetails.do?activeTab=documents&keyVal=PBHKXEPTGWA00,2018-12-31,brownfield-land/local-authority-eng/SWD/18HMR029
"28 & 29 Newport Street, Old Town, Swindon",yes,2020-12-23,2020-12-23,,0.02,6,6,18HMR038 - S/16/0864 | Erection of a roof extension to accommodate 2no. dwellings and erection of 2no. dwellings to the rear,local-authority-eng:SWD,not owned by a public authority,2016-07-07,https://pa1.swindon.gov.uk/publicaccess/applicationDetails.do?activeTab=documents&keyVal=O72GHUPT0IN00,permissioned,full planning permission,POINT(-1.766698 51.540781),18HMR038,https://pa1.swindon.gov.uk/publicaccess/applicationDetails.do?activeTab=documents&keyVal=O72GHUPT0IN00,2018-12-31,brownfield-land/local-authority-eng/SWD/18HMR038
"Selina House 192 Oxford Road, Stratton St Margaret, Swindon, SN3 4HA",yes,,2020-12-23,,0.15,8,8,18HMR045 - S/17/1478 | Demolition of care home and erection of 8 no. flats,local-authority-eng:SWD,not owned by a public authority,2018-02-08,https://pa1.swindon.gov.uk/publicaccess/applicationDetails.do?activeTab=documents&keyVal=OVSUEUPTHN600,permissioned,full planning permission,POINT(-1.785682 51.529073),18HMR045,https://pa1.swindon.gov.uk/publicaccess/applicationDetails.do?activeTab=documents&keyVal=OVSUEUPTHN600,2018-12-31,brownfield-land/local-authority-eng/SWD/18HMR045
"Union Square, Swindon",yes,,2020-12-23,,10.18,405,405,18HMR049 - S/11/0614 | Outline application seeking redevelopment to provide mixed-use development,local-authority-eng:SWD,not owned by a public authority,2012-05-03,https://pa1.swindon.gov.uk/publicaccess/applicationDetails.do?activeTab=documents&keyVal=LKMDETPT0FL00,permissioned,full planning permission,POINT(-1.79461 51.522344),18HMR049,https://pa1.swindon.gov.uk/publicaccess/applicationDetails.do?activeTab=documents&keyVal=LKMDETPT0FL00,2018-12-31,brownfield-land/local-authority-eng/SWD/18HMR049
"Land At Marlborough Park, Swindon",yes,,2020-12-23,,15.3,91,91,18HMR050 - S/OUT/15/2051 | A Hybrid application for a mix of residential development to include - full details of the erection of 91no. dwellings & 74no. age-restricted retirement dwellings,local-authority-eng:SWD,not owned by a public authority,2017-04-10,https://pa1.swindon.gov.uk/publicaccess/applicationDetails.do?activeTab=documents&keyVal=NZ4ZRWPT0FL00,permissioned,full planning permission,POINT(-1.784553 51.61122),18HMR050,https://pa1.swindon.gov.uk/publicaccess/applicationDetails.do?activeTab=documents&keyVal=NZ4ZRWPT0FL00,2018-12-31,brownfield-land/local-authority-eng/SWD/18HMR050
"Former Garage & Land, Phillips Lane, Old Town, Swindon, SN1 4BH",yes,,2020-12-23,,0.19,37,37,19HMR004 - S/19/1589 | Erection of 37no. apartments and 2no. commercial units for Class B1 or Class A2 or Class D1 Use and associated works.,local-authority-eng:SWD,not owned by a public authority,2020-09-25,https://pa1.swindon.gov.uk/publicaccess/applicationDetails.do?activeTab=documents&keyVal=PZU4LLPTKGF00,permissioned,full planning permission,POINT(-1.642515 51.552619),19HMR004,https://pa1.swindon.gov.uk/publicaccess/applicationDetails.do?activeTab=documents&keyVal=PZU4LLPTKGF00,2019-12-31,brownfield-land/local-authority-eng/SWD/19HMR004
"Land Adjacent To Berkley Farm House, Swindon Road, Wroughton, Swindon, SN4 9AQ",yes,,2020-12-23,,0.29,4,4,19HMR007 - S/16/1357 | Erection of 4no. detached dwellings,local-authority-eng:SWD,not owned by a public authority,2017-10-19,https://pa1.swindon.gov.uk/publicaccess/applicationDetails.do?activeTab=documents&keyVal=OB9XC2PT0FL00,permissioned,full planning permission,POINT(-1.734456 51.575355),19HMR007,https://pa1.swindon.gov.uk/publicaccess/applicationDetails.do?activeTab=documents&keyVal=OB9XC2PT0FL00,2019-12-31,brownfield-land/local-authority-eng/SWD/19HMR007
"Former Haskins Garage, High Street, Wroughton, Swindon",yes,,2020-12-23,,0.18,13,13,19HMR011 - S/17/0286 | Erection of 13no. dwellings and associated works.,local-authority-eng:SWD,not owned by a public authority,2017-04-05,https://pa1.swindon.gov.uk/publicaccess/applicationDetails.do?activeTab=documents&keyVal=OLF5M6PTLAJ00,permissioned,full planning permission,POINT(-1.786592 51.556795),19HMR011,https://pa1.swindon.gov.uk/publicaccess/applicationDetails.do?activeTab=documents&keyVal=OLF5M6PTLAJ00,2019-12-31,brownfield-land/local-authority-eng/SWD/19HMR011
"Land At Holdcroft, Broad Bush, Blunsdon, Swindon",yes,,2020-12-23,,3,54,54,19HMR014 - S/17/0528 | Erection of 54no. Dwellings,local-authority-eng:SWD,not owned by a public authority,2018-03-27,https://pa1.swindon.gov.uk/publicaccess/applicationDetails.do?activeTab=documents&keyVal=ON9VR9PTLVS00,permissioned,full planning permission,POINT(-1.7876 51.524801),19HMR014,https://pa1.swindon.gov.uk/publicaccess/applicationDetails.do?activeTab=documents&keyVal=ON9VR9PTLVS00,2019-12-31,brownfield-land/local-authority-eng/SWD/19HMR014
"Land at Alresco Childcare, Newtown Lare, Bishopstone, SN6 8PW",yes,,2020-12-23,,0.26,2,2,19HMR021 - S/17/1826 | Erection of 2no. dwellings,local-authority-eng:SWD,not owned by a public authority,2018-02-08,https://pa1.swindon.gov.uk/publicaccess/applicationDetails.do?activeTab=documents&keyVal=OYQXU2PTIVR00,permissioned,full planning permission,POINT(-1.777064 51.579986),19HMR021,https://pa1.swindon.gov.uk/publicaccess/applicationDetails.do?activeTab=documents&keyVal=OYQXU2PTIVR00,2019-12-31,brownfield-land/local-authority-eng/SWD/19HMR021
"Land at 5 Wanborough Road, Stratton St Margaret, Swindon",yes,2020-12-23,2020-12-23,,0.48,15,15,19HMR026 - S/18/0265 | Erection of 15no. dwellings,local-authority-eng:SWD,not owned by a public authority,2019-01-28,https://pa1.swindon.gov.uk/publicaccess/applicationDetails.do?activeTab=documents&keyVal=P46S91PT04V00,permissioned,full planning permission,POINT(-1.804841 51.55975),19HMR026,https://pa1.swindon.gov.uk/publicaccess/applicationDetails.do?activeTab=documents&keyVal=P46S91PT04V00,2019-12-31,brownfield-land/local-authority-eng/SWD/19HMR026
"The Former Cycle Club, 33 Dixon Street, Swindon",yes,,2020-12-23,,0.03,8,8,19HMR030 - S/18/1523 | Demolition of existing building and erection of 8 no. flats,local-authority-eng:SWD,not owned by a public authority,2019-02-26,https://pa1.swindon.gov.uk/publicaccess/applicationDetails.do?activeTab=documents&keyVal=PEU5YHPT04V00,permissioned,full planning permission,POINT(-1.729012 51.586939),19HMR030,https://pa1.swindon.gov.uk/publicaccess/applicationDetails.do?activeTab=documents&keyVal=PEU5YHPT04V00,2019-12-31,brownfield-land/local-authority-eng/SWD/19HMR030
"Land Adjacent to Co-operative Convenience Store, Moormead Road, Wroughton, Swindon",yes,,2020-12-23,,0.07,5,5,19HMR038 - S/OUT/17/1693 | Outline application for the erection of 2no. apartments and 3 dwellings,local-authority-eng:SWD,not owned by a public authority,2019-02-28,https://pa1.swindon.gov.uk/publicaccess/applicationDetails.do?activeTab=documents&keyVal=OXPO62PTIFK00,permissioned,outline planning permission,POINT(-1.780691 51.554122),19HMR038,https://pa1.swindon.gov.uk/publicaccess/applicationDetails.do?activeTab=documents&keyVal=OXPO62PTIFK00,2019-12-31,brownfield-land/local-authority-eng/SWD/19HMR038
"409 - 411 Cricklade Road, Swindon, SN2 1AQ",yes,,2020-12-23,,0.09,6,6,19HMR039 - S/18/1569 | Demolition of 409 Cricklade Road and erection of 6no. dwellings ( one 1 bed flat and five 2 bed houses),local-authority-eng:SWD,not owned by a public authority,2019-03-07,https://pa1.swindon.gov.uk/publicaccess/applicationDetails.do?activeTab=documents&keyVal=PFAM9JPT0FL00,permissioned,full planning permission,POINT(-1.801562 51.565596),19HMR039,https://pa1.swindon.gov.uk/publicaccess/applicationDetails.do?activeTab=documents&keyVal=PFAM9JPT0FL00,2019-12-31,brownfield-land/local-authority-eng/SWD/19HMR039
"98 Redcliffe Street, Swindon, SN2 2BZ",yes,,2020-12-23,,0.04,6,6,19HMR041 - S/18/1072 | Erection of a three storey block of 6 no. flats,local-authority-eng:SWD,not owned by a public authority,2019-02-15,https://pa1.swindon.gov.uk/publicaccess/applicationDetails.do?activeTab=documents&keyVal=PAXLL7PTGMP00,permissioned,full planning permission,POINT(-1.762084 51.570294),19HMR041,https://pa1.swindon.gov.uk/publicaccess/applicationDetails.do?activeTab=documents&keyVal=PAXLL7PTGMP00,2019-12-31,brownfield-land/local-authority-eng/SWD/19HMR041
Crown Timber Site Unit A Thornhill Industrial Estate South Marston Swindon,yes,,2020-12-23,,2.05,47,47,PP181901 - S/OUT/14/2058 | Outline application for the erection of up to 47no. dwellings,local-authority-eng:SWD,not owned by a public authority,2018-05-15,https://pa1.swindon.gov.uk/publicaccess/applicationDetails.do?activeTab=documents&keyVal=NG3QDNPT97000,permissioned,outline planning permission,POINT(-1.782897 51.564644),PP181901,https://pa1.swindon.gov.uk/publicaccess/applicationDetails.do?activeTab=documents&keyVal=NG3QDNPT97000,2018-12-31,brownfield-land/local-authority-eng/SWD/PP181901
"Bus Depot Eastcott Road, Old Town, SwindonSN1 3LS",yes,,2020-12-23,,0.61,45,45,"PP181915 - S/17/1777 | Demolition of existing buildings, erection of new buildings and conversion of existing buildings to form 45no. residential units",local-authority-eng:SWD,not owned by a public authority,2018-11-21,https://pa1.swindon.gov.uk/publicaccess/applicationDetails.do?activeTab=documents&keyVal=OYDTNAPTIQF00,permissioned,full planning permission,POINT(-1.782661 51.55904),PP181915,https://pa1.swindon.gov.uk/publicaccess/applicationDetails.do?activeTab=documents&keyVal=OYDTNAPTIQF00,2018-12-31,brownfield-land/local-authority-eng/SWD/PP181915
Morris Street Club 20-22 Morris Street Rodbourne Swindon SN2 2HU,yes,,2020-12-23,,0.04,5,5,PP181917 - S/18/0380 | Partial demolition with two storey extension and alterations to allow for the conversion of the existing social club to form 4 no. 1 bedroom flats and 1 no.2 bedroom flat,local-authority-eng:SWD,not owned by a public authority,2018-10-22,https://pa1.swindon.gov.uk/publicaccess/applicationDetails.do?activeTab=documents&keyVal=P54EY9PTLSB00,permissioned,full planning permission,POINT(-1.777846 51.555757),PP181917,https://pa1.swindon.gov.uk/publicaccess/applicationDetails.do?activeTab=documents&keyVal=P54EY9PTLSB00,2018-12-31,brownfield-land/local-authority-eng/SWD/PP181917
Coachbuilders House Stratton Road Stratton St Margaret Swindon,yes,2020-12-23,2020-12-23,,0.23,8,8,PP181918 - S/18/0256 | Erection of a mansard roof with dormer windows to create 8no. additional flats ( 7 one bed flats and 1 two bed flat),local-authority-eng:SWD,not owned by a public authority,2018-09-07,https://pa1.swindon.gov.uk/publicaccess/applicationDetails.do?activeTab=documents&keyVal=P44UC4PTLAY00,permissioned,full planning permission,POINT(-1.77671 51.553074),PP181918,https://pa1.swindon.gov.uk/publicaccess/applicationDetails.do?activeTab=documents&keyVal=P44UC4PTLAY00,2018-12-31,brownfield-land/local-authority-eng/SWD/PP181918
175 - 176 Manchester Road Swindon SN1 1TU,yes,2020-12-23,2020-12-23,,0.02,6,6,PP181920 - S/17/1707 | Change of use of 2no. dwellings to 6no. self contained apartments,local-authority-eng:SWD,not owned by a public authority,2018-12-18,https://pa1.swindon.gov.uk/publicaccess/applicationDetails.do?activeTab=documents&keyVal=OXX2I2PT0FL00,permissioned,full planning permission,POINT(-1.727288 51.555305),PP181920,https://pa1.swindon.gov.uk/publicaccess/applicationDetails.do?activeTab=documents&keyVal=OXX2I2PT0FL00,2018-12-31,brownfield-land/local-authority-eng/SWD/PP181920
"2 Temple Chambers Temple Street, Swindon, SN1 1SQ",yes,2020-12-23,2020-12-23,,0.01,5,5,"PP181922 - S/18/0406 | Change of use of ground, first and second floor and roof space from Class A1/A2/B1 to Class C3 to provide 5no. dwellings",local-authority-eng:SWD,not owned by a public authority,2018-05-18,https://pa1.swindon.gov.uk/publicaccess/applicationDetails.do?activeTab=documents&keyVal=P5BFPAPTLW600,permissioned,full planning permission,POINT(-1.826729 51.569192),PP181922,https://pa1.swindon.gov.uk/publicaccess/applicationDetails.do?activeTab=documents&keyVal=P5BFPAPTLW600,2018-12-31,brownfield-land/local-authority-eng/SWD/PP181922
"53 Victoria Road, Old Town, Swindon, SN1 3AY",yes,2020-12-23,2020-12-23,,0.01,5,5,PP181923 - S/PRIORC/18/1149 | Prior notification application for the change of use from office (Class B1a) to 5no. flats (Class C3),local-authority-eng:SWD,not owned by a public authority,2018-08-22,https://pa1.swindon.gov.uk/publicaccess/applicationDetails.do?activeTab=documents&keyVal=PBLB5MPT0FL00,permissioned,permission in principle,POINT(-1.741264 51.565407),PP181923,https://pa1.swindon.gov.uk/publicaccess/applicationDetails.do?activeTab=documents&keyVal=PBLB5MPT0FL00,2018-12-31,brownfield-land/local-authority-eng/SWD/PP181923
99-100 Victoria RoadOld TownSwindonSN1 3BE,yes,,2020-12-23,,0.27,31,31,PP181924 - S/PRIORC/18/0544 | Prior notification application for the change of use from office (Class B1) to 31no. dwellinghouses (Class C3).,local-authority-eng:SWD,not owned by a public authority,2018-05-24,https://pa1.swindon.gov.uk/publicaccess/applicationDetails.do?activeTab=documents&keyVal=P6CW7SPT04V00,permissioned,permission in principle,POINT(-1.744905 51.550565),PP181924,https://pa1.swindon.gov.uk/publicaccess/applicationDetails.do?activeTab=documents&keyVal=P6CW7SPT04V00,2018-12-31,brownfield-land/local-authority-eng/SWD/PP181924
"Land north of Edison Road, Dorcan",yes,,2020-12-23,,1.67,,,s0006 - S/18/1906 | Change of use of land from former factory site (use class B1) to lorry park (sui generis).,local-authority-eng:SWD,not owned by a public authority,2019-04-10,https://pa1.swindon.gov.uk/publicaccess/applicationDetails.do?activeTab=documents&keyVal=PINLXMPTKEW00,permissioned,full planning permission,POINT(-1.774146 51.548621),s0006,https://pa1.swindon.gov.uk/publicaccess/applicationDetails.do?activeTab=documents&keyVal=PINLXMPTKEW00,2018-12-31,brownfield-land/local-authority-eng/SWD/s0006
"Oak House, Rivermead Drive, Swindon",yes,,2020-12-23,,2.52,0,0,s0024 - s0024 | No Recent Planning History,local-authority-eng:SWD,not owned by a public authority,,https://pa1.swindon.gov.uk/publicaccess/,not permissioned,,POINT(-1.830491 51.5782),s0024,https://pa1.swindon.gov.uk/publicaccess/,2018-12-31,brownfield-land/local-authority-eng/SWD/s0024
Nythe Complex,,,2020-12-23,,0.93,35,35,s0070 - s0070 | No Recent Planning History,local-authority-eng:SWD,owned by a public authority,,https://pa1.swindon.gov.uk/publicaccess/,not permissioned,,POINT(-1.792698 51.568885),s0070,https://pa1.swindon.gov.uk/publicaccess/,2018-12-31,brownfield-land/local-authority-eng/SWD/s0070
Land bounded by Netherton Close/ Cranemore Avenue/ Keswick Road,,,2020-12-23,,0.17,6,6,s0082 - s0082 | No Recent Planning History,local-authority-eng:SWD,mixed ownership,,https://pa1.swindon.gov.uk/publicaccess/,not permissioned,,POINT(-1.783934 51.559327),s0082,https://pa1.swindon.gov.uk/publicaccess/,2017-12-31,brownfield-land/local-authority-eng/SWD/s0082
"Coal Yard, Signal Way",yes,,2020-12-23,,0.03,1,1,s0090 - S/18/0971 | Erection of 1no. dwelling,local-authority-eng:SWD,owned by a public authority,2018-08-24,https://pa1.swindon.gov.uk/publicaccess/applicationDetails.do?activeTab=documents&keyVal=P9WLL8PT04V00,permissioned,full planning permission,POINT(-1.787405 51.559517),s0090,https://pa1.swindon.gov.uk/publicaccess/applicationDetails.do?activeTab=documents&keyVal=P9WLL8PT04V00,2017-12-31,brownfield-land/local-authority-eng/SWD/s0090
"Former youth Centre, Sparcells",yes,2020-12-23,2020-12-23,,0.21,6,6,s0093 - S/18/0460 | Erection of 6no residential dwellings,local-authority-eng:SWD,not owned by a public authority,2018-11-15,https://pa1.swindon.gov.uk/publicaccess/applicationDetails.do?activeTab=documents&keyVal=P5N5YBPTM3A00,permissioned,full planning permission,POINT(-1.727309 51.585659),s0093,https://pa1.swindon.gov.uk/publicaccess/applicationDetails.do?activeTab=documents&keyVal=P5N5YBPTM3A00,2018-12-31,brownfield-land/local-authority-eng/SWD/s0093
North Star (Former Clares Site and Oasis Leisure Centre),yes,,2020-12-23,,13.05,,,"s0099 - s0099 | Outline application for the erection of a leisure development of up to 160, 000 sq.m. To include the provision of an entertainment arena, indoor ski centre, cinema, hotel, retail, restaurants and cafes, access, parking and associated works. Application is ongoing. Ref. : S/OUT/15/0943",local-authority-eng:SWD,not owned by a public authority,,https://pa1.swindon.gov.uk/publicaccess/,permissioned,full planning permission,POINT(-1.790611 51.523084),s0099,https://pa1.swindon.gov.uk/publicaccess/,2018-12-31,brownfield-land/local-authority-eng/SWD/s0099
Aspen House and Granville Street Car Park,yes,,2020-12-23,,1.27,0,0,s0100 - S/20/0284 | Erection of a hotel (Use Class C1) with ancillary restaurant.Ref. : S/OUT/17/0665,local-authority-eng:SWD,not owned by a public authority,2020-06-03,https://pa1.swindon.gov.uk/publicaccess/applicationDetails.do?activeTab=documents&keyVal=Q69LYKPTFR800,permissioned,full planning permission,POINT(-1.79276 51.525949),s0100,https://pa1.swindon.gov.uk/publicaccess/applicationDetails.do?activeTab=documents&keyVal=Q69LYKPTFR800,2017-12-31,brownfield-land/local-authority-eng/SWD/s0100
Tented Market,,,2020-12-23,,0.14,0,0,"s0101 - S/15/2017 | Demolition of existing and erection of a two story buildings with retail (A1) and food & drink (A3) units. Permission granted on appeal.Ref. : S/15/2017Decision Issued Date: 16/06/2016Demolition of existing tented market and erection of a 12 storey building comprising 101no. Flats, 4no. Class A3 (Food and Drink) units, 1no. Class A1 (Shop) unit. Application granted permission subject to S106 and conditions at October 2017 Planning CommitteeRef. : S/17/0673Decision Issued Date: Pending.",local-authority-eng:SWD,not owned by a public authority,2016-11-09,https://pa1.swindon.gov.uk/publicaccess/applicationDetails.do?activeTab=documents&keyVal=NYTT2FPTFMJ00,permissioned,full planning permission,POINT(-1.787231 51.562094),s0101,https://pa1.swindon.gov.uk/publicaccess/applicationDetails.do?activeTab=documents&keyVal=NYTT2FPTFMJ00,2017-12-31,brownfield-land/local-authority-eng/SWD/s0101
Thornhill Industrial Estate,yes,,2020-12-23,,5.09,0,0,s0111 - S/OUT/14/2059 | Application withdrawn 15/05/2018,local-authority-eng:SWD,not owned by a public authority,,https://pa1.swindon.gov.uk/publicaccess/,not permissioned,,POINT(-1.785588 51.562884),s0111,https://pa1.swindon.gov.uk/publicaccess/,2017-12-31,brownfield-land/local-authority-eng/SWD/s0111
