site-address,deliverable,end-date,entry-date,hazardous-substances,hectares,maximum-net-dwellings,minimum-net-dwellings,notes,organisation,ownership-status,planning-permission-date,planning-permission-history,planning-permission-status,planning-permission-type,point,site,site-plan-url,start-date,slug
"Holbrook House, Sheppard Street, Swindon",yes,,2020-12-23,,0.01,58,58,S0344 - S/PRIORC/16/0015 | Prior Approval Notification for the change of use of ground floor and first to fourth floors from offices (class B1(a)) to residential use (class C3) (58no. flats),local-authority-eng:SWD,not owned by a public authority,2016-02-23,https://pa1.swindon.gov.uk/publicaccess/applicationDetails.do?activeTab=documents&keyVal=O0HAO3PT0IN00,permissioned,permission in principle,POINT(-1.786995 51.562717),S0344,https://pa1.swindon.gov.uk/publicaccess/applicationDetails.do?activeTab=documents&keyVal=O0HAO3PT0IN00,2017-12-31,brownfield-land/local-authority-eng/SWD/S0344
"The Ivy Hotel, Moormead Road, Wroughton, Swindon SN4 9BY",yes,2020-12-23,2020-12-23,,0.46,38,38,S0348 - S/16/0487 | Demolition of buildings on site and the construction of 38 no. residential units of Retirement Living accommodation,local-authority-eng:SWD,not owned by a public authority,2016-11-29,https://pa1.swindon.gov.uk/publicaccess/applicationDetails.do?activeTab=documents&keyVal=O44JR4PTH9L00,permissioned,full planning permission,POINT(-1.76652 51.584777),S0348,https://pa1.swindon.gov.uk/publicaccess/applicationDetails.do?activeTab=documents&keyVal=O44JR4PTH9L00,2017-12-31,brownfield-land/local-authority-eng/SWD/S0348
"Anglia House, 115-118 Commercial Road, Swindon SN1 5PL",yes,,2020-12-23,,0.06,5,5,S0350 - S/16/0960 | Erection of an additional storey to provide 5no. flats and associated works.,local-authority-eng:SWD,not owned by a public authority,2016-09-20,https://pa1.swindon.gov.uk/publicaccess/applicationDetails.do?activeTab=documents&keyVal=O7RYB3PTHSE00,permissioned,full planning permission,POINT(-1.786784 51.605624),S0350,https://pa1.swindon.gov.uk/publicaccess/applicationDetails.do?activeTab=documents&keyVal=O7RYB3PTHSE00,2017-12-31,brownfield-land/local-authority-eng/SWD/S0350
"Land At Radway Road, Stratton St Margaret, Swindon SN3 4ND",yes,,2020-12-23,,2.2,,,"S0352 - S/16/0990 | Erection of an industrial/warehouse unit (class B1(a), B2 and B8) with associated works.",local-authority-eng:SWD,not owned by a public authority,2016-09-05,https://pa1.swindon.gov.uk/publicaccess/applicationDetails.do?activeTab=documents&keyVal=O8507LPT04V00,permissioned,full planning permission,POINT(-1.787313 51.601806),S0352,https://pa1.swindon.gov.uk/publicaccess/applicationDetails.do?activeTab=documents&keyVal=O8507LPT04V00,2018-12-31,brownfield-land/local-authority-eng/SWD/S0352
"18 - 24 Bridge Street & 16 - 17 Fleet Street, Swindon SN1 1BP",yes,,2020-12-23,,0.07,14,14,"S0358 - S/16/1679 | Demolition of 20 Bridge Street and 17 Fleet Street, erection of 4no. commercial units (Class A1 and A3) and 14no. residential apartments",local-authority-eng:SWD,not owned by a public authority,2017-02-03,https://pa1.swindon.gov.uk/publicaccess/applicationDetails.do?activeTab=documents&keyVal=ODYK5WPTJ9R00,permissioned,full planning permission,POINT(-1.768977 51.584301),S0358,https://pa1.swindon.gov.uk/publicaccess/applicationDetails.do?activeTab=documents&keyVal=ODYK5WPTJ9R00,2017-12-31,brownfield-land/local-authority-eng/SWD/S0358
The Limes,yes,,2020-12-23,,0.32,5,5,S0381 - S0381 | No Recent Planning History,local-authority-eng:SWD,not owned by a public authority,,https://pa1.swindon.gov.uk/publicaccess/,not permissioned,,POINT(-1.783774 51.556066),S0381,https://pa1.swindon.gov.uk/publicaccess/,2018-12-31,brownfield-land/local-authority-eng/SWD/S0381
North of Gateway North,yes,,2020-12-23,,5.16,,,"S0401 - S0401 | Part demolition and extension of existing building to provide new distribution warehouse accommodation including change of use (B8) and construction of new service yard, parking, access, landscaping and associated works.",local-authority-eng:SWD,not owned by a public authority,2010-01-11,https://pa1.swindon.gov.uk/publicaccess/applicationDetails.do?activeTab=documents&keyVal=KRAMLDPT97000,permissioned,full planning permission,POINT(-1.782747 51.559009),S0401,https://pa1.swindon.gov.uk/publicaccess/applicationDetails.do?activeTab=documents&keyVal=KRAMLDPT97000,2018-12-31,brownfield-land/local-authority-eng/SWD/S0401
South of Gateway North,yes,,2020-12-23,,2.34,,,"S0402 - S0402 | Part demolition and extension of existing building to provide new distribution warehouse accommodation including change of use (B8) and construction of new service yard, parking, access, landscaping and associated works.",local-authority-eng:SWD,not owned by a public authority,2010-01-11,https://pa1.swindon.gov.uk/publicaccess/applicationDetails.do?activeTab=documents&keyVal=KRAMLDPT97000,permissioned,full planning permission,POINT(-1.700211 51.541934),S0402,https://pa1.swindon.gov.uk/publicaccess/applicationDetails.do?activeTab=documents&keyVal=KRAMLDPT97000,2018-12-31,brownfield-land/local-authority-eng/SWD/S0402
The Wheatsheaf Public House 33-36 Dores Road Upper Stratton,yes,,2020-12-23,,0.23,8,8,S0413 - S/16/0768 | Demolition of the Wheatsheaf Public House and erection of 8no. dwellings,local-authority-eng:SWD,not owned by a public authority,2017-05-12,https://pa1.swindon.gov.uk/publicaccess/applicationDetails.do?activeTab=documents&keyVal=O6E5ERPT0IN00,permissioned,full planning permission,POINT(-1.773606 51.55177),S0413,https://pa1.swindon.gov.uk/publicaccess/applicationDetails.do?activeTab=documents&keyVal=O6E5ERPT0IN00,2018-12-31,brownfield-land/local-authority-eng/SWD/S0413
Land To The Rear Of 27 Eastcott Hill,yes,2020-12-23,2020-12-23,,0.02,6,6,S0415 - S/17/0526 | Erection of 6no. flats,local-authority-eng:SWD,not owned by a public authority,2017-08-11,https://pa1.swindon.gov.uk/publicaccess/applicationDetails.do?activeTab=documents&keyVal=ON9FPRPTLV800,permissioned,full planning permission,POINT(-1.808924 51.573069),S0415,https://pa1.swindon.gov.uk/publicaccess/applicationDetails.do?activeTab=documents&keyVal=ON9FPRPTLV800,2018-12-31,brownfield-land/local-authority-eng/SWD/S0415
3 Temple Chambers Temple Street,yes,2020-12-23,2020-12-23,,0.01,5,5,"S0416 - S/17/1757 | Change of use of ground floor, second floor and roofspace to 5no. flats",local-authority-eng:SWD,not owned by a public authority,2017-12-11,https://pa1.swindon.gov.uk/publicaccess/applicationDetails.do?activeTab=documents&keyVal=OY9VLNPT0IN00,permissioned,full planning permission,POINT(-1.787892 51.560375),S0416,https://pa1.swindon.gov.uk/publicaccess/applicationDetails.do?activeTab=documents&keyVal=OY9VLNPT0IN00,2018-12-31,brownfield-land/local-authority-eng/SWD/S0416
Southdown Nursing Home 17 Church Road Wanborough,yes,2020-12-23,2020-12-23,,0.17,8,8,S0418 - S/16/1968 | Change of use of former nursing home to 7 no. 2-bedroom flats,local-authority-eng:SWD,not owned by a public authority,2017-04-07,https://pa1.swindon.gov.uk/publicaccess/applicationDetails.do?activeTab=documents&keyVal=OGMXKGPTJR700,permissioned,full planning permission,POINT(-1.786795 51.564983),S0418,https://pa1.swindon.gov.uk/publicaccess/applicationDetails.do?activeTab=documents&keyVal=OGMXKGPTJR700,2018-12-31,brownfield-land/local-authority-eng/SWD/S0418
First Floor 17 - 21 High Street Old Town,yes,,2020-12-23,,0.03,6,6,S0420 - S/PRIORC/17/0931 | Prior notification application for the change of use from offices (Class B1a) to dwellings (Class C3) (6no. flats),local-authority-eng:SWD,not owned by a public authority,2017-08-11,https://pa1.swindon.gov.uk/publicaccess/applicationDetails.do?activeTab=documents&keyVal=OQUZ4SPT04V00,permissioned,permission in principle,POINT(-1.752111 51.63734),S0420,https://pa1.swindon.gov.uk/publicaccess/applicationDetails.do?activeTab=documents&keyVal=OQUZ4SPT04V00,2018-12-31,brownfield-land/local-authority-eng/SWD/S0420
"Former Zarlink Factory, Darby Close, Swindon",yes,,2020-12-23,,1.17,35,35,"S0424 - S/11/0826 | Erection of 35 no. units to provide class B1 (Business) & class B8 (Storage & Distribution) use, together with trade counters (Resubmission).",local-authority-eng:SWD,not owned by a public authority,2011-08-25,https://pa1.swindon.gov.uk/publicaccess/applicationDetails.do?activeTab=documents&keyVal=LMRSYQPT97000,permissioned,full planning permission,POINT(-1.773771 51.566369),S0424,https://pa1.swindon.gov.uk/publicaccess/applicationDetails.do?activeTab=documents&keyVal=LMRSYQPT97000,2018-12-31,brownfield-land/local-authority-eng/SWD/S0424
"Brunel West Car Park and House of Fraser, Swindon",yes,,2020-12-23,,0.85,290,290,"S0430 - S/OUT/19/1566 | A Hybrid application for the demolition of 44-45 Canal Walk (Brunel Shopping Centre) and outline application for the construction of two multi-storey towers for mixed use (up to 290no. residential units) and a podium 1-3 storeys (Use Class A1-A5 and leisure uses) with associated landscaping, access (access, landscaping, layout and scale not reserved) and full application for the reconfiguration of the trucking deck including associated traffic controls.",local-authority-eng:SWD,not owned by a public authority,,https://pa1.swindon.gov.uk/publicaccess/applicationDetails.do?activeTab=documents&keyVal=PZKSSTPTKCN00,pending decision,outline planning permission,POINT(-1.762652 51.519628),S0430,https://pa1.swindon.gov.uk/publicaccess/applicationDetails.do?activeTab=documents&keyVal=PZKSSTPTKCN00,2018-12-31,brownfield-land/local-authority-eng/SWD/S0430
Swindon Station Redevelopment,,,2020-12-23,,4.54,85,85,S0433 - S0433 | No Recent Planning History,local-authority-eng:SWD,not owned by a public authority,,https://pa1.swindon.gov.uk/publicaccess/,not permissioned,,POINT(-1.69719 51.542342),S0433,https://pa1.swindon.gov.uk/publicaccess/,2018-12-31,brownfield-land/local-authority-eng/SWD/S0433
"Manor Farm, Hannington",yes,,2020-12-23,,0.68,8,8,"S0434 - S/17/1114 | Demolition of buildings, and erection of 8no. dwellings and employment building (Use Class B1)",local-authority-eng:SWD,not owned by a public authority,2019-09-12,https://pa1.swindon.gov.uk/publicaccess/applicationDetails.do?activeTab=documents&keyVal=OSD5P4PTG6100,permissioned,full planning permission,POINT(-1.795758 51.558215),S0434,https://pa1.swindon.gov.uk/publicaccess/applicationDetails.do?activeTab=documents&keyVal=OSD5P4PTG6100,2018-12-31,brownfield-land/local-authority-eng/SWD/S0434
County Ground Depot,,,2020-12-23,,0.43,22,22,S0436 - S0436 | No Recent Planning History,local-authority-eng:SWD,not owned by a public authority,,https://pa1.swindon.gov.uk/publicaccess/,not permissioned,,POINT(-1.773525 51.564582),S0436,https://pa1.swindon.gov.uk/publicaccess/,2018-12-31,brownfield-land/local-authority-eng/SWD/S0436
"Burderop Park, Wroughton",yes,,2020-12-23,,12.6,77,77,"S0448 - S/17/0128 | Demolition of the pavilions, change of use of offices and ancillary buildings to 25no. apartments/dwellings, erection of 52no. dwellings, construction of new access and associated works.",local-authority-eng:SWD,not owned by a public authority,2018-04-27,https://pa1.swindon.gov.uk/publicaccess/applicationDetails.do?activeTab=documents&keyVal=OK4H08PTKU200,permissioned,full planning permission,POINT(-1.760534 51.520652),S0448,https://pa1.swindon.gov.uk/publicaccess/applicationDetails.do?activeTab=documents&keyVal=OK4H08PTKU200,2018-12-31,brownfield-land/local-authority-eng/SWD/S0448
"Croft Yard, Ham Road, Wanborough",yes,,2020-12-23,,0.32,9,9,S0458 - S0458 | No Recent Planning History,local-authority-eng:SWD,not owned by a public authority,,https://pa1.swindon.gov.uk/publicaccess/,not permissioned,,POINT(-1.874632 51.539051),S0458,https://pa1.swindon.gov.uk/publicaccess/,2018-12-31,brownfield-land/local-authority-eng/SWD/S0458
"The 12 Bar, 179 Westcott Place, Swindon",yes,2020-12-23,2020-12-23,,0.07,11,11,S0476 - S/13/0435 | Change of use of existing premises from Public House (A4) to part Retail (A1) and Residential (C3) to form 11no. units,local-authority-eng:SWD,not owned by a public authority,2013-09-06,https://pa1.swindon.gov.uk/publicaccess/applicationDetails.do?activeTab=documents&keyVal=MKTQ8OPT97000,permissioned,full planning permission,POINT(-1.79555 51.55833),S0476,https://pa1.swindon.gov.uk/publicaccess/applicationDetails.do?activeTab=documents&keyVal=MKTQ8OPT97000,2018-12-31,brownfield-land/local-authority-eng/SWD/S0476
