site-address,deliverable,end-date,entry-date,hazardous-substances,hectares,maximum-net-dwellings,minimum-net-dwellings,notes,organisation,ownership-status,planning-permission-date,planning-permission-history,planning-permission-status,planning-permission-type,point,site,site-plan-url,start-date,slug
Site of disused retail units on Devizes Road,yes,,2020-12-23,,0.08,5,5,s0113 - s0113 | No Recent Planning History,local-authority-eng:SWD,not owned by a public authority,,https://pa1.swindon.gov.uk/publicaccess/,not permissioned,,POINT(-1.782885 51.562069),s0113,https://pa1.swindon.gov.uk/publicaccess/,2017-12-31,brownfield-land/local-authority-eng/SWD/s0113
Sites of garages on Perrys Lane,yes,,2020-12-23,,0.11,5,5,s0115 - S/99/2654 | Erection of 3no. four-bedroom houses with double garages (Outline). Application refused 04/04/2000,local-authority-eng:SWD,not owned by a public authority,,https://pa1.swindon.gov.uk/publicaccess/,not permissioned,,POINT(-1.782989 51.561682),s0115,https://pa1.swindon.gov.uk/publicaccess/,2017-12-31,brownfield-land/local-authority-eng/SWD/s0115
Second Floor Fleetway House 55 - 58 Fleet Street Swindon,yes,,2020-12-23,,0.18,12,12,s0120 - S/17/0144 | Change of use of second floor to Residential (Class C3) to provide 12 no. flats with external alterations.Ref. : S/17/0144Decision Issued Date: 28/06/2017,local-authority-eng:SWD,not owned by a public authority,2017-06-28,https://pa1.swindon.gov.uk/publicaccess/applicationDetails.do?activeTab=documents&keyVal=OKA11NPTKV900,permissioned,full planning permission,POINT(-1.787929 51.564088),s0120,https://pa1.swindon.gov.uk/publicaccess/applicationDetails.do?activeTab=documents&keyVal=OKA11NPTKV900,2018-12-31,brownfield-land/local-authority-eng/SWD/s0120
"39-45 Fleet Street, Swindon",,,2020-12-23,,0.08,16,16,s0122 - s0122 | No Recent Planning History,local-authority-eng:SWD,not owned by a public authority,,https://pa1.swindon.gov.uk/publicaccess/,not permissioned,,POINT(-1.786559 51.56595),s0122,https://pa1.swindon.gov.uk/publicaccess/,2018-12-31,brownfield-land/local-authority-eng/SWD/s0122
"Falcon House, Fleming Way Car Park, Debenhams and 17 The Parade",yes,,2020-12-23,,0.85,90,90,s0125 - S/PRIORC/18/1013 | Prior notification application for the change of use from office (Class B1a) to 90no. apartments (Class C3).,local-authority-eng:SWD,not owned by a public authority,2018-07-26,https://pa1.swindon.gov.uk/publicaccess/applicationDetails.do?activeTab=documents&keyVal=PA7RKPPT0FL00,permissioned,other,POINT(-1.78102 51.560219),s0125,https://pa1.swindon.gov.uk/publicaccess/applicationDetails.do?activeTab=documents&keyVal=PA7RKPPT0FL00,2018-12-31,brownfield-land/local-authority-eng/SWD/s0125
One Sanford Street,yes,2020-12-23,2020-12-23,,0.14,12,12,s0126 - S/17/1109 | Erection of a roof extension to create 2 additional floors containing 12no. flats.Ref. : S/PRIORC/17/0003Decision Issued Date: 21/02/2017Erection of a roof extension to create 2 additional floors containing 12 no. flats. Application is ongoing. Ref. : S/17/1109Decision Issued Date: Pending,local-authority-eng:SWD,not owned by a public authority,2017-11-23,https://pa1.swindon.gov.uk/publicaccess/applicationDetails.do?activeTab=documents&keyVal=OSCXADPTG5Q00,permissioned,full planning permission,POINT(-1.786966 51.559281),s0126,https://pa1.swindon.gov.uk/publicaccess/applicationDetails.do?activeTab=documents&keyVal=OSCXADPTG5Q00,2018-12-31,brownfield-land/local-authority-eng/SWD/s0126
Swindon Station Car Park (South),,,2020-12-23,,1.84,160,160,s0128 - s0128 | No Recent Planning History,local-authority-eng:SWD,not owned by a public authority,,https://pa1.swindon.gov.uk/publicaccess/,not permissioned,,POINT(-1.785977 51.565051),s0128,https://pa1.swindon.gov.uk/publicaccess/,2018-12-31,brownfield-land/local-authority-eng/SWD/s0128
Swindon Station Car Park (North),,,2020-12-23,,0.52,52,52,s0129 - s0129 | No Recent Planning History,local-authority-eng:SWD,not owned by a public authority,,https://pa1.swindon.gov.uk/publicaccess/,not permissioned,,POINT(-1.772942 51.551092),s0129,https://pa1.swindon.gov.uk/publicaccess/,2018-12-31,brownfield-land/local-authority-eng/SWD/s0129
Princes Street Car Park,,,2020-12-23,,0.34,17,17,s0132 - s0132 | No Recent Planning History,local-authority-eng:SWD,not owned by a public authority,,https://pa1.swindon.gov.uk/publicaccess/,not permissioned,,POINT(-1.784969 51.562757),s0132,https://pa1.swindon.gov.uk/publicaccess/,2018-12-31,brownfield-land/local-authority-eng/SWD/s0132
Commercial Road Car Park,,,2020-12-23,,0.05,10,10,s0133 - s0133 | No Recent Planning History,local-authority-eng:SWD,not owned by a public authority,,https://pa1.swindon.gov.uk/publicaccess/,not permissioned,,POINT(-1.781744 51.560406),s0133,https://pa1.swindon.gov.uk/publicaccess/,2018-12-31,brownfield-land/local-authority-eng/SWD/s0133
Signal Point,,,2020-12-23,,0.43,,,s0140 - S/18/1474 | Change of use of part of ground and first floors from B1(a) (Business) to A3 (Cafe/Restaurant).,local-authority-eng:SWD,not owned by a public authority,2018-11-20,https://pa1.swindon.gov.uk/publicaccess/applicationDetails.do?activeTab=documents&keyVal=PEC1UAPTIF300,permissioned,full planning permission,POINT(-1.78147 51.559569),s0140,https://pa1.swindon.gov.uk/publicaccess/applicationDetails.do?activeTab=documents&keyVal=PEC1UAPTIF300,2018-12-31,brownfield-land/local-authority-eng/SWD/s0140
"Locarno, Dammas Lane Car Park and The Planks Car Park",yes,,2020-12-23,,0.46,115,115,"s0142 - S/07/2805 | Redevelopment including the partial demolition, change of use and restoration of The Locarno and Old Town Hall buildings, the erection of extensions and new buildings, plus the provision of 3 no. units for mixed Class A3/ Class A4 use, outdoor seating areas in association with those uses, Registry of Births, Deaths and Marriages (Class B1), 115 no. apartments, car parking, access and landscaping works.",local-authority-eng:SWD,not owned by a public authority,2008-09-08,https://pa1.swindon.gov.uk/publicaccess/applicationDetails.do?activeTab=documents&keyVal=JS3UTTPT04V00,permissioned,full planning permission,POINT(-1.790782 51.562985),s0142,https://pa1.swindon.gov.uk/publicaccess/applicationDetails.do?activeTab=documents&keyVal=JS3UTTPT04V00,2018-12-31,brownfield-land/local-authority-eng/SWD/s0142
The Parade Multistorey Car Park,,,2020-12-23,,0.18,36,36,s0146 - s0146 | No Recent Planning History,local-authority-eng:SWD,not owned by a public authority,,https://pa1.swindon.gov.uk/publicaccess/,not permissioned,,POINT(-1.77708 51.553079),s0146,https://pa1.swindon.gov.uk/publicaccess/,2018-12-31,brownfield-land/local-authority-eng/SWD/s0146
Former Wyvern Multistorey Car Park,yes,,2020-12-23,,0.19,38,38,s0147 - S/DEM/15/0737 | Prior Notification for the proposed demolition of multi-storey car park. Prior Approval required and given 04/06/2015Ref. : S/DEM/15/0737Decision Issued Date: 04/06/2015,local-authority-eng:SWD,not owned by a public authority,,https://pa1.swindon.gov.uk/publicaccess/,not permissioned,,POINT(-1.776215 51.553607),s0147,https://pa1.swindon.gov.uk/publicaccess/,2018-12-31,brownfield-land/local-authority-eng/SWD/s0147
Wyvern Theatre and Car Park,,,2020-12-23,,0.33,46,46,s0148 - s0148 | Erection of a new roof over existing roof terrace and walkways. Permission has been granted 28/02/2014Ref. : S/SP/13/1910Decision Issued Date: 28/02/2014,local-authority-eng:SWD,not owned by a public authority,,https://pa1.swindon.gov.uk/publicaccess/,not permissioned,,POINT(-1.775528 51.553553),s0148,https://pa1.swindon.gov.uk/publicaccess/,2018-12-31,brownfield-land/local-authority-eng/SWD/s0148
The Carriage Works,yes,,2020-12-23,,1.52,0,0,"s0150 - S/LBC/16/1807 | Refurbishment of the existing carriage works for use as office (Class B1) use and associated works including partial demolition, alterations and new access from London Street. Permission has been granted.Ref. : S/16/1806 & S/LBC/16/1807Decision Issued Date: 03/02/2017",local-authority-eng:SWD,not owned by a public authority,2017-02-03,https://pa1.swindon.gov.uk/publicaccess/applicationDetails.do?activeTab=documents&keyVal=OEZLJJPTJJ900,permissioned,full planning permission,POINT(-1.786688 51.562849),s0150,https://pa1.swindon.gov.uk/publicaccess/applicationDetails.do?activeTab=documents&keyVal=OEZLJJPTJJ900,2018-12-31,brownfield-land/local-authority-eng/SWD/s0150
Swindon Advertiser Offices,yes,,2020-12-23,,0.1,24,24,s0156 - S/19/0442 | Demolition of rear ground floor office space and erection of five storey extension and third floor extension to existing building to provide an additional 24no. apartments,local-authority-eng:SWD,not owned by a public authority,2019-10-24,https://pa1.swindon.gov.uk/publicaccess/applicationDetails.do?activeTab=documents&keyVal=POEMNDPTMYK00,permissioned,full planning permission,POINT(-1.78608 51.562096),s0156,https://pa1.swindon.gov.uk/publicaccess/applicationDetails.do?activeTab=documents&keyVal=POEMNDPTMYK00,2018-12-31,brownfield-land/local-authority-eng/SWD/s0156
"Land South of Church Road, Old Town",yes,,2020-12-23,,0.07,19,19,"s0157 - S/06/2316 | Demolition of existing garages and print works and the erection of new building to facilitate the provision of 19 no. apartments (Class C3) with vehicular access, car parking, cycle parking, landscaping and associated works.",local-authority-eng:SWD,not owned by a public authority,2007-05-17,https://pa1.swindon.gov.uk/publicaccess/applicationDetails.do?activeTab=documents&keyVal=J5MSE8PTE9000,permissioned,full planning permission,POINT(-1.780953 51.559364),s0157,https://pa1.swindon.gov.uk/publicaccess/applicationDetails.do?activeTab=documents&keyVal=J5MSE8PTE9000,2018-12-31,brownfield-land/local-authority-eng/SWD/s0157
"Pope Bros Builders Yard, Cricklade Street",yes,,2020-12-23,,0.12,12,12,"s0158 - S/18/0447 | Demolition of existing workshops and erection of 10no. dwellings, conversion of existing store to provide 2no. dwellings",local-authority-eng:SWD,not owned by a public authority,2019-11-26,https://pa1.swindon.gov.uk/publicaccess/applicationDetails.do?activeTab=documents&keyVal=P5KUAUPT0EE00,permissioned,full planning permission,POINT(-1.714859 51.63348),s0158,https://pa1.swindon.gov.uk/publicaccess/applicationDetails.do?activeTab=documents&keyVal=P5KUAUPT0EE00,2018-12-31,brownfield-land/local-authority-eng/SWD/s0158
20 Fleet Street,yes,,2020-12-23,,0.05,10,10,s0168 - s0168 | No Recent Planning History,local-authority-eng:SWD,not owned by a public authority,,https://pa1.swindon.gov.uk/publicaccess/,not permissioned,,POINT(-1.779918 51.582454),s0168,https://pa1.swindon.gov.uk/publicaccess/,2018-12-31,brownfield-land/local-authority-eng/SWD/s0168
32-34 Bridge Street,yes,,2020-12-23,,0.03,6,6,s0170 - s0170 | No Recent Planning History,local-authority-eng:SWD,not owned by a public authority,,https://pa1.swindon.gov.uk/publicaccess/,not permissioned,,POINT(-1.78206 51.590188),s0170,https://pa1.swindon.gov.uk/publicaccess/,2018-12-31,brownfield-land/local-authority-eng/SWD/s0170
Theatre Square,,,2020-12-23,,0.41,21,21,s0171 - s0171 | No Recent Planning History,local-authority-eng:SWD,not owned by a public authority,,https://pa1.swindon.gov.uk/publicaccess/,not permissioned,,POINT(-1.77729 51.595747),s0171,https://pa1.swindon.gov.uk/publicaccess/,2018-12-31,brownfield-land/local-authority-eng/SWD/s0171
"Land to the east of Newburgh Place, in front of Tesco Express",,,2020-12-23,,0.97,36,36,s0183 - s0183 | Change of use from a Class A1 Retail to Class D1 Clinic. Variation of condition 3 from previous. Permission has been granted permission S/13/0025 regarding opening hours).Ref. : S/14/1956Decision Issued Date: 07/01/2015Application for the erection of a single storey side extension. Permission has been granted.Ref. : S/16/0076Decision Issued Date: 18/03/2016,local-authority-eng:SWD,not owned by a public authority,,https://pa1.swindon.gov.uk/publicaccess/,not permissioned,,POINT(-1.805642 51.577173),s0183,https://pa1.swindon.gov.uk/publicaccess/,2018-12-31,brownfield-land/local-authority-eng/SWD/s0183
Land at Pinehurst Road inside 'The Circle',,,2020-12-23,,0.5,19,19,s0191 - s0191 | No Recent Planning History,local-authority-eng:SWD,not owned by a public authority,,https://pa1.swindon.gov.uk/publicaccess/,not permissioned,,POINT(-1.806867 51.580833),s0191,https://pa1.swindon.gov.uk/publicaccess/,2018-12-31,brownfield-land/local-authority-eng/SWD/s0191
In front of 68 Oaksey Road,,,2020-12-23,,0.19,7,7,s0204 - s0204 | No Recent Planning History,local-authority-eng:SWD,not owned by a public authority,,https://pa1.swindon.gov.uk/publicaccess/,not permissioned,,POINT(-1.78152 51.59731),s0204,https://pa1.swindon.gov.uk/publicaccess/,2018-12-31,brownfield-land/local-authority-eng/SWD/s0204
Groundwell Park and Ride,yes,,2020-12-23,,1.7,0,0,s0239 - s0239 | No Recent Planning History,local-authority-eng:SWD,not owned by a public authority,,https://pa1.swindon.gov.uk/publicaccess/,not permissioned,,POINT(-1.730629 51.548034),s0239,https://pa1.swindon.gov.uk/publicaccess/,2018-12-31,brownfield-land/local-authority-eng/SWD/s0239
Manor Garden Centre and surrounding,,,2020-12-23,,3.3,124,124,s0245 - s0245 | No Recent Planning History,local-authority-eng:SWD,not owned by a public authority,,https://pa1.swindon.gov.uk/publicaccess/,not permissioned,,POINT(-1.782509 51.538807),s0245,https://pa1.swindon.gov.uk/publicaccess/,2018-12-31,brownfield-land/local-authority-eng/SWD/s0245
Garage block east of Greenhill Road,,,2020-12-23,,0.2,8,8,s0246 - s0246 | No Recent Planning History,local-authority-eng:SWD,not owned by a public authority,,https://pa1.swindon.gov.uk/publicaccess/,not permissioned,,POINT(-1.807993 51.570172),s0246,https://pa1.swindon.gov.uk/publicaccess/,2018-12-31,brownfield-land/local-authority-eng/SWD/s0246
Garages at Wingfield Ave,,,2020-12-23,,0.23,9,9,s0264 - s0264 | No Recent Planning History,local-authority-eng:SWD,not owned by a public authority,,https://pa1.swindon.gov.uk/publicaccess/,not permissioned,,POINT(-1.782501 51.602264),s0264,https://pa1.swindon.gov.uk/publicaccess/,2018-12-31,brownfield-land/local-authority-eng/SWD/s0264
Liden Local Centre,,,2020-12-23,,1.58,79,79,s0276 - s0276 | No Recent Planning History,local-authority-eng:SWD,not owned by a public authority,,https://pa1.swindon.gov.uk/publicaccess/,not permissioned,,POINT(-1.8007 51.570475),s0276,https://pa1.swindon.gov.uk/publicaccess/,2018-12-31,brownfield-land/local-authority-eng/SWD/s0276
Pipers Way Park and Ride,yes,,2020-12-23,,5.27,0,0,s0297 - s0297 | No Recent Planning History,local-authority-eng:SWD,not owned by a public authority,,https://pa1.swindon.gov.uk/publicaccess/,not permissioned,,POINT(-1.821724 51.553401),s0297,https://pa1.swindon.gov.uk/publicaccess/,2018-12-31,brownfield-land/local-authority-eng/SWD/s0297
Barnfield Road,yes,,2020-12-23,,0.75,0,0,"s0298 - s0298 | Erection of 4 no. (Class A1) non-food retail units. (ref S/08/0478) granted 18 Jul 2008, now lapsed.",local-authority-eng:SWD,not owned by a public authority,,https://pa1.swindon.gov.uk/publicaccess/,not permissioned,,POINT(-1.809628 51.577417),s0298,https://pa1.swindon.gov.uk/publicaccess/,2018-12-31,brownfield-land/local-authority-eng/SWD/s0298
Northern Gateway,yes,,2020-12-23,,2.33,0,0,"S0308 - S/16/0505 | Erection of new retail facilities and provision of associated car parking, creation of a new vehicular and pedestrian accesses, a freestanding ATM, hard and soft landscaping and associated plant.",local-authority-eng:SWD,not owned by a public authority,2017-10-18,https://pa1.swindon.gov.uk/publicaccess/applicationDetails.do?activeTab=documents&keyVal=O4A3PVPTHAF00,permissioned,full planning permission,POINT(-1.767875 51.585492),S0308,https://pa1.swindon.gov.uk/publicaccess/applicationDetails.do?activeTab=documents&keyVal=O4A3PVPTHAF00,2018-12-31,brownfield-land/local-authority-eng/SWD/S0308
"Petrol Filling Station, Rodbourne Road",yes,,2020-12-23,,0.33,0,0,S0311 - S/16/0977 | Erection of an ATM. (Retrospective).,local-authority-eng:SWD,not owned by a public authority,2016-07-21,https://pa1.swindon.gov.uk/publicaccess/applicationDetails.do?activeTab=documents&keyVal=O81LH7PTHTB00,permissioned,other,POINT(-1.765075 51.576361),S0311,https://pa1.swindon.gov.uk/publicaccess/applicationDetails.do?activeTab=documents&keyVal=O81LH7PTHTB00,2018-12-31,brownfield-land/local-authority-eng/SWD/S0311
Toothill Village Centre,,,2020-12-23,,1.42,71,71,S0313 - S0313 | No Recent Planning History,local-authority-eng:SWD,not owned by a public authority,,https://pa1.swindon.gov.uk/publicaccess/,not permissioned,,POINT(-1.786833 51.562033),S0313,https://pa1.swindon.gov.uk/publicaccess/,2018-12-31,brownfield-land/local-authority-eng/SWD/S0313
Moredon Rec,yes,,2020-12-23,,2.66,60,60,S0314 - S0314 | No Recent Planning History,local-authority-eng:SWD,not owned by a public authority,,https://pa1.swindon.gov.uk/publicaccess/,not permissioned,,POINT(-1.738608 51.602284),S0314,https://pa1.swindon.gov.uk/publicaccess/,2018-12-31,brownfield-land/local-authority-eng/SWD/S0314
Stratton Education Centre,,,2020-12-23,,0.3,11,11,S0315 - S0315 | No Recent Planning History,local-authority-eng:SWD,not owned by a public authority,,https://pa1.swindon.gov.uk/publicaccess/,not permissioned,,POINT(-1.770337 51.543159),S0315,https://pa1.swindon.gov.uk/publicaccess/,2018-12-31,brownfield-land/local-authority-eng/SWD/S0315
"Contract House, Unit 5 Bramble Road Elgin Swindon SN2 8HB",yes,,2020-12-23,,0.39,,,S0318 - S/13/1537 | Outline application for the erection of buildings for B1(c) (Business - Light Industry) and/or B2 (General Industry) and/or B8 (Storage or Distribution) uses.,local-authority-eng:SWD,not owned by a public authority,2014-07-04,https://pa1.swindon.gov.uk/publicaccess/applicationDetails.do?activeTab=documents&keyVal=MUV555PT0FL00,permissioned,full planning permission,POINT(-1.778972 51.557514),S0318,https://pa1.swindon.gov.uk/publicaccess/applicationDetails.do?activeTab=documents&keyVal=MUV555PT0FL00,2018-12-31,brownfield-land/local-authority-eng/SWD/S0318
"54 -55 Bridge Street, Swindon, SN1 1BL",yes,,2020-12-23,,0.03,6,6,"S0319 - S0319 | Retention of retail use on ground floor, change of use of 1st. & 2nd. floor from retail (Class A1) to 6 no. dwellings (Class C3), erection of 1st & 2nd floor rear extensions and associated works.",local-authority-eng:SWD,not owned by a public authority,2014-07-21,https://pa1.swindon.gov.uk/publicaccess/applicationDetails.do?activeTab=documents&keyVal=MWO7F1PT0IN00,permissioned,full planning permission,POINT(-1.7892 51.55953),S0319,https://pa1.swindon.gov.uk/publicaccess/applicationDetails.do?activeTab=documents&keyVal=MWO7F1PT0IN00,2017-12-31,brownfield-land/local-authority-eng/SWD/S0319
"Unit 4 Hunts Rise, Swindon SN3 4TW",yes,,2020-12-23,,0.53,10,10,S0322 - S/14/1283 | Erection of 10no. two storey industrial units and associated works.,local-authority-eng:SWD,not owned by a public authority,2015-04-01,https://pa1.swindon.gov.uk/publicaccess/applicationDetails.do?activeTab=documents&keyVal=N9GTM0PT04V00,permissioned,full planning permission,POINT(-1.76055 51.571699),S0322,https://pa1.swindon.gov.uk/publicaccess/applicationDetails.do?activeTab=documents&keyVal=N9GTM0PT04V00,2018-12-31,brownfield-land/local-authority-eng/SWD/S0322
"Wakefield House, Pipers Way, Old Town Swindon SN3 1RE",yes,,2020-12-23,,0.66,34,34,S0326 - S/14/2137 | Demolition of existing energy centre and erection of a mixed use four storey building with a convenience retail store (Class A1) on the ground floor with 18no. apartments above and 16no. houses and associated works.,local-authority-eng:SWD,not owned by a public authority,2015-12-03,https://pa1.swindon.gov.uk/publicaccess/applicationDetails.do?activeTab=documents&keyVal=NGVIFNPT97000,permissioned,full planning permission,POINT(-1.783513 51.558814),S0326,https://pa1.swindon.gov.uk/publicaccess/applicationDetails.do?activeTab=documents&keyVal=NGVIFNPT97000,2017-12-31,brownfield-land/local-authority-eng/SWD/S0326
"22-23 Victoria Road, Old Town, Swindon SN1 3AW",yes,,2020-12-23,,0.04,6,6,"S0327 - S/15/0042 | Erection of a 4 storey building to provide 147sqm of retail floor space on the ground floor, 6 no. apartments on the floors above",local-authority-eng:SWD,not owned by a public authority,2015-03-04,https://pa1.swindon.gov.uk/publicaccess/applicationDetails.do?activeTab=documents&keyVal=NI9IC7PT97000,permissioned,full planning permission,POINT(-1.72926 51.541561),S0327,https://pa1.swindon.gov.uk/publicaccess/applicationDetails.do?activeTab=documents&keyVal=NI9IC7PT97000,2017-12-31,brownfield-land/local-authority-eng/SWD/S0327
"Former Milton Road Club, 25 Milton Road, Swindon SN1 5JA",yes,,2020-12-23,,0.03,10,10,S0328 - S/15/0133 | Change of use from working man's club (Class D2) to residential (Class C3) to provide 10no. self contained apartments,local-authority-eng:SWD,not owned by a public authority,2015-04-02,https://pa1.swindon.gov.uk/publicaccess/applicationDetails.do?activeTab=documents&keyVal=NIXYXXPT97000,permissioned,full planning permission,POINT(-1.799906 51.569958),S0328,https://pa1.swindon.gov.uk/publicaccess/applicationDetails.do?activeTab=documents&keyVal=NIXYXXPT97000,2017-12-31,brownfield-land/local-authority-eng/SWD/S0328
"Former Bampton Brothers, Stratton Road, Swindon",yes,,2020-12-23,,1.27,61,61,S0329 - S/OUT/15/0377 | Outline application for the erection of up to 61no. dwellings (means of access not reserved).,local-authority-eng:SWD,not owned by a public authority,2015-08-19,https://pa1.swindon.gov.uk/publicaccess/applicationDetails.do?activeTab=documents&keyVal=NKU3OYPT97000,permissioned,outline planning permission,POINT(-1.780467 51.606184),S0329,https://pa1.swindon.gov.uk/publicaccess/applicationDetails.do?activeTab=documents&keyVal=NKU3OYPT97000,2017-12-31,brownfield-land/local-authority-eng/SWD/S0329
"Anglia House, 115-118 Commercial Road, Swindon",yes,,2020-12-23,,0.01,14,14,S0330 - S/PRIORC/15/0748 | Prior Approval Notification for the change of use of 1st & 2nd floors from offices (Class B1) to 14no. apartments (Class C3) Prior Approval not required,local-authority-eng:SWD,not owned by a public authority,2015-08-26,https://pa1.swindon.gov.uk/publicaccess/applicationDetails.do?activeTab=documents&keyVal=NNYZKTPT97000,permissioned,permission in principle,POINT(-1.753916 51.575334),S0330,https://pa1.swindon.gov.uk/publicaccess/applicationDetails.do?activeTab=documents&keyVal=NNYZKTPT97000,2017-12-31,brownfield-land/local-authority-eng/SWD/S0330
"Kingsbridge House, Marlborough Road, Swindon",yes,2020-12-23,2020-12-23,,0.12,5,5,S0332 - S/15/0937 | Change of use from Guest House to 5 no. Flats,local-authority-eng:SWD,not owned by a public authority,2015-09-21,https://pa1.swindon.gov.uk/publicaccess/applicationDetails.do?activeTab=documents&keyVal=NPO9LZPT0EE00,permissioned,full planning permission,POINT(-1.750887 51.568255),S0332,https://pa1.swindon.gov.uk/publicaccess/applicationDetails.do?activeTab=documents&keyVal=NPO9LZPT0EE00,2017-12-31,brownfield-land/local-authority-eng/SWD/S0332
"16 Wembley Street, Rodbourne, Swindon SN2 1DN",yes,,2020-12-23,,0.11,6,6,S0337 - S/15/1342 | Erection of 6no. flats,local-authority-eng:SWD,not owned by a public authority,2017-01-17,https://pa1.swindon.gov.uk/publicaccess/applicationDetails.do?activeTab=documents&keyVal=NSYM9ZPT97000,permissioned,full planning permission,POINT(-1.787394 51.563646),S0337,https://pa1.swindon.gov.uk/publicaccess/applicationDetails.do?activeTab=documents&keyVal=NSYM9ZPT97000,2017-12-31,brownfield-land/local-authority-eng/SWD/S0337
"Lindseys Yard, Turnpike Road, Blunsdon, Swindon SN26 7AE",yes,,2020-12-23,,0.49,5,5,"S0338 - S/15/1352 | Demolition of existing warehouse and outbuildings, and erection of 5 no. residential dwellings",local-authority-eng:SWD,not owned by a public authority,2016-03-21,https://pa1.swindon.gov.uk/publicaccess/applicationDetails.do?activeTab=documents&keyVal=NT0V85PT97000,permissioned,full planning permission,POINT(-1.786833 51.526238),S0338,https://pa1.swindon.gov.uk/publicaccess/applicationDetails.do?activeTab=documents&keyVal=NT0V85PT97000,2017-12-31,brownfield-land/local-authority-eng/SWD/S0338
"Land Adjacent To New Inn, Swindon Road, Stratton St Margaret, Swindon SN3 4PN",yes,,2020-12-23,,0.16,6,6,"S0341 - S/16/1126 | Demolition of existing dwelling and erection of 6no. apartments and associated works, without compliance with conditions 3 - 10 from previous permission S/15/1839.",local-authority-eng:SWD,not owned by a public authority,2016-08-16,https://pa1.swindon.gov.uk/publicaccess/applicationDetails.do?activeTab=documents&keyVal=O9A1IHPTI5200,permissioned,full planning permission,POINT(-1.783513 51.558814),S0341,https://pa1.swindon.gov.uk/publicaccess/applicationDetails.do?activeTab=documents&keyVal=O9A1IHPTI5200,2017-12-31,brownfield-land/local-authority-eng/SWD/S0341
"WH Smith HQ, Greenbridge Road, Stratton St Margaret, Swindon",yes,,2020-12-23,,2.93,134,134,S0343 - S/OUT/15/2087 | Outline planning application for up to 134no. residential dwellings,local-authority-eng:SWD,not owned by a public authority,2017-02-07,https://pa1.swindon.gov.uk/publicaccess/applicationDetails.do?activeTab=documents&keyVal=NZI9O2PTFUR00,permissioned,outline planning permission,POINT(-1.758157 51.581743),S0343,https://pa1.swindon.gov.uk/publicaccess/applicationDetails.do?activeTab=documents&keyVal=NZI9O2PTFUR00,2017-12-31,brownfield-land/local-authority-eng/SWD/S0343
